question,answer,contexts,ground_truth
Tên đầy đủ tiếng Việt và tiếng Anh của quỹ TCSME là gì?,"Tên đầy đủ tiếng Việt của quỹ TCSME là QUỸ ĐẦU TƯ CỔ PHIẾU DOANH NGHIỆP VỪA VÀ NHỎ TECHCOM.
Tên đầy đủ tiếng Anh của quỹ là TECHCOM MEDIUM AND SMALL ENTERPRISES STOCK FUND.","['VII. ĐẠI LÝ PHÂN PHỐI CHỨNG CHỈ QUỸ.................................. 18\nVIII. TỔ CHỨC CHỨC UP QUYỀN.......................................... 18\nIX. THÔNG TIN VỀ QUỸ ĐẦU TƯ CỔ PHIẾU DOANH NGHIỆP VỪA VÀ NHỎ\nTECHCOM (TCSME).............................................. 18\n1. Thông tin về Quỹ................................................ 18\n1.1. Các điều khoản chung........................................... 19\n2.1. Các điều khoản chung........................................... 19\n2.1. Các điều khoản chung........................................... 19\n2.2. Mục tiêu, chính sách và hạn chế đầu tư.............................. 24\n2.2.1. Cơ cấu danh mục.............................................. 24\n2.2.2. Các quy định về mục tiêu, chính sách và hạn chế đầu tư.............. 26', '1. Công ty Quản lý Quỹ\nBà Nguyễn Thị Thu Hiền\nÔng Đặng Lưu Dũng\nBà Phan Thị Thu Hằng\n5\n5\n5\nII. CÁC ĐỊNH NGHĨA\n1. Tổng quan tình hình kinh tế vĩ mô.................................... 8\n2. Thị trường tài chính Việt Nam và cơ hội đầu tư.......................... 8\n3. Lợi tức của nhà đầu tư............................................. 14\n4. THÔNG TIN VỀ CÔNG TY CỔ PHẦN QUẢN LÝ QUỸ KÝ THƯƠNG............ 15\n1. Các thông tin chung............................................... 17\n2. Tình hình hoạt động của Công ty Cổ phần Quản lý Quỹ Ký Thương (TCSME)........ 17\n3. Ngành hàng Giám Sát............................................. 17\nVI. CÔNG TY KIỂM TOÁN............................................ 18\nVII. ĐẠI LÝ PHÂN PHỐI CHỨNG CHỈ QUỸ.................................. 18', 'Số: 9176 /QĐ-UBCK\nGiấy phép hành chứng chỉ quỹ ra công chúng\n----------------  \nCăn cứ khoản 2, Điều 46 Pháp lệnh Chứng khoán và Điều 45, 46 Nghị định số\n56/2007/NĐ-CP ngày 09/04/2007 của Chính phủ quy định chi tiết thi hành một số\nđiều của Pháp lệnh Chứng khoán;\nCăn cứ Quyết định số 30/2008/QĐ-BTC ngày 02/06/2008 của Bộ Tài chính về việc\nban hành Quy chế tổ chức và hoạt động của công ty quản lý quỹ, công ty chứng khoán;\nCăn cứ Giấy chứng nhận đăng ký kinh doanh số 0102013096 do Sở Kế hoạch và\nĐầu tư Thành phố Hà Nội cấp ngày 21/10/2008;\nXét đề nghị của Công ty cổ phần Quản lý Quỹ Ký Thương - TechcomCapital;  \nQUỸ ĐẦU TƯ CỔ PHIẾU DOANH NGHIỆP VỪA VÀ NHỎ TECHCOM\n(TCSME)  \nCHÀO BẢN CHỨNG CHỈ QUỸ ĐẦU TƯ CHỨNG KHOÁN RA CÔNG CHỨNG\n(Quỹ chứng khoán doanh nghiệp vừa và nhỏ Techcom)', 'nhượng, chuyển nhượng, hoặc bán một phần hoặc toàn bộ các khoản đầu tư vào Quỹ. Nhà đầu tư\ncó trách nhiệm tự mình thực hiện việc thẩm định và đánh giá mọi rủi ro liên quan đến đầu tư.  \nBản cáo bạch này bao gồm các thông tin về Quỹ, dự kiến các khoản đầu tư của Quỹ, các điều kiện\nvà quy định của Quỹ, hoặc các thông tin khác mà nhà đầu tư cần biết. Nhà đầu tư nên đọc kỹ Bản\ncáo bạch này và các tài liệu đính kèm trước khi ra quyết định đầu tư.\nTCC sẽ cập nhật Bản cáo bạch này nếu có bất kỳ thay đổi nào về thông tin.\nBản cáo bạch được cung cấp miễn phí tại văn phòng của TCC, các Đại lý phân phối và trên trang\nweb của TCC.  \nBản cáo bạch này được phát hành bởi:\nCông ty Cổ phần Quản lý Quỹ Ký Thương - TechcomCapital (“TCC”)', 'Bản cáo bạch này được phát hành bởi:\nCông ty Cổ phần Quản lý Quỹ Ký Thương - TechcomCapital (“TCC”)\nĐịa chỉ: Tầng 28, Tòa C5, số 119 Trần Duy Hưng, phường Trung Hòa, Quận Cầu Giấy, Hà Nội.\nĐiện thoại: (84-24) 39446368. Fax: (84-24) 39446583. Website: www.techcomcapital.com.vn.  \nBản cáo bạch này được phát hành bởi:\nCông ty Cổ phần Quản lý Quỹ Ký Thương - TechcomCapital (“TCC”)\nĐịa chỉ: Tầng 28, Tòa C5, số 119 Trần Duy Hưng, phường Trung Hòa, Quận Cầu Giấy, Hà Nội\nĐiện thoại: (84-24) 39446368 Fax: (84-24) 39446583\nWebsite: www.techcomcapital.com.vn  \nNơi cung cấp Bản cáo bạch:\nBản cáo bạch cập nhật những các tài liệu của Quỹ (báo cáo hoạt động, báo cáo tài chính,\nĐiểu Lệ Quỹ và các tài liệu cần thiết khác) được cung cấp trên trang điện tử của TCC,', 'Điểu Lệ Quỹ và các tài liệu cần thiết khác) được cung cấp trên trang điện tử của TCC,\nwww.techcomcapital.com.vn, tại văn phòng của TCC và các Đại lý phân phối như danh sách\ntrong phụ lục 1 của Bản cáo Bạch.  \nPhụ trách công bố thông tin:\nÔng Đặng Lưu Dũng – Tổng Giám đốc\nĐịa chỉ: Công ty Cổ phần Quản lý Quỹ Ký Thương\nTầng 28, Tòa C5, số 119 Trần Duy Hưng, phường Trung Hòa, Quận Cầu Giấy, Hà Nội\nĐiện thoại: (84-24) 39446368 Fax: (84-24) 39446583  \nBản cáo bạch này được phát hành bởi:\nCông ty Cổ phần Quản lý Quỹ Ký Thương - TechcomCapital (“TCC”)\nĐịa chỉ : Tầng 28, Tòa C5, số 119 Trần Duy Hưng, phường Trung Hòa, Quận Cầu Giấy, Hà Nội\nĐiện thoại : (84-24) 39446368 Fax: (84-24) 39446583\nWebsite : www.techcomcapital.com.vn  \nNơi cung cấp Bản cáo bạch:', '(Quỹ chứng khoán doanh nghiệp vừa và nhỏ Techcom)\nBản cáo bạch này được phát hành bởi:\nCông ty Cổ phần Quản lý Quỹ Ký Thương - TechcomCapital (“TCC”)\nĐịa chỉ : Tầng 28, Tòa C5, số 119 Trần Duy Hưng, phường Trung Hòa, Quận Cầu\nGiấy, Hà Nội\nĐiện thoại : (84-24) 39446368 Fax: (84-24) 39446583\nWebsite : www.techcomcapital.com.vn  \nNơi cung cấp Bản cáo bạch:\nBản cáo bạch cập nhật những các tài liệu của Quỹ (báo cáo hoạt động, báo cáo tài chính,\nĐiểu Lệ Quỹ và các tài liệu cần thiết khác) được cung cấp trên trang điện tử của TCC,\nwww.techcomcapital.com.vn, tại văn phòng của TCC và các Đại lý phân phối như danh sách\ntrong phụ lục 1 của Bản cáo Bạch.  \nPhụ trách công bố thông tin:\nÔng Đặng Lưu Dũng – Tổng Giám đốc\nĐịa chỉ : Công ty Cổ phần Quản lý Quỹ Ký Thương', 'chi phí/phí/giá dịch vụ liên quan đến các hoạt động của Quỹ mà Quỹ thực hiện hoặc gián tiếp hoặc tổng hợp các khoản phí và các chi phí/phí/giá dịch vụ liên quan đến các hoạt động của Quỹ mà Quỹ thực hiện hoặc gián tiếp hoặc tổng hợp các khoản phí và các chi phí/phí/giá dịch vụ liên quan đến các hoạt động của Quỹ mà Quỹ thực hiện hoặc gián tiếp hoặc tổng hợp các khoản phí và các chi phí/phí/giá dịch vụ liên quan đến các hoạt động của Quỹ mà Quỹ thực hiện hoặc gián tiếp hoặc tổng hợp các khoản phí và các chi phí/phí/giá dịch vụ liên quan đến các hoạt động của Quỹ mà Quỹ thực hiện hoặc gián tiếp hoặc tổng hợp các khoản phí và các chi phí/phí/giá dịch vụ liên quan đến các hoạt động của Quỹ mà Quỹ thực hiện hoặc gián tiếp hoặc tổng hợp các khoản phí và các chi phí/phí/giá dịch vụ liên quan đến', 'gián tiếp hoặc tổng hợp các khoản phí và các chi phí/phí/giá dịch vụ liên quan đến các hoạt động của Quỹ mà Quỹ thực hiện hoặc gián tiếp hoặc tổng hợp các khoản phí và các chi phí/phí/giá dịch vụ liên quan đến các hoạt động của Quỹ mà Quỹ thực hiện hoặc gián tiếp hoặc tổng hợp các khoản phí và các chi phí/phí/giá dịch vụ liên quan đến các hoạt động của Quỹ mà Quỹ thực hiện hoặc gián tiếp hoặc tổng hợp các khoản phí và các chi phí/phí/giá dịch vụ liên quan đến các hoạt động của Quỹ mà Quỹ thực hiện hoặc gián tiếp hoặc tổng hợp các khoản phí và các chi phí/phí/giá dịch vụ liên quan đến các hoạt động của Quỹ mà Quỹ thực hiện hoặc gián tiếp hoặc tổng hợp các khoản phí và các chi phí/phí/giá dịch vụ liên quan đến các hoạt động của Quỹ mà Quỹ thực hiện hoặc gián tiếp hoặc tổng hợp các khoản phí', 'dịch vụ liên quan đến các hoạt động của Quỹ mà Quỹ thực hiện hoặc gián tiếp hoặc tổng hợp các khoản phí và các chi phí/phí/giá dịch vụ liên quan đến các hoạt động của Quỹ mà Quỹ thực hiện hoặc gián tiếp hoặc tổng hợp các khoản phí và các chi phí/phí/giá dịch vụ liên quan đến các hoạt động của Quỹ mà Quỹ thực hiện hoặc gián tiếp hoặc tổng hợp các khoản phí và các chi phí/phí/giá dịch vụ liên quan đến các hoạt động của Quỹ mà Quỹ thực hiện hoặc gián tiếp hoặc tổng hợp các khoản phí và các chi phí/phí/giá dịch vụ liên quan đến các hoạt động của Quỹ mà Quỹ thực hiện hoặc gián tiếp hoặc tổng hợp các khoản phí và các chi phí/phí/giá dịch vụ liên quan đến các hoạt động của Quỹ mà Quỹ thực hiện hoặc gián tiếp hoặc tổng hợp các khoản phí và các chi phí/phí/giá dịch vụ liên quan đến các hoạt động', 'phí/phí/giá dịch vụ liên quan đến các hoạt động của Quỹ mà Quỹ thực hiện hoặc gián tiếp hoặc tổng hợp các khoản phí và các chi phí/phí/giá dịch vụ liên quan đến các hoạt động của Quỹ mà Quỹ thực hiện hoặc gián tiếp hoặc tổng hợp các khoản phí và các chi phí/phí/giá dịch vụ liên quan đến các hoạt động của Quỹ mà Quỹ thực hiện hoặc gián tiếp hoặc tổng hợp các khoản phí và các chi phí/phí/giá dịch vụ liên quan đến các hoạt động của Quỹ mà Quỹ thực hiện hoặc gián tiếp hoặc tổng hợp các khoản phí và các chi phí/phí/giá dịch vụ liên quan đến các hoạt động của Quỹ mà Quỹ thực hiện hoặc gián tiếp hoặc tổng hợp các khoản phí và các chi phí/phí/giá dịch vụ liên quan đến các hoạt động của Quỹ mà Quỹ thực hiện hoặc gián tiếp hoặc tổng hợp các khoản phí và các chi phí/phí/giá dịch vụ liên quan đến các', 'Website : www.techcomcapital.com.vn  \nNơi cung cấp Bản cáo bạch:\nBản cáo bạch cập nhật những các tài liệu của Quỹ (báo cáo hoạt động, báo cáo tài chính,\nĐiểu Lệ Quỹ và các tài liệu cần thiết khác) được cung cấp trên trang điện tử của TCC,\nwww.techcomcapital.com.vn, tại văn phòng của TCC và các Đại lý phân phối như danh sách\ntrong phụ lục 1 của Bản cáo Bạch.  \nPhụ trách công bố thông tin:\nÔng Đặng Lưu Dũng – Tổng Giám đốc\nĐịa chỉ: Công ty Cổ phần Quản lý Quỹ Ký Thương\nTầng 28, Tòa C5, số 119 Trần Duy Hưng, phường Trung Hòa, Quận Cầu Giấy, Hà Nội\nĐiện thoại: (84-24) 39446368 Fax: (84-24) 39446583', 'Quỹ thực hiện hoặc gián tiếp hoặc tổng hợp các khoản phí và các chi phí/phí/giá dịch vụ liên quan đến các hoạt động của Quỹ mà Quỹ thực hiện hoặc gián tiếp hoặc tổng hợp các khoản phí và các chi phí/phí/giá dịch vụ liên quan đến các hoạt động của Quỹ mà Quỹ thực hiện hoặc gián tiếp hoặc tổng hợp các khoản phí và các chi phí/phí/giá dịch vụ liên quan đến các hoạt động của Quỹ mà Quỹ thực hiện hoặc gián tiếp hoặc tổng hợp các khoản phí và các chi phí/phí/giá dịch vụ liên quan đến các hoạt động của Quỹ mà Quỹ thực hiện hoặc gián tiếp hoặc tổng hợp các khoản phí và các chi phí/phí/giá dịch vụ liên quan đến các hoạt động của Quỹ mà Quỹ thực hiện hoặc gián tiếp hoặc tổng hợp các khoản phí và các chi phí/phí/giá dịch vụ liên quan đến các hoạt động của Quỹ mà Quỹ thực hiện hoặc gián tiếp hoặc', 'liên quan đến các hoạt động của Quỹ mà Quỹ thực hiện hoặc gián tiếp hoặc tổng hợp các khoản phí và các chi phí/phí/giá dịch vụ liên quan đến các hoạt động của Quỹ mà Quỹ thực hiện hoặc gián tiếp hoặc tổng hợp các khoản phí và các chi phí/phí/giá dịch vụ liên quan đến các hoạt động của Quỹ mà Quỹ thực hiện hoặc gián tiếp hoặc tổng hợp các khoản phí và các chi phí/phí/giá dịch vụ liên quan đến các hoạt động của Quỹ mà Quỹ thực hiện hoặc gián tiếp hoặc tổng hợp các khoản phí và các chi phí/phí/giá dịch vụ liên quan đến các hoạt động của Quỹ mà Quỹ thực hiện hoặc gián tiếp hoặc tổng hợp các khoản phí và các chi phí/phí/giá dịch vụ liên quan đến', 'vụ liên quan đến các hoạt động của Quỹ mà Quỹ thực hiện hoặc gián tiếp hoặc tổng hợp các khoản phí và các chi phí/phí/giá dịch vụ liên quan đến các hoạt động của Quỹ mà Quỹ thực hiện hoặc gián tiếp hoặc tổng hợp các khoản phí và các chi phí/phí/giá dịch vụ liên quan đến các hoạt động của Quỹ mà Quỹ thực hiện hoặc gián tiếp hoặc tổng hợp các khoản phí và các chi phí/phí/giá dịch vụ liên quan đến các hoạt động của Quỹ mà Quỹ thực hiện hoặc gián tiếp hoặc tổng hợp các khoản phí và các chi phí/phí/giá dịch vụ liên quan đến các hoạt động của Quỹ mà Quỹ thực hiện hoặc gián tiếp hoặc tổng hợp các khoản phí và các chi phí/phí/giá dịch vụ liên quan đến các hoạt động của Quỹ mà Quỹ thực hiện hoặc gián tiếp hoặc tổng hợp các khoản phí và các chi phí/phí/giá dịch vụ liên quan đến các hoạt động của', 'Chỉ có các loại phí/dịch vụ và các chi phí/phí/giá dịch vụ liên quan trực tiếp hoặc gián tiếp hoặc tổng hợp các khoản phí và các chi phí/phí/giá dịch vụ liên quan đến các hoạt động của Quỹ mà Quỹ thực hiện hoặc gián tiếp hoặc tổng hợp các khoản phí và các chi phí/phí/giá dịch vụ liên quan đến các hoạt động của Quỹ mà Quỹ thực hiện hoặc gián tiếp hoặc tổng hợp các khoản phí và các chi phí/phí/giá dịch vụ liên quan đến các hoạt động của Quỹ mà Quỹ thực hiện hoặc gián tiếp hoặc tổng hợp các khoản phí và các chi phí/phí/giá dịch vụ liên quan đến các hoạt động của Quỹ mà Quỹ thực hiện hoặc gián tiếp hoặc tổng hợp các khoản phí và các chi phí/phí/giá dịch vụ liên quan đến các hoạt động của Quỹ mà Quỹ thực hiện hoặc gián tiếp hoặc tổng hợp các khoản phí và các chi phí/phí/giá dịch vụ liên quan', 'thực hiện hoặc gián tiếp hoặc tổng hợp các khoản phí và các chi phí/phí/giá dịch vụ liên quan đến các hoạt động của Quỹ mà Quỹ thực hiện hoặc gián tiếp hoặc tổng hợp các khoản phí và các chi phí/phí/giá dịch vụ liên quan đến các hoạt động của Quỹ mà Quỹ thực hiện hoặc gián tiếp hoặc tổng hợp các khoản phí và các chi phí/phí/giá dịch vụ liên quan đến các hoạt động của Quỹ mà Quỹ thực hiện hoặc gián tiếp hoặc tổng hợp các khoản phí và các chi phí/phí/giá dịch vụ liên quan đến các hoạt động của Quỹ mà Quỹ thực hiện hoặc gián tiếp hoặc tổng hợp các khoản phí và các chi phí/phí/giá dịch vụ liên quan đến các hoạt động của Quỹ mà Quỹ thực hiện hoặc gián tiếp hoặc tổng hợp các khoản phí và các chi phí/phí/giá dịch vụ liên quan đến các hoạt động của Quỹ mà Quỹ thực hiện hoặc gián tiếp hoặc tổng', 'liên quan đến các hoạt động của Quỹ mà Quỹ thực hiện hoặc gián tiếp hoặc tổng hợp các khoản phí và các chi phí/phí/giá dịch vụ liên quan đến các hoạt động của Quỹ mà Quỹ thực hiện hoặc gián tiếp hoặc tổng hợp các khoản phí và các chi phí/phí/giá dịch vụ liên quan đến các hoạt động của Quỹ mà Quỹ thực hiện hoặc gián tiếp hoặc tổng hợp các khoản phí và các chi phí/phí/giá dịch vụ liên quan đến các hoạt động của Quỹ mà Quỹ thực hiện hoặc gián tiếp hoặc tổng hợp các khoản phí và các chi phí/phí/giá dịch vụ liên quan đến các hoạt động của Quỹ mà Quỹ thực hiện hoặc gián tiếp hoặc tổng hợp các khoản phí và các chi phí/phí/giá dịch vụ liên quan đến các hoạt động của Quỹ mà Quỹ thực hiện hoặc gián tiếp hoặc tổng hợp các khoản phí và các chi phí/phí/giá dịch vụ liên quan đến các hoạt động của Quỹ', 'liên quan đến các hoạt động của Quỹ mà Quỹ thực hiện hoặc gián tiếp hoặc tổng hợp các khoản phí và các chi phí/phí/giá dịch vụ liên quan đến các hoạt động của Quỹ mà Quỹ thực hiện hoặc gián tiếp hoặc tổng hợp các khoản phí và các chi phí/phí/giá dịch vụ liên quan đến các hoạt động của Quỹ mà Quỹ thực hiện hoặc gián tiếp hoặc tổng hợp các khoản phí và các chi phí/phí/giá dịch vụ liên quan đến các hoạt động của Quỹ mà Quỹ thực hiện hoặc gián tiếp hoặc tổng hợp các khoản phí và các chi phí/phí/giá dịch vụ liên quan đến các hoạt động của Quỹ mà Quỹ thực hiện hoặc gián tiếp hoặc tổng hợp các khoản phí và các chi phí/phí/giá dịch vụ liên quan đến các hoạt động của Quỹ mà Quỹ thực hiện hoặc gián tiếp hoặc tổng hợp các khoản phí và các chi phí/phí/giá dịch vụ liên quan đến các hoạt động của Quỹ', 'liên quan đến các hoạt động của Quỹ mà Quỹ thực hiện hoặc gián tiếp hoặc tổng hợp các khoản phí và các chi phí/phí/giá dịch vụ liên quan đến các hoạt động của Quỹ mà Quỹ thực hiện hoặc gián tiếp hoặc tổng hợp các khoản phí và các chi phí/phí/giá dịch vụ liên quan đến các hoạt động của Quỹ mà Quỹ thực hiện hoặc gián tiếp hoặc tổng hợp các khoản phí và các chi phí/phí/giá dịch vụ liên quan đến các hoạt động của Quỹ mà Quỹ thực hiện hoặc gián tiếp hoặc tổng hợp các khoản phí và các chi phí/phí/giá dịch vụ liên quan đến các hoạt động của Quỹ mà Quỹ thực hiện hoặc gián tiếp hoặc tổng hợp các khoản phí và các chi phí/phí/giá dịch vụ liên quan đến các hoạt động của Quỹ mà Quỹ thực hiện hoặc gián tiếp hoặc tổng hợp các khoản phí và các chi phí/phí/giá dịch vụ liên quan đến các hoạt động của Quỹ', 'liên quan đến các hoạt động của Quỹ mà Quỹ thực hiện hoặc gián tiếp hoặc tổng hợp các khoản phí và các chi phí/phí/giá dịch vụ liên quan đến các hoạt động của Quỹ mà Quỹ thực hiện hoặc gián tiếp hoặc tổng hợp các khoản phí và các chi phí/phí/giá dịch vụ liên quan đến các hoạt động của Quỹ mà Quỹ thực hiện hoặc gián tiếp hoặc tổng hợp các khoản phí và các chi phí/phí/giá dịch vụ liên quan đến các hoạt động của Quỹ mà Quỹ thực hiện hoặc gián tiếp hoặc tổng hợp các khoản phí và các chi phí/phí/giá dịch vụ liên quan đến các hoạt động của Quỹ mà Quỹ thực hiện hoặc gián tiếp hoặc tổng hợp các khoản phí và các chi phí/phí/giá dịch vụ liên quan đến các hoạt động của Quỹ mà Quỹ thực hiện hoặc gián tiếp hoặc tổng hợp các khoản phí và các chi phí/phí/giá dịch vụ liên quan đến các hoạt động của Quỹ', 'liên quan đến các hoạt động của Quỹ mà Quỹ thực hiện hoặc gián tiếp hoặc tổng hợp các khoản phí và các chi phí/phí/giá dịch vụ liên quan đến các hoạt động của Quỹ mà Quỹ thực hiện hoặc gián tiếp hoặc tổng hợp các khoản phí và các chi phí/phí/giá dịch vụ liên quan đến các hoạt động của Quỹ mà Quỹ thực hiện hoặc gián tiếp hoặc tổng hợp các khoản phí và các chi phí/phí/giá dịch vụ liên quan đến các hoạt động của Quỹ mà Quỹ thực hiện hoặc gián tiếp hoặc tổng hợp các khoản phí và các chi phí/phí/giá dịch vụ liên quan đến các hoạt động của Quỹ mà Quỹ thực hiện hoặc gián tiếp hoặc tổng hợp các khoản phí và các chi phí/phí/giá dịch vụ liên quan đến các hoạt động của Quỹ mà Quỹ thực hiện hoặc gián tiếp hoặc tổng hợp các khoản phí và các chi phí/phí/giá dịch vụ liên quan đến các hoạt động của Quỹ', 'liên quan đến các hoạt động của Quỹ mà Quỹ thực hiện hoặc gián tiếp hoặc tổng hợp các khoản phí và các chi phí/phí/giá dịch vụ liên quan đến các hoạt động của Quỹ mà Quỹ thực hiện hoặc gián tiếp hoặc tổng hợp các khoản phí và các chi phí/phí/giá dịch vụ liên quan đến các hoạt động của Quỹ mà Quỹ thực hiện hoặc gián tiếp hoặc tổng hợp các khoản phí và các chi phí/phí/giá dịch vụ liên quan đến các hoạt động của Quỹ mà Quỹ thực hiện hoặc gián tiếp hoặc tổng hợp các khoản phí và các chi phí/phí/giá dịch vụ liên quan đến các hoạt động của Quỹ mà Quỹ thực hiện hoặc gián tiếp hoặc tổng hợp các khoản phí và các chi phí/phí/giá dịch vụ liên quan đến các hoạt động của Quỹ mà Quỹ thực hiện hoặc gián tiếp hoặc tổng hợp các khoản phí và các chi phí/phí/giá dịch vụ liên quan đến các hoạt động của Quỹ', 'liên quan đến các hoạt động của Quỹ mà Quỹ thực hiện hoặc gián tiếp hoặc tổng hợp các khoản phí và các chi phí/phí/giá dịch vụ liên quan đến các hoạt động của Quỹ mà Quỹ thực hiện hoặc gián tiếp hoặc tổng hợp các khoản phí và các chi phí/phí/giá dịch vụ liên quan đến các hoạt động của Quỹ mà Quỹ thực hiện hoặc gián tiếp hoặc tổng hợp các khoản phí và các chi phí/phí/giá dịch vụ liên quan đến các hoạt động của Quỹ mà Quỹ thực hiện hoặc gián tiếp hoặc tổng hợp các khoản phí và các chi phí/phí/giá dịch vụ liên quan đến các hoạt động của Quỹ mà Quỹ thực hiện hoặc gián tiếp hoặc tổng hợp các khoản phí và các chi phí/phí/giá dịch vụ liên quan đến các hoạt động của Quỹ mà Quỹ thực hiện hoặc gián tiếp hoặc tổng hợp các khoản phí và các chi phí/phí/giá dịch vụ liên quan đến các hoạt động của Quỹ', 'liên quan đến các hoạt động của Quỹ mà Quỹ thực hiện hoặc gián tiếp hoặc tổng hợp các khoản phí và các chi phí/phí/giá dịch vụ liên quan đến các hoạt động của Quỹ mà Quỹ thực hiện hoặc gián tiếp hoặc tổng hợp các khoản phí và các chi phí/phí/giá dịch vụ liên quan đến các hoạt động của Quỹ mà Quỹ thực hiện hoặc gián tiếp hoặc tổng hợp các khoản phí và các chi phí/phí/giá dịch vụ liên quan đến các hoạt động của Quỹ mà Quỹ thực hiện hoặc gián tiếp hoặc tổng hợp các khoản phí và các chi phí/phí/giá dịch vụ liên quan đến các hoạt động của Quỹ mà Quỹ thực hiện hoặc gián tiếp hoặc tổng hợp các khoản phí và các chi phí/phí/giá dịch vụ liên quan đến các hoạt động của Quỹ mà Quỹ thực hiện hoặc gián tiếp hoặc tổng hợp các khoản phí và các chi phí/phí/giá dịch vụ liên quan đến các hoạt động của Quỹ']",Tên tiếng Việt: Quỹ Đầu tư Cổ phiếu Doanh nghiệp vừa và nhỏ Techcom. Tên tiếng Anh: Techcom Small and Medium Enterprise Equity Fund.
Mục tiêu đầu tư chính của Quỹ TCSME được quy định như thế nào trong Bản cáo bạch?,"Mục tiêu đầu tư chính của Quỹ là tìm kiếm lợi nhuận dài hạn thông qua thu nhập và tăng trưởng giá trị đầu tư vốn trên cơ sở đánh giá, lựa chọn các tài sản có chất lượng tốt, phân bổ danh mục hợp lý và tối thiểu hóa rủi ro cho Nhà Đầu Tư.","['Số: 9176 /QĐ-UBCK\nGiấy phép hành chứng chỉ quỹ ra công chúng\n----------------  \nCăn cứ khoản 2, Điều 46 Pháp lệnh Chứng khoán và Điều 45, 46 Nghị định số\n56/2007/NĐ-CP ngày 09/04/2007 của Chính phủ quy định chi tiết thi hành một số\nđiều của Pháp lệnh Chứng khoán;\nCăn cứ Quyết định số 30/2008/QĐ-BTC ngày 02/06/2008 của Bộ Tài chính về việc\nban hành Quy chế tổ chức và hoạt động của công ty quản lý quỹ, công ty chứng khoán;\nCăn cứ Giấy chứng nhận đăng ký kinh doanh số 0102013096 do Sở Kế hoạch và\nĐầu tư Thành phố Hà Nội cấp ngày 21/10/2008;\nXét đề nghị của Công ty cổ phần Quản lý Quỹ Ký Thương - TechcomCapital;  \nQUỸ ĐẦU TƯ CỔ PHIẾU DOANH NGHIỆP VỪA VÀ NHỎ TECHCOM\n(TCSME)  \nCHÀO BẢN CHỨNG CHỈ QUỸ ĐẦU TƯ CHỨNG KHOÁN RA CÔNG CHỨNG\n(Quỹ chứng khoán doanh nghiệp vừa và nhỏ Techcom)', 'nhượng, chuyển nhượng, hoặc bán một phần hoặc toàn bộ các khoản đầu tư vào Quỹ. Nhà đầu tư\ncó trách nhiệm tự mình thực hiện việc thẩm định và đánh giá mọi rủi ro liên quan đến đầu tư.  \nBản cáo bạch này bao gồm các thông tin về Quỹ, dự kiến các khoản đầu tư của Quỹ, các điều kiện\nvà quy định của Quỹ, hoặc các thông tin khác mà nhà đầu tư cần biết. Nhà đầu tư nên đọc kỹ Bản\ncáo bạch này và các tài liệu đính kèm trước khi ra quyết định đầu tư.\nTCC sẽ cập nhật Bản cáo bạch này nếu có bất kỳ thay đổi nào về thông tin.\nBản cáo bạch được cung cấp miễn phí tại văn phòng của TCC, các Đại lý phân phối và trên trang\nweb của TCC.  \nBản cáo bạch này được phát hành bởi:\nCông ty Cổ phần Quản lý Quỹ Ký Thương - TechcomCapital (“TCC”)', '1. Công ty Quản lý Quỹ\nBà Nguyễn Thị Thu Hiền\nÔng Đặng Lưu Dũng\nBà Phan Thị Thu Hằng\n5\n5\n5\nII. CÁC ĐỊNH NGHĨA\n1. Tổng quan tình hình kinh tế vĩ mô.................................... 8\n2. Thị trường tài chính Việt Nam và cơ hội đầu tư.......................... 8\n3. Lợi tức của nhà đầu tư............................................. 14\n4. THÔNG TIN VỀ CÔNG TY CỔ PHẦN QUẢN LÝ QUỸ KÝ THƯƠNG............ 15\n1. Các thông tin chung............................................... 17\n2. Tình hình hoạt động của Công ty Cổ phần Quản lý Quỹ Ký Thương (TCSME)........ 17\n3. Ngành hàng Giám Sát............................................. 17\nVI. CÔNG TY KIỂM TOÁN............................................ 18\nVII. ĐẠI LÝ PHÂN PHỐI CHỨNG CHỈ QUỸ.................................. 18', 'VII. ĐẠI LÝ PHÂN PHỐI CHỨNG CHỈ QUỸ.................................. 18\nVIII. TỔ CHỨC CHỨC UP QUYỀN.......................................... 18\nIX. THÔNG TIN VỀ QUỸ ĐẦU TƯ CỔ PHIẾU DOANH NGHIỆP VỪA VÀ NHỎ\nTECHCOM (TCSME).............................................. 18\n1. Thông tin về Quỹ................................................ 18\n1.1. Các điều khoản chung........................................... 19\n2.1. Các điều khoản chung........................................... 19\n2.1. Các điều khoản chung........................................... 19\n2.2. Mục tiêu, chính sách và hạn chế đầu tư.............................. 24\n2.2.1. Cơ cấu danh mục.............................................. 24\n2.2.2. Các quy định về mục tiêu, chính sách và hạn chế đầu tư.............. 26', '(Quỹ chứng khoán doanh nghiệp vừa và nhỏ Techcom)\nBản cáo bạch này được phát hành bởi:\nCông ty Cổ phần Quản lý Quỹ Ký Thương - TechcomCapital (“TCC”)\nĐịa chỉ : Tầng 28, Tòa C5, số 119 Trần Duy Hưng, phường Trung Hòa, Quận Cầu\nGiấy, Hà Nội\nĐiện thoại : (84-24) 39446368 Fax: (84-24) 39446583\nWebsite : www.techcomcapital.com.vn  \nNơi cung cấp Bản cáo bạch:\nBản cáo bạch cập nhật những các tài liệu của Quỹ (báo cáo hoạt động, báo cáo tài chính,\nĐiểu Lệ Quỹ và các tài liệu cần thiết khác) được cung cấp trên trang điện tử của TCC,\nwww.techcomcapital.com.vn, tại văn phòng của TCC và các Đại lý phân phối như danh sách\ntrong phụ lục 1 của Bản cáo Bạch.  \nPhụ trách công bố thông tin:\nÔng Đặng Lưu Dũng – Tổng Giám đốc\nĐịa chỉ : Công ty Cổ phần Quản lý Quỹ Ký Thương', 'Bản cáo bạch này được phát hành bởi:\nCông ty Cổ phần Quản lý Quỹ Ký Thương - TechcomCapital (“TCC”)\nĐịa chỉ: Tầng 28, Tòa C5, số 119 Trần Duy Hưng, phường Trung Hòa, Quận Cầu Giấy, Hà Nội.\nĐiện thoại: (84-24) 39446368. Fax: (84-24) 39446583. Website: www.techcomcapital.com.vn.  \nBản cáo bạch này được phát hành bởi:\nCông ty Cổ phần Quản lý Quỹ Ký Thương - TechcomCapital (“TCC”)\nĐịa chỉ: Tầng 28, Tòa C5, số 119 Trần Duy Hưng, phường Trung Hòa, Quận Cầu Giấy, Hà Nội\nĐiện thoại: (84-24) 39446368 Fax: (84-24) 39446583\nWebsite: www.techcomcapital.com.vn  \nNơi cung cấp Bản cáo bạch:\nBản cáo bạch cập nhật những các tài liệu của Quỹ (báo cáo hoạt động, báo cáo tài chính,\nĐiểu Lệ Quỹ và các tài liệu cần thiết khác) được cung cấp trên trang điện tử của TCC,', 'Website : www.techcomcapital.com.vn  \nNơi cung cấp Bản cáo bạch:\nBản cáo bạch cập nhật những các tài liệu của Quỹ (báo cáo hoạt động, báo cáo tài chính,\nĐiểu Lệ Quỹ và các tài liệu cần thiết khác) được cung cấp trên trang điện tử của TCC,\nwww.techcomcapital.com.vn, tại văn phòng của TCC và các Đại lý phân phối như danh sách\ntrong phụ lục 1 của Bản cáo Bạch.  \nPhụ trách công bố thông tin:\nÔng Đặng Lưu Dũng – Tổng Giám đốc\nĐịa chỉ: Công ty Cổ phần Quản lý Quỹ Ký Thương\nTầng 28, Tòa C5, số 119 Trần Duy Hưng, phường Trung Hòa, Quận Cầu Giấy, Hà Nội\nĐiện thoại: (84-24) 39446368 Fax: (84-24) 39446583', 'Điểu Lệ Quỹ và các tài liệu cần thiết khác) được cung cấp trên trang điện tử của TCC,\nwww.techcomcapital.com.vn, tại văn phòng của TCC và các Đại lý phân phối như danh sách\ntrong phụ lục 1 của Bản cáo Bạch.  \nPhụ trách công bố thông tin:\nÔng Đặng Lưu Dũng – Tổng Giám đốc\nĐịa chỉ: Công ty Cổ phần Quản lý Quỹ Ký Thương\nTầng 28, Tòa C5, số 119 Trần Duy Hưng, phường Trung Hòa, Quận Cầu Giấy, Hà Nội\nĐiện thoại: (84-24) 39446368 Fax: (84-24) 39446583  \nBản cáo bạch này được phát hành bởi:\nCông ty Cổ phần Quản lý Quỹ Ký Thương - TechcomCapital (“TCC”)\nĐịa chỉ : Tầng 28, Tòa C5, số 119 Trần Duy Hưng, phường Trung Hòa, Quận Cầu Giấy, Hà Nội\nĐiện thoại : (84-24) 39446368 Fax: (84-24) 39446583\nWebsite : www.techcomcapital.com.vn  \nNơi cung cấp Bản cáo bạch:', 'thực hiện hoặc gián tiếp hoặc tổng hợp các khoản phí và các chi phí/phí/giá dịch vụ liên quan đến các hoạt động của Quỹ mà Quỹ thực hiện hoặc gián tiếp hoặc tổng hợp các khoản phí và các chi phí/phí/giá dịch vụ liên quan đến các hoạt động của Quỹ mà Quỹ thực hiện hoặc gián tiếp hoặc tổng hợp các khoản phí và các chi phí/phí/giá dịch vụ liên quan đến các hoạt động của Quỹ mà Quỹ thực hiện hoặc gián tiếp hoặc tổng hợp các khoản phí và các chi phí/phí/giá dịch vụ liên quan đến các hoạt động của Quỹ mà Quỹ thực hiện hoặc gián tiếp hoặc tổng hợp các khoản phí và các chi phí/phí/giá dịch vụ liên quan đến các hoạt động của Quỹ mà Quỹ thực hiện hoặc gián tiếp hoặc tổng hợp các khoản phí và các chi phí/phí/giá dịch vụ liên quan đến các hoạt động của Quỹ mà Quỹ thực hiện hoặc gián tiếp hoặc tổng', 'hiện hoặc gián tiếp hoặc tổng hợp các khoản phí và các chi phí/phí/giá dịch vụ liên quan đến các hoạt động của Quỹ mà Quỹ thực hiện hoặc gián tiếp hoặc tổng hợp các khoản phí và các chi phí/phí/giá dịch vụ liên quan đến các hoạt động của Quỹ mà Quỹ thực hiện hoặc gián tiếp hoặc tổng hợp các khoản phí và các chi phí/phí/giá dịch vụ liên quan đến các hoạt động của Quỹ mà Quỹ thực hiện hoặc gián tiếp hoặc tổng hợp các khoản phí và các chi phí/phí/giá dịch vụ liên quan đến các hoạt động của Quỹ mà Quỹ thực hiện hoặc gián tiếp hoặc tổng hợp các khoản phí và các chi phí/phí/giá dịch vụ liên quan đến các hoạt động của Quỹ mà Quỹ thực hiện hoặc gián tiếp hoặc tổng hợp các khoản phí và các chi phí/phí/giá dịch vụ liên quan đến các hoạt động của Quỹ mà Quỹ thực hiện hoặc gián tiếp hoặc tổng hợp các', 'Quỹ thực hiện hoặc gián tiếp hoặc tổng hợp các khoản phí và các chi phí/phí/giá dịch vụ liên quan đến các hoạt động của Quỹ mà Quỹ thực hiện hoặc gián tiếp hoặc tổng hợp các khoản phí và các chi phí/phí/giá dịch vụ liên quan đến các hoạt động của Quỹ mà Quỹ thực hiện hoặc gián tiếp hoặc tổng hợp các khoản phí và các chi phí/phí/giá dịch vụ liên quan đến các hoạt động của Quỹ mà Quỹ thực hiện hoặc gián tiếp hoặc tổng hợp các khoản phí và các chi phí/phí/giá dịch vụ liên quan đến các hoạt động của Quỹ mà Quỹ thực hiện hoặc gián tiếp hoặc tổng hợp các khoản phí và các chi phí/phí/giá dịch vụ liên quan đến các hoạt động của Quỹ mà Quỹ thực hiện hoặc gián tiếp hoặc tổng hợp các khoản phí và các chi phí/phí/giá dịch vụ liên quan đến các hoạt động của Quỹ mà Quỹ thực hiện hoặc gián tiếp hoặc', 'gián tiếp hoặc tổng hợp các khoản phí và các chi phí/phí/giá dịch vụ liên quan đến các hoạt động của Quỹ mà Quỹ thực hiện hoặc gián tiếp hoặc tổng hợp các khoản phí và các chi phí/phí/giá dịch vụ liên quan đến các hoạt động của Quỹ mà Quỹ thực hiện hoặc gián tiếp hoặc tổng hợp các khoản phí và các chi phí/phí/giá dịch vụ liên quan đến các hoạt động của Quỹ mà Quỹ thực hiện hoặc gián tiếp hoặc tổng hợp các khoản phí và các chi phí/phí/giá dịch vụ liên quan đến các hoạt động của Quỹ mà Quỹ thực hiện hoặc gián tiếp hoặc tổng hợp các khoản phí và các chi phí/phí/giá dịch vụ liên quan đến các hoạt động của Quỹ mà Quỹ thực hiện hoặc gián tiếp hoặc tổng hợp các khoản phí và các chi phí/phí/giá dịch vụ liên quan đến các hoạt động của Quỹ mà Quỹ thực hiện hoặc gián tiếp hoặc tổng hợp các khoản phí', '**Chế độ kế toán**  \nQuỹ sẽ áp dụng chế độ kế toán Việt Nam (VAS) và tuân thủ các quy định khác liên quan tới công tác kế toán cho Quỹ do các cơ quan có thẩm quyền quy định. Đồng Việt Nam sẽ là đồng tiền được sử dụng và thể hiện.  \n**Chế độ báo cáo**  \nCông ty Quản lý Quỹ có trách nhiệm duy trì sổ sách kế toán và chuẩn bị báo cáo tài chính cho Quỹ. Phù hợp với quy định tại Điều 38 của Điều Lệ Quỹ, Công ty Quản lý Quỹ có thể uỷ quyền cho một nhà cung cấp dịch vụ có thực hiện việc này. Một số sách kế toán và báo cáo tài chính mà Công ty Quản lý Quỹ hoặc nhà cung cấp dịch vụ có thể uỷ quyền sẽ được lưu trữ tại văn phòng của Công ty Quản lý Quỹ hoặc nhà cung cấp dịch vụ có liên quan.', 'dịch vụ liên quan đến các hoạt động của Quỹ mà Quỹ thực hiện hoặc gián tiếp hoặc tổng hợp các khoản phí và các chi phí/phí/giá dịch vụ liên quan đến các hoạt động của Quỹ mà Quỹ thực hiện hoặc gián tiếp hoặc tổng hợp các khoản phí và các chi phí/phí/giá dịch vụ liên quan đến các hoạt động của Quỹ mà Quỹ thực hiện hoặc gián tiếp hoặc tổng hợp các khoản phí và các chi phí/phí/giá dịch vụ liên quan đến các hoạt động của Quỹ mà Quỹ thực hiện hoặc gián tiếp hoặc tổng hợp các khoản phí và các chi phí/phí/giá dịch vụ liên quan đến các hoạt động của Quỹ mà Quỹ thực hiện hoặc gián tiếp hoặc tổng hợp các khoản phí và các chi phí/phí/giá dịch vụ liên quan đến các hoạt động của Quỹ mà Quỹ thực hiện hoặc gián tiếp hoặc tổng hợp các khoản phí và các chi phí/phí/giá dịch vụ liên quan đến các hoạt động', 'chi phí/phí/giá dịch vụ liên quan đến các hoạt động của Quỹ mà Quỹ thực hiện hoặc gián tiếp hoặc tổng hợp các khoản phí và các chi phí/phí/giá dịch vụ liên quan đến các hoạt động của Quỹ mà Quỹ thực hiện hoặc gián tiếp hoặc tổng hợp các khoản phí và các chi phí/phí/giá dịch vụ liên quan đến các hoạt động của Quỹ mà Quỹ thực hiện hoặc gián tiếp hoặc tổng hợp các khoản phí và các chi phí/phí/giá dịch vụ liên quan đến các hoạt động của Quỹ mà Quỹ thực hiện hoặc gián tiếp hoặc tổng hợp các khoản phí và các chi phí/phí/giá dịch vụ liên quan đến các hoạt động của Quỹ mà Quỹ thực hiện hoặc gián tiếp hoặc tổng hợp các khoản phí và các chi phí/phí/giá dịch vụ liên quan đến các hoạt động của Quỹ mà Quỹ thực hiện hoặc gián tiếp hoặc tổng hợp các khoản phí và các chi phí/phí/giá dịch vụ liên quan đến', '*   Kết quả hoạt động trong quá khứ của các Quỹ không có nghĩa là kết quả hoạt động trong tương lai.\n*   Tên của Quỹ không hàm ý về chất lượng hoạt động cũng như những lợi và lợi nhuận của Quỹ trong tương lai;\n*   Công ty Quản lý Quỹ không chịu trách nhiệm pháp lý về những rủi ro từ đầu tư của các chủ nợ, thành viên Hội đồng thành viên, Ban điều hành và nhân viên của Công ty Quản lý Quỹ không có trách nhiệm pháp lý về các rủi ro hoạt động của Công ty Quản lý Quỹ.\n*   Giống như các hình thức đầu tư khác, Quỹ, rủi ro thanh khoản sẽ được phân bổ trên cơ sở số ngày gần nhất với giá trị tài sản ròng. Các khoản đầu tư khác có thể có nhiều rủi ro hơn so với thời điểm hiện tại. Nhà Đầu tư cần phải nhận thức được khả năng chấp nhận rủi ro từ vơi rủi ro đầu tư mà Quỹ có thể gặp phải trong tương lai.', 'tiếp hoặc tổng hợp các khoản phí và các chi phí/phí/giá dịch vụ liên quan đến các hoạt động của Quỹ mà Quỹ thực hiện hoặc gián tiếp hoặc tổng hợp các khoản phí và các chi phí/phí/giá dịch vụ liên quan đến các hoạt động của Quỹ mà Quỹ thực hiện hoặc gián tiếp hoặc tổng hợp các khoản phí và các chi phí/phí/giá dịch vụ liên quan đến các hoạt động của Quỹ mà Quỹ thực hiện hoặc gián tiếp hoặc tổng hợp các khoản phí và các chi phí/phí/giá dịch vụ liên quan đến các hoạt động của Quỹ mà Quỹ thực hiện hoặc gián tiếp hoặc tổng hợp các khoản phí và các chi phí/phí/giá dịch vụ liên quan đến các hoạt động của Quỹ mà Quỹ thực hiện hoặc gián tiếp hoặc tổng hợp các khoản phí và các chi phí/phí/giá dịch vụ liên quan đến các hoạt động của Quỹ mà Quỹ thực hiện hoặc gián tiếp hoặc tổng hợp các khoản phí và', 'tiếp hoặc tổng hợp các khoản phí và các chi phí/phí/giá dịch vụ liên quan đến các hoạt động của Quỹ mà Quỹ thực hiện hoặc gián tiếp hoặc tổng hợp các khoản phí và các chi phí/phí/giá dịch vụ liên quan đến các hoạt động của Quỹ mà Quỹ thực hiện hoặc gián tiếp hoặc tổng hợp các khoản phí và các chi phí/phí/giá dịch vụ liên quan đến các hoạt động của Quỹ mà Quỹ thực hiện hoặc gián tiếp hoặc tổng hợp các khoản phí và các chi phí/phí/giá dịch vụ liên quan đến các hoạt động của Quỹ mà Quỹ thực hiện hoặc gián tiếp hoặc tổng hợp các khoản phí và các chi phí/phí/giá dịch vụ liên quan đến các hoạt động của Quỹ mà Quỹ thực hiện hoặc gián tiếp hoặc tổng hợp các khoản phí và các chi phí/phí/giá dịch vụ liên quan đến các hoạt động của Quỹ mà Quỹ thực hiện hoặc gián tiếp hoặc tổng hợp các khoản phí và', 'tiếp hoặc tổng hợp các khoản phí và các chi phí/phí/giá dịch vụ liên quan đến các hoạt động của Quỹ mà Quỹ thực hiện hoặc gián tiếp hoặc tổng hợp các khoản phí và các chi phí/phí/giá dịch vụ liên quan đến các hoạt động của Quỹ mà Quỹ thực hiện hoặc gián tiếp hoặc tổng hợp các khoản phí và các chi phí/phí/giá dịch vụ liên quan đến các hoạt động của Quỹ mà Quỹ thực hiện hoặc gián tiếp hoặc tổng hợp các khoản phí và các chi phí/phí/giá dịch vụ liên quan đến các hoạt động của Quỹ mà Quỹ thực hiện hoặc gián tiếp hoặc tổng hợp các khoản phí và các chi phí/phí/giá dịch vụ liên quan đến các hoạt động của Quỹ mà Quỹ thực hiện hoặc gián tiếp hoặc tổng hợp các khoản phí và các chi phí/phí/giá dịch vụ liên quan đến các hoạt động của Quỹ mà Quỹ thực hiện hoặc gián tiếp hoặc tổng hợp các khoản phí và', 'tiếp hoặc tổng hợp các khoản phí và các chi phí/phí/giá dịch vụ liên quan đến các hoạt động của Quỹ mà Quỹ thực hiện hoặc gián tiếp hoặc tổng hợp các khoản phí và các chi phí/phí/giá dịch vụ liên quan đến các hoạt động của Quỹ mà Quỹ thực hiện hoặc gián tiếp hoặc tổng hợp các khoản phí và các chi phí/phí/giá dịch vụ liên quan đến các hoạt động của Quỹ mà Quỹ thực hiện hoặc gián tiếp hoặc tổng hợp các khoản phí và các chi phí/phí/giá dịch vụ liên quan đến các hoạt động của Quỹ mà Quỹ thực hiện hoặc gián tiếp hoặc tổng hợp các khoản phí và các chi phí/phí/giá dịch vụ liên quan đến các hoạt động của Quỹ mà Quỹ thực hiện hoặc gián tiếp hoặc tổng hợp các khoản phí và các chi phí/phí/giá dịch vụ liên quan đến các hoạt động của Quỹ mà Quỹ thực hiện hoặc gián tiếp hoặc tổng hợp các khoản phí và', 'tiếp hoặc tổng hợp các khoản phí và các chi phí/phí/giá dịch vụ liên quan đến các hoạt động của Quỹ mà Quỹ thực hiện hoặc gián tiếp hoặc tổng hợp các khoản phí và các chi phí/phí/giá dịch vụ liên quan đến các hoạt động của Quỹ mà Quỹ thực hiện hoặc gián tiếp hoặc tổng hợp các khoản phí và các chi phí/phí/giá dịch vụ liên quan đến các hoạt động của Quỹ mà Quỹ thực hiện hoặc gián tiếp hoặc tổng hợp các khoản phí và các chi phí/phí/giá dịch vụ liên quan đến các hoạt động của Quỹ mà Quỹ thực hiện hoặc gián tiếp hoặc tổng hợp các khoản phí và các chi phí/phí/giá dịch vụ liên quan đến các hoạt động của Quỹ mà Quỹ thực hiện hoặc gián tiếp hoặc tổng hợp các khoản phí và các chi phí/phí/giá dịch vụ liên quan đến các hoạt động của Quỹ mà Quỹ thực hiện hoặc gián tiếp hoặc tổng hợp các khoản phí và', 'tiếp hoặc tổng hợp các khoản phí và các chi phí/phí/giá dịch vụ liên quan đến các hoạt động của Quỹ mà Quỹ thực hiện hoặc gián tiếp hoặc tổng hợp các khoản phí và các chi phí/phí/giá dịch vụ liên quan đến các hoạt động của Quỹ mà Quỹ thực hiện hoặc gián tiếp hoặc tổng hợp các khoản phí và các chi phí/phí/giá dịch vụ liên quan đến các hoạt động của Quỹ mà Quỹ thực hiện hoặc gián tiếp hoặc tổng hợp các khoản phí và các chi phí/phí/giá dịch vụ liên quan đến các hoạt động của Quỹ mà Quỹ thực hiện hoặc gián tiếp hoặc tổng hợp các khoản phí và các chi phí/phí/giá dịch vụ liên quan đến các hoạt động của Quỹ mà Quỹ thực hiện hoặc gián tiếp hoặc tổng hợp các khoản phí và các chi phí/phí/giá dịch vụ liên quan đến các hoạt động của Quỹ mà Quỹ thực hiện hoặc gián tiếp hoặc tổng hợp các khoản phí và', 'tiếp hoặc tổng hợp các khoản phí và các chi phí/phí/giá dịch vụ liên quan đến các hoạt động của Quỹ mà Quỹ thực hiện hoặc gián tiếp hoặc tổng hợp các khoản phí và các chi phí/phí/giá dịch vụ liên quan đến các hoạt động của Quỹ mà Quỹ thực hiện hoặc gián tiếp hoặc tổng hợp các khoản phí và các chi phí/phí/giá dịch vụ liên quan đến các hoạt động của Quỹ mà Quỹ thực hiện hoặc gián tiếp hoặc tổng hợp các khoản phí và các chi phí/phí/giá dịch vụ liên quan đến các hoạt động của Quỹ mà Quỹ thực hiện hoặc gián tiếp hoặc tổng hợp các khoản phí và các chi phí/phí/giá dịch vụ liên quan đến các hoạt động của Quỹ mà Quỹ thực hiện hoặc gián tiếp hoặc tổng hợp các khoản phí và các chi phí/phí/giá dịch vụ liên quan đến các hoạt động của Quỹ mà Quỹ thực hiện hoặc gián tiếp hoặc tổng hợp các khoản phí và', 'tiếp hoặc tổng hợp các khoản phí và các chi phí/phí/giá dịch vụ liên quan đến các hoạt động của Quỹ mà Quỹ thực hiện hoặc gián tiếp hoặc tổng hợp các khoản phí và các chi phí/phí/giá dịch vụ liên quan đến các hoạt động của Quỹ mà Quỹ thực hiện hoặc gián tiếp hoặc tổng hợp các khoản phí và các chi phí/phí/giá dịch vụ liên quan đến các hoạt động của Quỹ mà Quỹ thực hiện hoặc gián tiếp hoặc tổng hợp các khoản phí và các chi phí/phí/giá dịch vụ liên quan đến các hoạt động của Quỹ mà Quỹ thực hiện hoặc gián tiếp hoặc tổng hợp các khoản phí và các chi phí/phí/giá dịch vụ liên quan đến các hoạt động của Quỹ mà Quỹ thực hiện hoặc gián tiếp hoặc tổng hợp các khoản phí và các chi phí/phí/giá dịch vụ liên quan đến các hoạt động của Quỹ mà Quỹ thực hiện hoặc gián tiếp hoặc tổng hợp các khoản phí và', 'tiếp hoặc tổng hợp các khoản phí và các chi phí/phí/giá dịch vụ liên quan đến các hoạt động của Quỹ mà Quỹ thực hiện hoặc gián tiếp hoặc tổng hợp các khoản phí và các chi phí/phí/giá dịch vụ liên quan đến các hoạt động của Quỹ mà Quỹ thực hiện hoặc gián tiếp hoặc tổng hợp các khoản phí và các chi phí/phí/giá dịch vụ liên quan đến các hoạt động của Quỹ mà Quỹ thực hiện hoặc gián tiếp hoặc tổng hợp các khoản phí và các chi phí/phí/giá dịch vụ liên quan đến các hoạt động của Quỹ mà Quỹ thực hiện hoặc gián tiếp hoặc tổng hợp các khoản phí và các chi phí/phí/giá dịch vụ liên quan đến các hoạt động của Quỹ mà Quỹ thực hiện hoặc gián tiếp hoặc tổng hợp các khoản phí và các chi phí/phí/giá dịch vụ liên quan đến các hoạt động của Quỹ mà Quỹ thực hiện hoặc gián tiếp hoặc tổng hợp các khoản phí và']","Mục tiêu đầu tư là mang lại lợi nhuận dài hạn thông qua tăng trưởng vốn gốc và thu nhập trên cơ sở đánh giá, lựa chọn tài sản tốt, phân bổ danh mục hợp lý và tối thiểu hóa rủi ro."
Chiến lược đầu tư của Quỹ tập trung vào nhóm cổ phiếu nào?,Chiến lược đầu tư của Quỹ tập trung vào cổ phiếu của các Công ty hàng đầu trong rổ cổ phiếu VNMID và VNSML.,"['*   Kết quả hoạt động trong quá khứ của các Quỹ không có nghĩa là kết quả hoạt động trong tương lai.\n*   Tên của Quỹ không hàm ý về chất lượng hoạt động cũng như những lợi và lợi nhuận của Quỹ trong tương lai;\n*   Công ty Quản lý Quỹ không chịu trách nhiệm pháp lý về những rủi ro từ đầu tư của các chủ nợ, thành viên Hội đồng thành viên, Ban điều hành và nhân viên của Công ty Quản lý Quỹ không có trách nhiệm pháp lý về các rủi ro hoạt động của Công ty Quản lý Quỹ.\n*   Giống như các hình thức đầu tư khác, Quỹ, rủi ro thanh khoản sẽ được phân bổ trên cơ sở số ngày gần nhất với giá trị tài sản ròng. Các khoản đầu tư khác có thể có nhiều rủi ro hơn so với thời điểm hiện tại. Nhà Đầu tư cần phải nhận thức được khả năng chấp nhận rủi ro từ vơi rủi ro đầu tư mà Quỹ có thể gặp phải trong tương lai.', 'Các quy định khác liên quan đến kiểm toán, kế toán và chế độ báo cáo tuân thủ theo quy định tại Điều Lệ Quỹ.  \n**3. Các rủi ro khi đầu tư vào Quỹ**  \nMục tiêu của Công ty Quản lý Quỹ là quản lý các rủi ro đầu tư, và nếu có thể, hạn chế các tác động của các rủi ro này bằng việc áp dụng các phương pháp quản lý đầu tư theo tiêu chuẩn quốc tế tốt nhất. Nhà Đầu tư cần lưu ý về các điểm quan trọng sau đây:  \n*   Quỹ, Công ty Quản lý Quỹ, thành viên Hội đồng quản trị, người điều hành và nhân viên của ngân hàng giám sát sẽ làm nhiệm vụ của quản trị rủi ro và bảo quản tài sản của quỹ đại chúng, công ty đầu tư chứng khoán không được là đối tượng mua, bán trong giao dịch mua, bán tài sản của quỹ đại chúng, công ty đầu tư chứng khoán.', 'thực hiện hoặc gián tiếp hoặc tổng hợp các khoản phí và các chi phí/phí/giá dịch vụ liên quan đến các hoạt động của Quỹ mà Quỹ thực hiện hoặc gián tiếp hoặc tổng hợp các khoản phí và các chi phí/phí/giá dịch vụ liên quan đến các hoạt động của Quỹ mà Quỹ thực hiện hoặc gián tiếp hoặc tổng hợp các khoản phí và các chi phí/phí/giá dịch vụ liên quan đến các hoạt động của Quỹ mà Quỹ thực hiện hoặc gián tiếp hoặc tổng hợp các khoản phí và các chi phí/phí/giá dịch vụ liên quan đến các hoạt động của Quỹ mà Quỹ thực hiện hoặc gián tiếp hoặc tổng hợp các khoản phí và các chi phí/phí/giá dịch vụ liên quan đến các hoạt động của Quỹ mà Quỹ thực hiện hoặc gián tiếp hoặc tổng hợp các khoản phí và các chi phí/phí/giá dịch vụ liên quan đến các hoạt động của Quỹ mà Quỹ thực hiện hoặc gián tiếp hoặc tổng', 'hiện hoặc gián tiếp hoặc tổng hợp các khoản phí và các chi phí/phí/giá dịch vụ liên quan đến các hoạt động của Quỹ mà Quỹ thực hiện hoặc gián tiếp hoặc tổng hợp các khoản phí và các chi phí/phí/giá dịch vụ liên quan đến các hoạt động của Quỹ mà Quỹ thực hiện hoặc gián tiếp hoặc tổng hợp các khoản phí và các chi phí/phí/giá dịch vụ liên quan đến các hoạt động của Quỹ mà Quỹ thực hiện hoặc gián tiếp hoặc tổng hợp các khoản phí và các chi phí/phí/giá dịch vụ liên quan đến các hoạt động của Quỹ mà Quỹ thực hiện hoặc gián tiếp hoặc tổng hợp các khoản phí và các chi phí/phí/giá dịch vụ liên quan đến các hoạt động của Quỹ mà Quỹ thực hiện hoặc gián tiếp hoặc tổng hợp các khoản phí và các chi phí/phí/giá dịch vụ liên quan đến các hoạt động của Quỹ mà Quỹ thực hiện hoặc gián tiếp hoặc tổng hợp các', 'gián tiếp hoặc tổng hợp các khoản phí và các chi phí/phí/giá dịch vụ liên quan đến các hoạt động của Quỹ mà Quỹ thực hiện hoặc gián tiếp hoặc tổng hợp các khoản phí và các chi phí/phí/giá dịch vụ liên quan đến các hoạt động của Quỹ mà Quỹ thực hiện hoặc gián tiếp hoặc tổng hợp các khoản phí và các chi phí/phí/giá dịch vụ liên quan đến các hoạt động của Quỹ mà Quỹ thực hiện hoặc gián tiếp hoặc tổng hợp các khoản phí và các chi phí/phí/giá dịch vụ liên quan đến các hoạt động của Quỹ mà Quỹ thực hiện hoặc gián tiếp hoặc tổng hợp các khoản phí và các chi phí/phí/giá dịch vụ liên quan đến các hoạt động của Quỹ mà Quỹ thực hiện hoặc gián tiếp hoặc tổng hợp các khoản phí và các chi phí/phí/giá dịch vụ liên quan đến các hoạt động của Quỹ mà Quỹ thực hiện hoặc gián tiếp hoặc tổng hợp các khoản phí', 'tiếp hoặc tổng hợp các khoản phí và các chi phí/phí/giá dịch vụ liên quan đến các hoạt động của Quỹ mà Quỹ thực hiện hoặc gián tiếp hoặc tổng hợp các khoản phí và các chi phí/phí/giá dịch vụ liên quan đến các hoạt động của Quỹ mà Quỹ thực hiện hoặc gián tiếp hoặc tổng hợp các khoản phí và các chi phí/phí/giá dịch vụ liên quan đến các hoạt động của Quỹ mà Quỹ thực hiện hoặc gián tiếp hoặc tổng hợp các khoản phí và các chi phí/phí/giá dịch vụ liên quan đến các hoạt động của Quỹ mà Quỹ thực hiện hoặc gián tiếp hoặc tổng hợp các khoản phí và các chi phí/phí/giá dịch vụ liên quan đến các hoạt động của Quỹ mà Quỹ thực hiện hoặc gián tiếp hoặc tổng hợp các khoản phí và các chi phí/phí/giá dịch vụ liên quan đến các hoạt động của Quỹ mà Quỹ thực hiện hoặc gián tiếp hoặc tổng hợp các khoản phí và', 'tiếp hoặc tổng hợp các khoản phí và các chi phí/phí/giá dịch vụ liên quan đến các hoạt động của Quỹ mà Quỹ thực hiện hoặc gián tiếp hoặc tổng hợp các khoản phí và các chi phí/phí/giá dịch vụ liên quan đến các hoạt động của Quỹ mà Quỹ thực hiện hoặc gián tiếp hoặc tổng hợp các khoản phí và các chi phí/phí/giá dịch vụ liên quan đến các hoạt động của Quỹ mà Quỹ thực hiện hoặc gián tiếp hoặc tổng hợp các khoản phí và các chi phí/phí/giá dịch vụ liên quan đến các hoạt động của Quỹ mà Quỹ thực hiện hoặc gián tiếp hoặc tổng hợp các khoản phí và các chi phí/phí/giá dịch vụ liên quan đến các hoạt động của Quỹ mà Quỹ thực hiện hoặc gián tiếp hoặc tổng hợp các khoản phí và các chi phí/phí/giá dịch vụ liên quan đến các hoạt động của Quỹ mà Quỹ thực hiện hoặc gián tiếp hoặc tổng hợp các khoản phí và', 'tiếp hoặc tổng hợp các khoản phí và các chi phí/phí/giá dịch vụ liên quan đến các hoạt động của Quỹ mà Quỹ thực hiện hoặc gián tiếp hoặc tổng hợp các khoản phí và các chi phí/phí/giá dịch vụ liên quan đến các hoạt động của Quỹ mà Quỹ thực hiện hoặc gián tiếp hoặc tổng hợp các khoản phí và các chi phí/phí/giá dịch vụ liên quan đến các hoạt động của Quỹ mà Quỹ thực hiện hoặc gián tiếp hoặc tổng hợp các khoản phí và các chi phí/phí/giá dịch vụ liên quan đến các hoạt động của Quỹ mà Quỹ thực hiện hoặc gián tiếp hoặc tổng hợp các khoản phí và các chi phí/phí/giá dịch vụ liên quan đến các hoạt động của Quỹ mà Quỹ thực hiện hoặc gián tiếp hoặc tổng hợp các khoản phí và các chi phí/phí/giá dịch vụ liên quan đến các hoạt động của Quỹ mà Quỹ thực hiện hoặc gián tiếp hoặc tổng hợp các khoản phí và', 'tiếp hoặc tổng hợp các khoản phí và các chi phí/phí/giá dịch vụ liên quan đến các hoạt động của Quỹ mà Quỹ thực hiện hoặc gián tiếp hoặc tổng hợp các khoản phí và các chi phí/phí/giá dịch vụ liên quan đến các hoạt động của Quỹ mà Quỹ thực hiện hoặc gián tiếp hoặc tổng hợp các khoản phí và các chi phí/phí/giá dịch vụ liên quan đến các hoạt động của Quỹ mà Quỹ thực hiện hoặc gián tiếp hoặc tổng hợp các khoản phí và các chi phí/phí/giá dịch vụ liên quan đến các hoạt động của Quỹ mà Quỹ thực hiện hoặc gián tiếp hoặc tổng hợp các khoản phí và các chi phí/phí/giá dịch vụ liên quan đến các hoạt động của Quỹ mà Quỹ thực hiện hoặc gián tiếp hoặc tổng hợp các khoản phí và các chi phí/phí/giá dịch vụ liên quan đến các hoạt động của Quỹ mà Quỹ thực hiện hoặc gián tiếp hoặc tổng hợp các khoản phí và', 'tiếp hoặc tổng hợp các khoản phí và các chi phí/phí/giá dịch vụ liên quan đến các hoạt động của Quỹ mà Quỹ thực hiện hoặc gián tiếp hoặc tổng hợp các khoản phí và các chi phí/phí/giá dịch vụ liên quan đến các hoạt động của Quỹ mà Quỹ thực hiện hoặc gián tiếp hoặc tổng hợp các khoản phí và các chi phí/phí/giá dịch vụ liên quan đến các hoạt động của Quỹ mà Quỹ thực hiện hoặc gián tiếp hoặc tổng hợp các khoản phí và các chi phí/phí/giá dịch vụ liên quan đến các hoạt động của Quỹ mà Quỹ thực hiện hoặc gián tiếp hoặc tổng hợp các khoản phí và các chi phí/phí/giá dịch vụ liên quan đến các hoạt động của Quỹ mà Quỹ thực hiện hoặc gián tiếp hoặc tổng hợp các khoản phí và các chi phí/phí/giá dịch vụ liên quan đến các hoạt động của Quỹ mà Quỹ thực hiện hoặc gián tiếp hoặc tổng hợp các khoản phí và', 'tiếp hoặc tổng hợp các khoản phí và các chi phí/phí/giá dịch vụ liên quan đến các hoạt động của Quỹ mà Quỹ thực hiện hoặc gián tiếp hoặc tổng hợp các khoản phí và các chi phí/phí/giá dịch vụ liên quan đến các hoạt động của Quỹ mà Quỹ thực hiện hoặc gián tiếp hoặc tổng hợp các khoản phí và các chi phí/phí/giá dịch vụ liên quan đến các hoạt động của Quỹ mà Quỹ thực hiện hoặc gián tiếp hoặc tổng hợp các khoản phí và các chi phí/phí/giá dịch vụ liên quan đến các hoạt động của Quỹ mà Quỹ thực hiện hoặc gián tiếp hoặc tổng hợp các khoản phí và các chi phí/phí/giá dịch vụ liên quan đến các hoạt động của Quỹ mà Quỹ thực hiện hoặc gián tiếp hoặc tổng hợp các khoản phí và các chi phí/phí/giá dịch vụ liên quan đến các hoạt động của Quỹ mà Quỹ thực hiện hoặc gián tiếp hoặc tổng hợp các khoản phí và', 'tiếp hoặc tổng hợp các khoản phí và các chi phí/phí/giá dịch vụ liên quan đến các hoạt động của Quỹ mà Quỹ thực hiện hoặc gián tiếp hoặc tổng hợp các khoản phí và các chi phí/phí/giá dịch vụ liên quan đến các hoạt động của Quỹ mà Quỹ thực hiện hoặc gián tiếp hoặc tổng hợp các khoản phí và các chi phí/phí/giá dịch vụ liên quan đến các hoạt động của Quỹ mà Quỹ thực hiện hoặc gián tiếp hoặc tổng hợp các khoản phí và các chi phí/phí/giá dịch vụ liên quan đến các hoạt động của Quỹ mà Quỹ thực hiện hoặc gián tiếp hoặc tổng hợp các khoản phí và các chi phí/phí/giá dịch vụ liên quan đến các hoạt động của Quỹ mà Quỹ thực hiện hoặc gián tiếp hoặc tổng hợp các khoản phí và các chi phí/phí/giá dịch vụ liên quan đến các hoạt động của Quỹ mà Quỹ thực hiện hoặc gián tiếp hoặc tổng hợp các khoản phí và', 'tiếp hoặc tổng hợp các khoản phí và các chi phí/phí/giá dịch vụ liên quan đến các hoạt động của Quỹ mà Quỹ thực hiện hoặc gián tiếp hoặc tổng hợp các khoản phí và các chi phí/phí/giá dịch vụ liên quan đến các hoạt động của Quỹ mà Quỹ thực hiện hoặc gián tiếp hoặc tổng hợp các khoản phí và các chi phí/phí/giá dịch vụ liên quan đến các hoạt động của Quỹ mà Quỹ thực hiện hoặc gián tiếp hoặc tổng hợp các khoản phí và các chi phí/phí/giá dịch vụ liên quan đến các hoạt động của Quỹ mà Quỹ thực hiện hoặc gián tiếp hoặc tổng hợp các khoản phí và các chi phí/phí/giá dịch vụ liên quan đến các hoạt động của Quỹ mà Quỹ thực hiện hoặc gián tiếp hoặc tổng hợp các khoản phí và các chi phí/phí/giá dịch vụ liên quan đến các hoạt động của Quỹ mà Quỹ thực hiện hoặc gián tiếp hoặc tổng hợp các khoản phí và', 'tiếp hoặc tổng hợp các khoản phí và các chi phí/phí/giá dịch vụ liên quan đến các hoạt động của Quỹ mà Quỹ thực hiện hoặc gián tiếp hoặc tổng hợp các khoản phí và các chi phí/phí/giá dịch vụ liên quan đến các hoạt động của Quỹ mà Quỹ thực hiện hoặc gián tiếp hoặc tổng hợp các khoản phí và các chi phí/phí/giá dịch vụ liên quan đến các hoạt động của Quỹ mà Quỹ thực hiện hoặc gián tiếp hoặc tổng hợp các khoản phí và các chi phí/phí/giá dịch vụ liên quan đến các hoạt động của Quỹ mà Quỹ thực hiện hoặc gián tiếp hoặc tổng hợp các khoản phí và các chi phí/phí/giá dịch vụ liên quan đến các hoạt động của Quỹ mà Quỹ thực hiện hoặc gián tiếp hoặc tổng hợp các khoản phí và các chi phí/phí/giá dịch vụ liên quan đến các hoạt động của Quỹ mà Quỹ thực hiện hoặc gián tiếp hoặc tổng hợp các khoản phí và', 'tiếp hoặc tổng hợp các khoản phí và các chi phí/phí/giá dịch vụ liên quan đến các hoạt động của Quỹ mà Quỹ thực hiện hoặc gián tiếp hoặc tổng hợp các khoản phí và các chi phí/phí/giá dịch vụ liên quan đến các hoạt động của Quỹ mà Quỹ thực hiện hoặc gián tiếp hoặc tổng hợp các khoản phí và các chi phí/phí/giá dịch vụ liên quan đến các hoạt động của Quỹ mà Quỹ thực hiện hoặc gián tiếp hoặc tổng hợp các khoản phí và các chi phí/phí/giá dịch vụ liên quan đến các hoạt động của Quỹ mà Quỹ thực hiện hoặc gián tiếp hoặc tổng hợp các khoản phí và các chi phí/phí/giá dịch vụ liên quan đến các hoạt động của Quỹ mà Quỹ thực hiện hoặc gián tiếp hoặc tổng hợp các khoản phí và các chi phí/phí/giá dịch vụ liên quan đến các hoạt động của Quỹ mà Quỹ thực hiện hoặc gián tiếp hoặc tổng hợp các khoản phí và', 'tiếp hoặc tổng hợp các khoản phí và các chi phí/phí/giá dịch vụ liên quan đến các hoạt động của Quỹ mà Quỹ thực hiện hoặc gián tiếp hoặc tổng hợp các khoản phí và các chi phí/phí/giá dịch vụ liên quan đến các hoạt động của Quỹ mà Quỹ thực hiện hoặc gián tiếp hoặc tổng hợp các khoản phí và các chi phí/phí/giá dịch vụ liên quan đến các hoạt động của Quỹ mà Quỹ thực hiện hoặc gián tiếp hoặc tổng hợp các khoản phí và các chi phí/phí/giá dịch vụ liên quan đến các hoạt động của Quỹ mà Quỹ thực hiện hoặc gián tiếp hoặc tổng hợp các khoản phí và các chi phí/phí/giá dịch vụ liên quan đến các hoạt động của Quỹ mà Quỹ thực hiện hoặc gián tiếp hoặc tổng hợp các khoản phí và các chi phí/phí/giá dịch vụ liên quan đến các hoạt động của Quỹ mà Quỹ thực hiện hoặc gián tiếp hoặc tổng hợp các khoản phí và', 'tiếp hoặc tổng hợp các khoản phí và các chi phí/phí/giá dịch vụ liên quan đến các hoạt động của Quỹ mà Quỹ thực hiện hoặc gián tiếp hoặc tổng hợp các khoản phí và các chi phí/phí/giá dịch vụ liên quan đến các hoạt động của Quỹ mà Quỹ thực hiện hoặc gián tiếp hoặc tổng hợp các khoản phí và các chi phí/phí/giá dịch vụ liên quan đến các hoạt động của Quỹ mà Quỹ thực hiện hoặc gián tiếp hoặc tổng hợp các khoản phí và các chi phí/phí/giá dịch vụ liên quan đến các hoạt động của Quỹ mà Quỹ thực hiện hoặc gián tiếp hoặc tổng hợp các khoản phí và các chi phí/phí/giá dịch vụ liên quan đến các hoạt động của Quỹ mà Quỹ thực hiện hoặc gián tiếp hoặc tổng hợp các khoản phí và các chi phí/phí/giá dịch vụ liên quan đến các hoạt động của Quỹ mà Quỹ thực hiện hoặc gián tiếp hoặc tổng hợp các khoản phí và', 'tiếp hoặc tổng hợp các khoản phí và các chi phí/phí/giá dịch vụ liên quan đến các hoạt động của Quỹ mà Quỹ thực hiện hoặc gián tiếp hoặc tổng hợp các khoản phí và các chi phí/phí/giá dịch vụ liên quan đến các hoạt động của Quỹ mà Quỹ thực hiện hoặc gián tiếp hoặc tổng hợp các khoản phí và các chi phí/phí/giá dịch vụ liên quan đến các hoạt động của Quỹ mà Quỹ thực hiện hoặc gián tiếp hoặc tổng hợp các khoản phí và các chi phí/phí/giá dịch vụ liên quan đến các hoạt động của Quỹ mà Quỹ thực hiện hoặc gián tiếp hoặc tổng hợp các khoản phí và các chi phí/phí/giá dịch vụ liên quan đến các hoạt động của Quỹ mà Quỹ thực hiện hoặc gián tiếp hoặc tổng hợp các khoản phí và các chi phí/phí/giá dịch vụ liên quan đến các hoạt động của Quỹ mà Quỹ thực hiện hoặc gián tiếp hoặc tổng hợp các khoản phí và', 'tiếp hoặc tổng hợp các khoản phí và các chi phí/phí/giá dịch vụ liên quan đến các hoạt động của Quỹ mà Quỹ thực hiện hoặc gián tiếp hoặc tổng hợp các khoản phí và các chi phí/phí/giá dịch vụ liên quan đến các hoạt động của Quỹ mà Quỹ thực hiện hoặc gián tiếp hoặc tổng hợp các khoản phí và các chi phí/phí/giá dịch vụ liên quan đến các hoạt động của Quỹ mà Quỹ thực hiện hoặc gián tiếp hoặc tổng hợp các khoản phí và các chi phí/phí/giá dịch vụ liên quan đến các hoạt động của Quỹ mà Quỹ thực hiện hoặc gián tiếp hoặc tổng hợp các khoản phí và các chi phí/phí/giá dịch vụ liên quan đến các hoạt động của Quỹ mà Quỹ thực hiện hoặc gián tiếp hoặc tổng hợp các khoản phí và các chi phí/phí/giá dịch vụ liên quan đến các hoạt động của Quỹ mà Quỹ thực hiện hoặc gián tiếp hoặc tổng hợp các khoản phí và', 'tiếp hoặc tổng hợp các khoản phí và các chi phí/phí/giá dịch vụ liên quan đến các hoạt động của Quỹ mà Quỹ thực hiện hoặc gián tiếp hoặc tổng hợp các khoản phí và các chi phí/phí/giá dịch vụ liên quan đến các hoạt động của Quỹ mà Quỹ thực hiện hoặc gián tiếp hoặc tổng hợp các khoản phí và các chi phí/phí/giá dịch vụ liên quan đến các hoạt động của Quỹ mà Quỹ thực hiện hoặc gián tiếp hoặc tổng hợp các khoản phí và các chi phí/phí/giá dịch vụ liên quan đến các hoạt động của Quỹ mà Quỹ thực hiện hoặc gián tiếp hoặc tổng hợp các khoản phí và các chi phí/phí/giá dịch vụ liên quan đến các hoạt động của Quỹ mà Quỹ thực hiện hoặc gián tiếp hoặc tổng hợp các khoản phí và các chi phí/phí/giá dịch vụ liên quan đến các hoạt động của Quỹ mà Quỹ thực hiện hoặc gián tiếp hoặc tổng hợp các khoản phí và', 'tiếp hoặc tổng hợp các khoản phí và các chi phí/phí/giá dịch vụ liên quan đến các hoạt động của Quỹ mà Quỹ thực hiện hoặc gián tiếp hoặc tổng hợp các khoản phí và các chi phí/phí/giá dịch vụ liên quan đến các hoạt động của Quỹ mà Quỹ thực hiện hoặc gián tiếp hoặc tổng hợp các khoản phí và các chi phí/phí/giá dịch vụ liên quan đến các hoạt động của Quỹ mà Quỹ thực hiện hoặc gián tiếp hoặc tổng hợp các khoản phí và các chi phí/phí/giá dịch vụ liên quan đến các hoạt động của Quỹ mà Quỹ thực hiện hoặc gián tiếp hoặc tổng hợp các khoản phí và các chi phí/phí/giá dịch vụ liên quan đến các hoạt động của Quỹ mà Quỹ thực hiện hoặc gián tiếp hoặc tổng hợp các khoản phí và các chi phí/phí/giá dịch vụ liên quan đến các hoạt động của Quỹ mà Quỹ thực hiện hoặc gián tiếp hoặc tổng hợp các khoản phí và', 'tiếp hoặc tổng hợp các khoản phí và các chi phí/phí/giá dịch vụ liên quan đến các hoạt động của Quỹ mà Quỹ thực hiện hoặc gián tiếp hoặc tổng hợp các khoản phí và các chi phí/phí/giá dịch vụ liên quan đến các hoạt động của Quỹ mà Quỹ thực hiện hoặc gián tiếp hoặc tổng hợp các khoản phí và các chi phí/phí/giá dịch vụ liên quan đến các hoạt động của Quỹ mà Quỹ thực hiện hoặc gián tiếp hoặc tổng hợp các khoản phí và các chi phí/phí/giá dịch vụ liên quan đến các hoạt động của Quỹ mà Quỹ thực hiện hoặc gián tiếp hoặc tổng hợp các khoản phí và các chi phí/phí/giá dịch vụ liên quan đến các hoạt động của Quỹ mà Quỹ thực hiện hoặc gián tiếp hoặc tổng hợp các khoản phí và các chi phí/phí/giá dịch vụ liên quan đến các hoạt động của Quỹ mà Quỹ thực hiện hoặc gián tiếp hoặc tổng hợp các khoản phí và', 'tiếp hoặc tổng hợp các khoản phí và các chi phí/phí/giá dịch vụ liên quan đến các hoạt động của Quỹ mà Quỹ thực hiện hoặc gián tiếp hoặc tổng hợp các khoản phí và các chi phí/phí/giá dịch vụ liên quan đến các hoạt động của Quỹ mà Quỹ thực hiện hoặc gián tiếp hoặc tổng hợp các khoản phí và các chi phí/phí/giá dịch vụ liên quan đến các hoạt động của Quỹ mà Quỹ thực hiện hoặc gián tiếp hoặc tổng hợp các khoản phí và các chi phí/phí/giá dịch vụ liên quan đến các hoạt động của Quỹ mà Quỹ thực hiện hoặc gián tiếp hoặc tổng hợp các khoản phí và các chi phí/phí/giá dịch vụ liên quan đến các hoạt động của Quỹ mà Quỹ thực hiện hoặc gián tiếp hoặc tổng hợp các khoản phí và các chi phí/phí/giá dịch vụ liên quan đến các hoạt động của Quỹ mà Quỹ thực hiện hoặc gián tiếp hoặc tổng hợp các khoản phí và', 'tiếp hoặc tổng hợp các khoản phí và các chi phí/phí/giá dịch vụ liên quan đến các hoạt động của Quỹ mà Quỹ thực hiện hoặc gián tiếp hoặc tổng hợp các khoản phí và các chi phí/phí/giá dịch vụ liên quan đến các hoạt động của Quỹ mà Quỹ thực hiện hoặc gián tiếp hoặc tổng hợp các khoản phí và các chi phí/phí/giá dịch vụ liên quan đến các hoạt động của Quỹ mà Quỹ thực hiện hoặc gián tiếp hoặc tổng hợp các khoản phí và các chi phí/phí/giá dịch vụ liên quan đến các hoạt động của Quỹ mà Quỹ thực hiện hoặc gián tiếp hoặc tổng hợp các khoản phí và các chi phí/phí/giá dịch vụ liên quan đến các hoạt động của Quỹ mà Quỹ thực hiện hoặc gián tiếp hoặc tổng hợp các khoản phí và các chi phí/phí/giá dịch vụ liên quan đến các hoạt động của Quỹ mà Quỹ thực hiện hoặc gián tiếp hoặc tổng hợp các khoản phí và', 'tiếp hoặc tổng hợp các khoản phí và các chi phí/phí/giá dịch vụ liên quan đến các hoạt động của Quỹ mà Quỹ thực hiện hoặc gián tiếp hoặc tổng hợp các khoản phí và các chi phí/phí/giá dịch vụ liên quan đến các hoạt động của Quỹ mà Quỹ thực hiện hoặc gián tiếp hoặc tổng hợp các khoản phí và các chi phí/phí/giá dịch vụ liên quan đến các hoạt động của Quỹ mà Quỹ thực hiện hoặc gián tiếp hoặc tổng hợp các khoản phí và các chi phí/phí/giá dịch vụ liên quan đến các hoạt động của Quỹ mà Quỹ thực hiện hoặc gián tiếp hoặc tổng hợp các khoản phí và các chi phí/phí/giá dịch vụ liên quan đến các hoạt động của Quỹ mà Quỹ thực hiện hoặc gián tiếp hoặc tổng hợp các khoản phí và các chi phí/phí/giá dịch vụ liên quan đến các hoạt động của Quỹ mà Quỹ thực hiện hoặc gián tiếp hoặc tổng hợp các khoản phí và']",Chiến lược đầu tư chính là đầu tư năng động vào cổ phiếu của các Công ty hàng đầu trong rổ cổ phiếu VNMID và VNSML.
Vốn điều lệ ban đầu và mệnh giá một chứng chỉ quỹ trong đợt phát hành lần đầu là bao nhiêu?,Tôi không tìm thấy thông tin đó trong tài liệu.,"['*   Kết quả hoạt động trong quá khứ của các Quỹ không có nghĩa là kết quả hoạt động trong tương lai.\n*   Tên của Quỹ không hàm ý về chất lượng hoạt động cũng như những lợi và lợi nhuận của Quỹ trong tương lai;\n*   Công ty Quản lý Quỹ không chịu trách nhiệm pháp lý về những rủi ro từ đầu tư của các chủ nợ, thành viên Hội đồng thành viên, Ban điều hành và nhân viên của Công ty Quản lý Quỹ không có trách nhiệm pháp lý về các rủi ro hoạt động của Công ty Quản lý Quỹ.\n*   Giống như các hình thức đầu tư khác, Quỹ, rủi ro thanh khoản sẽ được phân bổ trên cơ sở số ngày gần nhất với giá trị tài sản ròng. Các khoản đầu tư khác có thể có nhiều rủi ro hơn so với thời điểm hiện tại. Nhà Đầu tư cần phải nhận thức được khả năng chấp nhận rủi ro từ vơi rủi ro đầu tư mà Quỹ có thể gặp phải trong tương lai.', 'Quỹ đầu tư chứng khoán được mô tả trong Bản cáo bạch này là Quỹ được thành lập theo\nLuật Chứng khoán số 54/2019/QH14 Quốc hội Nước Cộng Hòa Xã hội Chủ nghĩa Việt\nNam thông qua ngày 26 tháng 11 năm 2019 và các văn bản hướng dẫn thi hành. Bản cáo\nbạch này đã được đăng ký với Ủy ban Chứng khoán Nhà nước ngày / /2022.  \nTHÔNG BÁO QUAN TRỌNG  \nCác nhà đầu tư nên nghiên cứu Bản cáo bạch này một cách cẩn trọng và toàn diện và không nên\ncoi nội dung hoặc tóm tắt ở đây là các tư vấn liên quan đến pháp lý, thuế, hoặc tài chính/đầu\ntư và nên tham khảo ý kiến chuyên gia tư vấn của mình về các yêu cầu pháp lý, thuế, năm\ngiữa, hoặc tư vấn về các khía cạnh khác của việc đầu tư, mua, cho tặng, năm giữ,\nnhượng, chuyển nhượng, hoặc bán một phần hoặc toàn bộ các khoản đầu tư vào Quỹ. Nhà đầu tư', 'Các quy định khác liên quan đến kiểm toán, kế toán và chế độ báo cáo tuân thủ theo quy định tại Điều Lệ Quỹ.  \n**3. Các rủi ro khi đầu tư vào Quỹ**  \nMục tiêu của Công ty Quản lý Quỹ là quản lý các rủi ro đầu tư, và nếu có thể, hạn chế các tác động của các rủi ro này bằng việc áp dụng các phương pháp quản lý đầu tư theo tiêu chuẩn quốc tế tốt nhất. Nhà Đầu tư cần lưu ý về các điểm quan trọng sau đây:  \n*   Quỹ, Công ty Quản lý Quỹ, thành viên Hội đồng quản trị, người điều hành và nhân viên của ngân hàng giám sát sẽ làm nhiệm vụ của quản trị rủi ro và bảo quản tài sản của quỹ đại chúng, công ty đầu tư chứng khoán không được là đối tượng mua, bán trong giao dịch mua, bán tài sản của quỹ đại chúng, công ty đầu tư chứng khoán.', '*   Công ty Quản lý Quỹ sẽ xem xét và lựa chọn các khoản đầu tư có liên quan đến các chi phí.\n**3.1.Rủi ro lãi suất**  \nLà rủi ro mà hợp lý của các dòng tiền trong tương lai của chứng khoán có thu nhập cố định bị biến động do những thay đổi của lãi suất thị trường, dẫn tới giá trị thị trường của chứng khoán thay đổi. Thông thường, giá trị thị trường của trái phiếu và các chứng khoán có thu nhập cố định biến động ngược chiều với lãi suất. Quỹ có thể giảm thiểu rủi ro lãi suất bằng cách giữ các trái phiếu phù hợp với thời hạn của lãi suất. Công ty Quản lý Quỹ sẽ cố gắng giảm thiểu rủi ro lãi suất bằng cách lựa chọn các chứng khoán có lãi suất phù hợp với thời hạn của lãi suất.\n**3.2.Rủi ro lạm phát**', 'Là rủi ro mà hợp lý của các dòng tiền trong tương lai của chứng khoán có thu nhập cố định bị biến động do những thay đổi của lãi suất thị trường, dẫn tới giá trị thị trường của chứng khoán thay đổi. Thông thường, giá trị thị trường của trái phiếu và các chứng khoán có thu nhập cố định biến động ngược chiều với lãi suất. Quỹ có thể giảm thiểu rủi ro lãi suất bằng cách giữ các trái phiếu phù hợp với thời hạn của lãi suất. Công ty Quản lý Quỹ sẽ cố gắng giảm thiểu rủi ro lãi suất bằng cách lựa chọn các chứng khoán có lãi suất phù hợp với thời hạn của lãi suất.  \n**3.8. Rủi ro khối lượng**', '**3.2.Rủi ro lạm phát**  \nGiá trị thị trường tỷ lệ nghịch với lạm phát. Vì dụ trong môi trường lạm phát tăng, sức mua hay giá trị thực của các đồng tiền trong tương lai (menh giá và lãi trái phiếu nhận được hàng kỳ) sẽ giảm. Khi đó lợi suất của Quỹ trái phiếu tăng lên dẫn đến giá trị trái phiếu ròng. Rủi ro lạm phát giới hạn mức tăng trưởng của trái phiếu. Điều này thường biểu hiện cách rủi ro tài sản tài sản, trái phiếu hoặc chứng khoán nhận được hàng kỳ có thể bị ảnh hưởng bởi lạm phát.\n**3.3.Rủi ro tỷ giá**', '**2.12. Kiểm toán, kế toán và chế độ báo cáo**  \nCông ty kiểm toán được lựa chọn phải được thành lập và hoạt động phù hợp với quy định của Pháp luật, nằm trong danh sách các công ty kiểm toán được UBCKNN chấp thuận kiểm toán cho tổ chức tài chính, tổ chức niêm yết và cho tổ chức kinh doanh chứng khoán và không được là người liên quan của Công ty Quản lý Quỹ, Ngân hàng Giám sát. Năm kiểm toán: Tổng công ty kiểm toán Quỹ sẽ được Công ty Quản lý Quỹ đề cử để Đại Hội Đồng Quỹ thông qua. Các năm sau đó, Đại Hội Đầu Tư Quỹ sẽ thông qua cho Ban Đại Diện Quỹ thông qua việc lựa chọn công ty kiểm toán. Công ty Quản lý Quỹ sẽ đề xuất với Ban Đại Diện Quỹ ít nhất (02) công ty kiểm toán để kiểm toán cho Quỹ mình.  \n**Chế độ kế toán**', 'ngược lại;  \n*   Ngân hàng giám sát, thành viên Hội đồng quản trị, người điều hành và nhân viên của ngân hàng giám sát làm nhiệm vụ giám sát hoạt động và bảo quản tài sản của Quỹ đại chúng, Công ty đầu tư chứng khoán không được là đối tượng mua, bán trong giao dịch mua, bán tài sản của Quỹ đại chúng, công ty đầu tư chứng khoán.\n*   Có đầy đủ năng lực cung cấp dịch vụ giám sát, lưu ký;\n*   Thực hiện các cam kết đối với Quỹ như nêu tại Phụ Lục 2 và Phụ Lục 3 của Điều Lệ Quỹ.  \nCác quy định về quyền và nghĩa vụ, thời hạn công bố thông tin về Công ty Quản lý Quỹ tuân theo quy định tại Chương VII Điều Lệ Quỹ.  \n**2.12. Kiểm toán, kế toán và chế độ báo cáo**', '**3.6. Rủi ro biến động giá**  \nRủi ro về biến động giá của Quỹ phát sinh khi một hay một số Nhà Đầu tư nắm giữ một số lượng lớn cổ phiếu của Quỹ quyết định thực hiện lệnh bán của các cổ phiếu của Quỹ này. Nắm giữ một số lượng lớn cổ phiếu của Quỹ quyết định bán.  \n**3.7. Rủi ro tái đầu tư**  \nRủi ro tái đầu tư là rủi ro có thể xảy ra khi các khoản đầu tư trái phiếu với dòng tiền lãi trái phiếu nhận được hàng kỳ và gốc trái phiếu nhận được vào thời điểm đáo hạn được đi tìm đầu tư nhận lại. Công ty Quản lý Quỹ quyết định bán các chứng khoán của Quỹ.', '*   Ngân hàng giám sát, thành viên Hội đồng quản trị, người điều hành và nhân viên của ngân hàng giám sát làm nhiệm vụ giám sát hoạt động và bảo quản tài sản của Quỹ đại chúng, Công ty đầu tư chứng khoán không được là đối tượng mua, bán trong giao dịch mua, bán tài sản của Quỹ đại chúng, công ty đầu tư chứng khoán.\n*   Có đầy đủ năng lực cung cấp dịch vụ giám sát, lưu ký;  \nCác quy định về quyền và nghĩa vụ, thời hạn công bố thông tin về Công ty Quản lý Quỹ tuân theo quy định tại Chương VII Điều Lệ Quỹ.', 'quỹ (nếu có) so với mọi chỉ phí phát sinh liên quan đến việc điều chỉnh lại danh mục đầu tư.\nTrong thời hạn 05 ngày làm việc kể từ ngày hoãn khẩn tại thời điểm điều chỉnh lại danh mục đầu tư.\nTrong thời hạn 05 ngày làm việc kể từ ngày hoãn khẩn tại thời điểm điều chỉnh lại danh mục đầu tư.\nTrong thời hạn 05 ngày làm việc kể từ ngày hoãn khẩn tại thời điểm điều chỉnh lại danh mục đầu tư.\nTrong thời hạn 05 ngày làm việc kể từ ngày hoãn khẩn tại thời điểm điều chỉnh lại danh mục đầu tư.\nTrong thời hạn 05 ngày làm việc kể từ ngày hoãn khẩn tại thời điểm điều chỉnh lại danh mục đầu tư.\nTrong thời hạn 05 ngày làm việc kể từ ngày hoãn khẩn tại thời điểm điều chỉnh lại danh mục đầu tư.\nTrong thời hạn 05 ngày làm việc kể từ ngày hoãn khẩn tại thời điểm điều chỉnh lại danh mục đầu tư.', 'Việc bảo vệ Nhà Đầu tư nước ngoài không bị rủi ro này nằm ngoài khả năng của Quỹ và vì vậy, các Nhà Đầu tư nước ngoài, nếu cần thiết, cần phải tìm kiếm các công ty tư vấn phù hợp cho các nhà đầu tư của mình.  \n**3.5. Rủi ro thanh khoản**  \nRủi ro thanh khoản là rủi mà nhà đầu tư không bán được chứng chỉ quỹ vào ngày giao dịch chứng chỉ quỹ. Các chứng khoán thuộc danh mục đầu tư của Quỹ không thành khoản, hoặc đầu tư của Quỹ vào các chứng khoán có thanh khoản thấp.\nTrong đó, các chứng khoán trong danh mục đầu tư của Quỹ có thể được giao dịch trên thị trường chứng khoán, được thanh toán theo quy định của Điều Lệ Quỹ.  \n**3.6. Rủi ro biến động giá**', '**3.3.Rủi ro tỷ giá**  \nDo tài sản và nợ phải trả của Quỹ đều được trình bày bằng đồng Việt Nam, là đơn vị tiền tệ sử dụng của Quỹ. Mặc dù rủi ro tỷ giá trong tương lai hạn chế ảnh hưởng từ đồng tiền nước ngoài, thì tính chất của từng sản phẩm tài chính được trình bày trên Bảng Cân Đối Kế Toán của Quỹ. Do đó, giá trị thị trường của từng khoản đầu tư có thể bị ảnh hưởng bởi tỷ giá hối đoái.', 'c) Hoạt động mới, các cập, pháp lập hoặc các tổ chức phát hành;\nd) Quy định mới trong thời gian giải thể;\nTrong thời hạn 03 tháng kể từ ngày có các sai lệch phát sinh do các nguyên nhân quy định tại\nđiểm a, b, d, e điều này, công ty quản lý quỹ có nghĩa vụ thông báo cho Ủy ban Chứng khoán\nNhà nước và điều chỉnh lại cơ cấu danh mục đầu tư cho phù hợp với quy định tại Mục IX.2.2.4.\nTrường hợp sai lệch cơ cấu danh mục đầu tư không tuân thủ hạn chế đầu tư theo quy định\npháp luật hoặc điều lệ Quỹ, công ty quản lý quỹ phải điều chỉnh lại danh mục đầu tư trong\nhạn 15 ngày kể từ ngày phát hiện sai lệch. Công ty quản lý quỹ phải đối chiếu tương hai cho\nquỹ (nếu có) so với mọi chỉ phí phát sinh liên quan đến việc điều chỉnh lại danh mục đầu tư.', 'cụ nợ của Chính phủ;\nd) Không được đầu tư quá 30% tổng giá trị tài sản của quỹ vào các tài sản quỹ định tại điểm a,\nb, d, e và f mục IX.2.2.3, phải hành bởi các công ty trong cùng một nhóm công ty cơ quan hệ\nsở hữu với nhau, thuộc sở hữu hợp của sau đây: Công ty con, các công ty sở hữu\nhien 35% cổ phần, phần vốn góp của nhau.nhóm công ty con, công ty mẹ. Tổng\nđộ phân đầu tư vào chứng khoán phái sinh tính bằng giá trị cam kết của hợp đồng xác định\ntheo quy định tại Phụ Lục 4 Điều Lệ Quỹ;\ne) Không được đầu tư quá 10% tổng giá trị tài sản của quỹ vào các tài sản quỹ định tại điểm d\nmục IX.2.2.3;\nf) Tổng giá trị các hạng mục đầu tư lớn trong danh mục đầu tư của quỹ không được vượt quá\n40% tổng giá trị tài sản của quỹ. Trong đó, hạng mục đầu tư lớn của quỹ là hạng mục đầu tư', '2.2.4 Hạn mức đầu tư\nHạn mức đầu tư của Quỹ được quy định chi tiết tuân theo các quy định tại Thông tư hướng dẫn\nhoạt động và quản lý các quỹ đầu tư chứng khoán. Co cấu danh mục đầu tư của Quỹ phải đảm\nbảo tuân theo các hạn mức đầu tư sau:\na) Tựa trên tổng giá trị tài khoản thanh toán của Quỹ tại ngân hàng giám sát, quỹ mở được\ncâu đề qua 49% tổng giá trị tài sản của quỹ vào các tài sản theo quy định tại điểm a, b mục\nIX.2.2.3\nb) Không được đầu tư vào chứng khoán của một tổ chức phát hành quá 10% tổng giá trị chứng\nkhoán đang lưu hành của tổ chức đó, trừ công cụ nợ của Chính phủ;\nc) Không được đầu tư quá 20% tổng giá trị tài sản của quỹ vào chứng khoán đang lưu hành và\ncác tài sản (nếu có) quy định tại điểm a, b mục IX.2.2.3 của một tổ chức phát hành, trừ công\ncụ nợ của Chính phủ;', '**3.8. Rủi ro khối lượng**  \nRủi ro khối lượng là rủi ro có thể phát sinh khi thực hiện các lệnh mua, bán của Quỹ hoặc các khoản đầu tư của Quỹ mà các lệnh mua bán này bị hạn chế về số lượng, hoặc chỉ có thể thực hiện được một số lượng giới hạn.\nCông ty Quản lý Quỹ có thể có một số lượng lớn cổ phiếu trong danh mục đầu tư của Quỹ có thể bị ảnh hưởng bởi rủi ro khối lượng.  \n**3.9. Rủi ro bất khả kháng**  \nRủi ro này là những sự kiện bất thường có tính chất ảnh hưởng đến khả năng hoạt động của Quỹ.', '*   Thảm họa thiên nhiên như động đất, lũ lụt, hỏa hoạn, thảm họa thiên nhiên, thảm họa thiên nhiên, thảm họa thiên nhiên, thảm họa thiên nhiên, thảm họa thiên nhiên, thảm họa thiên nhiên, thảm họa thiên nhiên, thảm họa thiên nhiên, thảm họa thiên nhiên, thảm họa thiên nhiên, thảm họa thiên nhiên, thảm họa thiên nhiên, thảm họa thiên nhiên, thảm họa thiên nhiên, thảm họa thiên nhiên, thảm họa thiên nhiên, thảm họa thiên nhiên, thảm họa thiên nhiên, thảm họa thiên nhiên, thảm họa thiên nhiên, thảm họa thiên nhiên, thảm họa thiên nhiên, thảm họa thiên nhiên, thảm họa thiên nhiên, thảm họa thiên nhiên, thảm họa thiên nhiên, thảm họa thiên nhiên, thảm họa thiên nhiên, thảm họa thiên nhiên, thảm họa thiên nhiên, thảm họa thiên nhiên, thảm họa thiên nhiên, thảm họa thiên nhiên, thảm họa thiên', '*   Có đầy đủ cơ sở vật chất, nhân sự để Quản lý Quỹ mở;\n*   Đồng ý thực hiện các cam kết đối với Quỹ như nêu tại Phụ Lục 1 và Phụ Lục 3 của Điều Lệ Quỹ.  \nCác quy định về quyền và nghĩa vụ, chấm dứt quyền và nghĩa vụ, hạn chế hoạt động của Công ty Quản lý Quỹ tuân thủ theo quy định tại Chương VI Điều Lệ Quỹ.  \n**2.11. Tiêu chí lựa chọn, quyền hạn và trách nhiệm của Ngân hàng giám sát**\nNgân hàng Giám sát được lựa chọn phải đáp ứng các điều kiện sau:  \n*   Ngân hàng giám sát do Công ty Quản lý Quỹ lựa chọn phải đáp ứng các điều kiện quy định tại Khoản 1 Điều 116 Luật Chứng khoán;\n*   Ngân hàng giám sát phải hoạt động độc lập và tách biệt với Công ty Quản lý Quỹ mà ngân hàng cung cấp dịch vụ giám sát;', '40% tổng giá trị tài sản của quỹ. Trong đó, hạng mục đầu tư lớn của quỹ là hạng mục đầu tư\nvào các loại tài sản quỹ định tại điểm a, d, và g mục IX.2.2.3 (ngoại trừ chứng chỉ tiền gửi)\nphải hành bởi cùng một tổ chức, có tổng giá trị chiếm từ 5% trở lên tổng giá trị tài sản của\nquỹ;\ng) Tại mọi thời điểm, tổng giá trị cam kết trong các giao dịch chứng khoán phái sinh, dự nợ vay\nvà các khoản phải trả của quỹ không được vượt giá trị tài sản ròng của quỹ;\nh) Không được đầu tư vào chứng khoán của Chính phủ Quỹ;\ni) Chỉ được đầu tư vào chứng chỉ quỹ đại chúng khác, công ty đầu tư chứng khoán đại chúng\ndo công ty quản lý quỹ khác quản lý và bảo đảm các hạn chế sau:\n- Không đầu tư vào quá 10% tổng giá trị chứng chỉ quỹ đang lưu hành của một quỹ đại chúng,', '*   Không có bất kỳ sự bảo đảm nào về số tiền chi trả và giá trị của cổ tức được thanh toán trong tương lai;', 'Trong thời hạn 05 ngày làm việc kể từ ngày hoãn khẩn tại thời điểm điều chỉnh lại danh mục đầu tư.\nTrong thời hạn 05 ngày làm việc kể từ ngày hoãn khẩn tại thời điểm điều chỉnh lại danh mục đầu tư.\nTrong thời hạn 05 ngày làm việc kể từ ngày hoãn khẩn tại thời điểm điều chỉnh lại danh mục đầu tư.\nTrong thời hạn 05 ngày làm việc kể từ ngày hoãn khẩn tại thời điểm điều chỉnh lại danh mục đầu tư.\nTrong thời hạn 05 ngày làm việc kể từ ngày hoãn khẩn tại thời điểm điều chỉnh lại danh mục đầu tư.\nTrong thời hạn 05 ngày làm việc kể từ ngày hoãn khẩn tại thời điểm điều chỉnh lại danh mục đầu tư.\nTrong thời hạn 05 ngày làm việc kể từ ngày hoãn khẩn tại thời điểm điều chỉnh lại danh mục đầu tư.\nTrong thời hạn 05 ngày làm việc kể từ ngày hoãn khẩn tại thời điểm điều chỉnh lại danh mục đầu tư.', 'Trong thời hạn 05 ngày làm việc kể từ ngày hoãn khẩn tại thời điểm điều chỉnh lại danh mục đầu tư.\nTrong thời hạn 05 ngày làm việc kể từ ngày hoãn khẩn tại thời điểm điều chỉnh lại danh mục đầu tư.\nTrong thời hạn 05 ngày làm việc kể từ ngày hoãn khẩn tại thời điểm điều chỉnh lại danh mục đầu tư.\nTrong thời hạn 05 ngày làm việc kể từ ngày hoãn khẩn tại thời điểm điều chỉnh lại danh mục đầu tư.\nTrong thời hạn 05 ngày làm việc kể từ ngày hoãn khẩn tại thời điểm điều chỉnh lại danh mục đầu tư.\nTrong thời hạn 05 ngày làm việc kể từ ngày hoãn khẩn tại thời điểm điều chỉnh lại danh mục đầu tư.\nTrong thời hạn 05 ngày làm việc kể từ ngày hoãn khẩn tại thời điểm điều chỉnh lại danh mục đầu tư.\nTrong thời hạn 05 ngày làm việc kể từ ngày hoãn khẩn tại thời điểm điều chỉnh lại danh mục đầu tư.', 'Trong thời hạn 05 ngày làm việc kể từ ngày hoãn khẩn tại thời điểm điều chỉnh lại danh mục đầu tư.\nTrong thời hạn 05 ngày làm việc kể từ ngày hoãn khẩn tại thời điểm điều chỉnh lại danh mục đầu tư.\nTrong thời hạn 05 ngày làm việc kể từ ngày hoãn khẩn tại thời điểm điều chỉnh lại danh mục đầu tư.\nTrong thời hạn 05 ngày làm việc kể từ ngày hoãn khẩn tại thời điểm điều chỉnh lại danh mục đầu tư.\nTrong thời hạn 05 ngày làm việc kể từ ngày hoãn khẩn tại thời điểm điều chỉnh lại danh mục đầu tư.\nTrong thời hạn 05 ngày làm việc kể từ ngày hoãn khẩn tại thời điểm điều chỉnh lại danh mục đầu tư.\nTrong thời hạn 05 ngày làm việc kể từ ngày hoãn khẩn tại thời điểm điều chỉnh lại danh mục đầu tư.\nTrong thời hạn 05 ngày làm việc kể từ ngày hoãn khẩn tại thời điểm điều chỉnh lại danh mục đầu tư.', 'Trong thời hạn 05 ngày làm việc kể từ ngày hoãn khẩn tại thời điểm điều chỉnh lại danh mục đầu tư.\nTrong thời hạn 05 ngày làm việc kể từ ngày hoãn khẩn tại thời điểm điều chỉnh lại danh mục đầu tư.\nTrong thời hạn 05 ngày làm việc kể từ ngày hoãn khẩn tại thời điểm điều chỉnh lại danh mục đầu tư.\nTrong thời hạn 05 ngày làm việc kể từ ngày hoãn khẩn tại thời điểm điều chỉnh lại danh mục đầu tư.\nTrong thời hạn 05 ngày làm việc kể từ ngày hoãn khẩn tại thời điểm điều chỉnh lại danh mục đầu tư.\nTrong thời hạn 05 ngày làm việc kể từ ngày hoãn khẩn tại thời điểm điều chỉnh lại danh mục đầu tư.\nTrong thời hạn 05 ngày làm việc kể từ ngày hoãn khẩn tại thời điểm điều chỉnh lại danh mục đầu tư.\nTrong thời hạn 05 ngày làm việc kể từ ngày hoãn khẩn tại thời điểm điều chỉnh lại danh mục đầu tư.']",Vốn điều lệ huy động lần đầu là 50.000.000.000 VNĐ. Mệnh giá là 10.000 VNĐ/chứng chỉ quỹ.
Mức phí dịch vụ quản lý quỹ (Management Fee) tối đa là bao nhiêu phần trăm một năm?,"Mức phí quản lý của quỹ là 1,2% NAV/năm.","['từ trên 12 tháng trở lên 0,00%  \nGiấy dịch vụ Chuyển Đổi Quỹ sẽ được hạch toán cho Công ty Quản lý Quỹ và Đại Lý Phân Phối căn cứ theo hợp đồng ký giữa Công ty Quản lý Quỹ và Đại Lý Phân Phối.  \nd) Giấy dịch vụ Chuyển Nhượng  \nNhà Đầu tư phải trả một mức phí dịch vụ Chuyển Nhượng duy nhất là 300.000 đồng (ba trăm nghìn đồng) cho mỗi giao dịch chuyển nhượng Đơn vị Quỹ. Giá dịch vụ Chuyển Nhượng do người thực hiện chuyển nhượng thanh toán.  \nGiấy dịch vụ Chuyển nhượng sẽ không áp dụng trong trường hợp Nhà Đầu tư thực hiện chuyển nhượng số Chứng Chỉ quỹ từ tài khoản này sang tài khoản khác cùng tên thì Nhà Đầu tư tại Hai Đại Lý Phân Phối khác nhau.', 'Website : www.techcomcapital.com.vn  \nNơi cung cấp Bản cáo bạch:\nBản cáo bạch cập nhật những các tài liệu của Quỹ (báo cáo hoạt động, báo cáo tài chính,\nĐiểu Lệ Quỹ và các tài liệu cần thiết khác) được cung cấp trên trang điện tử của TCC,\nwww.techcomcapital.com.vn, tại văn phòng của TCC và các Đại lý phân phối như danh sách\ntrong phụ lục 1 của Bản cáo Bạch.  \nPhụ trách công bố thông tin:\nÔng Đặng Lưu Dũng – Tổng Giám đốc\nĐịa chỉ: Công ty Cổ phần Quản lý Quỹ Ký Thương\nTầng 28, Tòa C5, số 119 Trần Duy Hưng, phường Trung Hòa, Quận Cầu Giấy, Hà Nội\nĐiện thoại: (84-24) 39446368 Fax: (84-24) 39446583', '*   9 năm kinh nghiệm với vai trò giám đốc kiểm toán tại Công ty TNHH KPMG Việt Nam.\n*   Hiện là Giám đốc tài chính (CFO) tại Công ty CP Đầu Tư Thương Mại Quốc Tế Matrrot Dd.  \nCác quy định về tiêu chuẩn lựa chọn thành viên Ban đại diện Quỹ, quyền hạn và nhiệm vụ của Ban đại diện Quỹ, chủ tịch Ban đại diện Quỹ, đinh chỉ hoạc bãi miễn thành viên Ban đại diện Quỹ, cuộc họp của Ban đại diện Quỹ tuân theo quy định tại chương V Điều Lệ Quỹ.  \n**2.10. Quyền hạn và trách nhiệm của Công ty Quản lý Quỹ**\nCông ty Quản lý Quỹ được lựa chọn phải thỏa mãn các điều kiện sau:  \n*   Được thực hiện nghiệp vụ quản lý Quỹ;\n*   Hoàn toàn độc lập với Ngân hàng Giám sát;\n*   Có đầy đủ cơ sở vật chất, nhân sự để Quản lý Quỹ mở;', '(Quỹ chứng khoán doanh nghiệp vừa và nhỏ Techcom)\nBản cáo bạch này được phát hành bởi:\nCông ty Cổ phần Quản lý Quỹ Ký Thương - TechcomCapital (“TCC”)\nĐịa chỉ : Tầng 28, Tòa C5, số 119 Trần Duy Hưng, phường Trung Hòa, Quận Cầu\nGiấy, Hà Nội\nĐiện thoại : (84-24) 39446368 Fax: (84-24) 39446583\nWebsite : www.techcomcapital.com.vn  \nNơi cung cấp Bản cáo bạch:\nBản cáo bạch cập nhật những các tài liệu của Quỹ (báo cáo hoạt động, báo cáo tài chính,\nĐiểu Lệ Quỹ và các tài liệu cần thiết khác) được cung cấp trên trang điện tử của TCC,\nwww.techcomcapital.com.vn, tại văn phòng của TCC và các Đại lý phân phối như danh sách\ntrong phụ lục 1 của Bản cáo Bạch.  \nPhụ trách công bố thông tin:\nÔng Đặng Lưu Dũng – Tổng Giám đốc\nĐịa chỉ : Công ty Cổ phần Quản lý Quỹ Ký Thương', 'Điểu Lệ Quỹ và các tài liệu cần thiết khác) được cung cấp trên trang điện tử của TCC,\nwww.techcomcapital.com.vn, tại văn phòng của TCC và các Đại lý phân phối như danh sách\ntrong phụ lục 1 của Bản cáo Bạch.  \nPhụ trách công bố thông tin:\nÔng Đặng Lưu Dũng – Tổng Giám đốc\nĐịa chỉ: Công ty Cổ phần Quản lý Quỹ Ký Thương\nTầng 28, Tòa C5, số 119 Trần Duy Hưng, phường Trung Hòa, Quận Cầu Giấy, Hà Nội\nĐiện thoại: (84-24) 39446368 Fax: (84-24) 39446583  \nBản cáo bạch này được phát hành bởi:\nCông ty Cổ phần Quản lý Quỹ Ký Thương - TechcomCapital (“TCC”)\nĐịa chỉ : Tầng 28, Tòa C5, số 119 Trần Duy Hưng, phường Trung Hòa, Quận Cầu Giấy, Hà Nội\nĐiện thoại : (84-24) 39446368 Fax: (84-24) 39446583\nWebsite : www.techcomcapital.com.vn  \nNơi cung cấp Bản cáo bạch:', 'nhượng, chuyển nhượng, hoặc bán một phần hoặc toàn bộ các khoản đầu tư vào Quỹ. Nhà đầu tư\ncó trách nhiệm tự mình thực hiện việc thẩm định và đánh giá mọi rủi ro liên quan đến đầu tư.  \nBản cáo bạch này bao gồm các thông tin về Quỹ, dự kiến các khoản đầu tư của Quỹ, các điều kiện\nvà quy định của Quỹ, hoặc các thông tin khác mà nhà đầu tư cần biết. Nhà đầu tư nên đọc kỹ Bản\ncáo bạch này và các tài liệu đính kèm trước khi ra quyết định đầu tư.\nTCC sẽ cập nhật Bản cáo bạch này nếu có bất kỳ thay đổi nào về thông tin.\nBản cáo bạch được cung cấp miễn phí tại văn phòng của TCC, các Đại lý phân phối và trên trang\nweb của TCC.  \nBản cáo bạch này được phát hành bởi:\nCông ty Cổ phần Quản lý Quỹ Ký Thương - TechcomCapital (“TCC”)', 'Bản cáo bạch này được phát hành bởi:\nCông ty Cổ phần Quản lý Quỹ Ký Thương - TechcomCapital (“TCC”)\nĐịa chỉ: Tầng 28, Tòa C5, số 119 Trần Duy Hưng, phường Trung Hòa, Quận Cầu Giấy, Hà Nội.\nĐiện thoại: (84-24) 39446368. Fax: (84-24) 39446583. Website: www.techcomcapital.com.vn.  \nBản cáo bạch này được phát hành bởi:\nCông ty Cổ phần Quản lý Quỹ Ký Thương - TechcomCapital (“TCC”)\nĐịa chỉ: Tầng 28, Tòa C5, số 119 Trần Duy Hưng, phường Trung Hòa, Quận Cầu Giấy, Hà Nội\nĐiện thoại: (84-24) 39446368 Fax: (84-24) 39446583\nWebsite: www.techcomcapital.com.vn  \nNơi cung cấp Bản cáo bạch:\nBản cáo bạch cập nhật những các tài liệu của Quỹ (báo cáo hoạt động, báo cáo tài chính,\nĐiểu Lệ Quỹ và các tài liệu cần thiết khác) được cung cấp trên trang điện tử của TCC,', 'Số: 9176 /QĐ-UBCK\nGiấy phép hành chứng chỉ quỹ ra công chúng\n----------------  \nCăn cứ khoản 2, Điều 46 Pháp lệnh Chứng khoán và Điều 45, 46 Nghị định số\n56/2007/NĐ-CP ngày 09/04/2007 của Chính phủ quy định chi tiết thi hành một số\nđiều của Pháp lệnh Chứng khoán;\nCăn cứ Quyết định số 30/2008/QĐ-BTC ngày 02/06/2008 của Bộ Tài chính về việc\nban hành Quy chế tổ chức và hoạt động của công ty quản lý quỹ, công ty chứng khoán;\nCăn cứ Giấy chứng nhận đăng ký kinh doanh số 0102013096 do Sở Kế hoạch và\nĐầu tư Thành phố Hà Nội cấp ngày 21/10/2008;\nXét đề nghị của Công ty cổ phần Quản lý Quỹ Ký Thương - TechcomCapital;  \nQUỸ ĐẦU TƯ CỔ PHIẾU DOANH NGHIỆP VỪA VÀ NHỎ TECHCOM\n(TCSME)  \nCHÀO BẢN CHỨNG CHỈ QUỸ ĐẦU TƯ CHỨNG KHOÁN RA CÔNG CHỨNG\n(Quỹ chứng khoán doanh nghiệp vừa và nhỏ Techcom)', 'Quỹ thực hiện hoặc gián tiếp hoặc tổng hợp các khoản phí và các chi phí/phí/giá dịch vụ liên quan đến các hoạt động của Quỹ mà Quỹ thực hiện hoặc gián tiếp hoặc tổng hợp các khoản phí và các chi phí/phí/giá dịch vụ liên quan đến các hoạt động của Quỹ mà Quỹ thực hiện hoặc gián tiếp hoặc tổng hợp các khoản phí và các chi phí/phí/giá dịch vụ liên quan đến các hoạt động của Quỹ mà Quỹ thực hiện hoặc gián tiếp hoặc tổng hợp các khoản phí và các chi phí/phí/giá dịch vụ liên quan đến các hoạt động của Quỹ mà Quỹ thực hiện hoặc gián tiếp hoặc tổng hợp các khoản phí và các chi phí/phí/giá dịch vụ liên quan đến các hoạt động của Quỹ mà Quỹ thực hiện hoặc gián tiếp hoặc tổng hợp các khoản phí và các chi phí/phí/giá dịch vụ liên quan đến các hoạt động của Quỹ mà Quỹ thực hiện hoặc gián tiếp hoặc', '40% tổng giá trị tài sản của quỹ. Trong đó, hạng mục đầu tư lớn của quỹ là hạng mục đầu tư\nvào các loại tài sản quỹ định tại điểm a, d, và g mục IX.2.2.3 (ngoại trừ chứng chỉ tiền gửi)\nphải hành bởi cùng một tổ chức, có tổng giá trị chiếm từ 5% trở lên tổng giá trị tài sản của\nquỹ;\ng) Tại mọi thời điểm, tổng giá trị cam kết trong các giao dịch chứng khoán phái sinh, dự nợ vay\nvà các khoản phải trả của quỹ không được vượt giá trị tài sản ròng của quỹ;\nh) Không được đầu tư vào chứng khoán của Chính phủ Quỹ;\ni) Chỉ được đầu tư vào chứng chỉ quỹ đại chúng khác, công ty đầu tư chứng khoán đại chúng\ndo công ty quản lý quỹ khác quản lý và bảo đảm các hạn chế sau:\n- Không đầu tư vào quá 10% tổng giá trị chứng chỉ quỹ đang lưu hành của một quỹ đại chúng,', 'phí/phí/giá dịch vụ liên quan đến các hoạt động của Quỹ mà Quỹ thực hiện hoặc gián tiếp hoặc tổng hợp các khoản phí và các chi phí/phí/giá dịch vụ liên quan đến các hoạt động của Quỹ mà Quỹ thực hiện hoặc gián tiếp hoặc tổng hợp các khoản phí và các chi phí/phí/giá dịch vụ liên quan đến các hoạt động của Quỹ mà Quỹ thực hiện hoặc gián tiếp hoặc tổng hợp các khoản phí và các chi phí/phí/giá dịch vụ liên quan đến các hoạt động của Quỹ mà Quỹ thực hiện hoặc gián tiếp hoặc tổng hợp các khoản phí và các chi phí/phí/giá dịch vụ liên quan đến các hoạt động của Quỹ mà Quỹ thực hiện hoặc gián tiếp hoặc tổng hợp các khoản phí và các chi phí/phí/giá dịch vụ liên quan đến các hoạt động của Quỹ mà Quỹ thực hiện hoặc gián tiếp hoặc tổng hợp các khoản phí và các chi phí/phí/giá dịch vụ liên quan đến các', 'chi phí/phí/giá dịch vụ liên quan đến các hoạt động của Quỹ mà Quỹ thực hiện hoặc gián tiếp hoặc tổng hợp các khoản phí và các chi phí/phí/giá dịch vụ liên quan đến các hoạt động của Quỹ mà Quỹ thực hiện hoặc gián tiếp hoặc tổng hợp các khoản phí và các chi phí/phí/giá dịch vụ liên quan đến các hoạt động của Quỹ mà Quỹ thực hiện hoặc gián tiếp hoặc tổng hợp các khoản phí và các chi phí/phí/giá dịch vụ liên quan đến các hoạt động của Quỹ mà Quỹ thực hiện hoặc gián tiếp hoặc tổng hợp các khoản phí và các chi phí/phí/giá dịch vụ liên quan đến các hoạt động của Quỹ mà Quỹ thực hiện hoặc gián tiếp hoặc tổng hợp các khoản phí và các chi phí/phí/giá dịch vụ liên quan đến các hoạt động của Quỹ mà Quỹ thực hiện hoặc gián tiếp hoặc tổng hợp các khoản phí và các chi phí/phí/giá dịch vụ liên quan đến', 'liên quan đến các hoạt động của Quỹ mà Quỹ thực hiện hoặc gián tiếp hoặc tổng hợp các khoản phí và các chi phí/phí/giá dịch vụ liên quan đến các hoạt động của Quỹ mà Quỹ thực hiện hoặc gián tiếp hoặc tổng hợp các khoản phí và các chi phí/phí/giá dịch vụ liên quan đến các hoạt động của Quỹ mà Quỹ thực hiện hoặc gián tiếp hoặc tổng hợp các khoản phí và các chi phí/phí/giá dịch vụ liên quan đến các hoạt động của Quỹ mà Quỹ thực hiện hoặc gián tiếp hoặc tổng hợp các khoản phí và các chi phí/phí/giá dịch vụ liên quan đến các hoạt động của Quỹ mà Quỹ thực hiện hoặc gián tiếp hoặc tổng hợp các khoản phí và các chi phí/phí/giá dịch vụ liên quan đến', 'vụ liên quan đến các hoạt động của Quỹ mà Quỹ thực hiện hoặc gián tiếp hoặc tổng hợp các khoản phí và các chi phí/phí/giá dịch vụ liên quan đến các hoạt động của Quỹ mà Quỹ thực hiện hoặc gián tiếp hoặc tổng hợp các khoản phí và các chi phí/phí/giá dịch vụ liên quan đến các hoạt động của Quỹ mà Quỹ thực hiện hoặc gián tiếp hoặc tổng hợp các khoản phí và các chi phí/phí/giá dịch vụ liên quan đến các hoạt động của Quỹ mà Quỹ thực hiện hoặc gián tiếp hoặc tổng hợp các khoản phí và các chi phí/phí/giá dịch vụ liên quan đến các hoạt động của Quỹ mà Quỹ thực hiện hoặc gián tiếp hoặc tổng hợp các khoản phí và các chi phí/phí/giá dịch vụ liên quan đến các hoạt động của Quỹ mà Quỹ thực hiện hoặc gián tiếp hoặc tổng hợp các khoản phí và các chi phí/phí/giá dịch vụ liên quan đến các hoạt động của', 'dịch vụ liên quan đến các hoạt động của Quỹ mà Quỹ thực hiện hoặc gián tiếp hoặc tổng hợp các khoản phí và các chi phí/phí/giá dịch vụ liên quan đến các hoạt động của Quỹ mà Quỹ thực hiện hoặc gián tiếp hoặc tổng hợp các khoản phí và các chi phí/phí/giá dịch vụ liên quan đến các hoạt động của Quỹ mà Quỹ thực hiện hoặc gián tiếp hoặc tổng hợp các khoản phí và các chi phí/phí/giá dịch vụ liên quan đến các hoạt động của Quỹ mà Quỹ thực hiện hoặc gián tiếp hoặc tổng hợp các khoản phí và các chi phí/phí/giá dịch vụ liên quan đến các hoạt động của Quỹ mà Quỹ thực hiện hoặc gián tiếp hoặc tổng hợp các khoản phí và các chi phí/phí/giá dịch vụ liên quan đến các hoạt động của Quỹ mà Quỹ thực hiện hoặc gián tiếp hoặc tổng hợp các khoản phí và các chi phí/phí/giá dịch vụ liên quan đến các hoạt động', '**3.6. Rủi ro biến động giá**  \nRủi ro về biến động giá của Quỹ phát sinh khi một hay một số Nhà Đầu tư nắm giữ một số lượng lớn cổ phiếu của Quỹ quyết định thực hiện lệnh bán của các cổ phiếu của Quỹ này. Nắm giữ một số lượng lớn cổ phiếu của Quỹ quyết định bán.  \n**3.7. Rủi ro tái đầu tư**  \nRủi ro tái đầu tư là rủi ro có thể xảy ra khi các khoản đầu tư trái phiếu với dòng tiền lãi trái phiếu nhận được hàng kỳ và gốc trái phiếu nhận được vào thời điểm đáo hạn được đi tìm đầu tư nhận lại. Công ty Quản lý Quỹ quyết định bán các chứng khoán của Quỹ.', 'liên quan đến các hoạt động của Quỹ mà Quỹ thực hiện hoặc gián tiếp hoặc tổng hợp các khoản phí và các chi phí/phí/giá dịch vụ liên quan đến các hoạt động của Quỹ mà Quỹ thực hiện hoặc gián tiếp hoặc tổng hợp các khoản phí và các chi phí/phí/giá dịch vụ liên quan đến các hoạt động của Quỹ mà Quỹ thực hiện hoặc gián tiếp hoặc tổng hợp các khoản phí và các chi phí/phí/giá dịch vụ liên quan đến các hoạt động của Quỹ mà Quỹ thực hiện hoặc gián tiếp hoặc tổng hợp các khoản phí và các chi phí/phí/giá dịch vụ liên quan đến các hoạt động của Quỹ mà Quỹ thực hiện hoặc gián tiếp hoặc tổng hợp các khoản phí và các chi phí/phí/giá dịch vụ liên quan đến các hoạt động của Quỹ mà Quỹ thực hiện hoặc gián tiếp hoặc tổng hợp các khoản phí và các chi phí/phí/giá dịch vụ liên quan đến các hoạt động của Quỹ', 'liên quan đến các hoạt động của Quỹ mà Quỹ thực hiện hoặc gián tiếp hoặc tổng hợp các khoản phí và các chi phí/phí/giá dịch vụ liên quan đến các hoạt động của Quỹ mà Quỹ thực hiện hoặc gián tiếp hoặc tổng hợp các khoản phí và các chi phí/phí/giá dịch vụ liên quan đến các hoạt động của Quỹ mà Quỹ thực hiện hoặc gián tiếp hoặc tổng hợp các khoản phí và các chi phí/phí/giá dịch vụ liên quan đến các hoạt động của Quỹ mà Quỹ thực hiện hoặc gián tiếp hoặc tổng hợp các khoản phí và các chi phí/phí/giá dịch vụ liên quan đến các hoạt động của Quỹ mà Quỹ thực hiện hoặc gián tiếp hoặc tổng hợp các khoản phí và các chi phí/phí/giá dịch vụ liên quan đến các hoạt động của Quỹ mà Quỹ thực hiện hoặc gián tiếp hoặc tổng hợp các khoản phí và các chi phí/phí/giá dịch vụ liên quan đến các hoạt động của Quỹ', 'liên quan đến các hoạt động của Quỹ mà Quỹ thực hiện hoặc gián tiếp hoặc tổng hợp các khoản phí và các chi phí/phí/giá dịch vụ liên quan đến các hoạt động của Quỹ mà Quỹ thực hiện hoặc gián tiếp hoặc tổng hợp các khoản phí và các chi phí/phí/giá dịch vụ liên quan đến các hoạt động của Quỹ mà Quỹ thực hiện hoặc gián tiếp hoặc tổng hợp các khoản phí và các chi phí/phí/giá dịch vụ liên quan đến các hoạt động của Quỹ mà Quỹ thực hiện hoặc gián tiếp hoặc tổng hợp các khoản phí và các chi phí/phí/giá dịch vụ liên quan đến các hoạt động của Quỹ mà Quỹ thực hiện hoặc gián tiếp hoặc tổng hợp các khoản phí và các chi phí/phí/giá dịch vụ liên quan đến các hoạt động của Quỹ mà Quỹ thực hiện hoặc gián tiếp hoặc tổng hợp các khoản phí và các chi phí/phí/giá dịch vụ liên quan đến các hoạt động của Quỹ', 'liên quan đến các hoạt động của Quỹ mà Quỹ thực hiện hoặc gián tiếp hoặc tổng hợp các khoản phí và các chi phí/phí/giá dịch vụ liên quan đến các hoạt động của Quỹ mà Quỹ thực hiện hoặc gián tiếp hoặc tổng hợp các khoản phí và các chi phí/phí/giá dịch vụ liên quan đến các hoạt động của Quỹ mà Quỹ thực hiện hoặc gián tiếp hoặc tổng hợp các khoản phí và các chi phí/phí/giá dịch vụ liên quan đến các hoạt động của Quỹ mà Quỹ thực hiện hoặc gián tiếp hoặc tổng hợp các khoản phí và các chi phí/phí/giá dịch vụ liên quan đến các hoạt động của Quỹ mà Quỹ thực hiện hoặc gián tiếp hoặc tổng hợp các khoản phí và các chi phí/phí/giá dịch vụ liên quan đến các hoạt động của Quỹ mà Quỹ thực hiện hoặc gián tiếp hoặc tổng hợp các khoản phí và các chi phí/phí/giá dịch vụ liên quan đến các hoạt động của Quỹ', 'liên quan đến các hoạt động của Quỹ mà Quỹ thực hiện hoặc gián tiếp hoặc tổng hợp các khoản phí và các chi phí/phí/giá dịch vụ liên quan đến các hoạt động của Quỹ mà Quỹ thực hiện hoặc gián tiếp hoặc tổng hợp các khoản phí và các chi phí/phí/giá dịch vụ liên quan đến các hoạt động của Quỹ mà Quỹ thực hiện hoặc gián tiếp hoặc tổng hợp các khoản phí và các chi phí/phí/giá dịch vụ liên quan đến các hoạt động của Quỹ mà Quỹ thực hiện hoặc gián tiếp hoặc tổng hợp các khoản phí và các chi phí/phí/giá dịch vụ liên quan đến các hoạt động của Quỹ mà Quỹ thực hiện hoặc gián tiếp hoặc tổng hợp các khoản phí và các chi phí/phí/giá dịch vụ liên quan đến các hoạt động của Quỹ mà Quỹ thực hiện hoặc gián tiếp hoặc tổng hợp các khoản phí và các chi phí/phí/giá dịch vụ liên quan đến các hoạt động của Quỹ', 'liên quan đến các hoạt động của Quỹ mà Quỹ thực hiện hoặc gián tiếp hoặc tổng hợp các khoản phí và các chi phí/phí/giá dịch vụ liên quan đến các hoạt động của Quỹ mà Quỹ thực hiện hoặc gián tiếp hoặc tổng hợp các khoản phí và các chi phí/phí/giá dịch vụ liên quan đến các hoạt động của Quỹ mà Quỹ thực hiện hoặc gián tiếp hoặc tổng hợp các khoản phí và các chi phí/phí/giá dịch vụ liên quan đến các hoạt động của Quỹ mà Quỹ thực hiện hoặc gián tiếp hoặc tổng hợp các khoản phí và các chi phí/phí/giá dịch vụ liên quan đến các hoạt động của Quỹ mà Quỹ thực hiện hoặc gián tiếp hoặc tổng hợp các khoản phí và các chi phí/phí/giá dịch vụ liên quan đến các hoạt động của Quỹ mà Quỹ thực hiện hoặc gián tiếp hoặc tổng hợp các khoản phí và các chi phí/phí/giá dịch vụ liên quan đến các hoạt động của Quỹ', 'liên quan đến các hoạt động của Quỹ mà Quỹ thực hiện hoặc gián tiếp hoặc tổng hợp các khoản phí và các chi phí/phí/giá dịch vụ liên quan đến các hoạt động của Quỹ mà Quỹ thực hiện hoặc gián tiếp hoặc tổng hợp các khoản phí và các chi phí/phí/giá dịch vụ liên quan đến các hoạt động của Quỹ mà Quỹ thực hiện hoặc gián tiếp hoặc tổng hợp các khoản phí và các chi phí/phí/giá dịch vụ liên quan đến các hoạt động của Quỹ mà Quỹ thực hiện hoặc gián tiếp hoặc tổng hợp các khoản phí và các chi phí/phí/giá dịch vụ liên quan đến các hoạt động của Quỹ mà Quỹ thực hiện hoặc gián tiếp hoặc tổng hợp các khoản phí và các chi phí/phí/giá dịch vụ liên quan đến các hoạt động của Quỹ mà Quỹ thực hiện hoặc gián tiếp hoặc tổng hợp các khoản phí và các chi phí/phí/giá dịch vụ liên quan đến các hoạt động của Quỹ', 'liên quan đến các hoạt động của Quỹ mà Quỹ thực hiện hoặc gián tiếp hoặc tổng hợp các khoản phí và các chi phí/phí/giá dịch vụ liên quan đến các hoạt động của Quỹ mà Quỹ thực hiện hoặc gián tiếp hoặc tổng hợp các khoản phí và các chi phí/phí/giá dịch vụ liên quan đến các hoạt động của Quỹ mà Quỹ thực hiện hoặc gián tiếp hoặc tổng hợp các khoản phí và các chi phí/phí/giá dịch vụ liên quan đến các hoạt động của Quỹ mà Quỹ thực hiện hoặc gián tiếp hoặc tổng hợp các khoản phí và các chi phí/phí/giá dịch vụ liên quan đến các hoạt động của Quỹ mà Quỹ thực hiện hoặc gián tiếp hoặc tổng hợp các khoản phí và các chi phí/phí/giá dịch vụ liên quan đến các hoạt động của Quỹ mà Quỹ thực hiện hoặc gián tiếp hoặc tổng hợp các khoản phí và các chi phí/phí/giá dịch vụ liên quan đến các hoạt động của Quỹ', 'liên quan đến các hoạt động của Quỹ mà Quỹ thực hiện hoặc gián tiếp hoặc tổng hợp các khoản phí và các chi phí/phí/giá dịch vụ liên quan đến các hoạt động của Quỹ mà Quỹ thực hiện hoặc gián tiếp hoặc tổng hợp các khoản phí và các chi phí/phí/giá dịch vụ liên quan đến các hoạt động của Quỹ mà Quỹ thực hiện hoặc gián tiếp hoặc tổng hợp các khoản phí và các chi phí/phí/giá dịch vụ liên quan đến các hoạt động của Quỹ mà Quỹ thực hiện hoặc gián tiếp hoặc tổng hợp các khoản phí và các chi phí/phí/giá dịch vụ liên quan đến các hoạt động của Quỹ mà Quỹ thực hiện hoặc gián tiếp hoặc tổng hợp các khoản phí và các chi phí/phí/giá dịch vụ liên quan đến các hoạt động của Quỹ mà Quỹ thực hiện hoặc gián tiếp hoặc tổng hợp các khoản phí và các chi phí/phí/giá dịch vụ liên quan đến các hoạt động của Quỹ']","Giá dịch vụ Quản Lý tối đa là 1,2% NAV/năm."
Biểu phí dịch vụ mua lại (Redemption Fee) áp dụng cho nhà đầu tư nắm giữ dưới 6 tháng và từ 12 tháng trở lên là bao nhiêu?,"- Phí dịch vụ mua lại (Redemption Fee) cho nhà đầu tư nắm giữ dưới 6 tháng là 0,00%.
- Phí dịch vụ mua lại (Redemption Fee) cho nhà đầu tư nắm giữ từ 12 tháng trở lên là 0,00%.","['từ trên 12 tháng trở lên 0,00%  \nGiấy dịch vụ Chuyển Đổi Quỹ sẽ được hạch toán cho Công ty Quản lý Quỹ và Đại Lý Phân Phối căn cứ theo hợp đồng ký giữa Công ty Quản lý Quỹ và Đại Lý Phân Phối.  \nd) Giấy dịch vụ Chuyển Nhượng  \nNhà Đầu tư phải trả một mức phí dịch vụ Chuyển Nhượng duy nhất là 300.000 đồng (ba trăm nghìn đồng) cho mỗi giao dịch chuyển nhượng Đơn vị Quỹ. Giá dịch vụ Chuyển Nhượng do người thực hiện chuyển nhượng thanh toán.  \nGiấy dịch vụ Chuyển nhượng sẽ không áp dụng trong trường hợp Nhà Đầu tư thực hiện chuyển nhượng số Chứng Chỉ quỹ từ tài khoản này sang tài khoản khác cùng tên thì Nhà Đầu tư tại Hai Đại Lý Phân Phối khác nhau.', '**3.6. Rủi ro biến động giá**  \nRủi ro về biến động giá của Quỹ phát sinh khi một hay một số Nhà Đầu tư nắm giữ một số lượng lớn cổ phiếu của Quỹ quyết định thực hiện lệnh bán của các cổ phiếu của Quỹ này. Nắm giữ một số lượng lớn cổ phiếu của Quỹ quyết định bán.  \n**3.7. Rủi ro tái đầu tư**  \nRủi ro tái đầu tư là rủi ro có thể xảy ra khi các khoản đầu tư trái phiếu với dòng tiền lãi trái phiếu nhận được hàng kỳ và gốc trái phiếu nhận được vào thời điểm đáo hạn được đi tìm đầu tư nhận lại. Công ty Quản lý Quỹ quyết định bán các chứng khoán của Quỹ.', '- Không đầu tư vào quá 10% tổng giá trị chứng chỉ quỹ đang lưu hành của một quỹ đại chúng,\ncổ phiếu công ty quản lý quỹ khác có chứng khoán đại chúng;\n- Không đầu tư quá 20% tổng giá trị tài sản của quỹ vào chứng chỉ quỹ của một quỹ đại\nchúng, cổ phiếu của một công ty đầu tư chứng khoán đại chúng;\n- Không được đầu tư quá 50% tổng giá trị tài sản của quỹ vào các chứng chỉ quỹ đại chúng, cổ\nphiếu công ty đầu tư chứng khoán đại chúng;\nk) Không được đầu tư trực tiếp bất động sản, đã quỹ, kim loại quý hiếm;\n1) Phải có chứng khoán của ít nhất 06 tổ chức phát hành.\n2.2.5 Điều chỉnh danh mục đầu tư\nCơ cấu đầu tư của Quỹ mới chỉ được vược với các hạn chế đầu tư đã quy định tại điểm a,\nb, c, d, e và mục IX.2.2.4 và chỉ do các nguyên nhân sau:', 'Quỹ đầu tư chứng khoán được mô tả trong Bản cáo bạch này là Quỹ được thành lập theo\nLuật Chứng khoán số 54/2019/QH14 Quốc hội Nước Cộng Hòa Xã hội Chủ nghĩa Việt\nNam thông qua ngày 26 tháng 11 năm 2019 và các văn bản hướng dẫn thi hành. Bản cáo\nbạch này đã được đăng ký với Ủy ban Chứng khoán Nhà nước ngày / /2022.  \nTHÔNG BÁO QUAN TRỌNG  \nCác nhà đầu tư nên nghiên cứu Bản cáo bạch này một cách cẩn trọng và toàn diện và không nên\ncoi nội dung hoặc tóm tắt ở đây là các tư vấn liên quan đến pháp lý, thuế, hoặc tài chính/đầu\ntư và nên tham khảo ý kiến chuyên gia tư vấn của mình về các yêu cầu pháp lý, thuế, năm\ngiữa, hoặc tư vấn về các khía cạnh khác của việc đầu tư, mua, cho tặng, năm giữ,\nnhượng, chuyển nhượng, hoặc bán một phần hoặc toàn bộ các khoản đầu tư vào Quỹ. Nhà đầu tư', 'nhượng, chuyển nhượng, hoặc bán một phần hoặc toàn bộ các khoản đầu tư vào Quỹ. Nhà đầu tư\ncó trách nhiệm tự mình thực hiện việc thẩm định và đánh giá mọi rủi ro liên quan đến đầu tư.  \nBản cáo bạch này bao gồm các thông tin về Quỹ, dự kiến các khoản đầu tư của Quỹ, các điều kiện\nvà quy định của Quỹ, hoặc các thông tin khác mà nhà đầu tư cần biết. Nhà đầu tư nên đọc kỹ Bản\ncáo bạch này và các tài liệu đính kèm trước khi ra quyết định đầu tư.\nTCC sẽ cập nhật Bản cáo bạch này nếu có bất kỳ thay đổi nào về thông tin.\nBản cáo bạch được cung cấp miễn phí tại văn phòng của TCC, các Đại lý phân phối và trên trang\nweb của TCC.  \nBản cáo bạch này được phát hành bởi:\nCông ty Cổ phần Quản lý Quỹ Ký Thương - TechcomCapital (“TCC”)', 'Trong thời hạn 05 ngày làm việc kể từ ngày hoãn khẩn tại thời điểm điều chỉnh lại danh mục đầu tư.\nTrong thời hạn 05 ngày làm việc kể từ ngày hoãn khẩn tại thời điểm điều chỉnh lại danh mục đầu tư.\nTrong thời hạn 05 ngày làm việc kể từ ngày hoãn khẩn tại thời điểm điều chỉnh lại danh mục đầu tư.\nTrong thời hạn 05 ngày làm', '40% tổng giá trị tài sản của quỹ. Trong đó, hạng mục đầu tư lớn của quỹ là hạng mục đầu tư\nvào các loại tài sản quỹ định tại điểm a, d, và g mục IX.2.2.3 (ngoại trừ chứng chỉ tiền gửi)\nphải hành bởi cùng một tổ chức, có tổng giá trị chiếm từ 5% trở lên tổng giá trị tài sản của\nquỹ;\ng) Tại mọi thời điểm, tổng giá trị cam kết trong các giao dịch chứng khoán phái sinh, dự nợ vay\nvà các khoản phải trả của quỹ không được vượt giá trị tài sản ròng của quỹ;\nh) Không được đầu tư vào chứng khoán của Chính phủ Quỹ;\ni) Chỉ được đầu tư vào chứng chỉ quỹ đại chúng khác, công ty đầu tư chứng khoán đại chúng\ndo công ty quản lý quỹ khác quản lý và bảo đảm các hạn chế sau:\n- Không đầu tư vào quá 10% tổng giá trị chứng chỉ quỹ đang lưu hành của một quỹ đại chúng,', '**2.12. Kiểm toán, kế toán và chế độ báo cáo**  \nCông ty kiểm toán được lựa chọn phải được thành lập và hoạt động phù hợp với quy định của Pháp luật, nằm trong danh sách các công ty kiểm toán được UBCKNN chấp thuận kiểm toán cho tổ chức tài chính, tổ chức niêm yết và cho tổ chức kinh doanh chứng khoán và không được là người liên quan của Công ty Quản lý Quỹ, Ngân hàng Giám sát. Năm kiểm toán: Tổng công ty kiểm toán Quỹ sẽ được Công ty Quản lý Quỹ đề cử để Đại Hội Đồng Quỹ thông qua. Các năm sau đó, Đại Hội Đầu Tư Quỹ sẽ thông qua cho Ban Đại Diện Quỹ thông qua việc lựa chọn công ty kiểm toán. Công ty Quản lý Quỹ sẽ đề xuất với Ban Đại Diện Quỹ ít nhất (02) công ty kiểm toán để kiểm toán cho Quỹ mình.  \n**Chế độ kế toán**', 'Điểu Lệ Quỹ và các tài liệu cần thiết khác) được cung cấp trên trang điện tử của TCC,\nwww.techcomcapital.com.vn, tại văn phòng của TCC và các Đại lý phân phối như danh sách\ntrong phụ lục 1 của Bản cáo Bạch.  \nPhụ trách công bố thông tin:\nÔng Đặng Lưu Dũng – Tổng Giám đốc\nĐịa chỉ: Công ty Cổ phần Quản lý Quỹ Ký Thương\nTầng 28, Tòa C5, số 119 Trần Duy Hưng, phường Trung Hòa, Quận Cầu Giấy, Hà Nội\nĐiện thoại: (84-24) 39446368 Fax: (84-24) 39446583  \nBản cáo bạch này được phát hành bởi:\nCông ty Cổ phần Quản lý Quỹ Ký Thương - TechcomCapital (“TCC”)\nĐịa chỉ : Tầng 28, Tòa C5, số 119 Trần Duy Hưng, phường Trung Hòa, Quận Cầu Giấy, Hà Nội\nĐiện thoại : (84-24) 39446368 Fax: (84-24) 39446583\nWebsite : www.techcomcapital.com.vn  \nNơi cung cấp Bản cáo bạch:', '(Quỹ chứng khoán doanh nghiệp vừa và nhỏ Techcom)\nBản cáo bạch này được phát hành bởi:\nCông ty Cổ phần Quản lý Quỹ Ký Thương - TechcomCapital (“TCC”)\nĐịa chỉ : Tầng 28, Tòa C5, số 119 Trần Duy Hưng, phường Trung Hòa, Quận Cầu\nGiấy, Hà Nội\nĐiện thoại : (84-24) 39446368 Fax: (84-24) 39446583\nWebsite : www.techcomcapital.com.vn  \nNơi cung cấp Bản cáo bạch:\nBản cáo bạch cập nhật những các tài liệu của Quỹ (báo cáo hoạt động, báo cáo tài chính,\nĐiểu Lệ Quỹ và các tài liệu cần thiết khác) được cung cấp trên trang điện tử của TCC,\nwww.techcomcapital.com.vn, tại văn phòng của TCC và các Đại lý phân phối như danh sách\ntrong phụ lục 1 của Bản cáo Bạch.  \nPhụ trách công bố thông tin:\nÔng Đặng Lưu Dũng – Tổng Giám đốc\nĐịa chỉ : Công ty Cổ phần Quản lý Quỹ Ký Thương', 'Trong thời hạn 05 ngày làm việc kể từ ngày hoãn khẩn tại thời điểm điều chỉnh lại danh mục đầu tư.\nTrong thời hạn 05 ngày làm việc kể từ ngày hoãn khẩn tại thời điểm điều chỉnh lại danh mục đầu tư.\nTrong thời hạn 05 ngày làm việc kể từ ngày hoãn khẩn tại thời điểm điều chỉnh lại danh mục đầu tư.\nTrong thời hạn 05 ngày làm việc kể từ ngày hoãn khẩn tại thời điểm điều chỉnh lại danh mục đầu tư.\nTrong thời hạn 05 ngày làm việc kể từ ngày hoãn khẩn tại thời điểm điều chỉnh lại danh mục đầu tư.\nTrong thời hạn 05 ngày làm việc kể từ ngày hoãn khẩn tại thời điểm điều chỉnh lại danh mục đầu tư.\nTrong thời hạn 05 ngày làm việc kể từ ngày hoãn khẩn tại thời điểm điều chỉnh lại danh mục đầu tư.\nTrong thời hạn 05 ngày làm việc kể từ ngày hoãn khẩn tại thời điểm điều chỉnh lại danh mục đầu tư.', 'Trong thời hạn 05 ngày làm việc kể từ ngày hoãn khẩn tại thời điểm điều chỉnh lại danh mục đầu tư.\nTrong thời hạn 05 ngày làm việc kể từ ngày hoãn khẩn tại thời điểm điều chỉnh lại danh mục đầu tư.\nTrong thời hạn 05 ngày làm việc kể từ ngày hoãn khẩn tại thời điểm điều chỉnh lại danh mục đầu tư.\nTrong thời hạn 05 ngày làm việc kể từ ngày hoãn khẩn tại thời điểm điều chỉnh lại danh mục đầu tư.\nTrong thời hạn 05 ngày làm việc kể từ ngày hoãn khẩn tại thời điểm điều chỉnh lại danh mục đầu tư.\nTrong thời hạn 05 ngày làm việc kể từ ngày hoãn khẩn tại thời điểm điều chỉnh lại danh mục đầu tư.\nTrong thời hạn 05 ngày làm việc kể từ ngày hoãn khẩn tại thời điểm điều chỉnh lại danh mục đầu tư.\nTrong thời hạn 05 ngày làm việc kể từ ngày hoãn khẩn tại thời điểm điều chỉnh lại danh mục đầu tư.', 'Trong thời hạn 05 ngày làm việc kể từ ngày hoãn khẩn tại thời điểm điều chỉnh lại danh mục đầu tư.\nTrong thời hạn 05 ngày làm việc kể từ ngày hoãn khẩn tại thời điểm điều chỉnh lại danh mục đầu tư.\nTrong thời hạn 05 ngày làm việc kể từ ngày hoãn khẩn tại thời điểm điều chỉnh lại danh mục đầu tư.\nTrong thời hạn 05 ngày làm việc kể từ ngày hoãn khẩn tại thời điểm điều chỉnh lại danh mục đầu tư.\nTrong thời hạn 05 ngày làm việc kể từ ngày hoãn khẩn tại thời điểm điều chỉnh lại danh mục đầu tư.\nTrong thời hạn 05 ngày làm việc kể từ ngày hoãn khẩn tại thời điểm điều chỉnh lại danh mục đầu tư.\nTrong thời hạn 05 ngày làm việc kể từ ngày hoãn khẩn tại thời điểm điều chỉnh lại danh mục đầu tư.\nTrong thời hạn 05 ngày làm việc kể từ ngày hoãn khẩn tại thời điểm điều chỉnh lại danh mục đầu tư.', 'Trong thời hạn 05 ngày làm việc kể từ ngày hoãn khẩn tại thời điểm điều chỉnh lại danh mục đầu tư.\nTrong thời hạn 05 ngày làm việc kể từ ngày hoãn khẩn tại thời điểm điều chỉnh lại danh mục đầu tư.\nTrong thời hạn 05 ngày làm việc kể từ ngày hoãn khẩn tại thời điểm điều chỉnh lại danh mục đầu tư.\nTrong thời hạn 05 ngày làm việc kể từ ngày hoãn khẩn tại thời điểm điều chỉnh lại danh mục đầu tư.\nTrong thời hạn 05 ngày làm việc kể từ ngày hoãn khẩn tại thời điểm điều chỉnh lại danh mục đầu tư.\nTrong thời hạn 05 ngày làm việc kể từ ngày hoãn khẩn tại thời điểm điều chỉnh lại danh mục đầu tư.\nTrong thời hạn 05 ngày làm việc kể từ ngày hoãn khẩn tại thời điểm điều chỉnh lại danh mục đầu tư.\nTrong thời hạn 05 ngày làm việc kể từ ngày hoãn khẩn tại thời điểm điều chỉnh lại danh mục đầu tư.', 'Trong thời hạn 05 ngày làm việc kể từ ngày hoãn khẩn tại thời điểm điều chỉnh lại danh mục đầu tư.\nTrong thời hạn 05 ngày làm việc kể từ ngày hoãn khẩn tại thời điểm điều chỉnh lại danh mục đầu tư.\nTrong thời hạn 05 ngày làm việc kể từ ngày hoãn khẩn tại thời điểm điều chỉnh lại danh mục đầu tư.\nTrong thời hạn 05 ngày làm việc kể từ ngày hoãn khẩn tại thời điểm điều chỉnh lại danh mục đầu tư.\nTrong thời hạn 05 ngày làm việc kể từ ngày hoãn khẩn tại thời điểm điều chỉnh lại danh mục đầu tư.\nTrong thời hạn 05 ngày làm việc kể từ ngày hoãn khẩn tại thời điểm điều chỉnh lại danh mục đầu tư.\nTrong thời hạn 05 ngày làm việc kể từ ngày hoãn khẩn tại thời điểm điều chỉnh lại danh mục đầu tư.\nTrong thời hạn 05 ngày làm việc kể từ ngày hoãn khẩn tại thời điểm điều chỉnh lại danh mục đầu tư.', 'Trong thời hạn 05 ngày làm việc kể từ ngày hoãn khẩn tại thời điểm điều chỉnh lại danh mục đầu tư.\nTrong thời hạn 05 ngày làm việc kể từ ngày hoãn khẩn tại thời điểm điều chỉnh lại danh mục đầu tư.\nTrong thời hạn 05 ngày làm việc kể từ ngày hoãn khẩn tại thời điểm điều chỉnh lại danh mục đầu tư.\nTrong thời hạn 05 ngày làm việc kể từ ngày hoãn khẩn tại thời điểm điều chỉnh lại danh mục đầu tư.\nTrong thời hạn 05 ngày làm việc kể từ ngày hoãn khẩn tại thời điểm điều chỉnh lại danh mục đầu tư.\nTrong thời hạn 05 ngày làm việc kể từ ngày hoãn khẩn tại thời điểm điều chỉnh lại danh mục đầu tư.\nTrong thời hạn 05 ngày làm việc kể từ ngày hoãn khẩn tại thời điểm điều chỉnh lại danh mục đầu tư.\nTrong thời hạn 05 ngày làm việc kể từ ngày hoãn khẩn tại thời điểm điều chỉnh lại danh mục đầu tư.', 'Trong thời hạn 05 ngày làm việc kể từ ngày hoãn khẩn tại thời điểm điều chỉnh lại danh mục đầu tư.\nTrong thời hạn 05 ngày làm việc kể từ ngày hoãn khẩn tại thời điểm điều chỉnh lại danh mục đầu tư.\nTrong thời hạn 05 ngày làm việc kể từ ngày hoãn khẩn tại thời điểm điều chỉnh lại danh mục đầu tư.\nTrong thời hạn 05 ngày làm việc kể từ ngày hoãn khẩn tại thời điểm điều chỉnh lại danh mục đầu tư.\nTrong thời hạn 05 ngày làm việc kể từ ngày hoãn khẩn tại thời điểm điều chỉnh lại danh mục đầu tư.\nTrong thời hạn 05 ngày làm việc kể từ ngày hoãn khẩn tại thời điểm điều chỉnh lại danh mục đầu tư.\nTrong thời hạn 05 ngày làm việc kể từ ngày hoãn khẩn tại thời điểm điều chỉnh lại danh mục đầu tư.\nTrong thời hạn 05 ngày làm việc kể từ ngày hoãn khẩn tại thời điểm điều chỉnh lại danh mục đầu tư.', 'Trong thời hạn 05 ngày làm việc kể từ ngày hoãn khẩn tại thời điểm điều chỉnh lại danh mục đầu tư.\nTrong thời hạn 05 ngày làm việc kể từ ngày hoãn khẩn tại thời điểm điều chỉnh lại danh mục đầu tư.\nTrong thời hạn 05 ngày làm việc kể từ ngày hoãn khẩn tại thời điểm điều chỉnh lại danh mục đầu tư.\nTrong thời hạn 05 ngày làm việc kể từ ngày hoãn khẩn tại thời điểm điều chỉnh lại danh mục đầu tư.\nTrong thời hạn 05 ngày làm việc kể từ ngày hoãn khẩn tại thời điểm điều chỉnh lại danh mục đầu tư.\nTrong thời hạn 05 ngày làm việc kể từ ngày hoãn khẩn tại thời điểm điều chỉnh lại danh mục đầu tư.\nTrong thời hạn 05 ngày làm việc kể từ ngày hoãn khẩn tại thời điểm điều chỉnh lại danh mục đầu tư.\nTrong thời hạn 05 ngày làm việc kể từ ngày hoãn khẩn tại thời điểm điều chỉnh lại danh mục đầu tư.', 'Trong thời hạn 05 ngày làm việc kể từ ngày hoãn khẩn tại thời điểm điều chỉnh lại danh mục đầu tư.\nTrong thời hạn 05 ngày làm việc kể từ ngày hoãn khẩn tại thời điểm điều chỉnh lại danh mục đầu tư.\nTrong thời hạn 05 ngày làm việc kể từ ngày hoãn khẩn tại thời điểm điều chỉnh lại danh mục đầu tư.\nTrong thời hạn 05 ngày làm việc kể từ ngày hoãn khẩn tại thời điểm điều chỉnh lại danh mục đầu tư.\nTrong thời hạn 05 ngày làm việc kể từ ngày hoãn khẩn tại thời điểm điều chỉnh lại danh mục đầu tư.\nTrong thời hạn 05 ngày làm việc kể từ ngày hoãn khẩn tại thời điểm điều chỉnh lại danh mục đầu tư.\nTrong thời hạn 05 ngày làm việc kể từ ngày hoãn khẩn tại thời điểm điều chỉnh lại danh mục đầu tư.\nTrong thời hạn 05 ngày làm việc kể từ ngày hoãn khẩn tại thời điểm điều chỉnh lại danh mục đầu tư.', 'Trong thời hạn 05 ngày làm việc kể từ ngày hoãn khẩn tại thời điểm điều chỉnh lại danh mục đầu tư.\nTrong thời hạn 05 ngày làm việc kể từ ngày hoãn khẩn tại thời điểm điều chỉnh lại danh mục đầu tư.\nTrong thời hạn 05 ngày làm việc kể từ ngày hoãn khẩn tại thời điểm điều chỉnh lại danh mục đầu tư.\nTrong thời hạn 05 ngày làm việc kể từ ngày hoãn khẩn tại thời điểm điều chỉnh lại danh mục đầu tư.\nTrong thời hạn 05 ngày làm việc kể từ ngày hoãn khẩn tại thời điểm điều chỉnh lại danh mục đầu tư.\nTrong thời hạn 05 ngày làm việc kể từ ngày hoãn khẩn tại thời điểm điều chỉnh lại danh mục đầu tư.\nTrong thời hạn 05 ngày làm việc kể từ ngày hoãn khẩn tại thời điểm điều chỉnh lại danh mục đầu tư.\nTrong thời hạn 05 ngày làm việc kể từ ngày hoãn khẩn tại thời điểm điều chỉnh lại danh mục đầu tư.', 'Trong thời hạn 05 ngày làm việc kể từ ngày hoãn khẩn tại thời điểm điều chỉnh lại danh mục đầu tư.\nTrong thời hạn 05 ngày làm việc kể từ ngày hoãn khẩn tại thời điểm điều chỉnh lại danh mục đầu tư.\nTrong thời hạn 05 ngày làm việc kể từ ngày hoãn khẩn tại thời điểm điều chỉnh lại danh mục đầu tư.\nTrong thời hạn 05 ngày làm việc kể từ ngày hoãn khẩn tại thời điểm điều chỉnh lại danh mục đầu tư.\nTrong thời hạn 05 ngày làm việc kể từ ngày hoãn khẩn tại thời điểm điều chỉnh lại danh mục đầu tư.\nTrong thời hạn 05 ngày làm việc kể từ ngày hoãn khẩn tại thời điểm điều chỉnh lại danh mục đầu tư.\nTrong thời hạn 05 ngày làm việc kể từ ngày hoãn khẩn tại thời điểm điều chỉnh lại danh mục đầu tư.\nTrong thời hạn 05 ngày làm việc kể từ ngày hoãn khẩn tại thời điểm điều chỉnh lại danh mục đầu tư.', 'Trong thời hạn 05 ngày làm việc kể từ ngày hoãn khẩn tại thời điểm điều chỉnh lại danh mục đầu tư.\nTrong thời hạn 05 ngày làm việc kể từ ngày hoãn khẩn tại thời điểm điều chỉnh lại danh mục đầu tư.\nTrong thời hạn 05 ngày làm việc kể từ ngày hoãn khẩn tại thời điểm điều chỉnh lại danh mục đầu tư.\nTrong thời hạn 05 ngày làm việc kể từ ngày hoãn khẩn tại thời điểm điều chỉnh lại danh mục đầu tư.\nTrong thời hạn 05 ngày làm việc kể từ ngày hoãn khẩn tại thời điểm điều chỉnh lại danh mục đầu tư.\nTrong thời hạn 05 ngày làm việc kể từ ngày hoãn khẩn tại thời điểm điều chỉnh lại danh mục đầu tư.\nTrong thời hạn 05 ngày làm việc kể từ ngày hoãn khẩn tại thời điểm điều chỉnh lại danh mục đầu tư.\nTrong thời hạn 05 ngày làm việc kể từ ngày hoãn khẩn tại thời điểm điều chỉnh lại danh mục đầu tư.', 'Trong thời hạn 05 ngày làm việc kể từ ngày hoãn khẩn tại thời điểm điều chỉnh lại danh mục đầu tư.\nTrong thời hạn 05 ngày làm việc kể từ ngày hoãn khẩn tại thời điểm điều chỉnh lại danh mục đầu tư.\nTrong thời hạn 05 ngày làm việc kể từ ngày hoãn khẩn tại thời điểm điều chỉnh lại danh mục đầu tư.\nTrong thời hạn 05 ngày làm việc kể từ ngày hoãn khẩn tại thời điểm điều chỉnh lại danh mục đầu tư.\nTrong thời hạn 05 ngày làm việc kể từ ngày hoãn khẩn tại thời điểm điều chỉnh lại danh mục đầu tư.\nTrong thời hạn 05 ngày làm việc kể từ ngày hoãn khẩn tại thời điểm điều chỉnh lại danh mục đầu tư.\nTrong thời hạn 05 ngày làm việc kể từ ngày hoãn khẩn tại thời điểm điều chỉnh lại danh mục đầu tư.\nTrong thời hạn 05 ngày làm việc kể từ ngày hoãn khẩn tại thời điểm điều chỉnh lại danh mục đầu tư.', 'Trong thời hạn 05 ngày làm việc kể từ ngày hoãn khẩn tại thời điểm điều chỉnh lại danh mục đầu tư.\nTrong thời hạn 05 ngày làm việc kể từ ngày hoãn khẩn tại thời điểm điều chỉnh lại danh mục đầu tư.\nTrong thời hạn 05 ngày làm việc kể từ ngày hoãn khẩn tại thời điểm điều chỉnh lại danh mục đầu tư.\nTrong thời hạn 05 ngày làm việc kể từ ngày hoãn khẩn tại thời điểm điều chỉnh lại danh mục đầu tư.\nTrong thời hạn 05 ngày làm việc kể từ ngày hoãn khẩn tại thời điểm điều chỉnh lại danh mục đầu tư.\nTrong thời hạn 05 ngày làm việc kể từ ngày hoãn khẩn tại thời điểm điều chỉnh lại danh mục đầu tư.\nTrong thời hạn 05 ngày làm việc kể từ ngày hoãn khẩn tại thời điểm điều chỉnh lại danh mục đầu tư.\nTrong thời hạn 05 ngày làm việc kể từ ngày hoãn khẩn tại thời điểm điều chỉnh lại danh mục đầu tư.', 'Trong thời hạn 05 ngày làm việc kể từ ngày hoãn khẩn tại thời điểm điều chỉnh lại danh mục đầu tư.\nTrong thời hạn 05 ngày làm việc kể từ ngày hoãn khẩn tại thời điểm điều chỉnh lại danh mục đầu tư.\nTrong thời hạn 05 ngày làm việc kể từ ngày hoãn khẩn tại thời điểm điều chỉnh lại danh mục đầu tư.\nTrong thời hạn 05 ngày làm việc kể từ ngày hoãn khẩn tại thời điểm điều chỉnh lại danh mục đầu tư.\nTrong thời hạn 05 ngày làm việc kể từ ngày hoãn khẩn tại thời điểm điều chỉnh lại danh mục đầu tư.\nTrong thời hạn 05 ngày làm việc kể từ ngày hoãn khẩn tại thời điểm điều chỉnh lại danh mục đầu tư.\nTrong thời hạn 05 ngày làm việc kể từ ngày hoãn khẩn tại thời điểm điều chỉnh lại danh mục đầu tư.\nTrong thời hạn 05 ngày làm việc kể từ ngày hoãn khẩn tại thời điểm điều chỉnh lại danh mục đầu tư.']","0 đến dưới 6 tháng: 1,00%; Từ trên 12 tháng trở lên: 0,00%."
Phí dịch vụ chuyển đổi (Switching Fee) giữa các quỹ mở của TechcomCapital được tính như thế nào?,"Phí dịch vụ chuyển đổi (Switching Fee) giữa các quỹ mở của TechcomCapital là 3,0%.","['(Quỹ chứng khoán doanh nghiệp vừa và nhỏ Techcom)\nBản cáo bạch này được phát hành bởi:\nCông ty Cổ phần Quản lý Quỹ Ký Thương - TechcomCapital (“TCC”)\nĐịa chỉ : Tầng 28, Tòa C5, số 119 Trần Duy Hưng, phường Trung Hòa, Quận Cầu\nGiấy, Hà Nội\nĐiện thoại : (84-24) 39446368 Fax: (84-24) 39446583\nWebsite : www.techcomcapital.com.vn  \nNơi cung cấp Bản cáo bạch:\nBản cáo bạch cập nhật những các tài liệu của Quỹ (báo cáo hoạt động, báo cáo tài chính,\nĐiểu Lệ Quỹ và các tài liệu cần thiết khác) được cung cấp trên trang điện tử của TCC,\nwww.techcomcapital.com.vn, tại văn phòng của TCC và các Đại lý phân phối như danh sách\ntrong phụ lục 1 của Bản cáo Bạch.  \nPhụ trách công bố thông tin:\nÔng Đặng Lưu Dũng – Tổng Giám đốc\nĐịa chỉ : Công ty Cổ phần Quản lý Quỹ Ký Thương', 'nhượng, chuyển nhượng, hoặc bán một phần hoặc toàn bộ các khoản đầu tư vào Quỹ. Nhà đầu tư\ncó trách nhiệm tự mình thực hiện việc thẩm định và đánh giá mọi rủi ro liên quan đến đầu tư.  \nBản cáo bạch này bao gồm các thông tin về Quỹ, dự kiến các khoản đầu tư của Quỹ, các điều kiện\nvà quy định của Quỹ, hoặc các thông tin khác mà nhà đầu tư cần biết. Nhà đầu tư nên đọc kỹ Bản\ncáo bạch này và các tài liệu đính kèm trước khi ra quyết định đầu tư.\nTCC sẽ cập nhật Bản cáo bạch này nếu có bất kỳ thay đổi nào về thông tin.\nBản cáo bạch được cung cấp miễn phí tại văn phòng của TCC, các Đại lý phân phối và trên trang\nweb của TCC.  \nBản cáo bạch này được phát hành bởi:\nCông ty Cổ phần Quản lý Quỹ Ký Thương - TechcomCapital (“TCC”)', 'Bản cáo bạch này được phát hành bởi:\nCông ty Cổ phần Quản lý Quỹ Ký Thương - TechcomCapital (“TCC”)\nĐịa chỉ: Tầng 28, Tòa C5, số 119 Trần Duy Hưng, phường Trung Hòa, Quận Cầu Giấy, Hà Nội.\nĐiện thoại: (84-24) 39446368. Fax: (84-24) 39446583. Website: www.techcomcapital.com.vn.  \nBản cáo bạch này được phát hành bởi:\nCông ty Cổ phần Quản lý Quỹ Ký Thương - TechcomCapital (“TCC”)\nĐịa chỉ: Tầng 28, Tòa C5, số 119 Trần Duy Hưng, phường Trung Hòa, Quận Cầu Giấy, Hà Nội\nĐiện thoại: (84-24) 39446368 Fax: (84-24) 39446583\nWebsite: www.techcomcapital.com.vn  \nNơi cung cấp Bản cáo bạch:\nBản cáo bạch cập nhật những các tài liệu của Quỹ (báo cáo hoạt động, báo cáo tài chính,\nĐiểu Lệ Quỹ và các tài liệu cần thiết khác) được cung cấp trên trang điện tử của TCC,', 'Điểu Lệ Quỹ và các tài liệu cần thiết khác) được cung cấp trên trang điện tử của TCC,\nwww.techcomcapital.com.vn, tại văn phòng của TCC và các Đại lý phân phối như danh sách\ntrong phụ lục 1 của Bản cáo Bạch.  \nPhụ trách công bố thông tin:\nÔng Đặng Lưu Dũng – Tổng Giám đốc\nĐịa chỉ: Công ty Cổ phần Quản lý Quỹ Ký Thương\nTầng 28, Tòa C5, số 119 Trần Duy Hưng, phường Trung Hòa, Quận Cầu Giấy, Hà Nội\nĐiện thoại: (84-24) 39446368 Fax: (84-24) 39446583  \nBản cáo bạch này được phát hành bởi:\nCông ty Cổ phần Quản lý Quỹ Ký Thương - TechcomCapital (“TCC”)\nĐịa chỉ : Tầng 28, Tòa C5, số 119 Trần Duy Hưng, phường Trung Hòa, Quận Cầu Giấy, Hà Nội\nĐiện thoại : (84-24) 39446368 Fax: (84-24) 39446583\nWebsite : www.techcomcapital.com.vn  \nNơi cung cấp Bản cáo bạch:', 'Website : www.techcomcapital.com.vn  \nNơi cung cấp Bản cáo bạch:\nBản cáo bạch cập nhật những các tài liệu của Quỹ (báo cáo hoạt động, báo cáo tài chính,\nĐiểu Lệ Quỹ và các tài liệu cần thiết khác) được cung cấp trên trang điện tử của TCC,\nwww.techcomcapital.com.vn, tại văn phòng của TCC và các Đại lý phân phối như danh sách\ntrong phụ lục 1 của Bản cáo Bạch.  \nPhụ trách công bố thông tin:\nÔng Đặng Lưu Dũng – Tổng Giám đốc\nĐịa chỉ: Công ty Cổ phần Quản lý Quỹ Ký Thương\nTầng 28, Tòa C5, số 119 Trần Duy Hưng, phường Trung Hòa, Quận Cầu Giấy, Hà Nội\nĐiện thoại: (84-24) 39446368 Fax: (84-24) 39446583', 'Số: 9176 /QĐ-UBCK\nGiấy phép hành chứng chỉ quỹ ra công chúng\n----------------  \nCăn cứ khoản 2, Điều 46 Pháp lệnh Chứng khoán và Điều 45, 46 Nghị định số\n56/2007/NĐ-CP ngày 09/04/2007 của Chính phủ quy định chi tiết thi hành một số\nđiều của Pháp lệnh Chứng khoán;\nCăn cứ Quyết định số 30/2008/QĐ-BTC ngày 02/06/2008 của Bộ Tài chính về việc\nban hành Quy chế tổ chức và hoạt động của công ty quản lý quỹ, công ty chứng khoán;\nCăn cứ Giấy chứng nhận đăng ký kinh doanh số 0102013096 do Sở Kế hoạch và\nĐầu tư Thành phố Hà Nội cấp ngày 21/10/2008;\nXét đề nghị của Công ty cổ phần Quản lý Quỹ Ký Thương - TechcomCapital;  \nQUỸ ĐẦU TƯ CỔ PHIẾU DOANH NGHIỆP VỪA VÀ NHỎ TECHCOM\n(TCSME)  \nCHÀO BẢN CHỨNG CHỈ QUỸ ĐẦU TƯ CHỨNG KHOÁN RA CÔNG CHỨNG\n(Quỹ chứng khoán doanh nghiệp vừa và nhỏ Techcom)', 'VII. ĐẠI LÝ PHÂN PHỐI CHỨNG CHỈ QUỸ.................................. 18\nVIII. TỔ CHỨC CHỨC UP QUYỀN.......................................... 18\nIX. THÔNG TIN VỀ QUỸ ĐẦU TƯ CỔ PHIẾU DOANH NGHIỆP VỪA VÀ NHỎ\nTECHCOM (TCSME).............................................. 18\n1. Thông tin về Quỹ................................................ 18\n1.1. Các điều khoản chung........................................... 19\n2.1. Các điều khoản chung........................................... 19\n2.1. Các điều khoản chung........................................... 19\n2.2. Mục tiêu, chính sách và hạn chế đầu tư.............................. 24\n2.2.1. Cơ cấu danh mục.............................................. 24\n2.2.2. Các quy định về mục tiêu, chính sách và hạn chế đầu tư.............. 26', 'từ trên 12 tháng trở lên 0,00%  \nGiấy dịch vụ Chuyển Đổi Quỹ sẽ được hạch toán cho Công ty Quản lý Quỹ và Đại Lý Phân Phối căn cứ theo hợp đồng ký giữa Công ty Quản lý Quỹ và Đại Lý Phân Phối.  \nd) Giấy dịch vụ Chuyển Nhượng  \nNhà Đầu tư phải trả một mức phí dịch vụ Chuyển Nhượng duy nhất là 300.000 đồng (ba trăm nghìn đồng) cho mỗi giao dịch chuyển nhượng Đơn vị Quỹ. Giá dịch vụ Chuyển Nhượng do người thực hiện chuyển nhượng thanh toán.  \nGiấy dịch vụ Chuyển nhượng sẽ không áp dụng trong trường hợp Nhà Đầu tư thực hiện chuyển nhượng số Chứng Chỉ quỹ từ tài khoản này sang tài khoản khác cùng tên thì Nhà Đầu tư tại Hai Đại Lý Phân Phối khác nhau.', 'Quỹ thực hiện hoặc gián tiếp hoặc tổng hợp các khoản phí và các chi phí/phí/giá dịch vụ liên quan đến các hoạt động của Quỹ mà Quỹ thực hiện hoặc gián tiếp hoặc tổng hợp các khoản phí và các chi phí/phí/giá dịch vụ liên quan đến các hoạt động của Quỹ mà Quỹ thực hiện hoặc gián tiếp hoặc tổng hợp các khoản phí và các chi phí/phí/giá dịch vụ liên quan đến các hoạt động của Quỹ mà Quỹ thực hiện hoặc gián tiếp hoặc tổng hợp các khoản phí và các chi phí/phí/giá dịch vụ liên quan đến các hoạt động của Quỹ mà Quỹ thực hiện hoặc gián tiếp hoặc tổng hợp các khoản phí và các chi phí/phí/giá dịch vụ liên quan đến các hoạt động của Quỹ mà Quỹ thực hiện hoặc gián tiếp hoặc tổng hợp các khoản phí và các chi phí/phí/giá dịch vụ liên quan đến các hoạt động của Quỹ mà Quỹ thực hiện hoặc gián tiếp hoặc', 'Chỉ có các loại phí/dịch vụ và các chi phí/phí/giá dịch vụ liên quan trực tiếp hoặc gián tiếp hoặc tổng hợp các khoản phí và các chi phí/phí/giá dịch vụ liên quan đến các hoạt động của Quỹ mà Quỹ thực hiện hoặc gián tiếp hoặc tổng hợp các khoản phí và các chi phí/phí/giá dịch vụ liên quan đến các hoạt động của Quỹ mà Quỹ thực hiện hoặc gián tiếp hoặc tổng hợp các khoản phí và các chi phí/phí/giá dịch vụ liên quan đến các hoạt động của Quỹ mà Quỹ thực hiện hoặc gián tiếp hoặc tổng hợp các khoản phí và các chi phí/phí/giá dịch vụ liên quan đến các hoạt động của Quỹ mà Quỹ thực hiện hoặc gián tiếp hoặc tổng hợp các khoản phí và các chi phí/phí/giá dịch vụ liên quan đến các hoạt động của Quỹ mà Quỹ thực hiện hoặc gián tiếp hoặc tổng hợp các khoản phí và các chi phí/phí/giá dịch vụ liên quan', 'chi phí/phí/giá dịch vụ liên quan đến các hoạt động của Quỹ mà Quỹ thực hiện hoặc gián tiếp hoặc tổng hợp các khoản phí và các chi phí/phí/giá dịch vụ liên quan đến các hoạt động của Quỹ mà Quỹ thực hiện hoặc gián tiếp hoặc tổng hợp các khoản phí và các chi phí/phí/giá dịch vụ liên quan đến các hoạt động của Quỹ mà Quỹ thực hiện hoặc gián tiếp hoặc tổng hợp các khoản phí và các chi phí/phí/giá dịch vụ liên quan đến các hoạt động của Quỹ mà Quỹ thực hiện hoặc gián tiếp hoặc tổng hợp các khoản phí và các chi phí/phí/giá dịch vụ liên quan đến các hoạt động của Quỹ mà Quỹ thực hiện hoặc gián tiếp hoặc tổng hợp các khoản phí và các chi phí/phí/giá dịch vụ liên quan đến các hoạt động của Quỹ mà Quỹ thực hiện hoặc gián tiếp hoặc tổng hợp các khoản phí và các chi phí/phí/giá dịch vụ liên quan đến', 'phí/phí/giá dịch vụ liên quan đến các hoạt động của Quỹ mà Quỹ thực hiện hoặc gián tiếp hoặc tổng hợp các khoản phí và các chi phí/phí/giá dịch vụ liên quan đến các hoạt động của Quỹ mà Quỹ thực hiện hoặc gián tiếp hoặc tổng hợp các khoản phí và các chi phí/phí/giá dịch vụ liên quan đến các hoạt động của Quỹ mà Quỹ thực hiện hoặc gián tiếp hoặc tổng hợp các khoản phí và các chi phí/phí/giá dịch vụ liên quan đến các hoạt động của Quỹ mà Quỹ thực hiện hoặc gián tiếp hoặc tổng hợp các khoản phí và các chi phí/phí/giá dịch vụ liên quan đến các hoạt động của Quỹ mà Quỹ thực hiện hoặc gián tiếp hoặc tổng hợp các khoản phí và các chi phí/phí/giá dịch vụ liên quan đến các hoạt động của Quỹ mà Quỹ thực hiện hoặc gián tiếp hoặc tổng hợp các khoản phí và các chi phí/phí/giá dịch vụ liên quan đến các', 'vụ liên quan đến các hoạt động của Quỹ mà Quỹ thực hiện hoặc gián tiếp hoặc tổng hợp các khoản phí và các chi phí/phí/giá dịch vụ liên quan đến các hoạt động của Quỹ mà Quỹ thực hiện hoặc gián tiếp hoặc tổng hợp các khoản phí và các chi phí/phí/giá dịch vụ liên quan đến các hoạt động của Quỹ mà Quỹ thực hiện hoặc gián tiếp hoặc tổng hợp các khoản phí và các chi phí/phí/giá dịch vụ liên quan đến các hoạt động của Quỹ mà Quỹ thực hiện hoặc gián tiếp hoặc tổng hợp các khoản phí và các chi phí/phí/giá dịch vụ liên quan đến các hoạt động của Quỹ mà Quỹ thực hiện hoặc gián tiếp hoặc tổng hợp các khoản phí và các chi phí/phí/giá dịch vụ liên quan đến các hoạt động của Quỹ mà Quỹ thực hiện hoặc gián tiếp hoặc tổng hợp các khoản phí và các chi phí/phí/giá dịch vụ liên quan đến các hoạt động của', 'dịch vụ liên quan đến các hoạt động của Quỹ mà Quỹ thực hiện hoặc gián tiếp hoặc tổng hợp các khoản phí và các chi phí/phí/giá dịch vụ liên quan đến các hoạt động của Quỹ mà Quỹ thực hiện hoặc gián tiếp hoặc tổng hợp các khoản phí và các chi phí/phí/giá dịch vụ liên quan đến các hoạt động của Quỹ mà Quỹ thực hiện hoặc gián tiếp hoặc tổng hợp các khoản phí và các chi phí/phí/giá dịch vụ liên quan đến các hoạt động của Quỹ mà Quỹ thực hiện hoặc gián tiếp hoặc tổng hợp các khoản phí và các chi phí/phí/giá dịch vụ liên quan đến các hoạt động của Quỹ mà Quỹ thực hiện hoặc gián tiếp hoặc tổng hợp các khoản phí và các chi phí/phí/giá dịch vụ liên quan đến các hoạt động của Quỹ mà Quỹ thực hiện hoặc gián tiếp hoặc tổng hợp các khoản phí và các chi phí/phí/giá dịch vụ liên quan đến các hoạt động', 'liên quan đến các hoạt động của Quỹ mà Quỹ thực hiện hoặc gián tiếp hoặc tổng hợp các khoản phí và các chi phí/phí/giá dịch vụ liên quan đến các hoạt động của Quỹ mà Quỹ thực hiện hoặc gián tiếp hoặc tổng hợp các khoản phí và các chi phí/phí/giá dịch vụ liên quan đến các hoạt động của Quỹ mà Quỹ thực hiện hoặc gián tiếp hoặc tổng hợp các khoản phí và các chi phí/phí/giá dịch vụ liên quan đến các hoạt động của Quỹ mà Quỹ thực hiện hoặc gián tiếp hoặc tổng hợp các khoản phí và các chi phí/phí/giá dịch vụ liên quan đến các hoạt động của Quỹ mà Quỹ thực hiện hoặc gián tiếp hoặc tổng hợp các khoản phí và các chi phí/phí/giá dịch vụ liên quan đến', 'liên quan đến các hoạt động của Quỹ mà Quỹ thực hiện hoặc gián tiếp hoặc tổng hợp các khoản phí và các chi phí/phí/giá dịch vụ liên quan đến các hoạt động của Quỹ mà Quỹ thực hiện hoặc gián tiếp hoặc tổng hợp các khoản phí và các chi phí/phí/giá dịch vụ liên quan đến các hoạt động của Quỹ mà Quỹ thực hiện hoặc gián tiếp hoặc tổng hợp các khoản phí và các chi phí/phí/giá dịch vụ liên quan đến các hoạt động của Quỹ mà Quỹ thực hiện hoặc gián tiếp hoặc tổng hợp các khoản phí và các chi phí/phí/giá dịch vụ liên quan đến các hoạt động của Quỹ mà Quỹ thực hiện hoặc gián tiếp hoặc tổng hợp các khoản phí và các chi phí/phí/giá dịch vụ liên quan đến các hoạt động của Quỹ mà Quỹ thực hiện hoặc gián tiếp hoặc tổng hợp các khoản phí và các chi phí/phí/giá dịch vụ liên quan đến các hoạt động của Quỹ', 'liên quan đến các hoạt động của Quỹ mà Quỹ thực hiện hoặc gián tiếp hoặc tổng hợp các khoản phí và các chi phí/phí/giá dịch vụ liên quan đến các hoạt động của Quỹ mà Quỹ thực hiện hoặc gián tiếp hoặc tổng hợp các khoản phí và các chi phí/phí/giá dịch vụ liên quan đến các hoạt động của Quỹ mà Quỹ thực hiện hoặc gián tiếp hoặc tổng hợp các khoản phí và các chi phí/phí/giá dịch vụ liên quan đến các hoạt động của Quỹ mà Quỹ thực hiện hoặc gián tiếp hoặc tổng hợp các khoản phí và các chi phí/phí/giá dịch vụ liên quan đến các hoạt động của Quỹ mà Quỹ thực hiện hoặc gián tiếp hoặc tổng hợp các khoản phí và các chi phí/phí/giá dịch vụ liên quan đến các hoạt động của Quỹ mà Quỹ thực hiện hoặc gián tiếp hoặc tổng hợp các khoản phí và các chi phí/phí/giá dịch vụ liên quan đến các hoạt động của Quỹ', 'liên quan đến các hoạt động của Quỹ mà Quỹ thực hiện hoặc gián tiếp hoặc tổng hợp các khoản phí và các chi phí/phí/giá dịch vụ liên quan đến các hoạt động của Quỹ mà Quỹ thực hiện hoặc gián tiếp hoặc tổng hợp các khoản phí và các chi phí/phí/giá dịch vụ liên quan đến các hoạt động của Quỹ mà Quỹ thực hiện hoặc gián tiếp hoặc tổng hợp các khoản phí và các chi phí/phí/giá dịch vụ liên quan đến các hoạt động của Quỹ mà Quỹ thực hiện hoặc gián tiếp hoặc tổng hợp các khoản phí và các chi phí/phí/giá dịch vụ liên quan đến các hoạt động của Quỹ mà Quỹ thực hiện hoặc gián tiếp hoặc tổng hợp các khoản phí và các chi phí/phí/giá dịch vụ liên quan đến các hoạt động của Quỹ mà Quỹ thực hiện hoặc gián tiếp hoặc tổng hợp các khoản phí và các chi phí/phí/giá dịch vụ liên quan đến các hoạt động của Quỹ', 'liên quan đến các hoạt động của Quỹ mà Quỹ thực hiện hoặc gián tiếp hoặc tổng hợp các khoản phí và các chi phí/phí/giá dịch vụ liên quan đến các hoạt động của Quỹ mà Quỹ thực hiện hoặc gián tiếp hoặc tổng hợp các khoản phí và các chi phí/phí/giá dịch vụ liên quan đến các hoạt động của Quỹ mà Quỹ thực hiện hoặc gián tiếp hoặc tổng hợp các khoản phí và các chi phí/phí/giá dịch vụ liên quan đến các hoạt động của Quỹ mà Quỹ thực hiện hoặc gián tiếp hoặc tổng hợp các khoản phí và các chi phí/phí/giá dịch vụ liên quan đến các hoạt động của Quỹ mà Quỹ thực hiện hoặc gián tiếp hoặc tổng hợp các khoản phí và các chi phí/phí/giá dịch vụ liên quan đến các hoạt động của Quỹ mà Quỹ thực hiện hoặc gián tiếp hoặc tổng hợp các khoản phí và các chi phí/phí/giá dịch vụ liên quan đến các hoạt động của Quỹ', 'liên quan đến các hoạt động của Quỹ mà Quỹ thực hiện hoặc gián tiếp hoặc tổng hợp các khoản phí và các chi phí/phí/giá dịch vụ liên quan đến các hoạt động của Quỹ mà Quỹ thực hiện hoặc gián tiếp hoặc tổng hợp các khoản phí và các chi phí/phí/giá dịch vụ liên quan đến các hoạt động của Quỹ mà Quỹ thực hiện hoặc gián tiếp hoặc tổng hợp các khoản phí và các chi phí/phí/giá dịch vụ liên quan đến các hoạt động của Quỹ mà Quỹ thực hiện hoặc gián tiếp hoặc tổng hợp các khoản phí và các chi phí/phí/giá dịch vụ liên quan đến các hoạt động của Quỹ mà Quỹ thực hiện hoặc gián tiếp hoặc tổng hợp các khoản phí và các chi phí/phí/giá dịch vụ liên quan đến các hoạt động của Quỹ mà Quỹ thực hiện hoặc gián tiếp hoặc tổng hợp các khoản phí và các chi phí/phí/giá dịch vụ liên quan đến các hoạt động của Quỹ', 'liên quan đến các hoạt động của Quỹ mà Quỹ thực hiện hoặc gián tiếp hoặc tổng hợp các khoản phí và các chi phí/phí/giá dịch vụ liên quan đến các hoạt động của Quỹ mà Quỹ thực hiện hoặc gián tiếp hoặc tổng hợp các khoản phí và các chi phí/phí/giá dịch vụ liên quan đến các hoạt động của Quỹ mà Quỹ thực hiện hoặc gián tiếp hoặc tổng hợp các khoản phí và các chi phí/phí/giá dịch vụ liên quan đến các hoạt động của Quỹ mà Quỹ thực hiện hoặc gián tiếp hoặc tổng hợp các khoản phí và các chi phí/phí/giá dịch vụ liên quan đến các hoạt động của Quỹ mà Quỹ thực hiện hoặc gián tiếp hoặc tổng hợp các khoản phí và các chi phí/phí/giá dịch vụ liên quan đến các hoạt động của Quỹ mà Quỹ thực hiện hoặc gián tiếp hoặc tổng hợp các khoản phí và các chi phí/phí/giá dịch vụ liên quan đến các hoạt động của Quỹ', 'liên quan đến các hoạt động của Quỹ mà Quỹ thực hiện hoặc gián tiếp hoặc tổng hợp các khoản phí và các chi phí/phí/giá dịch vụ liên quan đến các hoạt động của Quỹ mà Quỹ thực hiện hoặc gián tiếp hoặc tổng hợp các khoản phí và các chi phí/phí/giá dịch vụ liên quan đến các hoạt động của Quỹ mà Quỹ thực hiện hoặc gián tiếp hoặc tổng hợp các khoản phí và các chi phí/phí/giá dịch vụ liên quan đến các hoạt động của Quỹ mà Quỹ thực hiện hoặc gián tiếp hoặc tổng hợp các khoản phí và các chi phí/phí/giá dịch vụ liên quan đến các hoạt động của Quỹ mà Quỹ thực hiện hoặc gián tiếp hoặc tổng hợp các khoản phí và các chi phí/phí/giá dịch vụ liên quan đến các hoạt động của Quỹ mà Quỹ thực hiện hoặc gián tiếp hoặc tổng hợp các khoản phí và các chi phí/phí/giá dịch vụ liên quan đến các hoạt động của Quỹ', 'liên quan đến các hoạt động của Quỹ mà Quỹ thực hiện hoặc gián tiếp hoặc tổng hợp các khoản phí và các chi phí/phí/giá dịch vụ liên quan đến các hoạt động của Quỹ mà Quỹ thực hiện hoặc gián tiếp hoặc tổng hợp các khoản phí và các chi phí/phí/giá dịch vụ liên quan đến các hoạt động của Quỹ mà Quỹ thực hiện hoặc gián tiếp hoặc tổng hợp các khoản phí và các chi phí/phí/giá dịch vụ liên quan đến các hoạt động của Quỹ mà Quỹ thực hiện hoặc gián tiếp hoặc tổng hợp các khoản phí và các chi phí/phí/giá dịch vụ liên quan đến các hoạt động của Quỹ mà Quỹ thực hiện hoặc gián tiếp hoặc tổng hợp các khoản phí và các chi phí/phí/giá dịch vụ liên quan đến các hoạt động của Quỹ mà Quỹ thực hiện hoặc gián tiếp hoặc tổng hợp các khoản phí và các chi phí/phí/giá dịch vụ liên quan đến các hoạt động của Quỹ', 'liên quan đến các hoạt động của Quỹ mà Quỹ thực hiện hoặc gián tiếp hoặc tổng hợp các khoản phí và các chi phí/phí/giá dịch vụ liên quan đến các hoạt động của Quỹ mà Quỹ thực hiện hoặc gián tiếp hoặc tổng hợp các khoản phí và các chi phí/phí/giá dịch vụ liên quan đến các hoạt động của Quỹ mà Quỹ thực hiện hoặc gián tiếp hoặc tổng hợp các khoản phí và các chi phí/phí/giá dịch vụ liên quan đến các hoạt động của Quỹ mà Quỹ thực hiện hoặc gián tiếp hoặc tổng hợp các khoản phí và các chi phí/phí/giá dịch vụ liên quan đến các hoạt động của Quỹ mà Quỹ thực hiện hoặc gián tiếp hoặc tổng hợp các khoản phí và các chi phí/phí/giá dịch vụ liên quan đến các hoạt động của Quỹ mà Quỹ thực hiện hoặc gián tiếp hoặc tổng hợp các khoản phí và các chi phí/phí/giá dịch vụ liên quan đến các hoạt động của Quỹ', 'liên quan đến các hoạt động của Quỹ mà Quỹ thực hiện hoặc gián tiếp hoặc tổng hợp các khoản phí và các chi phí/phí/giá dịch vụ liên quan đến các hoạt động của Quỹ mà Quỹ thực hiện hoặc gián tiếp hoặc tổng hợp các khoản phí và các chi phí/phí/giá dịch vụ liên quan đến các hoạt động của Quỹ mà Quỹ thực hiện hoặc gián tiếp hoặc tổng hợp các khoản phí và các chi phí/phí/giá dịch vụ liên quan đến các hoạt động của Quỹ mà Quỹ thực hiện hoặc gián tiếp hoặc tổng hợp các khoản phí và các chi phí/phí/giá dịch vụ liên quan đến các hoạt động của Quỹ mà Quỹ thực hiện hoặc gián tiếp hoặc tổng hợp các khoản phí và các chi phí/phí/giá dịch vụ liên quan đến các hoạt động của Quỹ mà Quỹ thực hiện hoặc gián tiếp hoặc tổng hợp các khoản phí và các chi phí/phí/giá dịch vụ liên quan đến các hoạt động của Quỹ']","Giá dịch vụ Chuyển Đổi Quỹ tối đa 3%. Biểu phí hiện tại: 0 đến dưới 6 tháng: 1,00%; trên 12 tháng: 0,00%."
Nhà đầu tư phải trả bao nhiêu phí cho một lần chuyển nhượng chứng chỉ quỹ (Transfer Fee)?,Nhà đầu tư phải trả 300.000 đồng cho mỗi giao dịch chuyển nhượng chứng chỉ quỹ.,"['từ trên 12 tháng trở lên 0,00%  \nGiấy dịch vụ Chuyển Đổi Quỹ sẽ được hạch toán cho Công ty Quản lý Quỹ và Đại Lý Phân Phối căn cứ theo hợp đồng ký giữa Công ty Quản lý Quỹ và Đại Lý Phân Phối.  \nd) Giấy dịch vụ Chuyển Nhượng  \nNhà Đầu tư phải trả một mức phí dịch vụ Chuyển Nhượng duy nhất là 300.000 đồng (ba trăm nghìn đồng) cho mỗi giao dịch chuyển nhượng Đơn vị Quỹ. Giá dịch vụ Chuyển Nhượng do người thực hiện chuyển nhượng thanh toán.  \nGiấy dịch vụ Chuyển nhượng sẽ không áp dụng trong trường hợp Nhà Đầu tư thực hiện chuyển nhượng số Chứng Chỉ quỹ từ tài khoản này sang tài khoản khác cùng tên thì Nhà Đầu tư tại Hai Đại Lý Phân Phối khác nhau.', 'nhượng, chuyển nhượng, hoặc bán một phần hoặc toàn bộ các khoản đầu tư vào Quỹ. Nhà đầu tư\ncó trách nhiệm tự mình thực hiện việc thẩm định và đánh giá mọi rủi ro liên quan đến đầu tư.  \nBản cáo bạch này bao gồm các thông tin về Quỹ, dự kiến các khoản đầu tư của Quỹ, các điều kiện\nvà quy định của Quỹ, hoặc các thông tin khác mà nhà đầu tư cần biết. Nhà đầu tư nên đọc kỹ Bản\ncáo bạch này và các tài liệu đính kèm trước khi ra quyết định đầu tư.\nTCC sẽ cập nhật Bản cáo bạch này nếu có bất kỳ thay đổi nào về thông tin.\nBản cáo bạch được cung cấp miễn phí tại văn phòng của TCC, các Đại lý phân phối và trên trang\nweb của TCC.  \nBản cáo bạch này được phát hành bởi:\nCông ty Cổ phần Quản lý Quỹ Ký Thương - TechcomCapital (“TCC”)', 'Website : www.techcomcapital.com.vn  \nNơi cung cấp Bản cáo bạch:\nBản cáo bạch cập nhật những các tài liệu của Quỹ (báo cáo hoạt động, báo cáo tài chính,\nĐiểu Lệ Quỹ và các tài liệu cần thiết khác) được cung cấp trên trang điện tử của TCC,\nwww.techcomcapital.com.vn, tại văn phòng của TCC và các Đại lý phân phối như danh sách\ntrong phụ lục 1 của Bản cáo Bạch.  \nPhụ trách công bố thông tin:\nÔng Đặng Lưu Dũng – Tổng Giám đốc\nĐịa chỉ: Công ty Cổ phần Quản lý Quỹ Ký Thương\nTầng 28, Tòa C5, số 119 Trần Duy Hưng, phường Trung Hòa, Quận Cầu Giấy, Hà Nội\nĐiện thoại: (84-24) 39446368 Fax: (84-24) 39446583', '(Quỹ chứng khoán doanh nghiệp vừa và nhỏ Techcom)\nBản cáo bạch này được phát hành bởi:\nCông ty Cổ phần Quản lý Quỹ Ký Thương - TechcomCapital (“TCC”)\nĐịa chỉ : Tầng 28, Tòa C5, số 119 Trần Duy Hưng, phường Trung Hòa, Quận Cầu\nGiấy, Hà Nội\nĐiện thoại : (84-24) 39446368 Fax: (84-24) 39446583\nWebsite : www.techcomcapital.com.vn  \nNơi cung cấp Bản cáo bạch:\nBản cáo bạch cập nhật những các tài liệu của Quỹ (báo cáo hoạt động, báo cáo tài chính,\nĐiểu Lệ Quỹ và các tài liệu cần thiết khác) được cung cấp trên trang điện tử của TCC,\nwww.techcomcapital.com.vn, tại văn phòng của TCC và các Đại lý phân phối như danh sách\ntrong phụ lục 1 của Bản cáo Bạch.  \nPhụ trách công bố thông tin:\nÔng Đặng Lưu Dũng – Tổng Giám đốc\nĐịa chỉ : Công ty Cổ phần Quản lý Quỹ Ký Thương', 'Điểu Lệ Quỹ và các tài liệu cần thiết khác) được cung cấp trên trang điện tử của TCC,\nwww.techcomcapital.com.vn, tại văn phòng của TCC và các Đại lý phân phối như danh sách\ntrong phụ lục 1 của Bản cáo Bạch.  \nPhụ trách công bố thông tin:\nÔng Đặng Lưu Dũng – Tổng Giám đốc\nĐịa chỉ: Công ty Cổ phần Quản lý Quỹ Ký Thương\nTầng 28, Tòa C5, số 119 Trần Duy Hưng, phường Trung Hòa, Quận Cầu Giấy, Hà Nội\nĐiện thoại: (84-24) 39446368 Fax: (84-24) 39446583  \nBản cáo bạch này được phát hành bởi:\nCông ty Cổ phần Quản lý Quỹ Ký Thương - TechcomCapital (“TCC”)\nĐịa chỉ : Tầng 28, Tòa C5, số 119 Trần Duy Hưng, phường Trung Hòa, Quận Cầu Giấy, Hà Nội\nĐiện thoại : (84-24) 39446368 Fax: (84-24) 39446583\nWebsite : www.techcomcapital.com.vn  \nNơi cung cấp Bản cáo bạch:', '**3.6. Rủi ro biến động giá**  \nRủi ro về biến động giá của Quỹ phát sinh khi một hay một số Nhà Đầu tư nắm giữ một số lượng lớn cổ phiếu của Quỹ quyết định thực hiện lệnh bán của các cổ phiếu của Quỹ này. Nắm giữ một số lượng lớn cổ phiếu của Quỹ quyết định bán.  \n**3.7. Rủi ro tái đầu tư**  \nRủi ro tái đầu tư là rủi ro có thể xảy ra khi các khoản đầu tư trái phiếu với dòng tiền lãi trái phiếu nhận được hàng kỳ và gốc trái phiếu nhận được vào thời điểm đáo hạn được đi tìm đầu tư nhận lại. Công ty Quản lý Quỹ quyết định bán các chứng khoán của Quỹ.', 'Bản cáo bạch này được phát hành bởi:\nCông ty Cổ phần Quản lý Quỹ Ký Thương - TechcomCapital (“TCC”)\nĐịa chỉ: Tầng 28, Tòa C5, số 119 Trần Duy Hưng, phường Trung Hòa, Quận Cầu Giấy, Hà Nội.\nĐiện thoại: (84-24) 39446368. Fax: (84-24) 39446583. Website: www.techcomcapital.com.vn.  \nBản cáo bạch này được phát hành bởi:\nCông ty Cổ phần Quản lý Quỹ Ký Thương - TechcomCapital (“TCC”)\nĐịa chỉ: Tầng 28, Tòa C5, số 119 Trần Duy Hưng, phường Trung Hòa, Quận Cầu Giấy, Hà Nội\nĐiện thoại: (84-24) 39446368 Fax: (84-24) 39446583\nWebsite: www.techcomcapital.com.vn  \nNơi cung cấp Bản cáo bạch:\nBản cáo bạch cập nhật những các tài liệu của Quỹ (báo cáo hoạt động, báo cáo tài chính,\nĐiểu Lệ Quỹ và các tài liệu cần thiết khác) được cung cấp trên trang điện tử của TCC,', 'Số: 9176 /QĐ-UBCK\nGiấy phép hành chứng chỉ quỹ ra công chúng\n----------------  \nCăn cứ khoản 2, Điều 46 Pháp lệnh Chứng khoán và Điều 45, 46 Nghị định số\n56/2007/NĐ-CP ngày 09/04/2007 của Chính phủ quy định chi tiết thi hành một số\nđiều của Pháp lệnh Chứng khoán;\nCăn cứ Quyết định số 30/2008/QĐ-BTC ngày 02/06/2008 của Bộ Tài chính về việc\nban hành Quy chế tổ chức và hoạt động của công ty quản lý quỹ, công ty chứng khoán;\nCăn cứ Giấy chứng nhận đăng ký kinh doanh số 0102013096 do Sở Kế hoạch và\nĐầu tư Thành phố Hà Nội cấp ngày 21/10/2008;\nXét đề nghị của Công ty cổ phần Quản lý Quỹ Ký Thương - TechcomCapital;  \nQUỸ ĐẦU TƯ CỔ PHIẾU DOANH NGHIỆP VỪA VÀ NHỎ TECHCOM\n(TCSME)  \nCHÀO BẢN CHỨNG CHỈ QUỸ ĐẦU TƯ CHỨNG KHOÁN RA CÔNG CHỨNG\n(Quỹ chứng khoán doanh nghiệp vừa và nhỏ Techcom)', '40% tổng giá trị tài sản của quỹ. Trong đó, hạng mục đầu tư lớn của quỹ là hạng mục đầu tư\nvào các loại tài sản quỹ định tại điểm a, d, và g mục IX.2.2.3 (ngoại trừ chứng chỉ tiền gửi)\nphải hành bởi cùng một tổ chức, có tổng giá trị chiếm từ 5% trở lên tổng giá trị tài sản của\nquỹ;\ng) Tại mọi thời điểm, tổng giá trị cam kết trong các giao dịch chứng khoán phái sinh, dự nợ vay\nvà các khoản phải trả của quỹ không được vượt giá trị tài sản ròng của quỹ;\nh) Không được đầu tư vào chứng khoán của Chính phủ Quỹ;\ni) Chỉ được đầu tư vào chứng chỉ quỹ đại chúng khác, công ty đầu tư chứng khoán đại chúng\ndo công ty quản lý quỹ khác quản lý và bảo đảm các hạn chế sau:\n- Không đầu tư vào quá 10% tổng giá trị chứng chỉ quỹ đang lưu hành của một quỹ đại chúng,', 'Quỹ đầu tư chứng khoán được mô tả trong Bản cáo bạch này là Quỹ được thành lập theo\nLuật Chứng khoán số 54/2019/QH14 Quốc hội Nước Cộng Hòa Xã hội Chủ nghĩa Việt\nNam thông qua ngày 26 tháng 11 năm 2019 và các văn bản hướng dẫn thi hành. Bản cáo\nbạch này đã được đăng ký với Ủy ban Chứng khoán Nhà nước ngày / /2022.  \nTHÔNG BÁO QUAN TRỌNG  \nCác nhà đầu tư nên nghiên cứu Bản cáo bạch này một cách cẩn trọng và toàn diện và không nên\ncoi nội dung hoặc tóm tắt ở đây là các tư vấn liên quan đến pháp lý, thuế, hoặc tài chính/đầu\ntư và nên tham khảo ý kiến chuyên gia tư vấn của mình về các yêu cầu pháp lý, thuế, năm\ngiữa, hoặc tư vấn về các khía cạnh khác của việc đầu tư, mua, cho tặng, năm giữ,\nnhượng, chuyển nhượng, hoặc bán một phần hoặc toàn bộ các khoản đầu tư vào Quỹ. Nhà đầu tư', '*   Kết quả hoạt động trong quá khứ của các Quỹ không có nghĩa là kết quả hoạt động trong tương lai.\n*   Tên của Quỹ không hàm ý về chất lượng hoạt động cũng như những lợi và lợi nhuận của Quỹ trong tương lai;\n*   Công ty Quản lý Quỹ không chịu trách nhiệm pháp lý về những rủi ro từ đầu tư của các chủ nợ, thành viên Hội đồng thành viên, Ban điều hành và nhân viên của Công ty Quản lý Quỹ không có trách nhiệm pháp lý về các rủi ro hoạt động của Công ty Quản lý Quỹ.\n*   Giống như các hình thức đầu tư khác, Quỹ, rủi ro thanh khoản sẽ được phân bổ trên cơ sở số ngày gần nhất với giá trị tài sản ròng. Các khoản đầu tư khác có thể có nhiều rủi ro hơn so với thời điểm hiện tại. Nhà Đầu tư cần phải nhận thức được khả năng chấp nhận rủi ro từ vơi rủi ro đầu tư mà Quỹ có thể gặp phải trong tương lai.', '*   9 năm kinh nghiệm với vai trò giám đốc kiểm toán tại Công ty TNHH KPMG Việt Nam.\n*   Hiện là Giám đốc tài chính (CFO) tại Công ty CP Đầu Tư Thương Mại Quốc Tế Matrrot Dd.  \nCác quy định về tiêu chuẩn lựa chọn thành viên Ban đại diện Quỹ, quyền hạn và nhiệm vụ của Ban đại diện Quỹ, chủ tịch Ban đại diện Quỹ, đinh chỉ hoạc bãi miễn thành viên Ban đại diện Quỹ, cuộc họp của Ban đại diện Quỹ tuân theo quy định tại chương V Điều Lệ Quỹ.  \n**2.10. Quyền hạn và trách nhiệm của Công ty Quản lý Quỹ**\nCông ty Quản lý Quỹ được lựa chọn phải thỏa mãn các điều kiện sau:  \n*   Được thực hiện nghiệp vụ quản lý Quỹ;\n*   Hoàn toàn độc lập với Ngân hàng Giám sát;\n*   Có đầy đủ cơ sở vật chất, nhân sự để Quản lý Quỹ mở;', 'Quỹ thực hiện hoặc gián tiếp hoặc tổng hợp các khoản phí và các chi phí/phí/giá dịch vụ liên quan đến các hoạt động của Quỹ mà Quỹ thực hiện hoặc gián tiếp hoặc tổng hợp các khoản phí và các chi phí/phí/giá dịch vụ liên quan đến các hoạt động của Quỹ mà Quỹ thực hiện hoặc gián tiếp hoặc tổng hợp các khoản phí và các chi phí/phí/giá dịch vụ liên quan đến các hoạt động của Quỹ mà Quỹ thực hiện hoặc gián tiếp hoặc tổng hợp các khoản phí và các chi phí/phí/giá dịch vụ liên quan đến các hoạt động của Quỹ mà Quỹ thực hiện hoặc gián tiếp hoặc tổng hợp các khoản phí và các chi phí/phí/giá dịch vụ liên quan đến các hoạt động của Quỹ mà Quỹ thực hiện hoặc gián tiếp hoặc tổng hợp các khoản phí và các chi phí/phí/giá dịch vụ liên quan đến các hoạt động của Quỹ mà Quỹ thực hiện hoặc gián tiếp hoặc', 'Giấy dịch vụ Chuyển nhượng sẽ được hạch toán cho Công ty Quản lý Quỹ và Đại Lý Phân Phối căn cứ theo hợp đồng ký giữa Công ty Quản lý Quỹ và Đại Lý Phân Phối.  \n3.2 Giá dịch vụ mà Quỹ phải trả', 'cụ nợ của Chính phủ;\nd) Không được đầu tư quá 30% tổng giá trị tài sản của quỹ vào các tài sản quỹ định tại điểm a,\nb, d, e và f mục IX.2.2.3, phải hành bởi các công ty trong cùng một nhóm công ty cơ quan hệ\nsở hữu với nhau, thuộc sở hữu hợp của sau đây: Công ty con, các công ty sở hữu\nhien 35% cổ phần, phần vốn góp của nhau.nhóm công ty con, công ty mẹ. Tổng\nđộ phân đầu tư vào chứng khoán phái sinh tính bằng giá trị cam kết của hợp đồng xác định\ntheo quy định tại Phụ Lục 4 Điều Lệ Quỹ;\ne) Không được đầu tư quá 10% tổng giá trị tài sản của quỹ vào các tài sản quỹ định tại điểm d\nmục IX.2.2.3;\nf) Tổng giá trị các hạng mục đầu tư lớn trong danh mục đầu tư của quỹ không được vượt quá\n40% tổng giá trị tài sản của quỹ. Trong đó, hạng mục đầu tư lớn của quỹ là hạng mục đầu tư', 'Chỉ có các loại phí/dịch vụ và các chi phí/phí/giá dịch vụ liên quan trực tiếp hoặc gián tiếp hoặc tổng hợp các khoản phí và các chi phí/phí/giá dịch vụ liên quan đến các hoạt động của Quỹ mà Quỹ thực hiện hoặc gián tiếp hoặc tổng hợp các khoản phí và các chi phí/phí/giá dịch vụ liên quan đến các hoạt động của Quỹ mà Quỹ thực hiện hoặc gián tiếp hoặc tổng hợp các khoản phí và các chi phí/phí/giá dịch vụ liên quan đến các hoạt động của Quỹ mà Quỹ thực hiện hoặc gián tiếp hoặc tổng hợp các khoản phí và các chi phí/phí/giá dịch vụ liên quan đến các hoạt động của Quỹ mà Quỹ thực hiện hoặc gián tiếp hoặc tổng hợp các khoản phí và các chi phí/phí/giá dịch vụ liên quan đến các hoạt động của Quỹ mà Quỹ thực hiện hoặc gián tiếp hoặc tổng hợp các khoản phí và các chi phí/phí/giá dịch vụ liên quan', 'phí/phí/giá dịch vụ liên quan đến các hoạt động của Quỹ mà Quỹ thực hiện hoặc gián tiếp hoặc tổng hợp các khoản phí và các chi phí/phí/giá dịch vụ liên quan đến các hoạt động của Quỹ mà Quỹ thực hiện hoặc gián tiếp hoặc tổng hợp các khoản phí và các chi phí/phí/giá dịch vụ liên quan đến các hoạt động của Quỹ mà Quỹ thực hiện hoặc gián tiếp hoặc tổng hợp các khoản phí và các chi phí/phí/giá dịch vụ liên quan đến các hoạt động của Quỹ mà Quỹ thực hiện hoặc gián tiếp hoặc tổng hợp các khoản phí và các chi phí/phí/giá dịch vụ liên quan đến các hoạt động của Quỹ mà Quỹ thực hiện hoặc gián tiếp hoặc tổng hợp các khoản phí và các chi phí/phí/giá dịch vụ liên quan đến các hoạt động của Quỹ mà Quỹ thực hiện hoặc gián tiếp hoặc tổng hợp các khoản phí và các chi phí/phí/giá dịch vụ liên quan đến các', 'gián tiếp hoặc tổng hợp các khoản phí và các chi phí/phí/giá dịch vụ liên quan đến các hoạt động của Quỹ mà Quỹ thực hiện hoặc gián tiếp hoặc tổng hợp các khoản phí và các chi phí/phí/giá dịch vụ liên quan đến các hoạt động của Quỹ mà Quỹ thực hiện hoặc gián tiếp hoặc tổng hợp các khoản phí và các chi phí/phí/giá dịch vụ liên quan đến các hoạt động của Quỹ mà Quỹ thực hiện hoặc gián tiếp hoặc tổng hợp các khoản phí và các chi phí/phí/giá dịch vụ liên quan đến các hoạt động của Quỹ mà Quỹ thực hiện hoặc gián tiếp hoặc tổng hợp các khoản phí và các chi phí/phí/giá dịch vụ liên quan đến các hoạt động của Quỹ mà Quỹ thực hiện hoặc gián tiếp hoặc tổng hợp các khoản phí và các chi phí/phí/giá dịch vụ liên quan đến các hoạt động của Quỹ mà Quỹ thực hiện hoặc gián tiếp hoặc tổng hợp các khoản phí', 'vụ liên quan đến các hoạt động của Quỹ mà Quỹ thực hiện hoặc gián tiếp hoặc tổng hợp các khoản phí và các chi phí/phí/giá dịch vụ liên quan đến các hoạt động của Quỹ mà Quỹ thực hiện hoặc gián tiếp hoặc tổng hợp các khoản phí và các chi phí/phí/giá dịch vụ liên quan đến các hoạt động của Quỹ mà Quỹ thực hiện hoặc gián tiếp hoặc tổng hợp các khoản phí và các chi phí/phí/giá dịch vụ liên quan đến các hoạt động của Quỹ mà Quỹ thực hiện hoặc gián tiếp hoặc tổng hợp các khoản phí và các chi phí/phí/giá dịch vụ liên quan đến các hoạt động của Quỹ mà Quỹ thực hiện hoặc gián tiếp hoặc tổng hợp các khoản phí và các chi phí/phí/giá dịch vụ liên quan đến các hoạt động của Quỹ mà Quỹ thực hiện hoặc gián tiếp hoặc tổng hợp các khoản phí và các chi phí/phí/giá dịch vụ liên quan đến các hoạt động của', 'tiếp hoặc tổng hợp các khoản phí và các chi phí/phí/giá dịch vụ liên quan đến các hoạt động của Quỹ mà Quỹ thực hiện hoặc gián tiếp hoặc tổng hợp các khoản phí và các chi phí/phí/giá dịch vụ liên quan đến các hoạt động của Quỹ mà Quỹ thực hiện hoặc gián tiếp hoặc tổng hợp các khoản phí và các chi phí/phí/giá dịch vụ liên quan đến các hoạt động của Quỹ mà Quỹ thực hiện hoặc gián tiếp hoặc tổng hợp các khoản phí và các chi phí/phí/giá dịch vụ liên quan đến các hoạt động của Quỹ mà Quỹ thực hiện hoặc gián tiếp hoặc tổng hợp các khoản phí và các chi phí/phí/giá dịch vụ liên quan đến các hoạt động của Quỹ mà Quỹ thực hiện hoặc gián tiếp hoặc tổng hợp các khoản phí và các chi phí/phí/giá dịch vụ liên quan đến các hoạt động của Quỹ mà Quỹ thực hiện hoặc gián tiếp hoặc tổng hợp các khoản phí và', 'tiếp hoặc tổng hợp các khoản phí và các chi phí/phí/giá dịch vụ liên quan đến các hoạt động của Quỹ mà Quỹ thực hiện hoặc gián tiếp hoặc tổng hợp các khoản phí và các chi phí/phí/giá dịch vụ liên quan đến các hoạt động của Quỹ mà Quỹ thực hiện hoặc gián tiếp hoặc tổng hợp các khoản phí và các chi phí/phí/giá dịch vụ liên quan đến các hoạt động của Quỹ mà Quỹ thực hiện hoặc gián tiếp hoặc tổng hợp các khoản phí và các chi phí/phí/giá dịch vụ liên quan đến các hoạt động của Quỹ mà Quỹ thực hiện hoặc gián tiếp hoặc tổng hợp các khoản phí và các chi phí/phí/giá dịch vụ liên quan đến các hoạt động của Quỹ mà Quỹ thực hiện hoặc gián tiếp hoặc tổng hợp các khoản phí và các chi phí/phí/giá dịch vụ liên quan đến các hoạt động của Quỹ mà Quỹ thực hiện hoặc gián tiếp hoặc tổng hợp các khoản phí và', 'tiếp hoặc tổng hợp các khoản phí và các chi phí/phí/giá dịch vụ liên quan đến các hoạt động của Quỹ mà Quỹ thực hiện hoặc gián tiếp hoặc tổng hợp các khoản phí và các chi phí/phí/giá dịch vụ liên quan đến các hoạt động của Quỹ mà Quỹ thực hiện hoặc gián tiếp hoặc tổng hợp các khoản phí và các chi phí/phí/giá dịch vụ liên quan đến các hoạt động của Quỹ mà Quỹ thực hiện hoặc gián tiếp hoặc tổng hợp các khoản phí và các chi phí/phí/giá dịch vụ liên quan đến các hoạt động của Quỹ mà Quỹ thực hiện hoặc gián tiếp hoặc tổng hợp các khoản phí và các chi phí/phí/giá dịch vụ liên quan đến các hoạt động của Quỹ mà Quỹ thực hiện hoặc gián tiếp hoặc tổng hợp các khoản phí và các chi phí/phí/giá dịch vụ liên quan đến các hoạt động của Quỹ mà Quỹ thực hiện hoặc gián tiếp hoặc tổng hợp các khoản phí và', 'tiếp hoặc tổng hợp các khoản phí và các chi phí/phí/giá dịch vụ liên quan đến các hoạt động của Quỹ mà Quỹ thực hiện hoặc gián tiếp hoặc tổng hợp các khoản phí và các chi phí/phí/giá dịch vụ liên quan đến các hoạt động của Quỹ mà Quỹ thực hiện hoặc gián tiếp hoặc tổng hợp các khoản phí và các chi phí/phí/giá dịch vụ liên quan đến các hoạt động của Quỹ mà Quỹ thực hiện hoặc gián tiếp hoặc tổng hợp các khoản phí và các chi phí/phí/giá dịch vụ liên quan đến các hoạt động của Quỹ mà Quỹ thực hiện hoặc gián tiếp hoặc tổng hợp các khoản phí và các chi phí/phí/giá dịch vụ liên quan đến các hoạt động của Quỹ mà Quỹ thực hiện hoặc gián tiếp hoặc tổng hợp các khoản phí và các chi phí/phí/giá dịch vụ liên quan đến các hoạt động của Quỹ mà Quỹ thực hiện hoặc gián tiếp hoặc tổng hợp các khoản phí và', 'tiếp hoặc tổng hợp các khoản phí và các chi phí/phí/giá dịch vụ liên quan đến các hoạt động của Quỹ mà Quỹ thực hiện hoặc gián tiếp hoặc tổng hợp các khoản phí và các chi phí/phí/giá dịch vụ liên quan đến các hoạt động của Quỹ mà Quỹ thực hiện hoặc gián tiếp hoặc tổng hợp các khoản phí và các chi phí/phí/giá dịch vụ liên quan đến các hoạt động của Quỹ mà Quỹ thực hiện hoặc gián tiếp hoặc tổng hợp các khoản phí và các chi phí/phí/giá dịch vụ liên quan đến các hoạt động của Quỹ mà Quỹ thực hiện hoặc gián tiếp hoặc tổng hợp các khoản phí và các chi phí/phí/giá dịch vụ liên quan đến các hoạt động của Quỹ mà Quỹ thực hiện hoặc gián tiếp hoặc tổng hợp các khoản phí và các chi phí/phí/giá dịch vụ liên quan đến các hoạt động của Quỹ mà Quỹ thực hiện hoặc gián tiếp hoặc tổng hợp các khoản phí và', 'tiếp hoặc tổng hợp các khoản phí và các chi phí/phí/giá dịch vụ liên quan đến các hoạt động của Quỹ mà Quỹ thực hiện hoặc gián tiếp hoặc tổng hợp các khoản phí và các chi phí/phí/giá dịch vụ liên quan đến các hoạt động của Quỹ mà Quỹ thực hiện hoặc gián tiếp hoặc tổng hợp các khoản phí và các chi phí/phí/giá dịch vụ liên quan đến các hoạt động của Quỹ mà Quỹ thực hiện hoặc gián tiếp hoặc tổng hợp các khoản phí và các chi phí/phí/giá dịch vụ liên quan đến các hoạt động của Quỹ mà Quỹ thực hiện hoặc gián tiếp hoặc tổng hợp các khoản phí và các chi phí/phí/giá dịch vụ liên quan đến các hoạt động của Quỹ mà Quỹ thực hiện hoặc gián tiếp hoặc tổng hợp các khoản phí và các chi phí/phí/giá dịch vụ liên quan đến các hoạt động của Quỹ mà Quỹ thực hiện hoặc gián tiếp hoặc tổng hợp các khoản phí và']",Giá dịch vụ Chuyển Nhượng là 300.000 đồng cho mỗi giao dịch.
Phí dịch vụ giám sát và phí lưu ký mà Quỹ phải trả cho Ngân hàng giám sát là bao nhiêu?,"Phí dịch vụ giám sát là 0,02%*NAV/Năm. Phí lưu ký là 0,06%*NAV/Năm.","['*   Ngân hàng giám sát, thành viên Hội đồng quản trị, người điều hành và nhân viên của ngân hàng giám sát làm nhiệm vụ giám sát hoạt động và bảo quản tài sản của Quỹ đại chúng, Công ty đầu tư chứng khoán không được là đối tượng mua, bán trong giao dịch mua, bán tài sản của Quỹ đại chúng, công ty đầu tư chứng khoán.\n*   Có đầy đủ năng lực cung cấp dịch vụ giám sát, lưu ký;  \nCác quy định về quyền và nghĩa vụ, thời hạn công bố thông tin về Công ty Quản lý Quỹ tuân theo quy định tại Chương VII Điều Lệ Quỹ.', 'ngược lại;  \n*   Ngân hàng giám sát, thành viên Hội đồng quản trị, người điều hành và nhân viên của ngân hàng giám sát làm nhiệm vụ giám sát hoạt động và bảo quản tài sản của Quỹ đại chúng, Công ty đầu tư chứng khoán không được là đối tượng mua, bán trong giao dịch mua, bán tài sản của Quỹ đại chúng, công ty đầu tư chứng khoán.\n*   Có đầy đủ năng lực cung cấp dịch vụ giám sát, lưu ký;\n*   Thực hiện các cam kết đối với Quỹ như nêu tại Phụ Lục 2 và Phụ Lục 3 của Điều Lệ Quỹ.  \nCác quy định về quyền và nghĩa vụ, thời hạn công bố thông tin về Công ty Quản lý Quỹ tuân theo quy định tại Chương VII Điều Lệ Quỹ.  \n**2.12. Kiểm toán, kế toán và chế độ báo cáo**', '*   Có đầy đủ cơ sở vật chất, nhân sự để Quản lý Quỹ mở;\n*   Đồng ý thực hiện các cam kết đối với Quỹ như nêu tại Phụ Lục 1 và Phụ Lục 3 của Điều Lệ Quỹ.  \nCác quy định về quyền và nghĩa vụ, chấm dứt quyền và nghĩa vụ, hạn chế hoạt động của Công ty Quản lý Quỹ tuân thủ theo quy định tại Chương VI Điều Lệ Quỹ.  \n**2.11. Tiêu chí lựa chọn, quyền hạn và trách nhiệm của Ngân hàng giám sát**\nNgân hàng Giám sát được lựa chọn phải đáp ứng các điều kiện sau:  \n*   Ngân hàng giám sát do Công ty Quản lý Quỹ lựa chọn phải đáp ứng các điều kiện quy định tại Khoản 1 Điều 116 Luật Chứng khoán;\n*   Ngân hàng giám sát phải hoạt động độc lập và tách biệt với Công ty Quản lý Quỹ mà ngân hàng cung cấp dịch vụ giám sát;', '**3.3.Rủi ro tỷ giá**  \nDo tài sản và nợ phải trả của Quỹ đều được trình bày bằng đồng Việt Nam, là đơn vị tiền tệ sử dụng của Quỹ. Mặc dù rủi ro tỷ giá trong tương lai hạn chế ảnh hưởng từ đồng tiền nước ngoài, thì tính chất của từng sản phẩm tài chính được trình bày trên Bảng Cân Đối Kế Toán của Quỹ. Do đó, giá trị thị trường của từng khoản đầu tư có thể bị ảnh hưởng bởi tỷ giá hối đoái.', 'Các quy định khác liên quan đến kiểm toán, kế toán và chế độ báo cáo tuân thủ theo quy định tại Điều Lệ Quỹ.  \n**3. Các rủi ro khi đầu tư vào Quỹ**  \nMục tiêu của Công ty Quản lý Quỹ là quản lý các rủi ro đầu tư, và nếu có thể, hạn chế các tác động của các rủi ro này bằng việc áp dụng các phương pháp quản lý đầu tư theo tiêu chuẩn quốc tế tốt nhất. Nhà Đầu tư cần lưu ý về các điểm quan trọng sau đây:  \n*   Quỹ, Công ty Quản lý Quỹ, thành viên Hội đồng quản trị, người điều hành và nhân viên của ngân hàng giám sát sẽ làm nhiệm vụ của quản trị rủi ro và bảo quản tài sản của quỹ đại chúng, công ty đầu tư chứng khoán không được là đối tượng mua, bán trong giao dịch mua, bán tài sản của quỹ đại chúng, công ty đầu tư chứng khoán.', '*   Kết quả hoạt động trong quá khứ của các Quỹ không có nghĩa là kết quả hoạt động trong tương lai.\n*   Tên của Quỹ không hàm ý về chất lượng hoạt động cũng như những lợi và lợi nhuận của Quỹ trong tương lai;\n*   Công ty Quản lý Quỹ không chịu trách nhiệm pháp lý về những rủi ro từ đầu tư của các chủ nợ, thành viên Hội đồng thành viên, Ban điều hành và nhân viên của Công ty Quản lý Quỹ không có trách nhiệm pháp lý về các rủi ro hoạt động của Công ty Quản lý Quỹ.\n*   Giống như các hình thức đầu tư khác, Quỹ, rủi ro thanh khoản sẽ được phân bổ trên cơ sở số ngày gần nhất với giá trị tài sản ròng. Các khoản đầu tư khác có thể có nhiều rủi ro hơn so với thời điểm hiện tại. Nhà Đầu tư cần phải nhận thức được khả năng chấp nhận rủi ro từ vơi rủi ro đầu tư mà Quỹ có thể gặp phải trong tương lai.', '**2.12. Kiểm toán, kế toán và chế độ báo cáo**  \nCông ty kiểm toán được lựa chọn phải được thành lập và hoạt động phù hợp với quy định của Pháp luật, nằm trong danh sách các công ty kiểm toán được UBCKNN chấp thuận kiểm toán cho tổ chức tài chính, tổ chức niêm yết và cho tổ chức kinh doanh chứng khoán và không được là người liên quan của Công ty Quản lý Quỹ, Ngân hàng Giám sát. Năm kiểm toán: Tổng công ty kiểm toán Quỹ sẽ được Công ty Quản lý Quỹ đề cử để Đại Hội Đồng Quỹ thông qua. Các năm sau đó, Đại Hội Đầu Tư Quỹ sẽ thông qua cho Ban Đại Diện Quỹ thông qua việc lựa chọn công ty kiểm toán. Công ty Quản lý Quỹ sẽ đề xuất với Ban Đại Diện Quỹ ít nhất (02) công ty kiểm toán để kiểm toán cho Quỹ mình.  \n**Chế độ kế toán**', '**Chế độ kế toán**  \nQuỹ sẽ áp dụng chế độ kế toán Việt Nam (VAS) và tuân thủ các quy định khác liên quan tới công tác kế toán cho Quỹ do các cơ quan có thẩm quyền quy định. Đồng Việt Nam sẽ là đồng tiền được sử dụng và thể hiện.  \n**Chế độ báo cáo**  \nCông ty Quản lý Quỹ có trách nhiệm duy trì sổ sách kế toán và chuẩn bị báo cáo tài chính cho Quỹ. Phù hợp với quy định tại Điều 38 của Điều Lệ Quỹ, Công ty Quản lý Quỹ có thể uỷ quyền cho một nhà cung cấp dịch vụ có thực hiện việc này. Một số sách kế toán và báo cáo tài chính mà Công ty Quản lý Quỹ hoặc nhà cung cấp dịch vụ có thể uỷ quyền sẽ được lưu trữ tại văn phòng của Công ty Quản lý Quỹ hoặc nhà cung cấp dịch vụ có liên quan.', '**3.2.Rủi ro lạm phát**  \nGiá trị thị trường tỷ lệ nghịch với lạm phát. Vì dụ trong môi trường lạm phát tăng, sức mua hay giá trị thực của các đồng tiền trong tương lai (menh giá và lãi trái phiếu nhận được hàng kỳ) sẽ giảm. Khi đó lợi suất của Quỹ trái phiếu tăng lên dẫn đến giá trị trái phiếu ròng. Rủi ro lạm phát giới hạn mức tăng trưởng của trái phiếu. Điều này thường biểu hiện cách rủi ro tài sản tài sản, trái phiếu hoặc chứng khoán nhận được hàng kỳ có thể bị ảnh hưởng bởi lạm phát.\n**3.3.Rủi ro tỷ giá**', '*   Công ty Quản lý Quỹ sẽ xem xét và lựa chọn các khoản đầu tư có liên quan đến các chi phí.\n**3.1.Rủi ro lãi suất**  \nLà rủi ro mà hợp lý của các dòng tiền trong tương lai của chứng khoán có thu nhập cố định bị biến động do những thay đổi của lãi suất thị trường, dẫn tới giá trị thị trường của chứng khoán thay đổi. Thông thường, giá trị thị trường của trái phiếu và các chứng khoán có thu nhập cố định biến động ngược chiều với lãi suất. Quỹ có thể giảm thiểu rủi ro lãi suất bằng cách giữ các trái phiếu phù hợp với thời hạn của lãi suất. Công ty Quản lý Quỹ sẽ cố gắng giảm thiểu rủi ro lãi suất bằng cách lựa chọn các chứng khoán có lãi suất phù hợp với thời hạn của lãi suất.\n**3.2.Rủi ro lạm phát**', 'Quỹ đầu tư chứng khoán được mô tả trong Bản cáo bạch này là Quỹ được thành lập theo\nLuật Chứng khoán số 54/2019/QH14 Quốc hội Nước Cộng Hòa Xã hội Chủ nghĩa Việt\nNam thông qua ngày 26 tháng 11 năm 2019 và các văn bản hướng dẫn thi hành. Bản cáo\nbạch này đã được đăng ký với Ủy ban Chứng khoán Nhà nước ngày / /2022.  \nTHÔNG BÁO QUAN TRỌNG  \nCác nhà đầu tư nên nghiên cứu Bản cáo bạch này một cách cẩn trọng và toàn diện và không nên\ncoi nội dung hoặc tóm tắt ở đây là các tư vấn liên quan đến pháp lý, thuế, hoặc tài chính/đầu\ntư và nên tham khảo ý kiến chuyên gia tư vấn của mình về các yêu cầu pháp lý, thuế, năm\ngiữa, hoặc tư vấn về các khía cạnh khác của việc đầu tư, mua, cho tặng, năm giữ,\nnhượng, chuyển nhượng, hoặc bán một phần hoặc toàn bộ các khoản đầu tư vào Quỹ. Nhà đầu tư', 'thực hiện hoặc gián tiếp hoặc tổng hợp các khoản phí và các chi phí/phí/giá dịch vụ liên quan đến các hoạt động của Quỹ mà Quỹ thực hiện hoặc gián tiếp hoặc tổng hợp các khoản phí và các chi phí/phí/giá dịch vụ liên quan đến các hoạt động của Quỹ mà Quỹ thực hiện hoặc gián tiếp hoặc tổng hợp các khoản phí và các chi phí/phí/giá dịch vụ liên quan đến các hoạt động của Quỹ mà Quỹ thực hiện hoặc gián tiếp hoặc tổng hợp các khoản phí và các chi phí/phí/giá dịch vụ liên quan đến các hoạt động của Quỹ mà Quỹ thực hiện hoặc gián tiếp hoặc tổng hợp các khoản phí và các chi phí/phí/giá dịch vụ liên quan đến các hoạt động của Quỹ mà Quỹ thực hiện hoặc gián tiếp hoặc tổng hợp các khoản phí và các chi phí/phí/giá dịch vụ liên quan đến các hoạt động của Quỹ mà Quỹ thực hiện hoặc gián tiếp hoặc tổng', 'tiếp hoặc tổng hợp các khoản phí và các chi phí/phí/giá dịch vụ liên quan đến các hoạt động của Quỹ mà Quỹ thực hiện hoặc gián tiếp hoặc tổng hợp các khoản phí và các chi phí/phí/giá dịch vụ liên quan đến các hoạt động của Quỹ mà Quỹ thực hiện hoặc gián tiếp hoặc tổng hợp các khoản phí và các chi phí/phí/giá dịch vụ liên quan đến các hoạt động của Quỹ mà Quỹ thực hiện hoặc gián tiếp hoặc tổng hợp các khoản phí và các chi phí/phí/giá dịch vụ liên quan đến các hoạt động của Quỹ mà Quỹ thực hiện hoặc gián tiếp hoặc tổng hợp các khoản phí và các chi phí/phí/giá dịch vụ liên quan đến các hoạt động của Quỹ mà Quỹ thực hiện hoặc gián tiếp hoặc tổng hợp các khoản phí và các chi phí/phí/giá dịch vụ liên quan đến các hoạt động của Quỹ mà Quỹ thực hiện hoặc gián tiếp hoặc tổng hợp các khoản phí và', 'tiếp hoặc tổng hợp các khoản phí và các chi phí/phí/giá dịch vụ liên quan đến các hoạt động của Quỹ mà Quỹ thực hiện hoặc gián tiếp hoặc tổng hợp các khoản phí và các chi phí/phí/giá dịch vụ liên quan đến các hoạt động của Quỹ mà Quỹ thực hiện hoặc gián tiếp hoặc tổng hợp các khoản phí và các chi phí/phí/giá dịch vụ liên quan đến các hoạt động của Quỹ mà Quỹ thực hiện hoặc gián tiếp hoặc tổng hợp các khoản phí và các chi phí/phí/giá dịch vụ liên quan đến các hoạt động của Quỹ mà Quỹ thực hiện hoặc gián tiếp hoặc tổng hợp các khoản phí và các chi phí/phí/giá dịch vụ liên quan đến các hoạt động của Quỹ mà Quỹ thực hiện hoặc gián tiếp hoặc tổng hợp các khoản phí và các chi phí/phí/giá dịch vụ liên quan đến các hoạt động của Quỹ mà Quỹ thực hiện hoặc gián tiếp hoặc tổng hợp các khoản phí và', 'tiếp hoặc tổng hợp các khoản phí và các chi phí/phí/giá dịch vụ liên quan đến các hoạt động của Quỹ mà Quỹ thực hiện hoặc gián tiếp hoặc tổng hợp các khoản phí và các chi phí/phí/giá dịch vụ liên quan đến các hoạt động của Quỹ mà Quỹ thực hiện hoặc gián tiếp hoặc tổng hợp các khoản phí và các chi phí/phí/giá dịch vụ liên quan đến các hoạt động của Quỹ mà Quỹ thực hiện hoặc gián tiếp hoặc tổng hợp các khoản phí và các chi phí/phí/giá dịch vụ liên quan đến các hoạt động của Quỹ mà Quỹ thực hiện hoặc gián tiếp hoặc tổng hợp các khoản phí và các chi phí/phí/giá dịch vụ liên quan đến các hoạt động của Quỹ mà Quỹ thực hiện hoặc gián tiếp hoặc tổng hợp các khoản phí và các chi phí/phí/giá dịch vụ liên quan đến các hoạt động của Quỹ mà Quỹ thực hiện hoặc gián tiếp hoặc tổng hợp các khoản phí và', 'tiếp hoặc tổng hợp các khoản phí và các chi phí/phí/giá dịch vụ liên quan đến các hoạt động của Quỹ mà Quỹ thực hiện hoặc gián tiếp hoặc tổng hợp các khoản phí và các chi phí/phí/giá dịch vụ liên quan đến các hoạt động của Quỹ mà Quỹ thực hiện hoặc gián tiếp hoặc tổng hợp các khoản phí và các chi phí/phí/giá dịch vụ liên quan đến các hoạt động của Quỹ mà Quỹ thực hiện hoặc gián tiếp hoặc tổng hợp các khoản phí và các chi phí/phí/giá dịch vụ liên quan đến các hoạt động của Quỹ mà Quỹ thực hiện hoặc gián tiếp hoặc tổng hợp các khoản phí và các chi phí/phí/giá dịch vụ liên quan đến các hoạt động của Quỹ mà Quỹ thực hiện hoặc gián tiếp hoặc tổng hợp các khoản phí và các chi phí/phí/giá dịch vụ liên quan đến các hoạt động của Quỹ mà Quỹ thực hiện hoặc gián tiếp hoặc tổng hợp các khoản phí và', 'tiếp hoặc tổng hợp các khoản phí và các chi phí/phí/giá dịch vụ liên quan đến các hoạt động của Quỹ mà Quỹ thực hiện hoặc gián tiếp hoặc tổng hợp các khoản phí và các chi phí/phí/giá dịch vụ liên quan đến các hoạt động của Quỹ mà Quỹ thực hiện hoặc gián tiếp hoặc tổng hợp các khoản phí và các chi phí/phí/giá dịch vụ liên quan đến các hoạt động của Quỹ mà Quỹ thực hiện hoặc gián tiếp hoặc tổng hợp các khoản phí và các chi phí/phí/giá dịch vụ liên quan đến các hoạt động của Quỹ mà Quỹ thực hiện hoặc gián tiếp hoặc tổng hợp các khoản phí và các chi phí/phí/giá dịch vụ liên quan đến các hoạt động của Quỹ mà Quỹ thực hiện hoặc gián tiếp hoặc tổng hợp các khoản phí và các chi phí/phí/giá dịch vụ liên quan đến các hoạt động của Quỹ mà Quỹ thực hiện hoặc gián tiếp hoặc tổng hợp các khoản phí và', 'tiếp hoặc tổng hợp các khoản phí và các chi phí/phí/giá dịch vụ liên quan đến các hoạt động của Quỹ mà Quỹ thực hiện hoặc gián tiếp hoặc tổng hợp các khoản phí và các chi phí/phí/giá dịch vụ liên quan đến các hoạt động của Quỹ mà Quỹ thực hiện hoặc gián tiếp hoặc tổng hợp các khoản phí và các chi phí/phí/giá dịch vụ liên quan đến các hoạt động của Quỹ mà Quỹ thực hiện hoặc gián tiếp hoặc tổng hợp các khoản phí và các chi phí/phí/giá dịch vụ liên quan đến các hoạt động của Quỹ mà Quỹ thực hiện hoặc gián tiếp hoặc tổng hợp các khoản phí và các chi phí/phí/giá dịch vụ liên quan đến các hoạt động của Quỹ mà Quỹ thực hiện hoặc gián tiếp hoặc tổng hợp các khoản phí và các chi phí/phí/giá dịch vụ liên quan đến các hoạt động của Quỹ mà Quỹ thực hiện hoặc gián tiếp hoặc tổng hợp các khoản phí và', 'tiếp hoặc tổng hợp các khoản phí và các chi phí/phí/giá dịch vụ liên quan đến các hoạt động của Quỹ mà Quỹ thực hiện hoặc gián tiếp hoặc tổng hợp các khoản phí và các chi phí/phí/giá dịch vụ liên quan đến các hoạt động của Quỹ mà Quỹ thực hiện hoặc gián tiếp hoặc tổng hợp các khoản phí và các chi phí/phí/giá dịch vụ liên quan đến các hoạt động của Quỹ mà Quỹ thực hiện hoặc gián tiếp hoặc tổng hợp các khoản phí và các chi phí/phí/giá dịch vụ liên quan đến các hoạt động của Quỹ mà Quỹ thực hiện hoặc gián tiếp hoặc tổng hợp các khoản phí và các chi phí/phí/giá dịch vụ liên quan đến các hoạt động của Quỹ mà Quỹ thực hiện hoặc gián tiếp hoặc tổng hợp các khoản phí và các chi phí/phí/giá dịch vụ liên quan đến các hoạt động của Quỹ mà Quỹ thực hiện hoặc gián tiếp hoặc tổng hợp các khoản phí và', 'tiếp hoặc tổng hợp các khoản phí và các chi phí/phí/giá dịch vụ liên quan đến các hoạt động của Quỹ mà Quỹ thực hiện hoặc gián tiếp hoặc tổng hợp các khoản phí và các chi phí/phí/giá dịch vụ liên quan đến các hoạt động của Quỹ mà Quỹ thực hiện hoặc gián tiếp hoặc tổng hợp các khoản phí và các chi phí/phí/giá dịch vụ liên quan đến các hoạt động của Quỹ mà Quỹ thực hiện hoặc gián tiếp hoặc tổng hợp các khoản phí và các chi phí/phí/giá dịch vụ liên quan đến các hoạt động của Quỹ mà Quỹ thực hiện hoặc gián tiếp hoặc tổng hợp các khoản phí và các chi phí/phí/giá dịch vụ liên quan đến các hoạt động của Quỹ mà Quỹ thực hiện hoặc gián tiếp hoặc tổng hợp các khoản phí và các chi phí/phí/giá dịch vụ liên quan đến các hoạt động của Quỹ mà Quỹ thực hiện hoặc gián tiếp hoặc tổng hợp các khoản phí và', 'tiếp hoặc tổng hợp các khoản phí và các chi phí/phí/giá dịch vụ liên quan đến các hoạt động của Quỹ mà Quỹ thực hiện hoặc gián tiếp hoặc tổng hợp các khoản phí và các chi phí/phí/giá dịch vụ liên quan đến các hoạt động của Quỹ mà Quỹ thực hiện hoặc gián tiếp hoặc tổng hợp các khoản phí và các chi phí/phí/giá dịch vụ liên quan đến các hoạt động của Quỹ mà Quỹ thực hiện hoặc gián tiếp hoặc tổng hợp các khoản phí và các chi phí/phí/giá dịch vụ liên quan đến các hoạt động của Quỹ mà Quỹ thực hiện hoặc gián tiếp hoặc tổng hợp các khoản phí và các chi phí/phí/giá dịch vụ liên quan đến các hoạt động của Quỹ mà Quỹ thực hiện hoặc gián tiếp hoặc tổng hợp các khoản phí và các chi phí/phí/giá dịch vụ liên quan đến các hoạt động của Quỹ mà Quỹ thực hiện hoặc gián tiếp hoặc tổng hợp các khoản phí và', 'tiếp hoặc tổng hợp các khoản phí và các chi phí/phí/giá dịch vụ liên quan đến các hoạt động của Quỹ mà Quỹ thực hiện hoặc gián tiếp hoặc tổng hợp các khoản phí và các chi phí/phí/giá dịch vụ liên quan đến các hoạt động của Quỹ mà Quỹ thực hiện hoặc gián tiếp hoặc tổng hợp các khoản phí và các chi phí/phí/giá dịch vụ liên quan đến các hoạt động của Quỹ mà Quỹ thực hiện hoặc gián tiếp hoặc tổng hợp các khoản phí và các chi phí/phí/giá dịch vụ liên quan đến các hoạt động của Quỹ mà Quỹ thực hiện hoặc gián tiếp hoặc tổng hợp các khoản phí và các chi phí/phí/giá dịch vụ liên quan đến các hoạt động của Quỹ mà Quỹ thực hiện hoặc gián tiếp hoặc tổng hợp các khoản phí và các chi phí/phí/giá dịch vụ liên quan đến các hoạt động của Quỹ mà Quỹ thực hiện hoặc gián tiếp hoặc tổng hợp các khoản phí và', 'tiếp hoặc tổng hợp các khoản phí và các chi phí/phí/giá dịch vụ liên quan đến các hoạt động của Quỹ mà Quỹ thực hiện hoặc gián tiếp hoặc tổng hợp các khoản phí và các chi phí/phí/giá dịch vụ liên quan đến các hoạt động của Quỹ mà Quỹ thực hiện hoặc gián tiếp hoặc tổng hợp các khoản phí và các chi phí/phí/giá dịch vụ liên quan đến các hoạt động của Quỹ mà Quỹ thực hiện hoặc gián tiếp hoặc tổng hợp các khoản phí và các chi phí/phí/giá dịch vụ liên quan đến các hoạt động của Quỹ mà Quỹ thực hiện hoặc gián tiếp hoặc tổng hợp các khoản phí và các chi phí/phí/giá dịch vụ liên quan đến các hoạt động của Quỹ mà Quỹ thực hiện hoặc gián tiếp hoặc tổng hợp các khoản phí và các chi phí/phí/giá dịch vụ liên quan đến các hoạt động của Quỹ mà Quỹ thực hiện hoặc gián tiếp hoặc tổng hợp các khoản phí và', 'tiếp hoặc tổng hợp các khoản phí và các chi phí/phí/giá dịch vụ liên quan đến các hoạt động của Quỹ mà Quỹ thực hiện hoặc gián tiếp hoặc tổng hợp các khoản phí và các chi phí/phí/giá dịch vụ liên quan đến các hoạt động của Quỹ mà Quỹ thực hiện hoặc gián tiếp hoặc tổng hợp các khoản phí và các chi phí/phí/giá dịch vụ liên quan đến các hoạt động của Quỹ mà Quỹ thực hiện hoặc gián tiếp hoặc tổng hợp các khoản phí và các chi phí/phí/giá dịch vụ liên quan đến các hoạt động của Quỹ mà Quỹ thực hiện hoặc gián tiếp hoặc tổng hợp các khoản phí và các chi phí/phí/giá dịch vụ liên quan đến các hoạt động của Quỹ mà Quỹ thực hiện hoặc gián tiếp hoặc tổng hợp các khoản phí và các chi phí/phí/giá dịch vụ liên quan đến các hoạt động của Quỹ mà Quỹ thực hiện hoặc gián tiếp hoặc tổng hợp các khoản phí và', 'tiếp hoặc tổng hợp các khoản phí và các chi phí/phí/giá dịch vụ liên quan đến các hoạt động của Quỹ mà Quỹ thực hiện hoặc gián tiếp hoặc tổng hợp các khoản phí và các chi phí/phí/giá dịch vụ liên quan đến các hoạt động của Quỹ mà Quỹ thực hiện hoặc gián tiếp hoặc tổng hợp các khoản phí và các chi phí/phí/giá dịch vụ liên quan đến các hoạt động của Quỹ mà Quỹ thực hiện hoặc gián tiếp hoặc tổng hợp các khoản phí và các chi phí/phí/giá dịch vụ liên quan đến các hoạt động của Quỹ mà Quỹ thực hiện hoặc gián tiếp hoặc tổng hợp các khoản phí và các chi phí/phí/giá dịch vụ liên quan đến các hoạt động của Quỹ mà Quỹ thực hiện hoặc gián tiếp hoặc tổng hợp các khoản phí và các chi phí/phí/giá dịch vụ liên quan đến các hoạt động của Quỹ mà Quỹ thực hiện hoặc gián tiếp hoặc tổng hợp các khoản phí và']","Phí giám sát: 0,02% NAV/năm (tối thiểu 5.000.000 đồng/tháng). Phí lưu ký: 0,06% NAV/năm (tối thiểu 20.000.000 đồng/tháng)."
Phí dịch vụ phát hành (Subscription Fee) hiện tại của Quỹ là bao nhiêu?,Phí dịch vụ phát hành (mua) hiện tại của Quỹ là 0%.,"['từ trên 12 tháng trở lên 0,00%  \nGiấy dịch vụ Chuyển Đổi Quỹ sẽ được hạch toán cho Công ty Quản lý Quỹ và Đại Lý Phân Phối căn cứ theo hợp đồng ký giữa Công ty Quản lý Quỹ và Đại Lý Phân Phối.  \nd) Giấy dịch vụ Chuyển Nhượng  \nNhà Đầu tư phải trả một mức phí dịch vụ Chuyển Nhượng duy nhất là 300.000 đồng (ba trăm nghìn đồng) cho mỗi giao dịch chuyển nhượng Đơn vị Quỹ. Giá dịch vụ Chuyển Nhượng do người thực hiện chuyển nhượng thanh toán.  \nGiấy dịch vụ Chuyển nhượng sẽ không áp dụng trong trường hợp Nhà Đầu tư thực hiện chuyển nhượng số Chứng Chỉ quỹ từ tài khoản này sang tài khoản khác cùng tên thì Nhà Đầu tư tại Hai Đại Lý Phân Phối khác nhau.', 'nhượng, chuyển nhượng, hoặc bán một phần hoặc toàn bộ các khoản đầu tư vào Quỹ. Nhà đầu tư\ncó trách nhiệm tự mình thực hiện việc thẩm định và đánh giá mọi rủi ro liên quan đến đầu tư.  \nBản cáo bạch này bao gồm các thông tin về Quỹ, dự kiến các khoản đầu tư của Quỹ, các điều kiện\nvà quy định của Quỹ, hoặc các thông tin khác mà nhà đầu tư cần biết. Nhà đầu tư nên đọc kỹ Bản\ncáo bạch này và các tài liệu đính kèm trước khi ra quyết định đầu tư.\nTCC sẽ cập nhật Bản cáo bạch này nếu có bất kỳ thay đổi nào về thông tin.\nBản cáo bạch được cung cấp miễn phí tại văn phòng của TCC, các Đại lý phân phối và trên trang\nweb của TCC.  \nBản cáo bạch này được phát hành bởi:\nCông ty Cổ phần Quản lý Quỹ Ký Thương - TechcomCapital (“TCC”)', '**3.6. Rủi ro biến động giá**  \nRủi ro về biến động giá của Quỹ phát sinh khi một hay một số Nhà Đầu tư nắm giữ một số lượng lớn cổ phiếu của Quỹ quyết định thực hiện lệnh bán của các cổ phiếu của Quỹ này. Nắm giữ một số lượng lớn cổ phiếu của Quỹ quyết định bán.  \n**3.7. Rủi ro tái đầu tư**  \nRủi ro tái đầu tư là rủi ro có thể xảy ra khi các khoản đầu tư trái phiếu với dòng tiền lãi trái phiếu nhận được hàng kỳ và gốc trái phiếu nhận được vào thời điểm đáo hạn được đi tìm đầu tư nhận lại. Công ty Quản lý Quỹ quyết định bán các chứng khoán của Quỹ.', '**Chế độ kế toán**  \nQuỹ sẽ áp dụng chế độ kế toán Việt Nam (VAS) và tuân thủ các quy định khác liên quan tới công tác kế toán cho Quỹ do các cơ quan có thẩm quyền quy định. Đồng Việt Nam sẽ là đồng tiền được sử dụng và thể hiện.  \n**Chế độ báo cáo**  \nCông ty Quản lý Quỹ có trách nhiệm duy trì sổ sách kế toán và chuẩn bị báo cáo tài chính cho Quỹ. Phù hợp với quy định tại Điều 38 của Điều Lệ Quỹ, Công ty Quản lý Quỹ có thể uỷ quyền cho một nhà cung cấp dịch vụ có thực hiện việc này. Một số sách kế toán và báo cáo tài chính mà Công ty Quản lý Quỹ hoặc nhà cung cấp dịch vụ có thể uỷ quyền sẽ được lưu trữ tại văn phòng của Công ty Quản lý Quỹ hoặc nhà cung cấp dịch vụ có liên quan.', '*   Kết quả hoạt động trong quá khứ của các Quỹ không có nghĩa là kết quả hoạt động trong tương lai.\n*   Tên của Quỹ không hàm ý về chất lượng hoạt động cũng như những lợi và lợi nhuận của Quỹ trong tương lai;\n*   Công ty Quản lý Quỹ không chịu trách nhiệm pháp lý về những rủi ro từ đầu tư của các chủ nợ, thành viên Hội đồng thành viên, Ban điều hành và nhân viên của Công ty Quản lý Quỹ không có trách nhiệm pháp lý về các rủi ro hoạt động của Công ty Quản lý Quỹ.\n*   Giống như các hình thức đầu tư khác, Quỹ, rủi ro thanh khoản sẽ được phân bổ trên cơ sở số ngày gần nhất với giá trị tài sản ròng. Các khoản đầu tư khác có thể có nhiều rủi ro hơn so với thời điểm hiện tại. Nhà Đầu tư cần phải nhận thức được khả năng chấp nhận rủi ro từ vơi rủi ro đầu tư mà Quỹ có thể gặp phải trong tương lai.', '40% tổng giá trị tài sản của quỹ. Trong đó, hạng mục đầu tư lớn của quỹ là hạng mục đầu tư\nvào các loại tài sản quỹ định tại điểm a, d, và g mục IX.2.2.3 (ngoại trừ chứng chỉ tiền gửi)\nphải hành bởi cùng một tổ chức, có tổng giá trị chiếm từ 5% trở lên tổng giá trị tài sản của\nquỹ;\ng) Tại mọi thời điểm, tổng giá trị cam kết trong các giao dịch chứng khoán phái sinh, dự nợ vay\nvà các khoản phải trả của quỹ không được vượt giá trị tài sản ròng của quỹ;\nh) Không được đầu tư vào chứng khoán của Chính phủ Quỹ;\ni) Chỉ được đầu tư vào chứng chỉ quỹ đại chúng khác, công ty đầu tư chứng khoán đại chúng\ndo công ty quản lý quỹ khác quản lý và bảo đảm các hạn chế sau:\n- Không đầu tư vào quá 10% tổng giá trị chứng chỉ quỹ đang lưu hành của một quỹ đại chúng,', 'thực hiện hoặc gián tiếp hoặc tổng hợp các khoản phí và các chi phí/phí/giá dịch vụ liên quan đến các hoạt động của Quỹ mà Quỹ thực hiện hoặc gián tiếp hoặc tổng hợp các khoản phí và các chi phí/phí/giá dịch vụ liên quan đến các hoạt động của Quỹ mà Quỹ thực hiện hoặc gián tiếp hoặc tổng hợp các khoản phí và các chi phí/phí/giá dịch vụ liên quan đến các hoạt động của Quỹ mà Quỹ thực hiện hoặc gián tiếp hoặc tổng hợp các khoản phí và các chi phí/phí/giá dịch vụ liên quan đến các hoạt động của Quỹ mà Quỹ thực hiện hoặc gián tiếp hoặc tổng hợp các khoản phí và các chi phí/phí/giá dịch vụ liên quan đến các hoạt động của Quỹ mà Quỹ thực hiện hoặc gián tiếp hoặc tổng hợp các khoản phí và các chi phí/phí/giá dịch vụ liên quan đến các hoạt động của Quỹ mà Quỹ thực hiện hoặc gián tiếp hoặc tổng', 'hiện hoặc gián tiếp hoặc tổng hợp các khoản phí và các chi phí/phí/giá dịch vụ liên quan đến các hoạt động của Quỹ mà Quỹ thực hiện hoặc gián tiếp hoặc tổng hợp các khoản phí và các chi phí/phí/giá dịch vụ liên quan đến các hoạt động của Quỹ mà Quỹ thực hiện hoặc gián tiếp hoặc tổng hợp các khoản phí và các chi phí/phí/giá dịch vụ liên quan đến các hoạt động của Quỹ mà Quỹ thực hiện hoặc gián tiếp hoặc tổng hợp các khoản phí và các chi phí/phí/giá dịch vụ liên quan đến các hoạt động của Quỹ mà Quỹ thực hiện hoặc gián tiếp hoặc tổng hợp các khoản phí và các chi phí/phí/giá dịch vụ liên quan đến các hoạt động của Quỹ mà Quỹ thực hiện hoặc gián tiếp hoặc tổng hợp các khoản phí và các chi phí/phí/giá dịch vụ liên quan đến các hoạt động của Quỹ mà Quỹ thực hiện hoặc gián tiếp hoặc tổng hợp các', 'dịch vụ liên quan đến các hoạt động của Quỹ mà Quỹ thực hiện hoặc gián tiếp hoặc tổng hợp các khoản phí và các chi phí/phí/giá dịch vụ liên quan đến các hoạt động của Quỹ mà Quỹ thực hiện hoặc gián tiếp hoặc tổng hợp các khoản phí và các chi phí/phí/giá dịch vụ liên quan đến các hoạt động của Quỹ mà Quỹ thực hiện hoặc gián tiếp hoặc tổng hợp các khoản phí và các chi phí/phí/giá dịch vụ liên quan đến các hoạt động của Quỹ mà Quỹ thực hiện hoặc gián tiếp hoặc tổng hợp các khoản phí và các chi phí/phí/giá dịch vụ liên quan đến các hoạt động của Quỹ mà Quỹ thực hiện hoặc gián tiếp hoặc tổng hợp các khoản phí và các chi phí/phí/giá dịch vụ liên quan đến các hoạt động của Quỹ mà Quỹ thực hiện hoặc gián tiếp hoặc tổng hợp các khoản phí và các chi phí/phí/giá dịch vụ liên quan đến các hoạt động', 'Các quy định khác liên quan đến kiểm toán, kế toán và chế độ báo cáo tuân thủ theo quy định tại Điều Lệ Quỹ.  \n**3. Các rủi ro khi đầu tư vào Quỹ**  \nMục tiêu của Công ty Quản lý Quỹ là quản lý các rủi ro đầu tư, và nếu có thể, hạn chế các tác động của các rủi ro này bằng việc áp dụng các phương pháp quản lý đầu tư theo tiêu chuẩn quốc tế tốt nhất. Nhà Đầu tư cần lưu ý về các điểm quan trọng sau đây:  \n*   Quỹ, Công ty Quản lý Quỹ, thành viên Hội đồng quản trị, người điều hành và nhân viên của ngân hàng giám sát sẽ làm nhiệm vụ của quản trị rủi ro và bảo quản tài sản của quỹ đại chúng, công ty đầu tư chứng khoán không được là đối tượng mua, bán trong giao dịch mua, bán tài sản của quỹ đại chúng, công ty đầu tư chứng khoán.', 'liên quan đến các hoạt động của Quỹ mà Quỹ thực hiện hoặc gián tiếp hoặc tổng hợp các khoản phí và các chi phí/phí/giá dịch vụ liên quan đến các hoạt động của Quỹ mà Quỹ thực hiện hoặc gián tiếp hoặc tổng hợp các khoản phí và các chi phí/phí/giá dịch vụ liên quan đến các hoạt động của Quỹ mà Quỹ thực hiện hoặc gián tiếp hoặc tổng hợp các khoản phí và các chi phí/phí/giá dịch vụ liên quan đến các hoạt động của Quỹ mà Quỹ thực hiện hoặc gián tiếp hoặc tổng hợp các khoản phí và các chi phí/phí/giá dịch vụ liên quan đến các hoạt động của Quỹ mà Quỹ thực hiện hoặc gián tiếp hoặc tổng hợp các khoản phí và các chi phí/phí/giá dịch vụ liên quan đến', 'Quỹ thực hiện hoặc gián tiếp hoặc tổng hợp các khoản phí và các chi phí/phí/giá dịch vụ liên quan đến các hoạt động của Quỹ mà Quỹ thực hiện hoặc gián tiếp hoặc tổng hợp các khoản phí và các chi phí/phí/giá dịch vụ liên quan đến các hoạt động của Quỹ mà Quỹ thực hiện hoặc gián tiếp hoặc tổng hợp các khoản phí và các chi phí/phí/giá dịch vụ liên quan đến các hoạt động của Quỹ mà Quỹ thực hiện hoặc gián tiếp hoặc tổng hợp các khoản phí và các chi phí/phí/giá dịch vụ liên quan đến các hoạt động của Quỹ mà Quỹ thực hiện hoặc gián tiếp hoặc tổng hợp các khoản phí và các chi phí/phí/giá dịch vụ liên quan đến các hoạt động của Quỹ mà Quỹ thực hiện hoặc gián tiếp hoặc tổng hợp các khoản phí và các chi phí/phí/giá dịch vụ liên quan đến các hoạt động của Quỹ mà Quỹ thực hiện hoặc gián tiếp hoặc', 'phí/phí/giá dịch vụ liên quan đến các hoạt động của Quỹ mà Quỹ thực hiện hoặc gián tiếp hoặc tổng hợp các khoản phí và các chi phí/phí/giá dịch vụ liên quan đến các hoạt động của Quỹ mà Quỹ thực hiện hoặc gián tiếp hoặc tổng hợp các khoản phí và các chi phí/phí/giá dịch vụ liên quan đến các hoạt động của Quỹ mà Quỹ thực hiện hoặc gián tiếp hoặc tổng hợp các khoản phí và các chi phí/phí/giá dịch vụ liên quan đến các hoạt động của Quỹ mà Quỹ thực hiện hoặc gián tiếp hoặc tổng hợp các khoản phí và các chi phí/phí/giá dịch vụ liên quan đến các hoạt động của Quỹ mà Quỹ thực hiện hoặc gián tiếp hoặc tổng hợp các khoản phí và các chi phí/phí/giá dịch vụ liên quan đến các hoạt động của Quỹ mà Quỹ thực hiện hoặc gián tiếp hoặc tổng hợp các khoản phí và các chi phí/phí/giá dịch vụ liên quan đến các', 'vụ liên quan đến các hoạt động của Quỹ mà Quỹ thực hiện hoặc gián tiếp hoặc tổng hợp các khoản phí và các chi phí/phí/giá dịch vụ liên quan đến các hoạt động của Quỹ mà Quỹ thực hiện hoặc gián tiếp hoặc tổng hợp các khoản phí và các chi phí/phí/giá dịch vụ liên quan đến các hoạt động của Quỹ mà Quỹ thực hiện hoặc gián tiếp hoặc tổng hợp các khoản phí và các chi phí/phí/giá dịch vụ liên quan đến các hoạt động của Quỹ mà Quỹ thực hiện hoặc gián tiếp hoặc tổng hợp các khoản phí và các chi phí/phí/giá dịch vụ liên quan đến các hoạt động của Quỹ mà Quỹ thực hiện hoặc gián tiếp hoặc tổng hợp các khoản phí và các chi phí/phí/giá dịch vụ liên quan đến các hoạt động của Quỹ mà Quỹ thực hiện hoặc gián tiếp hoặc tổng hợp các khoản phí và các chi phí/phí/giá dịch vụ liên quan đến các hoạt động của', 'gián tiếp hoặc tổng hợp các khoản phí và các chi phí/phí/giá dịch vụ liên quan đến các hoạt động của Quỹ mà Quỹ thực hiện hoặc gián tiếp hoặc tổng hợp các khoản phí và các chi phí/phí/giá dịch vụ liên quan đến các hoạt động của Quỹ mà Quỹ thực hiện hoặc gián tiếp hoặc tổng hợp các khoản phí và các chi phí/phí/giá dịch vụ liên quan đến các hoạt động của Quỹ mà Quỹ thực hiện hoặc gián tiếp hoặc tổng hợp các khoản phí và các chi phí/phí/giá dịch vụ liên quan đến các hoạt động của Quỹ mà Quỹ thực hiện hoặc gián tiếp hoặc tổng hợp các khoản phí và các chi phí/phí/giá dịch vụ liên quan đến các hoạt động của Quỹ mà Quỹ thực hiện hoặc gián tiếp hoặc tổng hợp các khoản phí và các chi phí/phí/giá dịch vụ liên quan đến các hoạt động của Quỹ mà Quỹ thực hiện hoặc gián tiếp hoặc tổng hợp các khoản phí', 'liên quan đến các hoạt động của Quỹ mà Quỹ thực hiện hoặc gián tiếp hoặc tổng hợp các khoản phí và các chi phí/phí/giá dịch vụ liên quan đến các hoạt động của Quỹ mà Quỹ thực hiện hoặc gián tiếp hoặc tổng hợp các khoản phí và các chi phí/phí/giá dịch vụ liên quan đến các hoạt động của Quỹ mà Quỹ thực hiện hoặc gián tiếp hoặc tổng hợp các khoản phí và các chi phí/phí/giá dịch vụ liên quan đến các hoạt động của Quỹ mà Quỹ thực hiện hoặc gián tiếp hoặc tổng hợp các khoản phí và các chi phí/phí/giá dịch vụ liên quan đến các hoạt động của Quỹ mà Quỹ thực hiện hoặc gián tiếp hoặc tổng hợp các khoản phí và các chi phí/phí/giá dịch vụ liên quan đến các hoạt động của Quỹ mà Quỹ thực hiện hoặc gián tiếp hoặc tổng hợp các khoản phí và các chi phí/phí/giá dịch vụ liên quan đến các hoạt động của Quỹ', 'liên quan đến các hoạt động của Quỹ mà Quỹ thực hiện hoặc gián tiếp hoặc tổng hợp các khoản phí và các chi phí/phí/giá dịch vụ liên quan đến các hoạt động của Quỹ mà Quỹ thực hiện hoặc gián tiếp hoặc tổng hợp các khoản phí và các chi phí/phí/giá dịch vụ liên quan đến các hoạt động của Quỹ mà Quỹ thực hiện hoặc gián tiếp hoặc tổng hợp các khoản phí và các chi phí/phí/giá dịch vụ liên quan đến các hoạt động của Quỹ mà Quỹ thực hiện hoặc gián tiếp hoặc tổng hợp các khoản phí và các chi phí/phí/giá dịch vụ liên quan đến các hoạt động của Quỹ mà Quỹ thực hiện hoặc gián tiếp hoặc tổng hợp các khoản phí và các chi phí/phí/giá dịch vụ liên quan đến các hoạt động của Quỹ mà Quỹ thực hiện hoặc gián tiếp hoặc tổng hợp các khoản phí và các chi phí/phí/giá dịch vụ liên quan đến các hoạt động của Quỹ', 'liên quan đến các hoạt động của Quỹ mà Quỹ thực hiện hoặc gián tiếp hoặc tổng hợp các khoản phí và các chi phí/phí/giá dịch vụ liên quan đến các hoạt động của Quỹ mà Quỹ thực hiện hoặc gián tiếp hoặc tổng hợp các khoản phí và các chi phí/phí/giá dịch vụ liên quan đến các hoạt động của Quỹ mà Quỹ thực hiện hoặc gián tiếp hoặc tổng hợp các khoản phí và các chi phí/phí/giá dịch vụ liên quan đến các hoạt động của Quỹ mà Quỹ thực hiện hoặc gián tiếp hoặc tổng hợp các khoản phí và các chi phí/phí/giá dịch vụ liên quan đến các hoạt động của Quỹ mà Quỹ thực hiện hoặc gián tiếp hoặc tổng hợp các khoản phí và các chi phí/phí/giá dịch vụ liên quan đến các hoạt động của Quỹ mà Quỹ thực hiện hoặc gián tiếp hoặc tổng hợp các khoản phí và các chi phí/phí/giá dịch vụ liên quan đến các hoạt động của Quỹ', 'liên quan đến các hoạt động của Quỹ mà Quỹ thực hiện hoặc gián tiếp hoặc tổng hợp các khoản phí và các chi phí/phí/giá dịch vụ liên quan đến các hoạt động của Quỹ mà Quỹ thực hiện hoặc gián tiếp hoặc tổng hợp các khoản phí và các chi phí/phí/giá dịch vụ liên quan đến các hoạt động của Quỹ mà Quỹ thực hiện hoặc gián tiếp hoặc tổng hợp các khoản phí và các chi phí/phí/giá dịch vụ liên quan đến các hoạt động của Quỹ mà Quỹ thực hiện hoặc gián tiếp hoặc tổng hợp các khoản phí và các chi phí/phí/giá dịch vụ liên quan đến các hoạt động của Quỹ mà Quỹ thực hiện hoặc gián tiếp hoặc tổng hợp các khoản phí và các chi phí/phí/giá dịch vụ liên quan đến các hoạt động của Quỹ mà Quỹ thực hiện hoặc gián tiếp hoặc tổng hợp các khoản phí và các chi phí/phí/giá dịch vụ liên quan đến các hoạt động của Quỹ', 'liên quan đến các hoạt động của Quỹ mà Quỹ thực hiện hoặc gián tiếp hoặc tổng hợp các khoản phí và các chi phí/phí/giá dịch vụ liên quan đến các hoạt động của Quỹ mà Quỹ thực hiện hoặc gián tiếp hoặc tổng hợp các khoản phí và các chi phí/phí/giá dịch vụ liên quan đến các hoạt động của Quỹ mà Quỹ thực hiện hoặc gián tiếp hoặc tổng hợp các khoản phí và các chi phí/phí/giá dịch vụ liên quan đến các hoạt động của Quỹ mà Quỹ thực hiện hoặc gián tiếp hoặc tổng hợp các khoản phí và các chi phí/phí/giá dịch vụ liên quan đến các hoạt động của Quỹ mà Quỹ thực hiện hoặc gián tiếp hoặc tổng hợp các khoản phí và các chi phí/phí/giá dịch vụ liên quan đến các hoạt động của Quỹ mà Quỹ thực hiện hoặc gián tiếp hoặc tổng hợp các khoản phí và các chi phí/phí/giá dịch vụ liên quan đến các hoạt động của Quỹ', 'liên quan đến các hoạt động của Quỹ mà Quỹ thực hiện hoặc gián tiếp hoặc tổng hợp các khoản phí và các chi phí/phí/giá dịch vụ liên quan đến các hoạt động của Quỹ mà Quỹ thực hiện hoặc gián tiếp hoặc tổng hợp các khoản phí và các chi phí/phí/giá dịch vụ liên quan đến các hoạt động của Quỹ mà Quỹ thực hiện hoặc gián tiếp hoặc tổng hợp các khoản phí và các chi phí/phí/giá dịch vụ liên quan đến các hoạt động của Quỹ mà Quỹ thực hiện hoặc gián tiếp hoặc tổng hợp các khoản phí và các chi phí/phí/giá dịch vụ liên quan đến các hoạt động của Quỹ mà Quỹ thực hiện hoặc gián tiếp hoặc tổng hợp các khoản phí và các chi phí/phí/giá dịch vụ liên quan đến các hoạt động của Quỹ mà Quỹ thực hiện hoặc gián tiếp hoặc tổng hợp các khoản phí và các chi phí/phí/giá dịch vụ liên quan đến các hoạt động của Quỹ', 'liên quan đến các hoạt động của Quỹ mà Quỹ thực hiện hoặc gián tiếp hoặc tổng hợp các khoản phí và các chi phí/phí/giá dịch vụ liên quan đến các hoạt động của Quỹ mà Quỹ thực hiện hoặc gián tiếp hoặc tổng hợp các khoản phí và các chi phí/phí/giá dịch vụ liên quan đến các hoạt động của Quỹ mà Quỹ thực hiện hoặc gián tiếp hoặc tổng hợp các khoản phí và các chi phí/phí/giá dịch vụ liên quan đến các hoạt động của Quỹ mà Quỹ thực hiện hoặc gián tiếp hoặc tổng hợp các khoản phí và các chi phí/phí/giá dịch vụ liên quan đến các hoạt động của Quỹ mà Quỹ thực hiện hoặc gián tiếp hoặc tổng hợp các khoản phí và các chi phí/phí/giá dịch vụ liên quan đến các hoạt động của Quỹ mà Quỹ thực hiện hoặc gián tiếp hoặc tổng hợp các khoản phí và các chi phí/phí/giá dịch vụ liên quan đến các hoạt động của Quỹ', 'liên quan đến các hoạt động của Quỹ mà Quỹ thực hiện hoặc gián tiếp hoặc tổng hợp các khoản phí và các chi phí/phí/giá dịch vụ liên quan đến các hoạt động của Quỹ mà Quỹ thực hiện hoặc gián tiếp hoặc tổng hợp các khoản phí và các chi phí/phí/giá dịch vụ liên quan đến các hoạt động của Quỹ mà Quỹ thực hiện hoặc gián tiếp hoặc tổng hợp các khoản phí và các chi phí/phí/giá dịch vụ liên quan đến các hoạt động của Quỹ mà Quỹ thực hiện hoặc gián tiếp hoặc tổng hợp các khoản phí và các chi phí/phí/giá dịch vụ liên quan đến các hoạt động của Quỹ mà Quỹ thực hiện hoặc gián tiếp hoặc tổng hợp các khoản phí và các chi phí/phí/giá dịch vụ liên quan đến các hoạt động của Quỹ mà Quỹ thực hiện hoặc gián tiếp hoặc tổng hợp các khoản phí và các chi phí/phí/giá dịch vụ liên quan đến các hoạt động của Quỹ', 'liên quan đến các hoạt động của Quỹ mà Quỹ thực hiện hoặc gián tiếp hoặc tổng hợp các khoản phí và các chi phí/phí/giá dịch vụ liên quan đến các hoạt động của Quỹ mà Quỹ thực hiện hoặc gián tiếp hoặc tổng hợp các khoản phí và các chi phí/phí/giá dịch vụ liên quan đến các hoạt động của Quỹ mà Quỹ thực hiện hoặc gián tiếp hoặc tổng hợp các khoản phí và các chi phí/phí/giá dịch vụ liên quan đến các hoạt động của Quỹ mà Quỹ thực hiện hoặc gián tiếp hoặc tổng hợp các khoản phí và các chi phí/phí/giá dịch vụ liên quan đến các hoạt động của Quỹ mà Quỹ thực hiện hoặc gián tiếp hoặc tổng hợp các khoản phí và các chi phí/phí/giá dịch vụ liên quan đến các hoạt động của Quỹ mà Quỹ thực hiện hoặc gián tiếp hoặc tổng hợp các khoản phí và các chi phí/phí/giá dịch vụ liên quan đến các hoạt động của Quỹ', 'liên quan đến các hoạt động của Quỹ mà Quỹ thực hiện hoặc gián tiếp hoặc tổng hợp các khoản phí và các chi phí/phí/giá dịch vụ liên quan đến các hoạt động của Quỹ mà Quỹ thực hiện hoặc gián tiếp hoặc tổng hợp các khoản phí và các chi phí/phí/giá dịch vụ liên quan đến các hoạt động của Quỹ mà Quỹ thực hiện hoặc gián tiếp hoặc tổng hợp các khoản phí và các chi phí/phí/giá dịch vụ liên quan đến các hoạt động của Quỹ mà Quỹ thực hiện hoặc gián tiếp hoặc tổng hợp các khoản phí và các chi phí/phí/giá dịch vụ liên quan đến các hoạt động của Quỹ mà Quỹ thực hiện hoặc gián tiếp hoặc tổng hợp các khoản phí và các chi phí/phí/giá dịch vụ liên quan đến các hoạt động của Quỹ mà Quỹ thực hiện hoặc gián tiếp hoặc tổng hợp các khoản phí và các chi phí/phí/giá dịch vụ liên quan đến các hoạt động của Quỹ']",Mức giá dịch vụ phát hành của Quỹ là 0%.
Phí dịch vụ quản trị quỹ (Fund Administration Fee) được tính theo tỷ lệ nào và mức tối thiểu là bao nhiêu?,Tôi không tìm thấy thông tin về phí dịch vụ quản trị quỹ (Fund Administration Fee) được tính theo tỷ lệ nào và mức tối thiểu là bao nhiêu trong các tài liệu được cung cấp.,"['từ trên 12 tháng trở lên 0,00%  \nGiấy dịch vụ Chuyển Đổi Quỹ sẽ được hạch toán cho Công ty Quản lý Quỹ và Đại Lý Phân Phối căn cứ theo hợp đồng ký giữa Công ty Quản lý Quỹ và Đại Lý Phân Phối.  \nd) Giấy dịch vụ Chuyển Nhượng  \nNhà Đầu tư phải trả một mức phí dịch vụ Chuyển Nhượng duy nhất là 300.000 đồng (ba trăm nghìn đồng) cho mỗi giao dịch chuyển nhượng Đơn vị Quỹ. Giá dịch vụ Chuyển Nhượng do người thực hiện chuyển nhượng thanh toán.  \nGiấy dịch vụ Chuyển nhượng sẽ không áp dụng trong trường hợp Nhà Đầu tư thực hiện chuyển nhượng số Chứng Chỉ quỹ từ tài khoản này sang tài khoản khác cùng tên thì Nhà Đầu tư tại Hai Đại Lý Phân Phối khác nhau.', '40% tổng giá trị tài sản của quỹ. Trong đó, hạng mục đầu tư lớn của quỹ là hạng mục đầu tư\nvào các loại tài sản quỹ định tại điểm a, d, và g mục IX.2.2.3 (ngoại trừ chứng chỉ tiền gửi)\nphải hành bởi cùng một tổ chức, có tổng giá trị chiếm từ 5% trở lên tổng giá trị tài sản của\nquỹ;\ng) Tại mọi thời điểm, tổng giá trị cam kết trong các giao dịch chứng khoán phái sinh, dự nợ vay\nvà các khoản phải trả của quỹ không được vượt giá trị tài sản ròng của quỹ;\nh) Không được đầu tư vào chứng khoán của Chính phủ Quỹ;\ni) Chỉ được đầu tư vào chứng chỉ quỹ đại chúng khác, công ty đầu tư chứng khoán đại chúng\ndo công ty quản lý quỹ khác quản lý và bảo đảm các hạn chế sau:\n- Không đầu tư vào quá 10% tổng giá trị chứng chỉ quỹ đang lưu hành của một quỹ đại chúng,', 'nhượng, chuyển nhượng, hoặc bán một phần hoặc toàn bộ các khoản đầu tư vào Quỹ. Nhà đầu tư\ncó trách nhiệm tự mình thực hiện việc thẩm định và đánh giá mọi rủi ro liên quan đến đầu tư.  \nBản cáo bạch này bao gồm các thông tin về Quỹ, dự kiến các khoản đầu tư của Quỹ, các điều kiện\nvà quy định của Quỹ, hoặc các thông tin khác mà nhà đầu tư cần biết. Nhà đầu tư nên đọc kỹ Bản\ncáo bạch này và các tài liệu đính kèm trước khi ra quyết định đầu tư.\nTCC sẽ cập nhật Bản cáo bạch này nếu có bất kỳ thay đổi nào về thông tin.\nBản cáo bạch được cung cấp miễn phí tại văn phòng của TCC, các Đại lý phân phối và trên trang\nweb của TCC.  \nBản cáo bạch này được phát hành bởi:\nCông ty Cổ phần Quản lý Quỹ Ký Thương - TechcomCapital (“TCC”)', '*   9 năm kinh nghiệm với vai trò giám đốc kiểm toán tại Công ty TNHH KPMG Việt Nam.\n*   Hiện là Giám đốc tài chính (CFO) tại Công ty CP Đầu Tư Thương Mại Quốc Tế Matrrot Dd.  \nCác quy định về tiêu chuẩn lựa chọn thành viên Ban đại diện Quỹ, quyền hạn và nhiệm vụ của Ban đại diện Quỹ, chủ tịch Ban đại diện Quỹ, đinh chỉ hoạc bãi miễn thành viên Ban đại diện Quỹ, cuộc họp của Ban đại diện Quỹ tuân theo quy định tại chương V Điều Lệ Quỹ.  \n**2.10. Quyền hạn và trách nhiệm của Công ty Quản lý Quỹ**\nCông ty Quản lý Quỹ được lựa chọn phải thỏa mãn các điều kiện sau:  \n*   Được thực hiện nghiệp vụ quản lý Quỹ;\n*   Hoàn toàn độc lập với Ngân hàng Giám sát;\n*   Có đầy đủ cơ sở vật chất, nhân sự để Quản lý Quỹ mở;', '**3.6. Rủi ro biến động giá**  \nRủi ro về biến động giá của Quỹ phát sinh khi một hay một số Nhà Đầu tư nắm giữ một số lượng lớn cổ phiếu của Quỹ quyết định thực hiện lệnh bán của các cổ phiếu của Quỹ này. Nắm giữ một số lượng lớn cổ phiếu của Quỹ quyết định bán.  \n**3.7. Rủi ro tái đầu tư**  \nRủi ro tái đầu tư là rủi ro có thể xảy ra khi các khoản đầu tư trái phiếu với dòng tiền lãi trái phiếu nhận được hàng kỳ và gốc trái phiếu nhận được vào thời điểm đáo hạn được đi tìm đầu tư nhận lại. Công ty Quản lý Quỹ quyết định bán các chứng khoán của Quỹ.', '2.2.4 Hạn mức đầu tư\nHạn mức đầu tư của Quỹ được quy định chi tiết tuân theo các quy định tại Thông tư hướng dẫn\nhoạt động và quản lý các quỹ đầu tư chứng khoán. Co cấu danh mục đầu tư của Quỹ phải đảm\nbảo tuân theo các hạn mức đầu tư sau:\na) Tựa trên tổng giá trị tài khoản thanh toán của Quỹ tại ngân hàng giám sát, quỹ mở được\ncâu đề qua 49% tổng giá trị tài sản của quỹ vào các tài sản theo quy định tại điểm a, b mục\nIX.2.2.3\nb) Không được đầu tư vào chứng khoán của một tổ chức phát hành quá 10% tổng giá trị chứng\nkhoán đang lưu hành của tổ chức đó, trừ công cụ nợ của Chính phủ;\nc) Không được đầu tư quá 20% tổng giá trị tài sản của quỹ vào chứng khoán đang lưu hành và\ncác tài sản (nếu có) quy định tại điểm a, b mục IX.2.2.3 của một tổ chức phát hành, trừ công\ncụ nợ của Chính phủ;', 'Website : www.techcomcapital.com.vn  \nNơi cung cấp Bản cáo bạch:\nBản cáo bạch cập nhật những các tài liệu của Quỹ (báo cáo hoạt động, báo cáo tài chính,\nĐiểu Lệ Quỹ và các tài liệu cần thiết khác) được cung cấp trên trang điện tử của TCC,\nwww.techcomcapital.com.vn, tại văn phòng của TCC và các Đại lý phân phối như danh sách\ntrong phụ lục 1 của Bản cáo Bạch.  \nPhụ trách công bố thông tin:\nÔng Đặng Lưu Dũng – Tổng Giám đốc\nĐịa chỉ: Công ty Cổ phần Quản lý Quỹ Ký Thương\nTầng 28, Tòa C5, số 119 Trần Duy Hưng, phường Trung Hòa, Quận Cầu Giấy, Hà Nội\nĐiện thoại: (84-24) 39446368 Fax: (84-24) 39446583', '(Quỹ chứng khoán doanh nghiệp vừa và nhỏ Techcom)\nBản cáo bạch này được phát hành bởi:\nCông ty Cổ phần Quản lý Quỹ Ký Thương - TechcomCapital (“TCC”)\nĐịa chỉ : Tầng 28, Tòa C5, số 119 Trần Duy Hưng, phường Trung Hòa, Quận Cầu\nGiấy, Hà Nội\nĐiện thoại : (84-24) 39446368 Fax: (84-24) 39446583\nWebsite : www.techcomcapital.com.vn  \nNơi cung cấp Bản cáo bạch:\nBản cáo bạch cập nhật những các tài liệu của Quỹ (báo cáo hoạt động, báo cáo tài chính,\nĐiểu Lệ Quỹ và các tài liệu cần thiết khác) được cung cấp trên trang điện tử của TCC,\nwww.techcomcapital.com.vn, tại văn phòng của TCC và các Đại lý phân phối như danh sách\ntrong phụ lục 1 của Bản cáo Bạch.  \nPhụ trách công bố thông tin:\nÔng Đặng Lưu Dũng – Tổng Giám đốc\nĐịa chỉ : Công ty Cổ phần Quản lý Quỹ Ký Thương', 'Bản cáo bạch này được phát hành bởi:\nCông ty Cổ phần Quản lý Quỹ Ký Thương - TechcomCapital (“TCC”)\nĐịa chỉ: Tầng 28, Tòa C5, số 119 Trần Duy Hưng, phường Trung Hòa, Quận Cầu Giấy, Hà Nội.\nĐiện thoại: (84-24) 39446368. Fax: (84-24) 39446583. Website: www.techcomcapital.com.vn.  \nBản cáo bạch này được phát hành bởi:\nCông ty Cổ phần Quản lý Quỹ Ký Thương - TechcomCapital (“TCC”)\nĐịa chỉ: Tầng 28, Tòa C5, số 119 Trần Duy Hưng, phường Trung Hòa, Quận Cầu Giấy, Hà Nội\nĐiện thoại: (84-24) 39446368 Fax: (84-24) 39446583\nWebsite: www.techcomcapital.com.vn  \nNơi cung cấp Bản cáo bạch:\nBản cáo bạch cập nhật những các tài liệu của Quỹ (báo cáo hoạt động, báo cáo tài chính,\nĐiểu Lệ Quỹ và các tài liệu cần thiết khác) được cung cấp trên trang điện tử của TCC,', 'Số: 9176 /QĐ-UBCK\nGiấy phép hành chứng chỉ quỹ ra công chúng\n----------------  \nCăn cứ khoản 2, Điều 46 Pháp lệnh Chứng khoán và Điều 45, 46 Nghị định số\n56/2007/NĐ-CP ngày 09/04/2007 của Chính phủ quy định chi tiết thi hành một số\nđiều của Pháp lệnh Chứng khoán;\nCăn cứ Quyết định số 30/2008/QĐ-BTC ngày 02/06/2008 của Bộ Tài chính về việc\nban hành Quy chế tổ chức và hoạt động của công ty quản lý quỹ, công ty chứng khoán;\nCăn cứ Giấy chứng nhận đăng ký kinh doanh số 0102013096 do Sở Kế hoạch và\nĐầu tư Thành phố Hà Nội cấp ngày 21/10/2008;\nXét đề nghị của Công ty cổ phần Quản lý Quỹ Ký Thương - TechcomCapital;  \nQUỸ ĐẦU TƯ CỔ PHIẾU DOANH NGHIỆP VỪA VÀ NHỎ TECHCOM\n(TCSME)  \nCHÀO BẢN CHỨNG CHỈ QUỸ ĐẦU TƯ CHỨNG KHOÁN RA CÔNG CHỨNG\n(Quỹ chứng khoán doanh nghiệp vừa và nhỏ Techcom)', 'Điểu Lệ Quỹ và các tài liệu cần thiết khác) được cung cấp trên trang điện tử của TCC,\nwww.techcomcapital.com.vn, tại văn phòng của TCC và các Đại lý phân phối như danh sách\ntrong phụ lục 1 của Bản cáo Bạch.  \nPhụ trách công bố thông tin:\nÔng Đặng Lưu Dũng – Tổng Giám đốc\nĐịa chỉ: Công ty Cổ phần Quản lý Quỹ Ký Thương\nTầng 28, Tòa C5, số 119 Trần Duy Hưng, phường Trung Hòa, Quận Cầu Giấy, Hà Nội\nĐiện thoại: (84-24) 39446368 Fax: (84-24) 39446583  \nBản cáo bạch này được phát hành bởi:\nCông ty Cổ phần Quản lý Quỹ Ký Thương - TechcomCapital (“TCC”)\nĐịa chỉ : Tầng 28, Tòa C5, số 119 Trần Duy Hưng, phường Trung Hòa, Quận Cầu Giấy, Hà Nội\nĐiện thoại : (84-24) 39446368 Fax: (84-24) 39446583\nWebsite : www.techcomcapital.com.vn  \nNơi cung cấp Bản cáo bạch:', 'Quỹ đầu tư chứng khoán được mô tả trong Bản cáo bạch này là Quỹ được thành lập theo\nLuật Chứng khoán số 54/2019/QH14 Quốc hội Nước Cộng Hòa Xã hội Chủ nghĩa Việt\nNam thông qua ngày 26 tháng 11 năm 2019 và các văn bản hướng dẫn thi hành. Bản cáo\nbạch này đã được đăng ký với Ủy ban Chứng khoán Nhà nước ngày / /2022.  \nTHÔNG BÁO QUAN TRỌNG  \nCác nhà đầu tư nên nghiên cứu Bản cáo bạch này một cách cẩn trọng và toàn diện và không nên\ncoi nội dung hoặc tóm tắt ở đây là các tư vấn liên quan đến pháp lý, thuế, hoặc tài chính/đầu\ntư và nên tham khảo ý kiến chuyên gia tư vấn của mình về các yêu cầu pháp lý, thuế, năm\ngiữa, hoặc tư vấn về các khía cạnh khác của việc đầu tư, mua, cho tặng, năm giữ,\nnhượng, chuyển nhượng, hoặc bán một phần hoặc toàn bộ các khoản đầu tư vào Quỹ. Nhà đầu tư', '*   Kết quả hoạt động trong quá khứ của các Quỹ không có nghĩa là kết quả hoạt động trong tương lai.\n*   Tên của Quỹ không hàm ý về chất lượng hoạt động cũng như những lợi và lợi nhuận của Quỹ trong tương lai;\n*   Công ty Quản lý Quỹ không chịu trách nhiệm pháp lý về những rủi ro từ đầu tư của các chủ nợ, thành viên Hội đồng thành viên, Ban điều hành và nhân viên của Công ty Quản lý Quỹ không có trách nhiệm pháp lý về các rủi ro hoạt động của Công ty Quản lý Quỹ.\n*   Giống như các hình thức đầu tư khác, Quỹ, rủi ro thanh khoản sẽ được phân bổ trên cơ sở số ngày gần nhất với giá trị tài sản ròng. Các khoản đầu tư khác có thể có nhiều rủi ro hơn so với thời điểm hiện tại. Nhà Đầu tư cần phải nhận thức được khả năng chấp nhận rủi ro từ vơi rủi ro đầu tư mà Quỹ có thể gặp phải trong tương lai.', '- Không đầu tư vào quá 10% tổng giá trị chứng chỉ quỹ đang lưu hành của một quỹ đại chúng,\ncổ phiếu công ty quản lý quỹ khác có chứng khoán đại chúng;\n- Không đầu tư quá 20% tổng giá trị tài sản của quỹ vào chứng chỉ quỹ của một quỹ đại\nchúng, cổ phiếu của một công ty đầu tư chứng khoán đại chúng;\n- Không được đầu tư quá 50% tổng giá trị tài sản của quỹ vào các chứng chỉ quỹ đại chúng, cổ\nphiếu công ty đầu tư chứng khoán đại chúng;\nk) Không được đầu tư trực tiếp bất động sản, đã quỹ, kim loại quý hiếm;\n1) Phải có chứng khoán của ít nhất 06 tổ chức phát hành.\n2.2.5 Điều chỉnh danh mục đầu tư\nCơ cấu đầu tư của Quỹ mới chỉ được vược với các hạn chế đầu tư đã quy định tại điểm a,\nb, c, d, e và mục IX.2.2.4 và chỉ do các nguyên nhân sau:', 'cụ nợ của Chính phủ;\nd) Không được đầu tư quá 30% tổng giá trị tài sản của quỹ vào các tài sản quỹ định tại điểm a,\nb, d, e và f mục IX.2.2.3, phải hành bởi các công ty trong cùng một nhóm công ty cơ quan hệ\nsở hữu với nhau, thuộc sở hữu hợp của sau đây: Công ty con, các công ty sở hữu\nhien 35% cổ phần, phần vốn góp của nhau.nhóm công ty con, công ty mẹ. Tổng\nđộ phân đầu tư vào chứng khoán phái sinh tính bằng giá trị cam kết của hợp đồng xác định\ntheo quy định tại Phụ Lục 4 Điều Lệ Quỹ;\ne) Không được đầu tư quá 10% tổng giá trị tài sản của quỹ vào các tài sản quỹ định tại điểm d\nmục IX.2.2.3;\nf) Tổng giá trị các hạng mục đầu tư lớn trong danh mục đầu tư của quỹ không được vượt quá\n40% tổng giá trị tài sản của quỹ. Trong đó, hạng mục đầu tư lớn của quỹ là hạng mục đầu tư', '*   Có đầy đủ cơ sở vật chất, nhân sự để Quản lý Quỹ mở;\n*   Đồng ý thực hiện các cam kết đối với Quỹ như nêu tại Phụ Lục 1 và Phụ Lục 3 của Điều Lệ Quỹ.  \nCác quy định về quyền và nghĩa vụ, chấm dứt quyền và nghĩa vụ, hạn chế hoạt động của Công ty Quản lý Quỹ tuân thủ theo quy định tại Chương VI Điều Lệ Quỹ.  \n**2.11. Tiêu chí lựa chọn, quyền hạn và trách nhiệm của Ngân hàng giám sát**\nNgân hàng Giám sát được lựa chọn phải đáp ứng các điều kiện sau:  \n*   Ngân hàng giám sát do Công ty Quản lý Quỹ lựa chọn phải đáp ứng các điều kiện quy định tại Khoản 1 Điều 116 Luật Chứng khoán;\n*   Ngân hàng giám sát phải hoạt động độc lập và tách biệt với Công ty Quản lý Quỹ mà ngân hàng cung cấp dịch vụ giám sát;', '**Chế độ kế toán**  \nQuỹ sẽ áp dụng chế độ kế toán Việt Nam (VAS) và tuân thủ các quy định khác liên quan tới công tác kế toán cho Quỹ do các cơ quan có thẩm quyền quy định. Đồng Việt Nam sẽ là đồng tiền được sử dụng và thể hiện.  \n**Chế độ báo cáo**  \nCông ty Quản lý Quỹ có trách nhiệm duy trì sổ sách kế toán và chuẩn bị báo cáo tài chính cho Quỹ. Phù hợp với quy định tại Điều 38 của Điều Lệ Quỹ, Công ty Quản lý Quỹ có thể uỷ quyền cho một nhà cung cấp dịch vụ có thực hiện việc này. Một số sách kế toán và báo cáo tài chính mà Công ty Quản lý Quỹ hoặc nhà cung cấp dịch vụ có thể uỷ quyền sẽ được lưu trữ tại văn phòng của Công ty Quản lý Quỹ hoặc nhà cung cấp dịch vụ có liên quan.', 'Các quy định khác liên quan đến kiểm toán, kế toán và chế độ báo cáo tuân thủ theo quy định tại Điều Lệ Quỹ.  \n**3. Các rủi ro khi đầu tư vào Quỹ**  \nMục tiêu của Công ty Quản lý Quỹ là quản lý các rủi ro đầu tư, và nếu có thể, hạn chế các tác động của các rủi ro này bằng việc áp dụng các phương pháp quản lý đầu tư theo tiêu chuẩn quốc tế tốt nhất. Nhà Đầu tư cần lưu ý về các điểm quan trọng sau đây:  \n*   Quỹ, Công ty Quản lý Quỹ, thành viên Hội đồng quản trị, người điều hành và nhân viên của ngân hàng giám sát sẽ làm nhiệm vụ của quản trị rủi ro và bảo quản tài sản của quỹ đại chúng, công ty đầu tư chứng khoán không được là đối tượng mua, bán trong giao dịch mua, bán tài sản của quỹ đại chúng, công ty đầu tư chứng khoán.', 'liên quan đến các hoạt động của Quỹ mà Quỹ thực hiện hoặc gián tiếp hoặc tổng hợp các khoản phí và các chi phí/phí/giá dịch vụ liên quan đến các hoạt động của Quỹ mà Quỹ thực hiện hoặc gián tiếp hoặc tổng hợp các khoản phí và các chi phí/phí/giá dịch vụ liên quan đến các hoạt động của Quỹ mà Quỹ thực hiện hoặc gián tiếp hoặc tổng hợp các khoản phí và các chi phí/phí/giá dịch vụ liên quan đến các hoạt động của Quỹ mà Quỹ thực hiện hoặc gián tiếp hoặc tổng hợp các khoản phí và các chi phí/phí/giá dịch vụ liên quan đến các hoạt động của Quỹ mà Quỹ thực hiện hoặc gián tiếp hoặc tổng hợp các khoản phí và các chi phí/phí/giá dịch vụ liên quan đến', 'chi phí/phí/giá dịch vụ liên quan đến các hoạt động của Quỹ mà Quỹ thực hiện hoặc gián tiếp hoặc tổng hợp các khoản phí và các chi phí/phí/giá dịch vụ liên quan đến các hoạt động của Quỹ mà Quỹ thực hiện hoặc gián tiếp hoặc tổng hợp các khoản phí và các chi phí/phí/giá dịch vụ liên quan đến các hoạt động của Quỹ mà Quỹ thực hiện hoặc gián tiếp hoặc tổng hợp các khoản phí và các chi phí/phí/giá dịch vụ liên quan đến các hoạt động của Quỹ mà Quỹ thực hiện hoặc gián tiếp hoặc tổng hợp các khoản phí và các chi phí/phí/giá dịch vụ liên quan đến các hoạt động của Quỹ mà Quỹ thực hiện hoặc gián tiếp hoặc tổng hợp các khoản phí và các chi phí/phí/giá dịch vụ liên quan đến các hoạt động của Quỹ mà Quỹ thực hiện hoặc gián tiếp hoặc tổng hợp các khoản phí và các chi phí/phí/giá dịch vụ liên quan đến', 'phí/phí/giá dịch vụ liên quan đến các hoạt động của Quỹ mà Quỹ thực hiện hoặc gián tiếp hoặc tổng hợp các khoản phí và các chi phí/phí/giá dịch vụ liên quan đến các hoạt động của Quỹ mà Quỹ thực hiện hoặc gián tiếp hoặc tổng hợp các khoản phí và các chi phí/phí/giá dịch vụ liên quan đến các hoạt động của Quỹ mà Quỹ thực hiện hoặc gián tiếp hoặc tổng hợp các khoản phí và các chi phí/phí/giá dịch vụ liên quan đến các hoạt động của Quỹ mà Quỹ thực hiện hoặc gián tiếp hoặc tổng hợp các khoản phí và các chi phí/phí/giá dịch vụ liên quan đến các hoạt động của Quỹ mà Quỹ thực hiện hoặc gián tiếp hoặc tổng hợp các khoản phí và các chi phí/phí/giá dịch vụ liên quan đến các hoạt động của Quỹ mà Quỹ thực hiện hoặc gián tiếp hoặc tổng hợp các khoản phí và các chi phí/phí/giá dịch vụ liên quan đến các', 'Chỉ có các loại phí/dịch vụ và các chi phí/phí/giá dịch vụ liên quan trực tiếp hoặc gián tiếp hoặc tổng hợp các khoản phí và các chi phí/phí/giá dịch vụ liên quan đến các hoạt động của Quỹ mà Quỹ thực hiện hoặc gián tiếp hoặc tổng hợp các khoản phí và các chi phí/phí/giá dịch vụ liên quan đến các hoạt động của Quỹ mà Quỹ thực hiện hoặc gián tiếp hoặc tổng hợp các khoản phí và các chi phí/phí/giá dịch vụ liên quan đến các hoạt động của Quỹ mà Quỹ thực hiện hoặc gián tiếp hoặc tổng hợp các khoản phí và các chi phí/phí/giá dịch vụ liên quan đến các hoạt động của Quỹ mà Quỹ thực hiện hoặc gián tiếp hoặc tổng hợp các khoản phí và các chi phí/phí/giá dịch vụ liên quan đến các hoạt động của Quỹ mà Quỹ thực hiện hoặc gián tiếp hoặc tổng hợp các khoản phí và các chi phí/phí/giá dịch vụ liên quan', 'vụ liên quan đến các hoạt động của Quỹ mà Quỹ thực hiện hoặc gián tiếp hoặc tổng hợp các khoản phí và các chi phí/phí/giá dịch vụ liên quan đến các hoạt động của Quỹ mà Quỹ thực hiện hoặc gián tiếp hoặc tổng hợp các khoản phí và các chi phí/phí/giá dịch vụ liên quan đến các hoạt động của Quỹ mà Quỹ thực hiện hoặc gián tiếp hoặc tổng hợp các khoản phí và các chi phí/phí/giá dịch vụ liên quan đến các hoạt động của Quỹ mà Quỹ thực hiện hoặc gián tiếp hoặc tổng hợp các khoản phí và các chi phí/phí/giá dịch vụ liên quan đến các hoạt động của Quỹ mà Quỹ thực hiện hoặc gián tiếp hoặc tổng hợp các khoản phí và các chi phí/phí/giá dịch vụ liên quan đến các hoạt động của Quỹ mà Quỹ thực hiện hoặc gián tiếp hoặc tổng hợp các khoản phí và các chi phí/phí/giá dịch vụ liên quan đến các hoạt động của', 'Giấy dịch vụ Chuyển nhượng sẽ được hạch toán cho Công ty Quản lý Quỹ và Đại Lý Phân Phối căn cứ theo hợp đồng ký giữa Công ty Quản lý Quỹ và Đại Lý Phân Phối.  \n3.2 Giá dịch vụ mà Quỹ phải trả', 'dịch vụ liên quan đến các hoạt động của Quỹ mà Quỹ thực hiện hoặc gián tiếp hoặc tổng hợp các khoản phí và các chi phí/phí/giá dịch vụ liên quan đến các hoạt động của Quỹ mà Quỹ thực hiện hoặc gián tiếp hoặc tổng hợp các khoản phí và các chi phí/phí/giá dịch vụ liên quan đến các hoạt động của Quỹ mà Quỹ thực hiện hoặc gián tiếp hoặc tổng hợp các khoản phí và các chi phí/phí/giá dịch vụ liên quan đến các hoạt động của Quỹ mà Quỹ thực hiện hoặc gián tiếp hoặc tổng hợp các khoản phí và các chi phí/phí/giá dịch vụ liên quan đến các hoạt động của Quỹ mà Quỹ thực hiện hoặc gián tiếp hoặc tổng hợp các khoản phí và các chi phí/phí/giá dịch vụ liên quan đến các hoạt động của Quỹ mà Quỹ thực hiện hoặc gián tiếp hoặc tổng hợp các khoản phí và các chi phí/phí/giá dịch vụ liên quan đến các hoạt động']","Giá dịch vụ Quản trị quỹ là 0,03% NAV/năm, tối thiểu 15.000.000 đồng/tháng (chưa VAT)."
Thời điểm đóng sổ lệnh (Cut-off time) đối với lệnh mua và lệnh bán chứng chỉ quỹ là khi nào?,Thời điểm đóng sổ lệnh (Cut-off time) đối với lệnh mua và lệnh bán chứng chỉ quỹ là 14h45 của ngày T-1.,"['c) Hoạt động mới, các cập, pháp lập hoặc các tổ chức phát hành;\nd) Quy định mới trong thời gian giải thể;\nTrong thời hạn 03 tháng kể từ ngày có các sai lệch phát sinh do các nguyên nhân quy định tại\nđiểm a, b, d, e điều này, công ty quản lý quỹ có nghĩa vụ thông báo cho Ủy ban Chứng khoán\nNhà nước và điều chỉnh lại cơ cấu danh mục đầu tư cho phù hợp với quy định tại Mục IX.2.2.4.\nTrường hợp sai lệch cơ cấu danh mục đầu tư không tuân thủ hạn chế đầu tư theo quy định\npháp luật hoặc điều lệ Quỹ, công ty quản lý quỹ phải điều chỉnh lại danh mục đầu tư trong\nhạn 15 ngày kể từ ngày phát hiện sai lệch. Công ty quản lý quỹ phải đối chiếu tương hai cho\nquỹ (nếu có) so với mọi chỉ phí phát sinh liên quan đến việc điều chỉnh lại danh mục đầu tư.', 'Quỹ đầu tư chứng khoán được mô tả trong Bản cáo bạch này là Quỹ được thành lập theo\nLuật Chứng khoán số 54/2019/QH14 Quốc hội Nước Cộng Hòa Xã hội Chủ nghĩa Việt\nNam thông qua ngày 26 tháng 11 năm 2019 và các văn bản hướng dẫn thi hành. Bản cáo\nbạch này đã được đăng ký với Ủy ban Chứng khoán Nhà nước ngày / /2022.  \nTHÔNG BÁO QUAN TRỌNG  \nCác nhà đầu tư nên nghiên cứu Bản cáo bạch này một cách cẩn trọng và toàn diện và không nên\ncoi nội dung hoặc tóm tắt ở đây là các tư vấn liên quan đến pháp lý, thuế, hoặc tài chính/đầu\ntư và nên tham khảo ý kiến chuyên gia tư vấn của mình về các yêu cầu pháp lý, thuế, năm\ngiữa, hoặc tư vấn về các khía cạnh khác của việc đầu tư, mua, cho tặng, năm giữ,\nnhượng, chuyển nhượng, hoặc bán một phần hoặc toàn bộ các khoản đầu tư vào Quỹ. Nhà đầu tư', '- Không đầu tư vào quá 10% tổng giá trị chứng chỉ quỹ đang lưu hành của một quỹ đại chúng,\ncổ phiếu công ty quản lý quỹ khác có chứng khoán đại chúng;\n- Không đầu tư quá 20% tổng giá trị tài sản của quỹ vào chứng chỉ quỹ của một quỹ đại\nchúng, cổ phiếu của một công ty đầu tư chứng khoán đại chúng;\n- Không được đầu tư quá 50% tổng giá trị tài sản của quỹ vào các chứng chỉ quỹ đại chúng, cổ\nphiếu công ty đầu tư chứng khoán đại chúng;\nk) Không được đầu tư trực tiếp bất động sản, đã quỹ, kim loại quý hiếm;\n1) Phải có chứng khoán của ít nhất 06 tổ chức phát hành.\n2.2.5 Điều chỉnh danh mục đầu tư\nCơ cấu đầu tư của Quỹ mới chỉ được vược với các hạn chế đầu tư đã quy định tại điểm a,\nb, c, d, e và mục IX.2.2.4 và chỉ do các nguyên nhân sau:', 'cụ nợ của Chính phủ;\nd) Không được đầu tư quá 30% tổng giá trị tài sản của quỹ vào các tài sản quỹ định tại điểm a,\nb, d, e và f mục IX.2.2.3, phải hành bởi các công ty trong cùng một nhóm công ty cơ quan hệ\nsở hữu với nhau, thuộc sở hữu hợp của sau đây: Công ty con, các công ty sở hữu\nhien 35% cổ phần, phần vốn góp của nhau.nhóm công ty con, công ty mẹ. Tổng\nđộ phân đầu tư vào chứng khoán phái sinh tính bằng giá trị cam kết của hợp đồng xác định\ntheo quy định tại Phụ Lục 4 Điều Lệ Quỹ;\ne) Không được đầu tư quá 10% tổng giá trị tài sản của quỹ vào các tài sản quỹ định tại điểm d\nmục IX.2.2.3;\nf) Tổng giá trị các hạng mục đầu tư lớn trong danh mục đầu tư của quỹ không được vượt quá\n40% tổng giá trị tài sản của quỹ. Trong đó, hạng mục đầu tư lớn của quỹ là hạng mục đầu tư', 'quỹ (nếu có) so với mọi chỉ phí phát sinh liên quan đến việc điều chỉnh lại danh mục đầu tư.\nTrong thời hạn 05 ngày làm việc kể từ ngày hoãn khẩn tại thời điểm điều chỉnh lại danh mục đầu tư.\nTrong thời hạn 05 ngày làm việc kể từ ngày hoãn khẩn tại thời điểm điều chỉnh lại danh mục đầu tư.\nTrong thời hạn 05 ngày làm việc kể từ ngày hoãn khẩn tại thời điểm điều chỉnh lại danh mục đầu tư.\nTrong thời hạn 05 ngày làm việc kể từ ngày hoãn khẩn tại thời điểm điều chỉnh lại danh mục đầu tư.\nTrong thời hạn 05 ngày làm việc kể từ ngày hoãn khẩn tại thời điểm điều chỉnh lại danh mục đầu tư.\nTrong thời hạn 05 ngày làm việc kể từ ngày hoãn khẩn tại thời điểm điều chỉnh lại danh mục đầu tư.\nTrong thời hạn 05 ngày làm việc kể từ ngày hoãn khẩn tại thời điểm điều chỉnh lại danh mục đầu tư.', 'ngược lại;  \n*   Ngân hàng giám sát, thành viên Hội đồng quản trị, người điều hành và nhân viên của ngân hàng giám sát làm nhiệm vụ giám sát hoạt động và bảo quản tài sản của Quỹ đại chúng, Công ty đầu tư chứng khoán không được là đối tượng mua, bán trong giao dịch mua, bán tài sản của Quỹ đại chúng, công ty đầu tư chứng khoán.\n*   Có đầy đủ năng lực cung cấp dịch vụ giám sát, lưu ký;\n*   Thực hiện các cam kết đối với Quỹ như nêu tại Phụ Lục 2 và Phụ Lục 3 của Điều Lệ Quỹ.  \nCác quy định về quyền và nghĩa vụ, thời hạn công bố thông tin về Công ty Quản lý Quỹ tuân theo quy định tại Chương VII Điều Lệ Quỹ.  \n**2.12. Kiểm toán, kế toán và chế độ báo cáo**', 'Trong thời hạn 05 ngày làm việc kể từ ngày hoãn khẩn tại thời điểm điều chỉnh lại danh mục đầu tư.\nTrong thời hạn 05 ngày làm việc kể từ ngày hoãn khẩn tại thời điểm điều chỉnh lại danh mục đầu tư.\nTrong thời hạn 05 ngày làm việc kể từ ngày hoãn khẩn tại thời điểm điều chỉnh lại danh mục đầu tư.\nTrong thời hạn 05 ngày làm', '2.2.4 Hạn mức đầu tư\nHạn mức đầu tư của Quỹ được quy định chi tiết tuân theo các quy định tại Thông tư hướng dẫn\nhoạt động và quản lý các quỹ đầu tư chứng khoán. Co cấu danh mục đầu tư của Quỹ phải đảm\nbảo tuân theo các hạn mức đầu tư sau:\na) Tựa trên tổng giá trị tài khoản thanh toán của Quỹ tại ngân hàng giám sát, quỹ mở được\ncâu đề qua 49% tổng giá trị tài sản của quỹ vào các tài sản theo quy định tại điểm a, b mục\nIX.2.2.3\nb) Không được đầu tư vào chứng khoán của một tổ chức phát hành quá 10% tổng giá trị chứng\nkhoán đang lưu hành của tổ chức đó, trừ công cụ nợ của Chính phủ;\nc) Không được đầu tư quá 20% tổng giá trị tài sản của quỹ vào chứng khoán đang lưu hành và\ncác tài sản (nếu có) quy định tại điểm a, b mục IX.2.2.3 của một tổ chức phát hành, trừ công\ncụ nợ của Chính phủ;', '40% tổng giá trị tài sản của quỹ. Trong đó, hạng mục đầu tư lớn của quỹ là hạng mục đầu tư\nvào các loại tài sản quỹ định tại điểm a, d, và g mục IX.2.2.3 (ngoại trừ chứng chỉ tiền gửi)\nphải hành bởi cùng một tổ chức, có tổng giá trị chiếm từ 5% trở lên tổng giá trị tài sản của\nquỹ;\ng) Tại mọi thời điểm, tổng giá trị cam kết trong các giao dịch chứng khoán phái sinh, dự nợ vay\nvà các khoản phải trả của quỹ không được vượt giá trị tài sản ròng của quỹ;\nh) Không được đầu tư vào chứng khoán của Chính phủ Quỹ;\ni) Chỉ được đầu tư vào chứng chỉ quỹ đại chúng khác, công ty đầu tư chứng khoán đại chúng\ndo công ty quản lý quỹ khác quản lý và bảo đảm các hạn chế sau:\n- Không đầu tư vào quá 10% tổng giá trị chứng chỉ quỹ đang lưu hành của một quỹ đại chúng,', '*   Có đầy đủ cơ sở vật chất, nhân sự để Quản lý Quỹ mở;\n*   Đồng ý thực hiện các cam kết đối với Quỹ như nêu tại Phụ Lục 1 và Phụ Lục 3 của Điều Lệ Quỹ.  \nCác quy định về quyền và nghĩa vụ, chấm dứt quyền và nghĩa vụ, hạn chế hoạt động của Công ty Quản lý Quỹ tuân thủ theo quy định tại Chương VI Điều Lệ Quỹ.  \n**2.11. Tiêu chí lựa chọn, quyền hạn và trách nhiệm của Ngân hàng giám sát**\nNgân hàng Giám sát được lựa chọn phải đáp ứng các điều kiện sau:  \n*   Ngân hàng giám sát do Công ty Quản lý Quỹ lựa chọn phải đáp ứng các điều kiện quy định tại Khoản 1 Điều 116 Luật Chứng khoán;\n*   Ngân hàng giám sát phải hoạt động độc lập và tách biệt với Công ty Quản lý Quỹ mà ngân hàng cung cấp dịch vụ giám sát;', 'b, c, d, e và mục IX.2.2.4 và chỉ do các nguyên nhân sau:\na) Biến động giá trên thị trường tài sản trong danh mục đầu tư của quỹ;\nb) Thực hiện các khoản thanh toán của quỹ theo quy định của pháp luật, bao gồm việc thực\nhiện lệnh giao dịch của nhà đầu tư;', 'từ trên 12 tháng trở lên 0,00%  \nGiấy dịch vụ Chuyển Đổi Quỹ sẽ được hạch toán cho Công ty Quản lý Quỹ và Đại Lý Phân Phối căn cứ theo hợp đồng ký giữa Công ty Quản lý Quỹ và Đại Lý Phân Phối.  \nd) Giấy dịch vụ Chuyển Nhượng  \nNhà Đầu tư phải trả một mức phí dịch vụ Chuyển Nhượng duy nhất là 300.000 đồng (ba trăm nghìn đồng) cho mỗi giao dịch chuyển nhượng Đơn vị Quỹ. Giá dịch vụ Chuyển Nhượng do người thực hiện chuyển nhượng thanh toán.  \nGiấy dịch vụ Chuyển nhượng sẽ không áp dụng trong trường hợp Nhà Đầu tư thực hiện chuyển nhượng số Chứng Chỉ quỹ từ tài khoản này sang tài khoản khác cùng tên thì Nhà Đầu tư tại Hai Đại Lý Phân Phối khác nhau.', '**2.12. Kiểm toán, kế toán và chế độ báo cáo**  \nCông ty kiểm toán được lựa chọn phải được thành lập và hoạt động phù hợp với quy định của Pháp luật, nằm trong danh sách các công ty kiểm toán được UBCKNN chấp thuận kiểm toán cho tổ chức tài chính, tổ chức niêm yết và cho tổ chức kinh doanh chứng khoán và không được là người liên quan của Công ty Quản lý Quỹ, Ngân hàng Giám sát. Năm kiểm toán: Tổng công ty kiểm toán Quỹ sẽ được Công ty Quản lý Quỹ đề cử để Đại Hội Đồng Quỹ thông qua. Các năm sau đó, Đại Hội Đầu Tư Quỹ sẽ thông qua cho Ban Đại Diện Quỹ thông qua việc lựa chọn công ty kiểm toán. Công ty Quản lý Quỹ sẽ đề xuất với Ban Đại Diện Quỹ ít nhất (02) công ty kiểm toán để kiểm toán cho Quỹ mình.  \n**Chế độ kế toán**', 'Trong thời hạn 05 ngày làm việc kể từ ngày hoãn khẩn tại thời điểm điều chỉnh lại danh mục đầu tư.\nTrong thời hạn 05 ngày làm việc kể từ ngày hoãn khẩn tại thời điểm điều chỉnh lại danh mục đầu tư.\nTrong thời hạn 05 ngày làm việc kể từ ngày hoãn khẩn tại thời điểm điều chỉnh lại danh mục đầu tư.\nTrong thời hạn 05 ngày làm việc kể từ ngày hoãn khẩn tại thời điểm điều chỉnh lại danh mục đầu tư.\nTrong thời hạn 05 ngày làm việc kể từ ngày hoãn khẩn tại thời điểm điều chỉnh lại danh mục đầu tư.\nTrong thời hạn 05 ngày làm việc kể từ ngày hoãn khẩn tại thời điểm điều chỉnh lại danh mục đầu tư.\nTrong thời hạn 05 ngày làm việc kể từ ngày hoãn khẩn tại thời điểm điều chỉnh lại danh mục đầu tư.\nTrong thời hạn 05 ngày làm việc kể từ ngày hoãn khẩn tại thời điểm điều chỉnh lại danh mục đầu tư.', 'Trong thời hạn 05 ngày làm việc kể từ ngày hoãn khẩn tại thời điểm điều chỉnh lại danh mục đầu tư.\nTrong thời hạn 05 ngày làm việc kể từ ngày hoãn khẩn tại thời điểm điều chỉnh lại danh mục đầu tư.\nTrong thời hạn 05 ngày làm việc kể từ ngày hoãn khẩn tại thời điểm điều chỉnh lại danh mục đầu tư.\nTrong thời hạn 05 ngày làm việc kể từ ngày hoãn khẩn tại thời điểm điều chỉnh lại danh mục đầu tư.\nTrong thời hạn 05 ngày làm việc kể từ ngày hoãn khẩn tại thời điểm điều chỉnh lại danh mục đầu tư.\nTrong thời hạn 05 ngày làm việc kể từ ngày hoãn khẩn tại thời điểm điều chỉnh lại danh mục đầu tư.\nTrong thời hạn 05 ngày làm việc kể từ ngày hoãn khẩn tại thời điểm điều chỉnh lại danh mục đầu tư.\nTrong thời hạn 05 ngày làm việc kể từ ngày hoãn khẩn tại thời điểm điều chỉnh lại danh mục đầu tư.', 'Trong thời hạn 05 ngày làm việc kể từ ngày hoãn khẩn tại thời điểm điều chỉnh lại danh mục đầu tư.\nTrong thời hạn 05 ngày làm việc kể từ ngày hoãn khẩn tại thời điểm điều chỉnh lại danh mục đầu tư.\nTrong thời hạn 05 ngày làm việc kể từ ngày hoãn khẩn tại thời điểm điều chỉnh lại danh mục đầu tư.\nTrong thời hạn 05 ngày làm việc kể từ ngày hoãn khẩn tại thời điểm điều chỉnh lại danh mục đầu tư.\nTrong thời hạn 05 ngày làm việc kể từ ngày hoãn khẩn tại thời điểm điều chỉnh lại danh mục đầu tư.\nTrong thời hạn 05 ngày làm việc kể từ ngày hoãn khẩn tại thời điểm điều chỉnh lại danh mục đầu tư.\nTrong thời hạn 05 ngày làm việc kể từ ngày hoãn khẩn tại thời điểm điều chỉnh lại danh mục đầu tư.\nTrong thời hạn 05 ngày làm việc kể từ ngày hoãn khẩn tại thời điểm điều chỉnh lại danh mục đầu tư.', 'Trong thời hạn 05 ngày làm việc kể từ ngày hoãn khẩn tại thời điểm điều chỉnh lại danh mục đầu tư.\nTrong thời hạn 05 ngày làm việc kể từ ngày hoãn khẩn tại thời điểm điều chỉnh lại danh mục đầu tư.\nTrong thời hạn 05 ngày làm việc kể từ ngày hoãn khẩn tại thời điểm điều chỉnh lại danh mục đầu tư.\nTrong thời hạn 05 ngày làm việc kể từ ngày hoãn khẩn tại thời điểm điều chỉnh lại danh mục đầu tư.\nTrong thời hạn 05 ngày làm việc kể từ ngày hoãn khẩn tại thời điểm điều chỉnh lại danh mục đầu tư.\nTrong thời hạn 05 ngày làm việc kể từ ngày hoãn khẩn tại thời điểm điều chỉnh lại danh mục đầu tư.\nTrong thời hạn 05 ngày làm việc kể từ ngày hoãn khẩn tại thời điểm điều chỉnh lại danh mục đầu tư.\nTrong thời hạn 05 ngày làm việc kể từ ngày hoãn khẩn tại thời điểm điều chỉnh lại danh mục đầu tư.', 'Trong thời hạn 05 ngày làm việc kể từ ngày hoãn khẩn tại thời điểm điều chỉnh lại danh mục đầu tư.\nTrong thời hạn 05 ngày làm việc kể từ ngày hoãn khẩn tại thời điểm điều chỉnh lại danh mục đầu tư.\nTrong thời hạn 05 ngày làm việc kể từ ngày hoãn khẩn tại thời điểm điều chỉnh lại danh mục đầu tư.\nTrong thời hạn 05 ngày làm việc kể từ ngày hoãn khẩn tại thời điểm điều chỉnh lại danh mục đầu tư.\nTrong thời hạn 05 ngày làm việc kể từ ngày hoãn khẩn tại thời điểm điều chỉnh lại danh mục đầu tư.\nTrong thời hạn 05 ngày làm việc kể từ ngày hoãn khẩn tại thời điểm điều chỉnh lại danh mục đầu tư.\nTrong thời hạn 05 ngày làm việc kể từ ngày hoãn khẩn tại thời điểm điều chỉnh lại danh mục đầu tư.\nTrong thời hạn 05 ngày làm việc kể từ ngày hoãn khẩn tại thời điểm điều chỉnh lại danh mục đầu tư.', 'Trong thời hạn 05 ngày làm việc kể từ ngày hoãn khẩn tại thời điểm điều chỉnh lại danh mục đầu tư.\nTrong thời hạn 05 ngày làm việc kể từ ngày hoãn khẩn tại thời điểm điều chỉnh lại danh mục đầu tư.\nTrong thời hạn 05 ngày làm việc kể từ ngày hoãn khẩn tại thời điểm điều chỉnh lại danh mục đầu tư.\nTrong thời hạn 05 ngày làm việc kể từ ngày hoãn khẩn tại thời điểm điều chỉnh lại danh mục đầu tư.\nTrong thời hạn 05 ngày làm việc kể từ ngày hoãn khẩn tại thời điểm điều chỉnh lại danh mục đầu tư.\nTrong thời hạn 05 ngày làm việc kể từ ngày hoãn khẩn tại thời điểm điều chỉnh lại danh mục đầu tư.\nTrong thời hạn 05 ngày làm việc kể từ ngày hoãn khẩn tại thời điểm điều chỉnh lại danh mục đầu tư.\nTrong thời hạn 05 ngày làm việc kể từ ngày hoãn khẩn tại thời điểm điều chỉnh lại danh mục đầu tư.', 'Trong thời hạn 05 ngày làm việc kể từ ngày hoãn khẩn tại thời điểm điều chỉnh lại danh mục đầu tư.\nTrong thời hạn 05 ngày làm việc kể từ ngày hoãn khẩn tại thời điểm điều chỉnh lại danh mục đầu tư.\nTrong thời hạn 05 ngày làm việc kể từ ngày hoãn khẩn tại thời điểm điều chỉnh lại danh mục đầu tư.\nTrong thời hạn 05 ngày làm việc kể từ ngày hoãn khẩn tại thời điểm điều chỉnh lại danh mục đầu tư.\nTrong thời hạn 05 ngày làm việc kể từ ngày hoãn khẩn tại thời điểm điều chỉnh lại danh mục đầu tư.\nTrong thời hạn 05 ngày làm việc kể từ ngày hoãn khẩn tại thời điểm điều chỉnh lại danh mục đầu tư.\nTrong thời hạn 05 ngày làm việc kể từ ngày hoãn khẩn tại thời điểm điều chỉnh lại danh mục đầu tư.\nTrong thời hạn 05 ngày làm việc kể từ ngày hoãn khẩn tại thời điểm điều chỉnh lại danh mục đầu tư.', 'Trong thời hạn 05 ngày làm việc kể từ ngày hoãn khẩn tại thời điểm điều chỉnh lại danh mục đầu tư.\nTrong thời hạn 05 ngày làm việc kể từ ngày hoãn khẩn tại thời điểm điều chỉnh lại danh mục đầu tư.\nTrong thời hạn 05 ngày làm việc kể từ ngày hoãn khẩn tại thời điểm điều chỉnh lại danh mục đầu tư.\nTrong thời hạn 05 ngày làm việc kể từ ngày hoãn khẩn tại thời điểm điều chỉnh lại danh mục đầu tư.\nTrong thời hạn 05 ngày làm việc kể từ ngày hoãn khẩn tại thời điểm điều chỉnh lại danh mục đầu tư.\nTrong thời hạn 05 ngày làm việc kể từ ngày hoãn khẩn tại thời điểm điều chỉnh lại danh mục đầu tư.\nTrong thời hạn 05 ngày làm việc kể từ ngày hoãn khẩn tại thời điểm điều chỉnh lại danh mục đầu tư.\nTrong thời hạn 05 ngày làm việc kể từ ngày hoãn khẩn tại thời điểm điều chỉnh lại danh mục đầu tư.', 'Trong thời hạn 05 ngày làm việc kể từ ngày hoãn khẩn tại thời điểm điều chỉnh lại danh mục đầu tư.\nTrong thời hạn 05 ngày làm việc kể từ ngày hoãn khẩn tại thời điểm điều chỉnh lại danh mục đầu tư.\nTrong thời hạn 05 ngày làm việc kể từ ngày hoãn khẩn tại thời điểm điều chỉnh lại danh mục đầu tư.\nTrong thời hạn 05 ngày làm việc kể từ ngày hoãn khẩn tại thời điểm điều chỉnh lại danh mục đầu tư.\nTrong thời hạn 05 ngày làm việc kể từ ngày hoãn khẩn tại thời điểm điều chỉnh lại danh mục đầu tư.\nTrong thời hạn 05 ngày làm việc kể từ ngày hoãn khẩn tại thời điểm điều chỉnh lại danh mục đầu tư.\nTrong thời hạn 05 ngày làm việc kể từ ngày hoãn khẩn tại thời điểm điều chỉnh lại danh mục đầu tư.\nTrong thời hạn 05 ngày làm việc kể từ ngày hoãn khẩn tại thời điểm điều chỉnh lại danh mục đầu tư.', 'Trong thời hạn 05 ngày làm việc kể từ ngày hoãn khẩn tại thời điểm điều chỉnh lại danh mục đầu tư.\nTrong thời hạn 05 ngày làm việc kể từ ngày hoãn khẩn tại thời điểm điều chỉnh lại danh mục đầu tư.\nTrong thời hạn 05 ngày làm việc kể từ ngày hoãn khẩn tại thời điểm điều chỉnh lại danh mục đầu tư.\nTrong thời hạn 05 ngày làm việc kể từ ngày hoãn khẩn tại thời điểm điều chỉnh lại danh mục đầu tư.\nTrong thời hạn 05 ngày làm việc kể từ ngày hoãn khẩn tại thời điểm điều chỉnh lại danh mục đầu tư.\nTrong thời hạn 05 ngày làm việc kể từ ngày hoãn khẩn tại thời điểm điều chỉnh lại danh mục đầu tư.\nTrong thời hạn 05 ngày làm việc kể từ ngày hoãn khẩn tại thời điểm điều chỉnh lại danh mục đầu tư.\nTrong thời hạn 05 ngày làm việc kể từ ngày hoãn khẩn tại thời điểm điều chỉnh lại danh mục đầu tư.', 'Trong thời hạn 05 ngày làm việc kể từ ngày hoãn khẩn tại thời điểm điều chỉnh lại danh mục đầu tư.\nTrong thời hạn 05 ngày làm việc kể từ ngày hoãn khẩn tại thời điểm điều chỉnh lại danh mục đầu tư.\nTrong thời hạn 05 ngày làm việc kể từ ngày hoãn khẩn tại thời điểm điều chỉnh lại danh mục đầu tư.\nTrong thời hạn 05 ngày làm việc kể từ ngày hoãn khẩn tại thời điểm điều chỉnh lại danh mục đầu tư.\nTrong thời hạn 05 ngày làm việc kể từ ngày hoãn khẩn tại thời điểm điều chỉnh lại danh mục đầu tư.\nTrong thời hạn 05 ngày làm việc kể từ ngày hoãn khẩn tại thời điểm điều chỉnh lại danh mục đầu tư.\nTrong thời hạn 05 ngày làm việc kể từ ngày hoãn khẩn tại thời điểm điều chỉnh lại danh mục đầu tư.\nTrong thời hạn 05 ngày làm việc kể từ ngày hoãn khẩn tại thời điểm điều chỉnh lại danh mục đầu tư.', 'Trong thời hạn 05 ngày làm việc kể từ ngày hoãn khẩn tại thời điểm điều chỉnh lại danh mục đầu tư.\nTrong thời hạn 05 ngày làm việc kể từ ngày hoãn khẩn tại thời điểm điều chỉnh lại danh mục đầu tư.\nTrong thời hạn 05 ngày làm việc kể từ ngày hoãn khẩn tại thời điểm điều chỉnh lại danh mục đầu tư.\nTrong thời hạn 05 ngày làm việc kể từ ngày hoãn khẩn tại thời điểm điều chỉnh lại danh mục đầu tư.\nTrong thời hạn 05 ngày làm việc kể từ ngày hoãn khẩn tại thời điểm điều chỉnh lại danh mục đầu tư.\nTrong thời hạn 05 ngày làm việc kể từ ngày hoãn khẩn tại thời điểm điều chỉnh lại danh mục đầu tư.\nTrong thời hạn 05 ngày làm việc kể từ ngày hoãn khẩn tại thời điểm điều chỉnh lại danh mục đầu tư.\nTrong thời hạn 05 ngày làm việc kể từ ngày hoãn khẩn tại thời điểm điều chỉnh lại danh mục đầu tư.']",Thời điểm đóng sổ lệnh là 14h45 ngày T-1 (trước ngày giao dịch).
Giá trị đặt lệnh mua tối thiểu (Minimum Subscription) đối với nhà đầu tư là bao nhiêu?,Giá trị đặt lệnh mua tối thiểu (ban đầu và bổ sung) đối với nhà đầu tư là 10.000 VNĐ.,"['từ trên 12 tháng trở lên 0,00%  \nGiấy dịch vụ Chuyển Đổi Quỹ sẽ được hạch toán cho Công ty Quản lý Quỹ và Đại Lý Phân Phối căn cứ theo hợp đồng ký giữa Công ty Quản lý Quỹ và Đại Lý Phân Phối.  \nd) Giấy dịch vụ Chuyển Nhượng  \nNhà Đầu tư phải trả một mức phí dịch vụ Chuyển Nhượng duy nhất là 300.000 đồng (ba trăm nghìn đồng) cho mỗi giao dịch chuyển nhượng Đơn vị Quỹ. Giá dịch vụ Chuyển Nhượng do người thực hiện chuyển nhượng thanh toán.  \nGiấy dịch vụ Chuyển nhượng sẽ không áp dụng trong trường hợp Nhà Đầu tư thực hiện chuyển nhượng số Chứng Chỉ quỹ từ tài khoản này sang tài khoản khác cùng tên thì Nhà Đầu tư tại Hai Đại Lý Phân Phối khác nhau.', 'nhượng, chuyển nhượng, hoặc bán một phần hoặc toàn bộ các khoản đầu tư vào Quỹ. Nhà đầu tư\ncó trách nhiệm tự mình thực hiện việc thẩm định và đánh giá mọi rủi ro liên quan đến đầu tư.  \nBản cáo bạch này bao gồm các thông tin về Quỹ, dự kiến các khoản đầu tư của Quỹ, các điều kiện\nvà quy định của Quỹ, hoặc các thông tin khác mà nhà đầu tư cần biết. Nhà đầu tư nên đọc kỹ Bản\ncáo bạch này và các tài liệu đính kèm trước khi ra quyết định đầu tư.\nTCC sẽ cập nhật Bản cáo bạch này nếu có bất kỳ thay đổi nào về thông tin.\nBản cáo bạch được cung cấp miễn phí tại văn phòng của TCC, các Đại lý phân phối và trên trang\nweb của TCC.  \nBản cáo bạch này được phát hành bởi:\nCông ty Cổ phần Quản lý Quỹ Ký Thương - TechcomCapital (“TCC”)', '**3.6. Rủi ro biến động giá**  \nRủi ro về biến động giá của Quỹ phát sinh khi một hay một số Nhà Đầu tư nắm giữ một số lượng lớn cổ phiếu của Quỹ quyết định thực hiện lệnh bán của các cổ phiếu của Quỹ này. Nắm giữ một số lượng lớn cổ phiếu của Quỹ quyết định bán.  \n**3.7. Rủi ro tái đầu tư**  \nRủi ro tái đầu tư là rủi ro có thể xảy ra khi các khoản đầu tư trái phiếu với dòng tiền lãi trái phiếu nhận được hàng kỳ và gốc trái phiếu nhận được vào thời điểm đáo hạn được đi tìm đầu tư nhận lại. Công ty Quản lý Quỹ quyết định bán các chứng khoán của Quỹ.', '- Không đầu tư vào quá 10% tổng giá trị chứng chỉ quỹ đang lưu hành của một quỹ đại chúng,\ncổ phiếu công ty quản lý quỹ khác có chứng khoán đại chúng;\n- Không đầu tư quá 20% tổng giá trị tài sản của quỹ vào chứng chỉ quỹ của một quỹ đại\nchúng, cổ phiếu của một công ty đầu tư chứng khoán đại chúng;\n- Không được đầu tư quá 50% tổng giá trị tài sản của quỹ vào các chứng chỉ quỹ đại chúng, cổ\nphiếu công ty đầu tư chứng khoán đại chúng;\nk) Không được đầu tư trực tiếp bất động sản, đã quỹ, kim loại quý hiếm;\n1) Phải có chứng khoán của ít nhất 06 tổ chức phát hành.\n2.2.5 Điều chỉnh danh mục đầu tư\nCơ cấu đầu tư của Quỹ mới chỉ được vược với các hạn chế đầu tư đã quy định tại điểm a,\nb, c, d, e và mục IX.2.2.4 và chỉ do các nguyên nhân sau:', 'Trong thời hạn 05 ngày làm việc kể từ ngày hoãn khẩn tại thời điểm điều chỉnh lại danh mục đầu tư.\nTrong thời hạn 05 ngày làm việc kể từ ngày hoãn khẩn tại thời điểm điều chỉnh lại danh mục đầu tư.\nTrong thời hạn 05 ngày làm việc kể từ ngày hoãn khẩn tại thời điểm điều chỉnh lại danh mục đầu tư.\nTrong thời hạn 05 ngày làm', 'liên quan đến các hoạt động của Quỹ mà Quỹ thực hiện hoặc gián tiếp hoặc tổng hợp các khoản phí và các chi phí/phí/giá dịch vụ liên quan đến các hoạt động của Quỹ mà Quỹ thực hiện hoặc gián tiếp hoặc tổng hợp các khoản phí và các chi phí/phí/giá dịch vụ liên quan đến các hoạt động của Quỹ mà Quỹ thực hiện hoặc gián tiếp hoặc tổng hợp các khoản phí và các chi phí/phí/giá dịch vụ liên quan đến các hoạt động của Quỹ mà Quỹ thực hiện hoặc gián tiếp hoặc tổng hợp các khoản phí và các chi phí/phí/giá dịch vụ liên quan đến các hoạt động của Quỹ mà Quỹ thực hiện hoặc gián tiếp hoặc tổng hợp các khoản phí và các chi phí/phí/giá dịch vụ liên quan đến', 'vụ liên quan đến các hoạt động của Quỹ mà Quỹ thực hiện hoặc gián tiếp hoặc tổng hợp các khoản phí và các chi phí/phí/giá dịch vụ liên quan đến các hoạt động của Quỹ mà Quỹ thực hiện hoặc gián tiếp hoặc tổng hợp các khoản phí và các chi phí/phí/giá dịch vụ liên quan đến các hoạt động của Quỹ mà Quỹ thực hiện hoặc gián tiếp hoặc tổng hợp các khoản phí và các chi phí/phí/giá dịch vụ liên quan đến các hoạt động của Quỹ mà Quỹ thực hiện hoặc gián tiếp hoặc tổng hợp các khoản phí và các chi phí/phí/giá dịch vụ liên quan đến các hoạt động của Quỹ mà Quỹ thực hiện hoặc gián tiếp hoặc tổng hợp các khoản phí và các chi phí/phí/giá dịch vụ liên quan đến các hoạt động của Quỹ mà Quỹ thực hiện hoặc gián tiếp hoặc tổng hợp các khoản phí và các chi phí/phí/giá dịch vụ liên quan đến các hoạt động của', 'cụ nợ của Chính phủ;\nd) Không được đầu tư quá 30% tổng giá trị tài sản của quỹ vào các tài sản quỹ định tại điểm a,\nb, d, e và f mục IX.2.2.3, phải hành bởi các công ty trong cùng một nhóm công ty cơ quan hệ\nsở hữu với nhau, thuộc sở hữu hợp của sau đây: Công ty con, các công ty sở hữu\nhien 35% cổ phần, phần vốn góp của nhau.nhóm công ty con, công ty mẹ. Tổng\nđộ phân đầu tư vào chứng khoán phái sinh tính bằng giá trị cam kết của hợp đồng xác định\ntheo quy định tại Phụ Lục 4 Điều Lệ Quỹ;\ne) Không được đầu tư quá 10% tổng giá trị tài sản của quỹ vào các tài sản quỹ định tại điểm d\nmục IX.2.2.3;\nf) Tổng giá trị các hạng mục đầu tư lớn trong danh mục đầu tư của quỹ không được vượt quá\n40% tổng giá trị tài sản của quỹ. Trong đó, hạng mục đầu tư lớn của quỹ là hạng mục đầu tư', 'phí/phí/giá dịch vụ liên quan đến các hoạt động của Quỹ mà Quỹ thực hiện hoặc gián tiếp hoặc tổng hợp các khoản phí và các chi phí/phí/giá dịch vụ liên quan đến các hoạt động của Quỹ mà Quỹ thực hiện hoặc gián tiếp hoặc tổng hợp các khoản phí và các chi phí/phí/giá dịch vụ liên quan đến các hoạt động của Quỹ mà Quỹ thực hiện hoặc gián tiếp hoặc tổng hợp các khoản phí và các chi phí/phí/giá dịch vụ liên quan đến các hoạt động của Quỹ mà Quỹ thực hiện hoặc gián tiếp hoặc tổng hợp các khoản phí và các chi phí/phí/giá dịch vụ liên quan đến các hoạt động của Quỹ mà Quỹ thực hiện hoặc gián tiếp hoặc tổng hợp các khoản phí và các chi phí/phí/giá dịch vụ liên quan đến các hoạt động của Quỹ mà Quỹ thực hiện hoặc gián tiếp hoặc tổng hợp các khoản phí và các chi phí/phí/giá dịch vụ liên quan đến các', '40% tổng giá trị tài sản của quỹ. Trong đó, hạng mục đầu tư lớn của quỹ là hạng mục đầu tư\nvào các loại tài sản quỹ định tại điểm a, d, và g mục IX.2.2.3 (ngoại trừ chứng chỉ tiền gửi)\nphải hành bởi cùng một tổ chức, có tổng giá trị chiếm từ 5% trở lên tổng giá trị tài sản của\nquỹ;\ng) Tại mọi thời điểm, tổng giá trị cam kết trong các giao dịch chứng khoán phái sinh, dự nợ vay\nvà các khoản phải trả của quỹ không được vượt giá trị tài sản ròng của quỹ;\nh) Không được đầu tư vào chứng khoán của Chính phủ Quỹ;\ni) Chỉ được đầu tư vào chứng chỉ quỹ đại chúng khác, công ty đầu tư chứng khoán đại chúng\ndo công ty quản lý quỹ khác quản lý và bảo đảm các hạn chế sau:\n- Không đầu tư vào quá 10% tổng giá trị chứng chỉ quỹ đang lưu hành của một quỹ đại chúng,', 'Quỹ thực hiện hoặc gián tiếp hoặc tổng hợp các khoản phí và các chi phí/phí/giá dịch vụ liên quan đến các hoạt động của Quỹ mà Quỹ thực hiện hoặc gián tiếp hoặc tổng hợp các khoản phí và các chi phí/phí/giá dịch vụ liên quan đến các hoạt động của Quỹ mà Quỹ thực hiện hoặc gián tiếp hoặc tổng hợp các khoản phí và các chi phí/phí/giá dịch vụ liên quan đến các hoạt động của Quỹ mà Quỹ thực hiện hoặc gián tiếp hoặc tổng hợp các khoản phí và các chi phí/phí/giá dịch vụ liên quan đến các hoạt động của Quỹ mà Quỹ thực hiện hoặc gián tiếp hoặc tổng hợp các khoản phí và các chi phí/phí/giá dịch vụ liên quan đến các hoạt động của Quỹ mà Quỹ thực hiện hoặc gián tiếp hoặc tổng hợp các khoản phí và các chi phí/phí/giá dịch vụ liên quan đến các hoạt động của Quỹ mà Quỹ thực hiện hoặc gián tiếp hoặc', 'dịch vụ liên quan đến các hoạt động của Quỹ mà Quỹ thực hiện hoặc gián tiếp hoặc tổng hợp các khoản phí và các chi phí/phí/giá dịch vụ liên quan đến các hoạt động của Quỹ mà Quỹ thực hiện hoặc gián tiếp hoặc tổng hợp các khoản phí và các chi phí/phí/giá dịch vụ liên quan đến các hoạt động của Quỹ mà Quỹ thực hiện hoặc gián tiếp hoặc tổng hợp các khoản phí và các chi phí/phí/giá dịch vụ liên quan đến các hoạt động của Quỹ mà Quỹ thực hiện hoặc gián tiếp hoặc tổng hợp các khoản phí và các chi phí/phí/giá dịch vụ liên quan đến các hoạt động của Quỹ mà Quỹ thực hiện hoặc gián tiếp hoặc tổng hợp các khoản phí và các chi phí/phí/giá dịch vụ liên quan đến các hoạt động của Quỹ mà Quỹ thực hiện hoặc gián tiếp hoặc tổng hợp các khoản phí và các chi phí/phí/giá dịch vụ liên quan đến các hoạt động', 'Quỹ đầu tư chứng khoán được mô tả trong Bản cáo bạch này là Quỹ được thành lập theo\nLuật Chứng khoán số 54/2019/QH14 Quốc hội Nước Cộng Hòa Xã hội Chủ nghĩa Việt\nNam thông qua ngày 26 tháng 11 năm 2019 và các văn bản hướng dẫn thi hành. Bản cáo\nbạch này đã được đăng ký với Ủy ban Chứng khoán Nhà nước ngày / /2022.  \nTHÔNG BÁO QUAN TRỌNG  \nCác nhà đầu tư nên nghiên cứu Bản cáo bạch này một cách cẩn trọng và toàn diện và không nên\ncoi nội dung hoặc tóm tắt ở đây là các tư vấn liên quan đến pháp lý, thuế, hoặc tài chính/đầu\ntư và nên tham khảo ý kiến chuyên gia tư vấn của mình về các yêu cầu pháp lý, thuế, năm\ngiữa, hoặc tư vấn về các khía cạnh khác của việc đầu tư, mua, cho tặng, năm giữ,\nnhượng, chuyển nhượng, hoặc bán một phần hoặc toàn bộ các khoản đầu tư vào Quỹ. Nhà đầu tư', 'chi phí/phí/giá dịch vụ liên quan đến các hoạt động của Quỹ mà Quỹ thực hiện hoặc gián tiếp hoặc tổng hợp các khoản phí và các chi phí/phí/giá dịch vụ liên quan đến các hoạt động của Quỹ mà Quỹ thực hiện hoặc gián tiếp hoặc tổng hợp các khoản phí và các chi phí/phí/giá dịch vụ liên quan đến các hoạt động của Quỹ mà Quỹ thực hiện hoặc gián tiếp hoặc tổng hợp các khoản phí và các chi phí/phí/giá dịch vụ liên quan đến các hoạt động của Quỹ mà Quỹ thực hiện hoặc gián tiếp hoặc tổng hợp các khoản phí và các chi phí/phí/giá dịch vụ liên quan đến các hoạt động của Quỹ mà Quỹ thực hiện hoặc gián tiếp hoặc tổng hợp các khoản phí và các chi phí/phí/giá dịch vụ liên quan đến các hoạt động của Quỹ mà Quỹ thực hiện hoặc gián tiếp hoặc tổng hợp các khoản phí và các chi phí/phí/giá dịch vụ liên quan đến', 'Trong thời hạn 05 ngày làm việc kể từ ngày hoãn khẩn tại thời điểm điều chỉnh lại danh mục đầu tư.\nTrong thời hạn 05 ngày làm việc kể từ ngày hoãn khẩn tại thời điểm điều chỉnh lại danh mục đầu tư.\nTrong thời hạn 05 ngày làm việc kể từ ngày hoãn khẩn tại thời điểm điều chỉnh lại danh mục đầu tư.\nTrong thời hạn 05 ngày làm việc kể từ ngày hoãn khẩn tại thời điểm điều chỉnh lại danh mục đầu tư.\nTrong thời hạn 05 ngày làm việc kể từ ngày hoãn khẩn tại thời điểm điều chỉnh lại danh mục đầu tư.\nTrong thời hạn 05 ngày làm việc kể từ ngày hoãn khẩn tại thời điểm điều chỉnh lại danh mục đầu tư.\nTrong thời hạn 05 ngày làm việc kể từ ngày hoãn khẩn tại thời điểm điều chỉnh lại danh mục đầu tư.\nTrong thời hạn 05 ngày làm việc kể từ ngày hoãn khẩn tại thời điểm điều chỉnh lại danh mục đầu tư.', 'Trong thời hạn 05 ngày làm việc kể từ ngày hoãn khẩn tại thời điểm điều chỉnh lại danh mục đầu tư.\nTrong thời hạn 05 ngày làm việc kể từ ngày hoãn khẩn tại thời điểm điều chỉnh lại danh mục đầu tư.\nTrong thời hạn 05 ngày làm việc kể từ ngày hoãn khẩn tại thời điểm điều chỉnh lại danh mục đầu tư.\nTrong thời hạn 05 ngày làm việc kể từ ngày hoãn khẩn tại thời điểm điều chỉnh lại danh mục đầu tư.\nTrong thời hạn 05 ngày làm việc kể từ ngày hoãn khẩn tại thời điểm điều chỉnh lại danh mục đầu tư.\nTrong thời hạn 05 ngày làm việc kể từ ngày hoãn khẩn tại thời điểm điều chỉnh lại danh mục đầu tư.\nTrong thời hạn 05 ngày làm việc kể từ ngày hoãn khẩn tại thời điểm điều chỉnh lại danh mục đầu tư.\nTrong thời hạn 05 ngày làm việc kể từ ngày hoãn khẩn tại thời điểm điều chỉnh lại danh mục đầu tư.', 'Trong thời hạn 05 ngày làm việc kể từ ngày hoãn khẩn tại thời điểm điều chỉnh lại danh mục đầu tư.\nTrong thời hạn 05 ngày làm việc kể từ ngày hoãn khẩn tại thời điểm điều chỉnh lại danh mục đầu tư.\nTrong thời hạn 05 ngày làm việc kể từ ngày hoãn khẩn tại thời điểm điều chỉnh lại danh mục đầu tư.\nTrong thời hạn 05 ngày làm việc kể từ ngày hoãn khẩn tại thời điểm điều chỉnh lại danh mục đầu tư.\nTrong thời hạn 05 ngày làm việc kể từ ngày hoãn khẩn tại thời điểm điều chỉnh lại danh mục đầu tư.\nTrong thời hạn 05 ngày làm việc kể từ ngày hoãn khẩn tại thời điểm điều chỉnh lại danh mục đầu tư.\nTrong thời hạn 05 ngày làm việc kể từ ngày hoãn khẩn tại thời điểm điều chỉnh lại danh mục đầu tư.\nTrong thời hạn 05 ngày làm việc kể từ ngày hoãn khẩn tại thời điểm điều chỉnh lại danh mục đầu tư.', 'Trong thời hạn 05 ngày làm việc kể từ ngày hoãn khẩn tại thời điểm điều chỉnh lại danh mục đầu tư.\nTrong thời hạn 05 ngày làm việc kể từ ngày hoãn khẩn tại thời điểm điều chỉnh lại danh mục đầu tư.\nTrong thời hạn 05 ngày làm việc kể từ ngày hoãn khẩn tại thời điểm điều chỉnh lại danh mục đầu tư.\nTrong thời hạn 05 ngày làm việc kể từ ngày hoãn khẩn tại thời điểm điều chỉnh lại danh mục đầu tư.\nTrong thời hạn 05 ngày làm việc kể từ ngày hoãn khẩn tại thời điểm điều chỉnh lại danh mục đầu tư.\nTrong thời hạn 05 ngày làm việc kể từ ngày hoãn khẩn tại thời điểm điều chỉnh lại danh mục đầu tư.\nTrong thời hạn 05 ngày làm việc kể từ ngày hoãn khẩn tại thời điểm điều chỉnh lại danh mục đầu tư.\nTrong thời hạn 05 ngày làm việc kể từ ngày hoãn khẩn tại thời điểm điều chỉnh lại danh mục đầu tư.', 'Trong thời hạn 05 ngày làm việc kể từ ngày hoãn khẩn tại thời điểm điều chỉnh lại danh mục đầu tư.\nTrong thời hạn 05 ngày làm việc kể từ ngày hoãn khẩn tại thời điểm điều chỉnh lại danh mục đầu tư.\nTrong thời hạn 05 ngày làm việc kể từ ngày hoãn khẩn tại thời điểm điều chỉnh lại danh mục đầu tư.\nTrong thời hạn 05 ngày làm việc kể từ ngày hoãn khẩn tại thời điểm điều chỉnh lại danh mục đầu tư.\nTrong thời hạn 05 ngày làm việc kể từ ngày hoãn khẩn tại thời điểm điều chỉnh lại danh mục đầu tư.\nTrong thời hạn 05 ngày làm việc kể từ ngày hoãn khẩn tại thời điểm điều chỉnh lại danh mục đầu tư.\nTrong thời hạn 05 ngày làm việc kể từ ngày hoãn khẩn tại thời điểm điều chỉnh lại danh mục đầu tư.\nTrong thời hạn 05 ngày làm việc kể từ ngày hoãn khẩn tại thời điểm điều chỉnh lại danh mục đầu tư.', 'Trong thời hạn 05 ngày làm việc kể từ ngày hoãn khẩn tại thời điểm điều chỉnh lại danh mục đầu tư.\nTrong thời hạn 05 ngày làm việc kể từ ngày hoãn khẩn tại thời điểm điều chỉnh lại danh mục đầu tư.\nTrong thời hạn 05 ngày làm việc kể từ ngày hoãn khẩn tại thời điểm điều chỉnh lại danh mục đầu tư.\nTrong thời hạn 05 ngày làm việc kể từ ngày hoãn khẩn tại thời điểm điều chỉnh lại danh mục đầu tư.\nTrong thời hạn 05 ngày làm việc kể từ ngày hoãn khẩn tại thời điểm điều chỉnh lại danh mục đầu tư.\nTrong thời hạn 05 ngày làm việc kể từ ngày hoãn khẩn tại thời điểm điều chỉnh lại danh mục đầu tư.\nTrong thời hạn 05 ngày làm việc kể từ ngày hoãn khẩn tại thời điểm điều chỉnh lại danh mục đầu tư.\nTrong thời hạn 05 ngày làm việc kể từ ngày hoãn khẩn tại thời điểm điều chỉnh lại danh mục đầu tư.', 'Trong thời hạn 05 ngày làm việc kể từ ngày hoãn khẩn tại thời điểm điều chỉnh lại danh mục đầu tư.\nTrong thời hạn 05 ngày làm việc kể từ ngày hoãn khẩn tại thời điểm điều chỉnh lại danh mục đầu tư.\nTrong thời hạn 05 ngày làm việc kể từ ngày hoãn khẩn tại thời điểm điều chỉnh lại danh mục đầu tư.\nTrong thời hạn 05 ngày làm việc kể từ ngày hoãn khẩn tại thời điểm điều chỉnh lại danh mục đầu tư.\nTrong thời hạn 05 ngày làm việc kể từ ngày hoãn khẩn tại thời điểm điều chỉnh lại danh mục đầu tư.\nTrong thời hạn 05 ngày làm việc kể từ ngày hoãn khẩn tại thời điểm điều chỉnh lại danh mục đầu tư.\nTrong thời hạn 05 ngày làm việc kể từ ngày hoãn khẩn tại thời điểm điều chỉnh lại danh mục đầu tư.\nTrong thời hạn 05 ngày làm việc kể từ ngày hoãn khẩn tại thời điểm điều chỉnh lại danh mục đầu tư.', 'Trong thời hạn 05 ngày làm việc kể từ ngày hoãn khẩn tại thời điểm điều chỉnh lại danh mục đầu tư.\nTrong thời hạn 05 ngày làm việc kể từ ngày hoãn khẩn tại thời điểm điều chỉnh lại danh mục đầu tư.\nTrong thời hạn 05 ngày làm việc kể từ ngày hoãn khẩn tại thời điểm điều chỉnh lại danh mục đầu tư.\nTrong thời hạn 05 ngày làm việc kể từ ngày hoãn khẩn tại thời điểm điều chỉnh lại danh mục đầu tư.\nTrong thời hạn 05 ngày làm việc kể từ ngày hoãn khẩn tại thời điểm điều chỉnh lại danh mục đầu tư.\nTrong thời hạn 05 ngày làm việc kể từ ngày hoãn khẩn tại thời điểm điều chỉnh lại danh mục đầu tư.\nTrong thời hạn 05 ngày làm việc kể từ ngày hoãn khẩn tại thời điểm điều chỉnh lại danh mục đầu tư.\nTrong thời hạn 05 ngày làm việc kể từ ngày hoãn khẩn tại thời điểm điều chỉnh lại danh mục đầu tư.', 'Trong thời hạn 05 ngày làm việc kể từ ngày hoãn khẩn tại thời điểm điều chỉnh lại danh mục đầu tư.\nTrong thời hạn 05 ngày làm việc kể từ ngày hoãn khẩn tại thời điểm điều chỉnh lại danh mục đầu tư.\nTrong thời hạn 05 ngày làm việc kể từ ngày hoãn khẩn tại thời điểm điều chỉnh lại danh mục đầu tư.\nTrong thời hạn 05 ngày làm việc kể từ ngày hoãn khẩn tại thời điểm điều chỉnh lại danh mục đầu tư.\nTrong thời hạn 05 ngày làm việc kể từ ngày hoãn khẩn tại thời điểm điều chỉnh lại danh mục đầu tư.\nTrong thời hạn 05 ngày làm việc kể từ ngày hoãn khẩn tại thời điểm điều chỉnh lại danh mục đầu tư.\nTrong thời hạn 05 ngày làm việc kể từ ngày hoãn khẩn tại thời điểm điều chỉnh lại danh mục đầu tư.\nTrong thời hạn 05 ngày làm việc kể từ ngày hoãn khẩn tại thời điểm điều chỉnh lại danh mục đầu tư.', 'Trong thời hạn 05 ngày làm việc kể từ ngày hoãn khẩn tại thời điểm điều chỉnh lại danh mục đầu tư.\nTrong thời hạn 05 ngày làm việc kể từ ngày hoãn khẩn tại thời điểm điều chỉnh lại danh mục đầu tư.\nTrong thời hạn 05 ngày làm việc kể từ ngày hoãn khẩn tại thời điểm điều chỉnh lại danh mục đầu tư.\nTrong thời hạn 05 ngày làm việc kể từ ngày hoãn khẩn tại thời điểm điều chỉnh lại danh mục đầu tư.\nTrong thời hạn 05 ngày làm việc kể từ ngày hoãn khẩn tại thời điểm điều chỉnh lại danh mục đầu tư.\nTrong thời hạn 05 ngày làm việc kể từ ngày hoãn khẩn tại thời điểm điều chỉnh lại danh mục đầu tư.\nTrong thời hạn 05 ngày làm việc kể từ ngày hoãn khẩn tại thời điểm điều chỉnh lại danh mục đầu tư.\nTrong thời hạn 05 ngày làm việc kể từ ngày hoãn khẩn tại thời điểm điều chỉnh lại danh mục đầu tư.', 'Trong thời hạn 05 ngày làm việc kể từ ngày hoãn khẩn tại thời điểm điều chỉnh lại danh mục đầu tư.\nTrong thời hạn 05 ngày làm việc kể từ ngày hoãn khẩn tại thời điểm điều chỉnh lại danh mục đầu tư.\nTrong thời hạn 05 ngày làm việc kể từ ngày hoãn khẩn tại thời điểm điều chỉnh lại danh mục đầu tư.\nTrong thời hạn 05 ngày làm việc kể từ ngày hoãn khẩn tại thời điểm điều chỉnh lại danh mục đầu tư.\nTrong thời hạn 05 ngày làm việc kể từ ngày hoãn khẩn tại thời điểm điều chỉnh lại danh mục đầu tư.\nTrong thời hạn 05 ngày làm việc kể từ ngày hoãn khẩn tại thời điểm điều chỉnh lại danh mục đầu tư.\nTrong thời hạn 05 ngày làm việc kể từ ngày hoãn khẩn tại thời điểm điều chỉnh lại danh mục đầu tư.\nTrong thời hạn 05 ngày làm việc kể từ ngày hoãn khẩn tại thời điểm điều chỉnh lại danh mục đầu tư.']",Mức đầu tư tối thiểu là 10.000 VNĐ.
Số lượng chứng chỉ quỹ tối thiểu phải bán trong một lệnh bán (Minimum Redemption) là bao nhiêu?,Tôi không tìm thấy thông tin đó trong tài liệu.,"['nhiên, thảm họa thiên nhiên, thảm họa thiên nhiên, thảm họa thiên nhiên, thảm họa thiên nhiên, thảm họa thiên nhiên, thảm họa thiên nhiên, thảm họa thiên nhiên, thảm họa thiên nhiên,', 'nhiên, thảm họa thiên nhiên, thảm họa thiên nhiên, thảm họa thiên nhiên, thảm họa thiên nhiên, thảm họa thiên nhiên, thảm họa thiên nhiên, thảm họa thiên nhiên, thảm họa thiên nhiên, thảm họa thiên nhiên, thảm họa thiên nhiên, thảm họa thiên nhiên, thảm họa thiên nhiên, thảm họa thiên nhiên, thảm họa thiên nhiên, thảm họa thiên nhiên, thảm họa thiên nhiên, thảm họa thiên nhiên, thảm họa thiên nhiên, thảm họa thiên nhiên, thảm họa thiên nhiên, thảm họa thiên nhiên, thảm họa thiên nhiên, thảm họa thiên nhiên, thảm họa thiên nhiên, thảm họa thiên nhiên, thảm họa thiên nhiên, thảm họa thiên nhiên, thảm họa thiên nhiên, thảm họa thiên nhiên, thảm họa thiên nhiên, thảm họa thiên nhiên, thảm họa thiên nhiên, thảm họa thiên nhiên, thảm họa thiên nhiên, thảm họa thiên nhiên, thảm họa thiên nhiên,', 'nhiên, thảm họa thiên nhiên, thảm họa thiên nhiên, thảm họa thiên nhiên, thảm họa thiên nhiên, thảm họa thiên nhiên, thảm họa thiên nhiên, thảm họa thiên nhiên, thảm họa thiên nhiên, thảm họa thiên nhiên, thảm họa thiên nhiên, thảm họa thiên nhiên, thảm họa thiên nhiên, thảm họa thiên nhiên, thảm họa thiên nhiên, thảm họa thiên nhiên, thảm họa thiên nhiên, thảm họa thiên nhiên, thảm họa thiên nhiên, thảm họa thiên nhiên, thảm họa thiên nhiên, thảm họa thiên nhiên, thảm họa thiên nhiên, thảm họa thiên nhiên, thảm họa thiên nhiên, thảm họa thiên nhiên, thảm họa thiên nhiên, thảm họa thiên nhiên, thảm họa thiên nhiên, thảm họa thiên nhiên, thảm họa thiên nhiên, thảm họa thiên nhiên, thảm họa thiên nhiên, thảm họa thiên nhiên, thảm họa thiên nhiên, thảm họa thiên nhiên, thảm họa thiên nhiên,', 'nhiên, thảm họa thiên nhiên, thảm họa thiên nhiên, thảm họa thiên nhiên, thảm họa thiên nhiên, thảm họa thiên nhiên, thảm họa thiên nhiên, thảm họa thiên nhiên, thảm họa thiên nhiên, thảm họa thiên nhiên, thảm họa thiên nhiên, thảm họa thiên nhiên, thảm họa thiên nhiên, thảm họa thiên nhiên, thảm họa thiên nhiên, thảm họa thiên nhiên, thảm họa thiên nhiên, thảm họa thiên nhiên, thảm họa thiên nhiên, thảm họa thiên nhiên, thảm họa thiên nhiên, thảm họa thiên nhiên, thảm họa thiên nhiên, thảm họa thiên nhiên, thảm họa thiên nhiên, thảm họa thiên nhiên, thảm họa thiên nhiên, thảm họa thiên nhiên, thảm họa thiên nhiên, thảm họa thiên nhiên, thảm họa thiên nhiên, thảm họa thiên nhiên, thảm họa thiên nhiên, thảm họa thiên nhiên, thảm họa thiên nhiên, thảm họa thiên nhiên, thảm họa thiên nhiên,', 'nhiên, thảm họa thiên nhiên, thảm họa thiên nhiên, thảm họa thiên nhiên, thảm họa thiên nhiên, thảm họa thiên nhiên, thảm họa thiên nhiên, thảm họa thiên nhiên, thảm họa thiên nhiên, thảm họa thiên nhiên, thảm họa thiên nhiên, thảm họa thiên nhiên, thảm họa thiên nhiên, thảm họa thiên nhiên, thảm họa thiên nhiên, thảm họa thiên nhiên, thảm họa thiên nhiên, thảm họa thiên nhiên, thảm họa thiên nhiên, thảm họa thiên nhiên, thảm họa thiên nhiên, thảm họa thiên nhiên, thảm họa thiên nhiên, thảm họa thiên nhiên, thảm họa thiên nhiên, thảm họa thiên nhiên, thảm họa thiên nhiên, thảm họa thiên nhiên, thảm họa thiên nhiên, thảm họa thiên nhiên, thảm họa thiên nhiên, thảm họa thiên nhiên, thảm họa thiên nhiên, thảm họa thiên nhiên, thảm họa thiên nhiên, thảm họa thiên nhiên, thảm họa thiên nhiên,', 'nhiên, thảm họa thiên nhiên, thảm họa thiên nhiên, thảm họa thiên nhiên, thảm họa thiên nhiên, thảm họa thiên nhiên, thảm họa thiên nhiên, thảm họa thiên nhiên, thảm họa thiên nhiên, thảm họa thiên nhiên, thảm họa thiên nhiên, thảm họa thiên nhiên, thảm họa thiên nhiên, thảm họa thiên nhiên, thảm họa thiên nhiên, thảm họa thiên nhiên, thảm họa thiên nhiên, thảm họa thiên nhiên, thảm họa thiên nhiên, thảm họa thiên nhiên, thảm họa thiên nhiên, thảm họa thiên nhiên, thảm họa thiên nhiên, thảm họa thiên nhiên, thảm họa thiên nhiên, thảm họa thiên nhiên, thảm họa thiên nhiên, thảm họa thiên nhiên, thảm họa thiên nhiên, thảm họa thiên nhiên, thảm họa thiên nhiên, thảm họa thiên nhiên, thảm họa thiên nhiên, thảm họa thiên nhiên, thảm họa thiên nhiên, thảm họa thiên nhiên, thảm họa thiên nhiên,', 'nhiên, thảm họa thiên nhiên, thảm họa thiên nhiên, thảm họa thiên nhiên, thảm họa thiên nhiên, thảm họa thiên nhiên, thảm họa thiên nhiên, thảm họa thiên nhiên, thảm họa thiên nhiên, thảm họa thiên nhiên, thảm họa thiên nhiên, thảm họa thiên nhiên, thảm họa thiên nhiên, thảm họa thiên nhiên, thảm họa thiên nhiên, thảm họa thiên nhiên, thảm họa thiên nhiên, thảm họa thiên nhiên, thảm họa thiên nhiên, thảm họa thiên nhiên, thảm họa thiên nhiên, thảm họa thiên nhiên, thảm họa thiên nhiên, thảm họa thiên nhiên, thảm họa thiên nhiên, thảm họa thiên nhiên, thảm họa thiên nhiên, thảm họa thiên nhiên, thảm họa thiên nhiên, thảm họa thiên nhiên, thảm họa thiên nhiên, thảm họa thiên nhiên, thảm họa thiên nhiên, thảm họa thiên nhiên, thảm họa thiên nhiên, thảm họa thiên nhiên, thảm họa thiên nhiên,', 'nhiên, thảm họa thiên nhiên, thảm họa thiên nhiên, thảm họa thiên nhiên, thảm họa thiên nhiên, thảm họa thiên nhiên, thảm họa thiên nhiên, thảm họa thiên nhiên, thảm họa thiên nhiên, thảm họa thiên nhiên, thảm họa thiên nhiên, thảm họa thiên nhiên, thảm họa thiên nhiên, thảm họa thiên nhiên, thảm họa thiên nhiên, thảm họa thiên nhiên, thảm họa thiên nhiên, thảm họa thiên nhiên, thảm họa thiên nhiên, thảm họa thiên nhiên, thảm họa thiên nhiên, thảm họa thiên nhiên, thảm họa thiên nhiên, thảm họa thiên nhiên, thảm họa thiên nhiên, thảm họa thiên nhiên, thảm họa thiên nhiên, thảm họa thiên nhiên, thảm họa thiên nhiên, thảm họa thiên nhiên, thảm họa thiên nhiên, thảm họa thiên nhiên, thảm họa thiên nhiên, thảm họa thiên nhiên, thảm họa thiên nhiên, thảm họa thiên nhiên, thảm họa thiên nhiên,', 'nhiên, thảm họa thiên nhiên, thảm họa thiên nhiên, thảm họa thiên nhiên, thảm họa thiên nhiên, thảm họa thiên nhiên, thảm họa thiên nhiên, thảm họa thiên nhiên, thảm họa thiên nhiên, thảm họa thiên nhiên, thảm họa thiên nhiên, thảm họa thiên nhiên, thảm họa thiên nhiên, thảm họa thiên nhiên, thảm họa thiên nhiên, thảm họa thiên nhiên, thảm họa thiên nhiên, thảm họa thiên nhiên, thảm họa thiên nhiên, thảm họa thiên nhiên, thảm họa thiên nhiên, thảm họa thiên nhiên, thảm họa thiên nhiên, thảm họa thiên nhiên, thảm họa thiên nhiên, thảm họa thiên nhiên, thảm họa thiên nhiên, thảm họa thiên nhiên, thảm họa thiên nhiên, thảm họa thiên nhiên, thảm họa thiên nhiên, thảm họa thiên nhiên, thảm họa thiên nhiên, thảm họa thiên nhiên, thảm họa thiên nhiên, thảm họa thiên nhiên, thảm họa thiên nhiên,', 'nhiên, thảm họa thiên nhiên, thảm họa thiên nhiên, thảm họa thiên nhiên, thảm họa thiên nhiên, thảm họa thiên nhiên, thảm họa thiên nhiên, thảm họa thiên nhiên, thảm họa thiên nhiên, thảm họa thiên nhiên, thảm họa thiên nhiên, thảm họa thiên nhiên, thảm họa thiên nhiên, thảm họa thiên nhiên, thảm họa thiên nhiên, thảm họa thiên nhiên, thảm họa thiên nhiên, thảm họa thiên nhiên, thảm họa thiên nhiên, thảm họa thiên nhiên, thảm họa thiên nhiên, thảm họa thiên nhiên, thảm họa thiên nhiên, thảm họa thiên nhiên, thảm họa thiên nhiên, thảm họa thiên nhiên, thảm họa thiên nhiên, thảm họa thiên nhiên, thảm họa thiên nhiên, thảm họa thiên nhiên, thảm họa thiên nhiên, thảm họa thiên nhiên, thảm họa thiên nhiên, thảm họa thiên nhiên, thảm họa thiên nhiên, thảm họa thiên nhiên, thảm họa thiên nhiên,', 'nhiên, thảm họa thiên nhiên, thảm họa thiên nhiên, thảm họa thiên nhiên, thảm họa thiên nhiên, thảm họa thiên nhiên, thảm họa thiên nhiên, thảm họa thiên nhiên, thảm họa thiên nhiên, thảm họa thiên nhiên, thảm họa thiên nhiên, thảm họa thiên nhiên, thảm họa thiên nhiên, thảm họa thiên nhiên, thảm họa thiên nhiên, thảm họa thiên nhiên, thảm họa thiên nhiên, thảm họa thiên nhiên, thảm họa thiên nhiên, thảm họa thiên nhiên, thảm họa thiên nhiên, thảm họa thiên nhiên, thảm họa thiên nhiên, thảm họa thiên nhiên, thảm họa thiên nhiên, thảm họa thiên nhiên, thảm họa thiên nhiên, thảm họa thiên nhiên, thảm họa thiên nhiên, thảm họa thiên nhiên, thảm họa thiên nhiên, thảm họa thiên nhiên, thảm họa thiên nhiên, thảm họa thiên nhiên, thảm họa thiên nhiên, thảm họa thiên nhiên, thảm họa thiên nhiên,', 'nhiên, thảm họa thiên nhiên, thảm họa thiên nhiên, thảm họa thiên nhiên, thảm họa thiên nhiên, thảm họa thiên nhiên, thảm họa thiên nhiên, thảm họa thiên nhiên, thảm họa thiên nhiên, thảm họa thiên nhiên, thảm họa thiên nhiên, thảm họa thiên nhiên, thảm họa thiên nhiên, thảm họa thiên nhiên, thảm họa thiên nhiên, thảm họa thiên nhiên, thảm họa thiên nhiên, thảm họa thiên nhiên, thảm họa thiên nhiên, thảm họa thiên nhiên, thảm họa thiên nhiên, thảm họa thiên nhiên, thảm họa thiên nhiên, thảm họa thiên nhiên, thảm họa thiên nhiên, thảm họa thiên nhiên, thảm họa thiên nhiên, thảm họa thiên nhiên, thảm họa thiên nhiên, thảm họa thiên nhiên, thảm họa thiên nhiên, thảm họa thiên nhiên, thảm họa thiên nhiên, thảm họa thiên nhiên, thảm họa thiên nhiên, thảm họa thiên nhiên, thảm họa thiên nhiên,', 'nhiên, thảm họa thiên nhiên, thảm họa thiên nhiên, thảm họa thiên nhiên, thảm họa thiên nhiên, thảm họa thiên nhiên, thảm họa thiên nhiên, thảm họa thiên nhiên, thảm họa thiên nhiên, thảm họa thiên nhiên, thảm họa thiên nhiên, thảm họa thiên nhiên, thảm họa thiên nhiên, thảm họa thiên nhiên, thảm họa thiên nhiên, thảm họa thiên nhiên, thảm họa thiên nhiên, thảm họa thiên nhiên, thảm họa thiên nhiên, thảm họa thiên nhiên, thảm họa thiên nhiên, thảm họa thiên nhiên, thảm họa thiên nhiên, thảm họa thiên nhiên, thảm họa thiên nhiên, thảm họa thiên nhiên, thảm họa thiên nhiên, thảm họa thiên nhiên, thảm họa thiên nhiên, thảm họa thiên nhiên, thảm họa thiên nhiên, thảm họa thiên nhiên, thảm họa thiên nhiên, thảm họa thiên nhiên, thảm họa thiên nhiên, thảm họa thiên nhiên, thảm họa thiên nhiên,', 'nhiên, thảm họa thiên nhiên, thảm họa thiên nhiên, thảm họa thiên nhiên, thảm họa thiên nhiên, thảm họa thiên nhiên, thảm họa thiên nhiên, thảm họa thiên nhiên, thảm họa thiên nhiên, thảm họa thiên nhiên, thảm họa thiên nhiên, thảm họa thiên nhiên, thảm họa thiên nhiên, thảm họa thiên nhiên, thảm họa thiên nhiên, thảm họa thiên nhiên, thảm họa thiên nhiên, thảm họa thiên nhiên, thảm họa thiên nhiên, thảm họa thiên nhiên, thảm họa thiên nhiên, thảm họa thiên nhiên, thảm họa thiên nhiên, thảm họa thiên nhiên, thảm họa thiên nhiên, thảm họa thiên nhiên, thảm họa thiên nhiên, thảm họa thiên nhiên, thảm họa thiên nhiên, thảm họa thiên nhiên, thảm họa thiên nhiên, thảm họa thiên nhiên, thảm họa thiên nhiên, thảm họa thiên nhiên, thảm họa thiên nhiên, thảm họa thiên nhiên, thảm họa thiên nhiên,', 'nhiên, thảm họa thiên nhiên, thảm họa thiên nhiên, thảm họa thiên nhiên, thảm họa thiên nhiên, thảm họa thiên nhiên, thảm họa thiên nhiên, thảm họa thiên nhiên, thảm họa thiên nhiên, thảm họa thiên nhiên, thảm họa thiên nhiên, thảm họa thiên nhiên, thảm họa thiên nhiên, thảm họa thiên nhiên, thảm họa thiên nhiên, thảm họa thiên nhiên, thảm họa thiên nhiên, thảm họa thiên nhiên, thảm họa thiên nhiên, thảm họa thiên nhiên, thảm họa thiên nhiên, thảm họa thiên nhiên, thảm họa thiên nhiên, thảm họa thiên nhiên, thảm họa thiên nhiên, thảm họa thiên nhiên, thảm họa thiên nhiên, thảm họa thiên nhiên, thảm họa thiên nhiên, thảm họa thiên nhiên, thảm họa thiên nhiên, thảm họa thiên nhiên, thảm họa thiên nhiên, thảm họa thiên nhiên, thảm họa thiên nhiên, thảm họa thiên nhiên, thảm họa thiên nhiên,', 'nhiên, thảm họa thiên nhiên, thảm họa thiên nhiên, thảm họa thiên nhiên, thảm họa thiên nhiên, thảm họa thiên nhiên, thảm họa thiên nhiên, thảm họa thiên nhiên, thảm họa thiên nhiên, thảm họa thiên nhiên, thảm họa thiên nhiên, thảm họa thiên nhiên, thảm họa thiên nhiên, thảm họa thiên nhiên, thảm họa thiên nhiên, thảm họa thiên nhiên, thảm họa thiên nhiên, thảm họa thiên nhiên, thảm họa thiên nhiên, thảm họa thiên nhiên, thảm họa thiên nhiên, thảm họa thiên nhiên, thảm họa thiên nhiên, thảm họa thiên nhiên, thảm họa thiên nhiên, thảm họa thiên nhiên, thảm họa thiên nhiên, thảm họa thiên nhiên, thảm họa thiên nhiên, thảm họa thiên nhiên, thảm họa thiên nhiên, thảm họa thiên nhiên, thảm họa thiên nhiên, thảm họa thiên nhiên, thảm họa thiên nhiên, thảm họa thiên nhiên, thảm họa thiên nhiên,', 'nhiên, thảm họa thiên nhiên, thảm họa thiên nhiên, thảm họa thiên nhiên, thảm họa thiên nhiên, thảm họa thiên nhiên, thảm họa thiên nhiên, thảm họa thiên nhiên, thảm họa thiên nhiên, thảm họa thiên nhiên, thảm họa thiên nhiên, thảm họa thiên nhiên, thảm họa thiên nhiên, thảm họa thiên nhiên, thảm họa thiên nhiên, thảm họa thiên nhiên, thảm họa thiên nhiên, thảm họa thiên nhiên, thảm họa thiên nhiên, thảm họa thiên nhiên, thảm họa thiên nhiên, thảm họa thiên nhiên, thảm họa thiên nhiên, thảm họa thiên nhiên, thảm họa thiên nhiên, thảm họa thiên nhiên, thảm họa thiên nhiên, thảm họa thiên nhiên, thảm họa thiên nhiên, thảm họa thiên nhiên, thảm họa thiên nhiên, thảm họa thiên nhiên, thảm họa thiên nhiên, thảm họa thiên nhiên, thảm họa thiên nhiên, thảm họa thiên nhiên, thảm họa thiên nhiên,', 'nhiên, thảm họa thiên nhiên, thảm họa thiên nhiên, thảm họa thiên nhiên, thảm họa thiên nhiên, thảm họa thiên nhiên, thảm họa thiên nhiên, thảm họa thiên nhiên, thảm họa thiên nhiên, thảm họa thiên nhiên, thảm họa thiên nhiên, thảm họa thiên nhiên, thảm họa thiên nhiên, thảm họa thiên nhiên, thảm họa thiên nhiên, thảm họa thiên nhiên, thảm họa thiên nhiên, thảm họa thiên nhiên, thảm họa thiên nhiên, thảm họa thiên nhiên, thảm họa thiên nhiên, thảm họa thiên nhiên, thảm họa thiên nhiên, thảm họa thiên nhiên, thảm họa thiên nhiên, thảm họa thiên nhiên, thảm họa thiên nhiên, thảm họa thiên nhiên, thảm họa thiên nhiên, thảm họa thiên nhiên, thảm họa thiên nhiên, thảm họa thiên nhiên, thảm họa thiên nhiên, thảm họa thiên nhiên, thảm họa thiên nhiên, thảm họa thiên nhiên, thảm họa thiên nhiên,', 'nhiên, thảm họa thiên nhiên, thảm họa thiên nhiên, thảm họa thiên nhiên, thảm họa thiên nhiên, thảm họa thiên nhiên, thảm họa thiên nhiên, thảm họa thiên nhiên, thảm họa thiên nhiên, thảm họa thiên nhiên, thảm họa thiên nhiên, thảm họa thiên nhiên, thảm họa thiên nhiên, thảm họa thiên nhiên, thảm họa thiên nhiên, thảm họa thiên nhiên, thảm họa thiên nhiên, thảm họa thiên nhiên, thảm họa thiên nhiên, thảm họa thiên nhiên, thảm họa thiên nhiên, thảm họa thiên nhiên, thảm họa thiên nhiên, thảm họa thiên nhiên, thảm họa thiên nhiên, thảm họa thiên nhiên, thảm họa thiên nhiên, thảm họa thiên nhiên, thảm họa thiên nhiên, thảm họa thiên nhiên, thảm họa thiên nhiên, thảm họa thiên nhiên, thảm họa thiên nhiên, thảm họa thiên nhiên, thảm họa thiên nhiên, thảm họa thiên nhiên, thảm họa thiên nhiên,', 'nhiên, thảm họa thiên nhiên, thảm họa thiên nhiên, thảm họa thiên nhiên, thảm họa thiên nhiên, thảm họa thiên nhiên, thảm họa thiên nhiên, thảm họa thiên nhiên, thảm họa thiên nhiên, thảm họa thiên nhiên, thảm họa thiên nhiên, thảm họa thiên nhiên, thảm họa thiên nhiên, thảm họa thiên nhiên, thảm họa thiên nhiên, thảm họa thiên nhiên, thảm họa thiên nhiên, thảm họa thiên nhiên, thảm họa thiên nhiên, thảm họa thiên nhiên, thảm họa thiên nhiên, thảm họa thiên nhiên, thảm họa thiên nhiên, thảm họa thiên nhiên, thảm họa thiên nhiên, thảm họa thiên nhiên, thảm họa thiên nhiên, thảm họa thiên nhiên, thảm họa thiên nhiên, thảm họa thiên nhiên, thảm họa thiên nhiên, thảm họa thiên nhiên, thảm họa thiên nhiên, thảm họa thiên nhiên, thảm họa thiên nhiên, thảm họa thiên nhiên, thảm họa thiên nhiên,', 'nhiên, thảm họa thiên nhiên, thảm họa thiên nhiên, thảm họa thiên nhiên, thảm họa thiên nhiên, thảm họa thiên nhiên, thảm họa thiên nhiên, thảm họa thiên nhiên, thảm họa thiên nhiên, thảm họa thiên nhiên, thảm họa thiên nhiên, thảm họa thiên nhiên, thảm họa thiên nhiên, thảm họa thiên nhiên, thảm họa thiên nhiên, thảm họa thiên nhiên, thảm họa thiên nhiên, thảm họa thiên nhiên, thảm họa thiên nhiên, thảm họa thiên nhiên, thảm họa thiên nhiên, thảm họa thiên nhiên, thảm họa thiên nhiên, thảm họa thiên nhiên, thảm họa thiên nhiên, thảm họa thiên nhiên, thảm họa thiên nhiên, thảm họa thiên nhiên, thảm họa thiên nhiên, thảm họa thiên nhiên, thảm họa thiên nhiên, thảm họa thiên nhiên, thảm họa thiên nhiên, thảm họa thiên nhiên, thảm họa thiên nhiên, thảm họa thiên nhiên, thảm họa thiên nhiên,', 'nhiên, thảm họa thiên nhiên, thảm họa thiên nhiên, thảm họa thiên nhiên, thảm họa thiên nhiên, thảm họa thiên nhiên, thảm họa thiên nhiên, thảm họa thiên nhiên, thảm họa thiên nhiên, thảm họa thiên nhiên, thảm họa thiên nhiên, thảm họa thiên nhiên, thảm họa thiên nhiên, thảm họa thiên nhiên, thảm họa thiên nhiên, thảm họa thiên nhiên, thảm họa thiên nhiên, thảm họa thiên nhiên, thảm họa thiên nhiên, thảm họa thiên nhiên, thảm họa thiên nhiên, thảm họa thiên nhiên, thảm họa thiên nhiên, thảm họa thiên nhiên, thảm họa thiên nhiên, thảm họa thiên nhiên, thảm họa thiên nhiên, thảm họa thiên nhiên, thảm họa thiên nhiên, thảm họa thiên nhiên, thảm họa thiên nhiên, thảm họa thiên nhiên, thảm họa thiên nhiên, thảm họa thiên nhiên, thảm họa thiên nhiên, thảm họa thiên nhiên, thảm họa thiên nhiên,', 'nhiên, thảm họa thiên nhiên, thảm họa thiên nhiên, thảm họa thiên nhiên, thảm họa thiên nhiên, thảm họa thiên nhiên, thảm họa thiên nhiên, thảm họa thiên nhiên, thảm họa thiên nhiên, thảm họa thiên nhiên, thảm họa thiên nhiên, thảm họa thiên nhiên, thảm họa thiên nhiên, thảm họa thiên nhiên, thảm họa thiên nhiên, thảm họa thiên nhiên, thảm họa thiên nhiên, thảm họa thiên nhiên, thảm họa thiên nhiên, thảm họa thiên nhiên, thảm họa thiên nhiên, thảm họa thiên nhiên, thảm họa thiên nhiên, thảm họa thiên nhiên, thảm họa thiên nhiên, thảm họa thiên nhiên, thảm họa thiên nhiên, thảm họa thiên nhiên, thảm họa thiên nhiên, thảm họa thiên nhiên, thảm họa thiên nhiên, thảm họa thiên nhiên, thảm họa thiên nhiên, thảm họa thiên nhiên, thảm họa thiên nhiên, thảm họa thiên nhiên, thảm họa thiên nhiên,', 'nhiên, thảm họa thiên nhiên, thảm họa thiên nhiên, thảm họa thiên nhiên, thảm họa thiên nhiên, thảm họa thiên nhiên, thảm họa thiên nhiên, thảm họa thiên nhiên, thảm họa thiên nhiên, thảm họa thiên nhiên, thảm họa thiên nhiên, thảm họa thiên nhiên, thảm họa thiên nhiên, thảm họa thiên nhiên, thảm họa thiên nhiên, thảm họa thiên nhiên, thảm họa thiên nhiên, thảm họa thiên nhiên, thảm họa thiên nhiên, thảm họa thiên nhiên, thảm họa thiên nhiên, thảm họa thiên nhiên, thảm họa thiên nhiên, thảm họa thiên nhiên, thảm họa thiên nhiên, thảm họa thiên nhiên, thảm họa thiên nhiên, thảm họa thiên nhiên, thảm họa thiên nhiên, thảm họa thiên nhiên, thảm họa thiên nhiên, thảm họa thiên nhiên, thảm họa thiên nhiên, thảm họa thiên nhiên, thảm họa thiên nhiên, thảm họa thiên nhiên, thảm họa thiên nhiên,', 'nhiên, thảm họa thiên nhiên, thảm họa thiên nhiên, thảm họa thiên nhiên, thảm họa thiên nhiên, thảm họa thiên nhiên, thảm họa thiên nhiên, thảm họa thiên nhiên, thảm họa thiên nhiên, thảm họa thiên nhiên, thảm họa thiên nhiên, thảm họa thiên nhiên, thảm họa thiên nhiên, thảm họa thiên nhiên, thảm họa thiên nhiên, thảm họa thiên nhiên, thảm họa thiên nhiên, thảm họa thiên nhiên, thảm họa thiên nhiên, thảm họa thiên nhiên, thảm họa thiên nhiên, thảm họa thiên nhiên, thảm họa thiên nhiên, thảm họa thiên nhiên, thảm họa thiên nhiên, thảm họa thiên nhiên, thảm họa thiên nhiên, thảm họa thiên nhiên, thảm họa thiên nhiên, thảm họa thiên nhiên, thảm họa thiên nhiên, thảm họa thiên nhiên, thảm họa thiên nhiên, thảm họa thiên nhiên, thảm họa thiên nhiên, thảm họa thiên nhiên, thảm họa thiên nhiên,']",Lệnh Bán tối thiểu là 10 (mười) Đơn Vị Quỹ.
"Trong trường hợp lệnh bán bị thực hiện một phần, nhà đầu tư cần làm gì nếu số lượng CCQ còn lại nhỏ hơn số lượng tối thiểu?","Nếu lệnh bán của nhà đầu tư bị thực hiện một phần và số lượng chứng chỉ quỹ còn lại nhỏ hơn số lượng tối thiểu, nhà đầu tư cần tuân theo quy định tại Điều lệ Quỹ. Tuy nhiên, tài liệu không cung cấp thông tin chi tiết về hành động cụ thể mà nhà đầu tư cần thực hiện trong trường hợp này.","['Quỹ đầu tư chứng khoán được mô tả trong Bản cáo bạch này là Quỹ được thành lập theo\nLuật Chứng khoán số 54/2019/QH14 Quốc hội Nước Cộng Hòa Xã hội Chủ nghĩa Việt\nNam thông qua ngày 26 tháng 11 năm 2019 và các văn bản hướng dẫn thi hành. Bản cáo\nbạch này đã được đăng ký với Ủy ban Chứng khoán Nhà nước ngày / /2022.  \nTHÔNG BÁO QUAN TRỌNG  \nCác nhà đầu tư nên nghiên cứu Bản cáo bạch này một cách cẩn trọng và toàn diện và không nên\ncoi nội dung hoặc tóm tắt ở đây là các tư vấn liên quan đến pháp lý, thuế, hoặc tài chính/đầu\ntư và nên tham khảo ý kiến chuyên gia tư vấn của mình về các yêu cầu pháp lý, thuế, năm\ngiữa, hoặc tư vấn về các khía cạnh khác của việc đầu tư, mua, cho tặng, năm giữ,\nnhượng, chuyển nhượng, hoặc bán một phần hoặc toàn bộ các khoản đầu tư vào Quỹ. Nhà đầu tư', '2.2.4 Hạn mức đầu tư\nHạn mức đầu tư của Quỹ được quy định chi tiết tuân theo các quy định tại Thông tư hướng dẫn\nhoạt động và quản lý các quỹ đầu tư chứng khoán. Co cấu danh mục đầu tư của Quỹ phải đảm\nbảo tuân theo các hạn mức đầu tư sau:\na) Tựa trên tổng giá trị tài khoản thanh toán của Quỹ tại ngân hàng giám sát, quỹ mở được\ncâu đề qua 49% tổng giá trị tài sản của quỹ vào các tài sản theo quy định tại điểm a, b mục\nIX.2.2.3\nb) Không được đầu tư vào chứng khoán của một tổ chức phát hành quá 10% tổng giá trị chứng\nkhoán đang lưu hành của tổ chức đó, trừ công cụ nợ của Chính phủ;\nc) Không được đầu tư quá 20% tổng giá trị tài sản của quỹ vào chứng khoán đang lưu hành và\ncác tài sản (nếu có) quy định tại điểm a, b mục IX.2.2.3 của một tổ chức phát hành, trừ công\ncụ nợ của Chính phủ;', 'cụ nợ của Chính phủ;\nd) Không được đầu tư quá 30% tổng giá trị tài sản của quỹ vào các tài sản quỹ định tại điểm a,\nb, d, e và f mục IX.2.2.3, phải hành bởi các công ty trong cùng một nhóm công ty cơ quan hệ\nsở hữu với nhau, thuộc sở hữu hợp của sau đây: Công ty con, các công ty sở hữu\nhien 35% cổ phần, phần vốn góp của nhau.nhóm công ty con, công ty mẹ. Tổng\nđộ phân đầu tư vào chứng khoán phái sinh tính bằng giá trị cam kết của hợp đồng xác định\ntheo quy định tại Phụ Lục 4 Điều Lệ Quỹ;\ne) Không được đầu tư quá 10% tổng giá trị tài sản của quỹ vào các tài sản quỹ định tại điểm d\nmục IX.2.2.3;\nf) Tổng giá trị các hạng mục đầu tư lớn trong danh mục đầu tư của quỹ không được vượt quá\n40% tổng giá trị tài sản của quỹ. Trong đó, hạng mục đầu tư lớn của quỹ là hạng mục đầu tư', '*   9 năm kinh nghiệm với vai trò giám đốc kiểm toán tại Công ty TNHH KPMG Việt Nam.\n*   Hiện là Giám đốc tài chính (CFO) tại Công ty CP Đầu Tư Thương Mại Quốc Tế Matrrot Dd.  \nCác quy định về tiêu chuẩn lựa chọn thành viên Ban đại diện Quỹ, quyền hạn và nhiệm vụ của Ban đại diện Quỹ, chủ tịch Ban đại diện Quỹ, đinh chỉ hoạc bãi miễn thành viên Ban đại diện Quỹ, cuộc họp của Ban đại diện Quỹ tuân theo quy định tại chương V Điều Lệ Quỹ.  \n**2.10. Quyền hạn và trách nhiệm của Công ty Quản lý Quỹ**\nCông ty Quản lý Quỹ được lựa chọn phải thỏa mãn các điều kiện sau:  \n*   Được thực hiện nghiệp vụ quản lý Quỹ;\n*   Hoàn toàn độc lập với Ngân hàng Giám sát;\n*   Có đầy đủ cơ sở vật chất, nhân sự để Quản lý Quỹ mở;', '40% tổng giá trị tài sản của quỹ. Trong đó, hạng mục đầu tư lớn của quỹ là hạng mục đầu tư\nvào các loại tài sản quỹ định tại điểm a, d, và g mục IX.2.2.3 (ngoại trừ chứng chỉ tiền gửi)\nphải hành bởi cùng một tổ chức, có tổng giá trị chiếm từ 5% trở lên tổng giá trị tài sản của\nquỹ;\ng) Tại mọi thời điểm, tổng giá trị cam kết trong các giao dịch chứng khoán phái sinh, dự nợ vay\nvà các khoản phải trả của quỹ không được vượt giá trị tài sản ròng của quỹ;\nh) Không được đầu tư vào chứng khoán của Chính phủ Quỹ;\ni) Chỉ được đầu tư vào chứng chỉ quỹ đại chúng khác, công ty đầu tư chứng khoán đại chúng\ndo công ty quản lý quỹ khác quản lý và bảo đảm các hạn chế sau:\n- Không đầu tư vào quá 10% tổng giá trị chứng chỉ quỹ đang lưu hành của một quỹ đại chúng,', '*   Kết quả hoạt động trong quá khứ của các Quỹ không có nghĩa là kết quả hoạt động trong tương lai.\n*   Tên của Quỹ không hàm ý về chất lượng hoạt động cũng như những lợi và lợi nhuận của Quỹ trong tương lai;\n*   Công ty Quản lý Quỹ không chịu trách nhiệm pháp lý về những rủi ro từ đầu tư của các chủ nợ, thành viên Hội đồng thành viên, Ban điều hành và nhân viên của Công ty Quản lý Quỹ không có trách nhiệm pháp lý về các rủi ro hoạt động của Công ty Quản lý Quỹ.\n*   Giống như các hình thức đầu tư khác, Quỹ, rủi ro thanh khoản sẽ được phân bổ trên cơ sở số ngày gần nhất với giá trị tài sản ròng. Các khoản đầu tư khác có thể có nhiều rủi ro hơn so với thời điểm hiện tại. Nhà Đầu tư cần phải nhận thức được khả năng chấp nhận rủi ro từ vơi rủi ro đầu tư mà Quỹ có thể gặp phải trong tương lai.', 'c) Hoạt động mới, các cập, pháp lập hoặc các tổ chức phát hành;\nd) Quy định mới trong thời gian giải thể;\nTrong thời hạn 03 tháng kể từ ngày có các sai lệch phát sinh do các nguyên nhân quy định tại\nđiểm a, b, d, e điều này, công ty quản lý quỹ có nghĩa vụ thông báo cho Ủy ban Chứng khoán\nNhà nước và điều chỉnh lại cơ cấu danh mục đầu tư cho phù hợp với quy định tại Mục IX.2.2.4.\nTrường hợp sai lệch cơ cấu danh mục đầu tư không tuân thủ hạn chế đầu tư theo quy định\npháp luật hoặc điều lệ Quỹ, công ty quản lý quỹ phải điều chỉnh lại danh mục đầu tư trong\nhạn 15 ngày kể từ ngày phát hiện sai lệch. Công ty quản lý quỹ phải đối chiếu tương hai cho\nquỹ (nếu có) so với mọi chỉ phí phát sinh liên quan đến việc điều chỉnh lại danh mục đầu tư.', 'Số: 9176 /QĐ-UBCK\nGiấy phép hành chứng chỉ quỹ ra công chúng\n----------------  \nCăn cứ khoản 2, Điều 46 Pháp lệnh Chứng khoán và Điều 45, 46 Nghị định số\n56/2007/NĐ-CP ngày 09/04/2007 của Chính phủ quy định chi tiết thi hành một số\nđiều của Pháp lệnh Chứng khoán;\nCăn cứ Quyết định số 30/2008/QĐ-BTC ngày 02/06/2008 của Bộ Tài chính về việc\nban hành Quy chế tổ chức và hoạt động của công ty quản lý quỹ, công ty chứng khoán;\nCăn cứ Giấy chứng nhận đăng ký kinh doanh số 0102013096 do Sở Kế hoạch và\nĐầu tư Thành phố Hà Nội cấp ngày 21/10/2008;\nXét đề nghị của Công ty cổ phần Quản lý Quỹ Ký Thương - TechcomCapital;  \nQUỸ ĐẦU TƯ CỔ PHIẾU DOANH NGHIỆP VỪA VÀ NHỎ TECHCOM\n(TCSME)  \nCHÀO BẢN CHỨNG CHỈ QUỸ ĐẦU TƯ CHỨNG KHOÁN RA CÔNG CHỨNG\n(Quỹ chứng khoán doanh nghiệp vừa và nhỏ Techcom)', 'gián tiếp hoặc tổng hợp các khoản phí và các chi phí/phí/giá dịch vụ liên quan đến các hoạt động của Quỹ mà Quỹ thực hiện hoặc gián tiếp hoặc tổng hợp các khoản phí và các chi phí/phí/giá dịch vụ liên quan đến các hoạt động của Quỹ mà Quỹ thực hiện hoặc gián tiếp hoặc tổng hợp các khoản phí và các chi phí/phí/giá dịch vụ liên quan đến các hoạt động của Quỹ mà Quỹ thực hiện hoặc gián tiếp hoặc tổng hợp các khoản phí và các chi phí/phí/giá dịch vụ liên quan đến các hoạt động của Quỹ mà Quỹ thực hiện hoặc gián tiếp hoặc tổng hợp các khoản phí và các chi phí/phí/giá dịch vụ liên quan đến các hoạt động của Quỹ mà Quỹ thực hiện hoặc gián tiếp hoặc tổng hợp các khoản phí và các chi phí/phí/giá dịch vụ liên quan đến các hoạt động của Quỹ mà Quỹ thực hiện hoặc gián tiếp hoặc tổng hợp các khoản phí', 'hiện hoặc gián tiếp hoặc tổng hợp các khoản phí và các chi phí/phí/giá dịch vụ liên quan đến các hoạt động của Quỹ mà Quỹ thực hiện hoặc gián tiếp hoặc tổng hợp các khoản phí và các chi phí/phí/giá dịch vụ liên quan đến các hoạt động của Quỹ mà Quỹ thực hiện hoặc gián tiếp hoặc tổng hợp các khoản phí và các chi phí/phí/giá dịch vụ liên quan đến các hoạt động của Quỹ mà Quỹ thực hiện hoặc gián tiếp hoặc tổng hợp các khoản phí và các chi phí/phí/giá dịch vụ liên quan đến các hoạt động của Quỹ mà Quỹ thực hiện hoặc gián tiếp hoặc tổng hợp các khoản phí và các chi phí/phí/giá dịch vụ liên quan đến các hoạt động của Quỹ mà Quỹ thực hiện hoặc gián tiếp hoặc tổng hợp các khoản phí và các chi phí/phí/giá dịch vụ liên quan đến các hoạt động của Quỹ mà Quỹ thực hiện hoặc gián tiếp hoặc tổng hợp các', 'thực hiện hoặc gián tiếp hoặc tổng hợp các khoản phí và các chi phí/phí/giá dịch vụ liên quan đến các hoạt động của Quỹ mà Quỹ thực hiện hoặc gián tiếp hoặc tổng hợp các khoản phí và các chi phí/phí/giá dịch vụ liên quan đến các hoạt động của Quỹ mà Quỹ thực hiện hoặc gián tiếp hoặc tổng hợp các khoản phí và các chi phí/phí/giá dịch vụ liên quan đến các hoạt động của Quỹ mà Quỹ thực hiện hoặc gián tiếp hoặc tổng hợp các khoản phí và các chi phí/phí/giá dịch vụ liên quan đến các hoạt động của Quỹ mà Quỹ thực hiện hoặc gián tiếp hoặc tổng hợp các khoản phí và các chi phí/phí/giá dịch vụ liên quan đến các hoạt động của Quỹ mà Quỹ thực hiện hoặc gián tiếp hoặc tổng hợp các khoản phí và các chi phí/phí/giá dịch vụ liên quan đến các hoạt động của Quỹ mà Quỹ thực hiện hoặc gián tiếp hoặc tổng', 'tiếp hoặc tổng hợp các khoản phí và các chi phí/phí/giá dịch vụ liên quan đến các hoạt động của Quỹ mà Quỹ thực hiện hoặc gián tiếp hoặc tổng hợp các khoản phí và các chi phí/phí/giá dịch vụ liên quan đến các hoạt động của Quỹ mà Quỹ thực hiện hoặc gián tiếp hoặc tổng hợp các khoản phí và các chi phí/phí/giá dịch vụ liên quan đến các hoạt động của Quỹ mà Quỹ thực hiện hoặc gián tiếp hoặc tổng hợp các khoản phí và các chi phí/phí/giá dịch vụ liên quan đến các hoạt động của Quỹ mà Quỹ thực hiện hoặc gián tiếp hoặc tổng hợp các khoản phí và các chi phí/phí/giá dịch vụ liên quan đến các hoạt động của Quỹ mà Quỹ thực hiện hoặc gián tiếp hoặc tổng hợp các khoản phí và các chi phí/phí/giá dịch vụ liên quan đến các hoạt động của Quỹ mà Quỹ thực hiện hoặc gián tiếp hoặc tổng hợp các khoản phí và', 'tiếp hoặc tổng hợp các khoản phí và các chi phí/phí/giá dịch vụ liên quan đến các hoạt động của Quỹ mà Quỹ thực hiện hoặc gián tiếp hoặc tổng hợp các khoản phí và các chi phí/phí/giá dịch vụ liên quan đến các hoạt động của Quỹ mà Quỹ thực hiện hoặc gián tiếp hoặc tổng hợp các khoản phí và các chi phí/phí/giá dịch vụ liên quan đến các hoạt động của Quỹ mà Quỹ thực hiện hoặc gián tiếp hoặc tổng hợp các khoản phí và các chi phí/phí/giá dịch vụ liên quan đến các hoạt động của Quỹ mà Quỹ thực hiện hoặc gián tiếp hoặc tổng hợp các khoản phí và các chi phí/phí/giá dịch vụ liên quan đến các hoạt động của Quỹ mà Quỹ thực hiện hoặc gián tiếp hoặc tổng hợp các khoản phí và các chi phí/phí/giá dịch vụ liên quan đến các hoạt động của Quỹ mà Quỹ thực hiện hoặc gián tiếp hoặc tổng hợp các khoản phí và', 'tiếp hoặc tổng hợp các khoản phí và các chi phí/phí/giá dịch vụ liên quan đến các hoạt động của Quỹ mà Quỹ thực hiện hoặc gián tiếp hoặc tổng hợp các khoản phí và các chi phí/phí/giá dịch vụ liên quan đến các hoạt động của Quỹ mà Quỹ thực hiện hoặc gián tiếp hoặc tổng hợp các khoản phí và các chi phí/phí/giá dịch vụ liên quan đến các hoạt động của Quỹ mà Quỹ thực hiện hoặc gián tiếp hoặc tổng hợp các khoản phí và các chi phí/phí/giá dịch vụ liên quan đến các hoạt động của Quỹ mà Quỹ thực hiện hoặc gián tiếp hoặc tổng hợp các khoản phí và các chi phí/phí/giá dịch vụ liên quan đến các hoạt động của Quỹ mà Quỹ thực hiện hoặc gián tiếp hoặc tổng hợp các khoản phí và các chi phí/phí/giá dịch vụ liên quan đến các hoạt động của Quỹ mà Quỹ thực hiện hoặc gián tiếp hoặc tổng hợp các khoản phí và', 'tiếp hoặc tổng hợp các khoản phí và các chi phí/phí/giá dịch vụ liên quan đến các hoạt động của Quỹ mà Quỹ thực hiện hoặc gián tiếp hoặc tổng hợp các khoản phí và các chi phí/phí/giá dịch vụ liên quan đến các hoạt động của Quỹ mà Quỹ thực hiện hoặc gián tiếp hoặc tổng hợp các khoản phí và các chi phí/phí/giá dịch vụ liên quan đến các hoạt động của Quỹ mà Quỹ thực hiện hoặc gián tiếp hoặc tổng hợp các khoản phí và các chi phí/phí/giá dịch vụ liên quan đến các hoạt động của Quỹ mà Quỹ thực hiện hoặc gián tiếp hoặc tổng hợp các khoản phí và các chi phí/phí/giá dịch vụ liên quan đến các hoạt động của Quỹ mà Quỹ thực hiện hoặc gián tiếp hoặc tổng hợp các khoản phí và các chi phí/phí/giá dịch vụ liên quan đến các hoạt động của Quỹ mà Quỹ thực hiện hoặc gián tiếp hoặc tổng hợp các khoản phí và', 'tiếp hoặc tổng hợp các khoản phí và các chi phí/phí/giá dịch vụ liên quan đến các hoạt động của Quỹ mà Quỹ thực hiện hoặc gián tiếp hoặc tổng hợp các khoản phí và các chi phí/phí/giá dịch vụ liên quan đến các hoạt động của Quỹ mà Quỹ thực hiện hoặc gián tiếp hoặc tổng hợp các khoản phí và các chi phí/phí/giá dịch vụ liên quan đến các hoạt động của Quỹ mà Quỹ thực hiện hoặc gián tiếp hoặc tổng hợp các khoản phí và các chi phí/phí/giá dịch vụ liên quan đến các hoạt động của Quỹ mà Quỹ thực hiện hoặc gián tiếp hoặc tổng hợp các khoản phí và các chi phí/phí/giá dịch vụ liên quan đến các hoạt động của Quỹ mà Quỹ thực hiện hoặc gián tiếp hoặc tổng hợp các khoản phí và các chi phí/phí/giá dịch vụ liên quan đến các hoạt động của Quỹ mà Quỹ thực hiện hoặc gián tiếp hoặc tổng hợp các khoản phí và', 'tiếp hoặc tổng hợp các khoản phí và các chi phí/phí/giá dịch vụ liên quan đến các hoạt động của Quỹ mà Quỹ thực hiện hoặc gián tiếp hoặc tổng hợp các khoản phí và các chi phí/phí/giá dịch vụ liên quan đến các hoạt động của Quỹ mà Quỹ thực hiện hoặc gián tiếp hoặc tổng hợp các khoản phí và các chi phí/phí/giá dịch vụ liên quan đến các hoạt động của Quỹ mà Quỹ thực hiện hoặc gián tiếp hoặc tổng hợp các khoản phí và các chi phí/phí/giá dịch vụ liên quan đến các hoạt động của Quỹ mà Quỹ thực hiện hoặc gián tiếp hoặc tổng hợp các khoản phí và các chi phí/phí/giá dịch vụ liên quan đến các hoạt động của Quỹ mà Quỹ thực hiện hoặc gián tiếp hoặc tổng hợp các khoản phí và các chi phí/phí/giá dịch vụ liên quan đến các hoạt động của Quỹ mà Quỹ thực hiện hoặc gián tiếp hoặc tổng hợp các khoản phí và', 'tiếp hoặc tổng hợp các khoản phí và các chi phí/phí/giá dịch vụ liên quan đến các hoạt động của Quỹ mà Quỹ thực hiện hoặc gián tiếp hoặc tổng hợp các khoản phí và các chi phí/phí/giá dịch vụ liên quan đến các hoạt động của Quỹ mà Quỹ thực hiện hoặc gián tiếp hoặc tổng hợp các khoản phí và các chi phí/phí/giá dịch vụ liên quan đến các hoạt động của Quỹ mà Quỹ thực hiện hoặc gián tiếp hoặc tổng hợp các khoản phí và các chi phí/phí/giá dịch vụ liên quan đến các hoạt động của Quỹ mà Quỹ thực hiện hoặc gián tiếp hoặc tổng hợp các khoản phí và các chi phí/phí/giá dịch vụ liên quan đến các hoạt động của Quỹ mà Quỹ thực hiện hoặc gián tiếp hoặc tổng hợp các khoản phí và các chi phí/phí/giá dịch vụ liên quan đến các hoạt động của Quỹ mà Quỹ thực hiện hoặc gián tiếp hoặc tổng hợp các khoản phí và', 'tiếp hoặc tổng hợp các khoản phí và các chi phí/phí/giá dịch vụ liên quan đến các hoạt động của Quỹ mà Quỹ thực hiện hoặc gián tiếp hoặc tổng hợp các khoản phí và các chi phí/phí/giá dịch vụ liên quan đến các hoạt động của Quỹ mà Quỹ thực hiện hoặc gián tiếp hoặc tổng hợp các khoản phí và các chi phí/phí/giá dịch vụ liên quan đến các hoạt động của Quỹ mà Quỹ thực hiện hoặc gián tiếp hoặc tổng hợp các khoản phí và các chi phí/phí/giá dịch vụ liên quan đến các hoạt động của Quỹ mà Quỹ thực hiện hoặc gián tiếp hoặc tổng hợp các khoản phí và các chi phí/phí/giá dịch vụ liên quan đến các hoạt động của Quỹ mà Quỹ thực hiện hoặc gián tiếp hoặc tổng hợp các khoản phí và các chi phí/phí/giá dịch vụ liên quan đến các hoạt động của Quỹ mà Quỹ thực hiện hoặc gián tiếp hoặc tổng hợp các khoản phí và', 'tiếp hoặc tổng hợp các khoản phí và các chi phí/phí/giá dịch vụ liên quan đến các hoạt động của Quỹ mà Quỹ thực hiện hoặc gián tiếp hoặc tổng hợp các khoản phí và các chi phí/phí/giá dịch vụ liên quan đến các hoạt động của Quỹ mà Quỹ thực hiện hoặc gián tiếp hoặc tổng hợp các khoản phí và các chi phí/phí/giá dịch vụ liên quan đến các hoạt động của Quỹ mà Quỹ thực hiện hoặc gián tiếp hoặc tổng hợp các khoản phí và các chi phí/phí/giá dịch vụ liên quan đến các hoạt động của Quỹ mà Quỹ thực hiện hoặc gián tiếp hoặc tổng hợp các khoản phí và các chi phí/phí/giá dịch vụ liên quan đến các hoạt động của Quỹ mà Quỹ thực hiện hoặc gián tiếp hoặc tổng hợp các khoản phí và các chi phí/phí/giá dịch vụ liên quan đến các hoạt động của Quỹ mà Quỹ thực hiện hoặc gián tiếp hoặc tổng hợp các khoản phí và', 'tiếp hoặc tổng hợp các khoản phí và các chi phí/phí/giá dịch vụ liên quan đến các hoạt động của Quỹ mà Quỹ thực hiện hoặc gián tiếp hoặc tổng hợp các khoản phí và các chi phí/phí/giá dịch vụ liên quan đến các hoạt động của Quỹ mà Quỹ thực hiện hoặc gián tiếp hoặc tổng hợp các khoản phí và các chi phí/phí/giá dịch vụ liên quan đến các hoạt động của Quỹ mà Quỹ thực hiện hoặc gián tiếp hoặc tổng hợp các khoản phí và các chi phí/phí/giá dịch vụ liên quan đến các hoạt động của Quỹ mà Quỹ thực hiện hoặc gián tiếp hoặc tổng hợp các khoản phí và các chi phí/phí/giá dịch vụ liên quan đến các hoạt động của Quỹ mà Quỹ thực hiện hoặc gián tiếp hoặc tổng hợp các khoản phí và các chi phí/phí/giá dịch vụ liên quan đến các hoạt động của Quỹ mà Quỹ thực hiện hoặc gián tiếp hoặc tổng hợp các khoản phí và', 'tiếp hoặc tổng hợp các khoản phí và các chi phí/phí/giá dịch vụ liên quan đến các hoạt động của Quỹ mà Quỹ thực hiện hoặc gián tiếp hoặc tổng hợp các khoản phí và các chi phí/phí/giá dịch vụ liên quan đến các hoạt động của Quỹ mà Quỹ thực hiện hoặc gián tiếp hoặc tổng hợp các khoản phí và các chi phí/phí/giá dịch vụ liên quan đến các hoạt động của Quỹ mà Quỹ thực hiện hoặc gián tiếp hoặc tổng hợp các khoản phí và các chi phí/phí/giá dịch vụ liên quan đến các hoạt động của Quỹ mà Quỹ thực hiện hoặc gián tiếp hoặc tổng hợp các khoản phí và các chi phí/phí/giá dịch vụ liên quan đến các hoạt động của Quỹ mà Quỹ thực hiện hoặc gián tiếp hoặc tổng hợp các khoản phí và các chi phí/phí/giá dịch vụ liên quan đến các hoạt động của Quỹ mà Quỹ thực hiện hoặc gián tiếp hoặc tổng hợp các khoản phí và', 'tiếp hoặc tổng hợp các khoản phí và các chi phí/phí/giá dịch vụ liên quan đến các hoạt động của Quỹ mà Quỹ thực hiện hoặc gián tiếp hoặc tổng hợp các khoản phí và các chi phí/phí/giá dịch vụ liên quan đến các hoạt động của Quỹ mà Quỹ thực hiện hoặc gián tiếp hoặc tổng hợp các khoản phí và các chi phí/phí/giá dịch vụ liên quan đến các hoạt động của Quỹ mà Quỹ thực hiện hoặc gián tiếp hoặc tổng hợp các khoản phí và các chi phí/phí/giá dịch vụ liên quan đến các hoạt động của Quỹ mà Quỹ thực hiện hoặc gián tiếp hoặc tổng hợp các khoản phí và các chi phí/phí/giá dịch vụ liên quan đến các hoạt động của Quỹ mà Quỹ thực hiện hoặc gián tiếp hoặc tổng hợp các khoản phí và các chi phí/phí/giá dịch vụ liên quan đến các hoạt động của Quỹ mà Quỹ thực hiện hoặc gián tiếp hoặc tổng hợp các khoản phí và', 'tiếp hoặc tổng hợp các khoản phí và các chi phí/phí/giá dịch vụ liên quan đến các hoạt động của Quỹ mà Quỹ thực hiện hoặc gián tiếp hoặc tổng hợp các khoản phí và các chi phí/phí/giá dịch vụ liên quan đến các hoạt động của Quỹ mà Quỹ thực hiện hoặc gián tiếp hoặc tổng hợp các khoản phí và các chi phí/phí/giá dịch vụ liên quan đến các hoạt động của Quỹ mà Quỹ thực hiện hoặc gián tiếp hoặc tổng hợp các khoản phí và các chi phí/phí/giá dịch vụ liên quan đến các hoạt động của Quỹ mà Quỹ thực hiện hoặc gián tiếp hoặc tổng hợp các khoản phí và các chi phí/phí/giá dịch vụ liên quan đến các hoạt động của Quỹ mà Quỹ thực hiện hoặc gián tiếp hoặc tổng hợp các khoản phí và các chi phí/phí/giá dịch vụ liên quan đến các hoạt động của Quỹ mà Quỹ thực hiện hoặc gián tiếp hoặc tổng hợp các khoản phí và', 'tiếp hoặc tổng hợp các khoản phí và các chi phí/phí/giá dịch vụ liên quan đến các hoạt động của Quỹ mà Quỹ thực hiện hoặc gián tiếp hoặc tổng hợp các khoản phí và các chi phí/phí/giá dịch vụ liên quan đến các hoạt động của Quỹ mà Quỹ thực hiện hoặc gián tiếp hoặc tổng hợp các khoản phí và các chi phí/phí/giá dịch vụ liên quan đến các hoạt động của Quỹ mà Quỹ thực hiện hoặc gián tiếp hoặc tổng hợp các khoản phí và các chi phí/phí/giá dịch vụ liên quan đến các hoạt động của Quỹ mà Quỹ thực hiện hoặc gián tiếp hoặc tổng hợp các khoản phí và các chi phí/phí/giá dịch vụ liên quan đến các hoạt động của Quỹ mà Quỹ thực hiện hoặc gián tiếp hoặc tổng hợp các khoản phí và các chi phí/phí/giá dịch vụ liên quan đến các hoạt động của Quỹ mà Quỹ thực hiện hoặc gián tiếp hoặc tổng hợp các khoản phí và']",Nhà Đầu tư cần đặt bán toàn bộ để giảm số Đơn vị Quỹ nắm giữ về 0.
Quỹ xác định Giá trị tài sản ròng (NAV) với tần suất như thế nào và công bố ở đâu?,"Quỹ xác định Giá trị tài sản ròng (NAV) hàng ngày và công bố tại Trụ sở chính của Công ty Quản lý Quỹ, và trên các trang web hoặc các phương tiện truyền thông khác.","['**Chế độ kế toán**  \nQuỹ sẽ áp dụng chế độ kế toán Việt Nam (VAS) và tuân thủ các quy định khác liên quan tới công tác kế toán cho Quỹ do các cơ quan có thẩm quyền quy định. Đồng Việt Nam sẽ là đồng tiền được sử dụng và thể hiện.  \n**Chế độ báo cáo**  \nCông ty Quản lý Quỹ có trách nhiệm duy trì sổ sách kế toán và chuẩn bị báo cáo tài chính cho Quỹ. Phù hợp với quy định tại Điều 38 của Điều Lệ Quỹ, Công ty Quản lý Quỹ có thể uỷ quyền cho một nhà cung cấp dịch vụ có thực hiện việc này. Một số sách kế toán và báo cáo tài chính mà Công ty Quản lý Quỹ hoặc nhà cung cấp dịch vụ có thể uỷ quyền sẽ được lưu trữ tại văn phòng của Công ty Quản lý Quỹ hoặc nhà cung cấp dịch vụ có liên quan.', '**3.3.Rủi ro tỷ giá**  \nDo tài sản và nợ phải trả của Quỹ đều được trình bày bằng đồng Việt Nam, là đơn vị tiền tệ sử dụng của Quỹ. Mặc dù rủi ro tỷ giá trong tương lai hạn chế ảnh hưởng từ đồng tiền nước ngoài, thì tính chất của từng sản phẩm tài chính được trình bày trên Bảng Cân Đối Kế Toán của Quỹ. Do đó, giá trị thị trường của từng khoản đầu tư có thể bị ảnh hưởng bởi tỷ giá hối đoái.', 'Quỹ đầu tư chứng khoán được mô tả trong Bản cáo bạch này là Quỹ được thành lập theo\nLuật Chứng khoán số 54/2019/QH14 Quốc hội Nước Cộng Hòa Xã hội Chủ nghĩa Việt\nNam thông qua ngày 26 tháng 11 năm 2019 và các văn bản hướng dẫn thi hành. Bản cáo\nbạch này đã được đăng ký với Ủy ban Chứng khoán Nhà nước ngày / /2022.  \nTHÔNG BÁO QUAN TRỌNG  \nCác nhà đầu tư nên nghiên cứu Bản cáo bạch này một cách cẩn trọng và toàn diện và không nên\ncoi nội dung hoặc tóm tắt ở đây là các tư vấn liên quan đến pháp lý, thuế, hoặc tài chính/đầu\ntư và nên tham khảo ý kiến chuyên gia tư vấn của mình về các yêu cầu pháp lý, thuế, năm\ngiữa, hoặc tư vấn về các khía cạnh khác của việc đầu tư, mua, cho tặng, năm giữ,\nnhượng, chuyển nhượng, hoặc bán một phần hoặc toàn bộ các khoản đầu tư vào Quỹ. Nhà đầu tư', 'quỹ (nếu có) so với mọi chỉ phí phát sinh liên quan đến việc điều chỉnh lại danh mục đầu tư.\nTrong thời hạn 05 ngày làm việc kể từ ngày hoãn khẩn tại thời điểm điều chỉnh lại danh mục đầu tư.\nTrong thời hạn 05 ngày làm việc kể từ ngày hoãn khẩn tại thời điểm điều chỉnh lại danh mục đầu tư.\nTrong thời hạn 05 ngày làm việc kể từ ngày hoãn khẩn tại thời điểm điều chỉnh lại danh mục đầu tư.\nTrong thời hạn 05 ngày làm việc kể từ ngày hoãn khẩn tại thời điểm điều chỉnh lại danh mục đầu tư.\nTrong thời hạn 05 ngày làm việc kể từ ngày hoãn khẩn tại thời điểm điều chỉnh lại danh mục đầu tư.\nTrong thời hạn 05 ngày làm việc kể từ ngày hoãn khẩn tại thời điểm điều chỉnh lại danh mục đầu tư.\nTrong thời hạn 05 ngày làm việc kể từ ngày hoãn khẩn tại thời điểm điều chỉnh lại danh mục đầu tư.', '*   Không có bất kỳ sự bảo đảm nào về số tiền chi trả và giá trị của cổ tức được thanh toán trong tương lai;', '*   Ngân hàng giám sát, thành viên Hội đồng quản trị, người điều hành và nhân viên của ngân hàng giám sát làm nhiệm vụ giám sát hoạt động và bảo quản tài sản của Quỹ đại chúng, Công ty đầu tư chứng khoán không được là đối tượng mua, bán trong giao dịch mua, bán tài sản của Quỹ đại chúng, công ty đầu tư chứng khoán.\n*   Có đầy đủ năng lực cung cấp dịch vụ giám sát, lưu ký;  \nCác quy định về quyền và nghĩa vụ, thời hạn công bố thông tin về Công ty Quản lý Quỹ tuân theo quy định tại Chương VII Điều Lệ Quỹ.', 'Chỉ có các loại phí/dịch vụ và các chi phí/phí/giá dịch vụ liên quan trực tiếp hoặc gián tiếp hoặc tổng hợp các khoản phí và các chi phí/phí/giá dịch vụ liên quan đến các hoạt động của Quỹ mà Quỹ thực hiện hoặc gián tiếp hoặc tổng hợp các khoản phí và các chi phí/phí/giá dịch vụ liên quan đến các hoạt động của Quỹ mà Quỹ thực hiện hoặc gián tiếp hoặc tổng hợp các khoản phí và các chi phí/phí/giá dịch vụ liên quan đến các hoạt động của Quỹ mà Quỹ thực hiện hoặc gián tiếp hoặc tổng hợp các khoản phí và các chi phí/phí/giá dịch vụ liên quan đến các hoạt động của Quỹ mà Quỹ thực hiện hoặc gián tiếp hoặc tổng hợp các khoản phí và các chi phí/phí/giá dịch vụ liên quan đến các hoạt động của Quỹ mà Quỹ thực hiện hoặc gián tiếp hoặc tổng hợp các khoản phí và các chi phí/phí/giá dịch vụ liên quan', 'cụ nợ của Chính phủ;\nd) Không được đầu tư quá 30% tổng giá trị tài sản của quỹ vào các tài sản quỹ định tại điểm a,\nb, d, e và f mục IX.2.2.3, phải hành bởi các công ty trong cùng một nhóm công ty cơ quan hệ\nsở hữu với nhau, thuộc sở hữu hợp của sau đây: Công ty con, các công ty sở hữu\nhien 35% cổ phần, phần vốn góp của nhau.nhóm công ty con, công ty mẹ. Tổng\nđộ phân đầu tư vào chứng khoán phái sinh tính bằng giá trị cam kết của hợp đồng xác định\ntheo quy định tại Phụ Lục 4 Điều Lệ Quỹ;\ne) Không được đầu tư quá 10% tổng giá trị tài sản của quỹ vào các tài sản quỹ định tại điểm d\nmục IX.2.2.3;\nf) Tổng giá trị các hạng mục đầu tư lớn trong danh mục đầu tư của quỹ không được vượt quá\n40% tổng giá trị tài sản của quỹ. Trong đó, hạng mục đầu tư lớn của quỹ là hạng mục đầu tư', '*   Có đầy đủ cơ sở vật chất, nhân sự để Quản lý Quỹ mở;\n*   Đồng ý thực hiện các cam kết đối với Quỹ như nêu tại Phụ Lục 1 và Phụ Lục 3 của Điều Lệ Quỹ.  \nCác quy định về quyền và nghĩa vụ, chấm dứt quyền và nghĩa vụ, hạn chế hoạt động của Công ty Quản lý Quỹ tuân thủ theo quy định tại Chương VI Điều Lệ Quỹ.  \n**2.11. Tiêu chí lựa chọn, quyền hạn và trách nhiệm của Ngân hàng giám sát**\nNgân hàng Giám sát được lựa chọn phải đáp ứng các điều kiện sau:  \n*   Ngân hàng giám sát do Công ty Quản lý Quỹ lựa chọn phải đáp ứng các điều kiện quy định tại Khoản 1 Điều 116 Luật Chứng khoán;\n*   Ngân hàng giám sát phải hoạt động độc lập và tách biệt với Công ty Quản lý Quỹ mà ngân hàng cung cấp dịch vụ giám sát;', 'Quỹ thực hiện hoặc gián tiếp hoặc tổng hợp các khoản phí và các chi phí/phí/giá dịch vụ liên quan đến các hoạt động của Quỹ mà Quỹ thực hiện hoặc gián tiếp hoặc tổng hợp các khoản phí và các chi phí/phí/giá dịch vụ liên quan đến các hoạt động của Quỹ mà Quỹ thực hiện hoặc gián tiếp hoặc tổng hợp các khoản phí và các chi phí/phí/giá dịch vụ liên quan đến các hoạt động của Quỹ mà Quỹ thực hiện hoặc gián tiếp hoặc tổng hợp các khoản phí và các chi phí/phí/giá dịch vụ liên quan đến các hoạt động của Quỹ mà Quỹ thực hiện hoặc gián tiếp hoặc tổng hợp các khoản phí và các chi phí/phí/giá dịch vụ liên quan đến các hoạt động của Quỹ mà Quỹ thực hiện hoặc gián tiếp hoặc tổng hợp các khoản phí và các chi phí/phí/giá dịch vụ liên quan đến các hoạt động của Quỹ mà Quỹ thực hiện hoặc gián tiếp hoặc', 'vụ liên quan đến các hoạt động của Quỹ mà Quỹ thực hiện hoặc gián tiếp hoặc tổng hợp các khoản phí và các chi phí/phí/giá dịch vụ liên quan đến các hoạt động của Quỹ mà Quỹ thực hiện hoặc gián tiếp hoặc tổng hợp các khoản phí và các chi phí/phí/giá dịch vụ liên quan đến các hoạt động của Quỹ mà Quỹ thực hiện hoặc gián tiếp hoặc tổng hợp các khoản phí và các chi phí/phí/giá dịch vụ liên quan đến các hoạt động của Quỹ mà Quỹ thực hiện hoặc gián tiếp hoặc tổng hợp các khoản phí và các chi phí/phí/giá dịch vụ liên quan đến các hoạt động của Quỹ mà Quỹ thực hiện hoặc gián tiếp hoặc tổng hợp các khoản phí và các chi phí/phí/giá dịch vụ liên quan đến các hoạt động của Quỹ mà Quỹ thực hiện hoặc gián tiếp hoặc tổng hợp các khoản phí và các chi phí/phí/giá dịch vụ liên quan đến các hoạt động của', 'liên quan đến các hoạt động của Quỹ mà Quỹ thực hiện hoặc gián tiếp hoặc tổng hợp các khoản phí và các chi phí/phí/giá dịch vụ liên quan đến các hoạt động của Quỹ mà Quỹ thực hiện hoặc gián tiếp hoặc tổng hợp các khoản phí và các chi phí/phí/giá dịch vụ liên quan đến các hoạt động của Quỹ mà Quỹ thực hiện hoặc gián tiếp hoặc tổng hợp các khoản phí và các chi phí/phí/giá dịch vụ liên quan đến các hoạt động của Quỹ mà Quỹ thực hiện hoặc gián tiếp hoặc tổng hợp các khoản phí và các chi phí/phí/giá dịch vụ liên quan đến các hoạt động của Quỹ mà Quỹ thực hiện hoặc gián tiếp hoặc tổng hợp các khoản phí và các chi phí/phí/giá dịch vụ liên quan đến', 'ngược lại;  \n*   Ngân hàng giám sát, thành viên Hội đồng quản trị, người điều hành và nhân viên của ngân hàng giám sát làm nhiệm vụ giám sát hoạt động và bảo quản tài sản của Quỹ đại chúng, Công ty đầu tư chứng khoán không được là đối tượng mua, bán trong giao dịch mua, bán tài sản của Quỹ đại chúng, công ty đầu tư chứng khoán.\n*   Có đầy đủ năng lực cung cấp dịch vụ giám sát, lưu ký;\n*   Thực hiện các cam kết đối với Quỹ như nêu tại Phụ Lục 2 và Phụ Lục 3 của Điều Lệ Quỹ.  \nCác quy định về quyền và nghĩa vụ, thời hạn công bố thông tin về Công ty Quản lý Quỹ tuân theo quy định tại Chương VII Điều Lệ Quỹ.  \n**2.12. Kiểm toán, kế toán và chế độ báo cáo**', 'chi phí/phí/giá dịch vụ liên quan đến các hoạt động của Quỹ mà Quỹ thực hiện hoặc gián tiếp hoặc tổng hợp các khoản phí và các chi phí/phí/giá dịch vụ liên quan đến các hoạt động của Quỹ mà Quỹ thực hiện hoặc gián tiếp hoặc tổng hợp các khoản phí và các chi phí/phí/giá dịch vụ liên quan đến các hoạt động của Quỹ mà Quỹ thực hiện hoặc gián tiếp hoặc tổng hợp các khoản phí và các chi phí/phí/giá dịch vụ liên quan đến các hoạt động của Quỹ mà Quỹ thực hiện hoặc gián tiếp hoặc tổng hợp các khoản phí và các chi phí/phí/giá dịch vụ liên quan đến các hoạt động của Quỹ mà Quỹ thực hiện hoặc gián tiếp hoặc tổng hợp các khoản phí và các chi phí/phí/giá dịch vụ liên quan đến các hoạt động của Quỹ mà Quỹ thực hiện hoặc gián tiếp hoặc tổng hợp các khoản phí và các chi phí/phí/giá dịch vụ liên quan đến', '**3.2.Rủi ro lạm phát**  \nGiá trị thị trường tỷ lệ nghịch với lạm phát. Vì dụ trong môi trường lạm phát tăng, sức mua hay giá trị thực của các đồng tiền trong tương lai (menh giá và lãi trái phiếu nhận được hàng kỳ) sẽ giảm. Khi đó lợi suất của Quỹ trái phiếu tăng lên dẫn đến giá trị trái phiếu ròng. Rủi ro lạm phát giới hạn mức tăng trưởng của trái phiếu. Điều này thường biểu hiện cách rủi ro tài sản tài sản, trái phiếu hoặc chứng khoán nhận được hàng kỳ có thể bị ảnh hưởng bởi lạm phát.\n**3.3.Rủi ro tỷ giá**', 'dịch vụ liên quan đến các hoạt động của Quỹ mà Quỹ thực hiện hoặc gián tiếp hoặc tổng hợp các khoản phí và các chi phí/phí/giá dịch vụ liên quan đến các hoạt động của Quỹ mà Quỹ thực hiện hoặc gián tiếp hoặc tổng hợp các khoản phí và các chi phí/phí/giá dịch vụ liên quan đến các hoạt động của Quỹ mà Quỹ thực hiện hoặc gián tiếp hoặc tổng hợp các khoản phí và các chi phí/phí/giá dịch vụ liên quan đến các hoạt động của Quỹ mà Quỹ thực hiện hoặc gián tiếp hoặc tổng hợp các khoản phí và các chi phí/phí/giá dịch vụ liên quan đến các hoạt động của Quỹ mà Quỹ thực hiện hoặc gián tiếp hoặc tổng hợp các khoản phí và các chi phí/phí/giá dịch vụ liên quan đến các hoạt động của Quỹ mà Quỹ thực hiện hoặc gián tiếp hoặc tổng hợp các khoản phí và các chi phí/phí/giá dịch vụ liên quan đến các hoạt động', '*   Công ty Quản lý Quỹ sẽ xem xét và lựa chọn các khoản đầu tư có liên quan đến các chi phí.\n**3.1.Rủi ro lãi suất**  \nLà rủi ro mà hợp lý của các dòng tiền trong tương lai của chứng khoán có thu nhập cố định bị biến động do những thay đổi của lãi suất thị trường, dẫn tới giá trị thị trường của chứng khoán thay đổi. Thông thường, giá trị thị trường của trái phiếu và các chứng khoán có thu nhập cố định biến động ngược chiều với lãi suất. Quỹ có thể giảm thiểu rủi ro lãi suất bằng cách giữ các trái phiếu phù hợp với thời hạn của lãi suất. Công ty Quản lý Quỹ sẽ cố gắng giảm thiểu rủi ro lãi suất bằng cách lựa chọn các chứng khoán có lãi suất phù hợp với thời hạn của lãi suất.\n**3.2.Rủi ro lạm phát**', 'gián tiếp hoặc tổng hợp các khoản phí và các chi phí/phí/giá dịch vụ liên quan đến các hoạt động của Quỹ mà Quỹ thực hiện hoặc gián tiếp hoặc tổng hợp các khoản phí và các chi phí/phí/giá dịch vụ liên quan đến các hoạt động của Quỹ mà Quỹ thực hiện hoặc gián tiếp hoặc tổng hợp các khoản phí và các chi phí/phí/giá dịch vụ liên quan đến các hoạt động của Quỹ mà Quỹ thực hiện hoặc gián tiếp hoặc tổng hợp các khoản phí và các chi phí/phí/giá dịch vụ liên quan đến các hoạt động của Quỹ mà Quỹ thực hiện hoặc gián tiếp hoặc tổng hợp các khoản phí và các chi phí/phí/giá dịch vụ liên quan đến các hoạt động của Quỹ mà Quỹ thực hiện hoặc gián tiếp hoặc tổng hợp các khoản phí và các chi phí/phí/giá dịch vụ liên quan đến các hoạt động của Quỹ mà Quỹ thực hiện hoặc gián tiếp hoặc tổng hợp các khoản phí', 'liên quan đến các hoạt động của Quỹ mà Quỹ thực hiện hoặc gián tiếp hoặc tổng hợp các khoản phí và các chi phí/phí/giá dịch vụ liên quan đến các hoạt động của Quỹ mà Quỹ thực hiện hoặc gián tiếp hoặc tổng hợp các khoản phí và các chi phí/phí/giá dịch vụ liên quan đến các hoạt động của Quỹ mà Quỹ thực hiện hoặc gián tiếp hoặc tổng hợp các khoản phí và các chi phí/phí/giá dịch vụ liên quan đến các hoạt động của Quỹ mà Quỹ thực hiện hoặc gián tiếp hoặc tổng hợp các khoản phí và các chi phí/phí/giá dịch vụ liên quan đến các hoạt động của Quỹ mà Quỹ thực hiện hoặc gián tiếp hoặc tổng hợp các khoản phí và các chi phí/phí/giá dịch vụ liên quan đến các hoạt động của Quỹ mà Quỹ thực hiện hoặc gián tiếp hoặc tổng hợp các khoản phí và các chi phí/phí/giá dịch vụ liên quan đến các hoạt động của Quỹ', 'liên quan đến các hoạt động của Quỹ mà Quỹ thực hiện hoặc gián tiếp hoặc tổng hợp các khoản phí và các chi phí/phí/giá dịch vụ liên quan đến các hoạt động của Quỹ mà Quỹ thực hiện hoặc gián tiếp hoặc tổng hợp các khoản phí và các chi phí/phí/giá dịch vụ liên quan đến các hoạt động của Quỹ mà Quỹ thực hiện hoặc gián tiếp hoặc tổng hợp các khoản phí và các chi phí/phí/giá dịch vụ liên quan đến các hoạt động của Quỹ mà Quỹ thực hiện hoặc gián tiếp hoặc tổng hợp các khoản phí và các chi phí/phí/giá dịch vụ liên quan đến các hoạt động của Quỹ mà Quỹ thực hiện hoặc gián tiếp hoặc tổng hợp các khoản phí và các chi phí/phí/giá dịch vụ liên quan đến các hoạt động của Quỹ mà Quỹ thực hiện hoặc gián tiếp hoặc tổng hợp các khoản phí và các chi phí/phí/giá dịch vụ liên quan đến các hoạt động của Quỹ', 'liên quan đến các hoạt động của Quỹ mà Quỹ thực hiện hoặc gián tiếp hoặc tổng hợp các khoản phí và các chi phí/phí/giá dịch vụ liên quan đến các hoạt động của Quỹ mà Quỹ thực hiện hoặc gián tiếp hoặc tổng hợp các khoản phí và các chi phí/phí/giá dịch vụ liên quan đến các hoạt động của Quỹ mà Quỹ thực hiện hoặc gián tiếp hoặc tổng hợp các khoản phí và các chi phí/phí/giá dịch vụ liên quan đến các hoạt động của Quỹ mà Quỹ thực hiện hoặc gián tiếp hoặc tổng hợp các khoản phí và các chi phí/phí/giá dịch vụ liên quan đến các hoạt động của Quỹ mà Quỹ thực hiện hoặc gián tiếp hoặc tổng hợp các khoản phí và các chi phí/phí/giá dịch vụ liên quan đến các hoạt động của Quỹ mà Quỹ thực hiện hoặc gián tiếp hoặc tổng hợp các khoản phí và các chi phí/phí/giá dịch vụ liên quan đến các hoạt động của Quỹ', 'liên quan đến các hoạt động của Quỹ mà Quỹ thực hiện hoặc gián tiếp hoặc tổng hợp các khoản phí và các chi phí/phí/giá dịch vụ liên quan đến các hoạt động của Quỹ mà Quỹ thực hiện hoặc gián tiếp hoặc tổng hợp các khoản phí và các chi phí/phí/giá dịch vụ liên quan đến các hoạt động của Quỹ mà Quỹ thực hiện hoặc gián tiếp hoặc tổng hợp các khoản phí và các chi phí/phí/giá dịch vụ liên quan đến các hoạt động của Quỹ mà Quỹ thực hiện hoặc gián tiếp hoặc tổng hợp các khoản phí và các chi phí/phí/giá dịch vụ liên quan đến các hoạt động của Quỹ mà Quỹ thực hiện hoặc gián tiếp hoặc tổng hợp các khoản phí và các chi phí/phí/giá dịch vụ liên quan đến các hoạt động của Quỹ mà Quỹ thực hiện hoặc gián tiếp hoặc tổng hợp các khoản phí và các chi phí/phí/giá dịch vụ liên quan đến các hoạt động của Quỹ', 'liên quan đến các hoạt động của Quỹ mà Quỹ thực hiện hoặc gián tiếp hoặc tổng hợp các khoản phí và các chi phí/phí/giá dịch vụ liên quan đến các hoạt động của Quỹ mà Quỹ thực hiện hoặc gián tiếp hoặc tổng hợp các khoản phí và các chi phí/phí/giá dịch vụ liên quan đến các hoạt động của Quỹ mà Quỹ thực hiện hoặc gián tiếp hoặc tổng hợp các khoản phí và các chi phí/phí/giá dịch vụ liên quan đến các hoạt động của Quỹ mà Quỹ thực hiện hoặc gián tiếp hoặc tổng hợp các khoản phí và các chi phí/phí/giá dịch vụ liên quan đến các hoạt động của Quỹ mà Quỹ thực hiện hoặc gián tiếp hoặc tổng hợp các khoản phí và các chi phí/phí/giá dịch vụ liên quan đến các hoạt động của Quỹ mà Quỹ thực hiện hoặc gián tiếp hoặc tổng hợp các khoản phí và các chi phí/phí/giá dịch vụ liên quan đến các hoạt động của Quỹ', 'liên quan đến các hoạt động của Quỹ mà Quỹ thực hiện hoặc gián tiếp hoặc tổng hợp các khoản phí và các chi phí/phí/giá dịch vụ liên quan đến các hoạt động của Quỹ mà Quỹ thực hiện hoặc gián tiếp hoặc tổng hợp các khoản phí và các chi phí/phí/giá dịch vụ liên quan đến các hoạt động của Quỹ mà Quỹ thực hiện hoặc gián tiếp hoặc tổng hợp các khoản phí và các chi phí/phí/giá dịch vụ liên quan đến các hoạt động của Quỹ mà Quỹ thực hiện hoặc gián tiếp hoặc tổng hợp các khoản phí và các chi phí/phí/giá dịch vụ liên quan đến các hoạt động của Quỹ mà Quỹ thực hiện hoặc gián tiếp hoặc tổng hợp các khoản phí và các chi phí/phí/giá dịch vụ liên quan đến các hoạt động của Quỹ mà Quỹ thực hiện hoặc gián tiếp hoặc tổng hợp các khoản phí và các chi phí/phí/giá dịch vụ liên quan đến các hoạt động của Quỹ', 'liên quan đến các hoạt động của Quỹ mà Quỹ thực hiện hoặc gián tiếp hoặc tổng hợp các khoản phí và các chi phí/phí/giá dịch vụ liên quan đến các hoạt động của Quỹ mà Quỹ thực hiện hoặc gián tiếp hoặc tổng hợp các khoản phí và các chi phí/phí/giá dịch vụ liên quan đến các hoạt động của Quỹ mà Quỹ thực hiện hoặc gián tiếp hoặc tổng hợp các khoản phí và các chi phí/phí/giá dịch vụ liên quan đến các hoạt động của Quỹ mà Quỹ thực hiện hoặc gián tiếp hoặc tổng hợp các khoản phí và các chi phí/phí/giá dịch vụ liên quan đến các hoạt động của Quỹ mà Quỹ thực hiện hoặc gián tiếp hoặc tổng hợp các khoản phí và các chi phí/phí/giá dịch vụ liên quan đến các hoạt động của Quỹ mà Quỹ thực hiện hoặc gián tiếp hoặc tổng hợp các khoản phí và các chi phí/phí/giá dịch vụ liên quan đến các hoạt động của Quỹ']",NAV được xác định tại mỗi Ngày Giao Dịch (thứ Hai đến thứ Sáu) và công bố vào ngày làm việc tiếp theo.
Thời gian thanh toán tiền bán chứng chỉ quỹ cho nhà đầu tư là trong vòng bao lâu?,Tôi không tìm thấy thông tin đó trong tài liệu.,"['*   Kết quả hoạt động trong quá khứ của các Quỹ không có nghĩa là kết quả hoạt động trong tương lai.\n*   Tên của Quỹ không hàm ý về chất lượng hoạt động cũng như những lợi và lợi nhuận của Quỹ trong tương lai;\n*   Công ty Quản lý Quỹ không chịu trách nhiệm pháp lý về những rủi ro từ đầu tư của các chủ nợ, thành viên Hội đồng thành viên, Ban điều hành và nhân viên của Công ty Quản lý Quỹ không có trách nhiệm pháp lý về các rủi ro hoạt động của Công ty Quản lý Quỹ.\n*   Giống như các hình thức đầu tư khác, Quỹ, rủi ro thanh khoản sẽ được phân bổ trên cơ sở số ngày gần nhất với giá trị tài sản ròng. Các khoản đầu tư khác có thể có nhiều rủi ro hơn so với thời điểm hiện tại. Nhà Đầu tư cần phải nhận thức được khả năng chấp nhận rủi ro từ vơi rủi ro đầu tư mà Quỹ có thể gặp phải trong tương lai.', '**2.12. Kiểm toán, kế toán và chế độ báo cáo**  \nCông ty kiểm toán được lựa chọn phải được thành lập và hoạt động phù hợp với quy định của Pháp luật, nằm trong danh sách các công ty kiểm toán được UBCKNN chấp thuận kiểm toán cho tổ chức tài chính, tổ chức niêm yết và cho tổ chức kinh doanh chứng khoán và không được là người liên quan của Công ty Quản lý Quỹ, Ngân hàng Giám sát. Năm kiểm toán: Tổng công ty kiểm toán Quỹ sẽ được Công ty Quản lý Quỹ đề cử để Đại Hội Đồng Quỹ thông qua. Các năm sau đó, Đại Hội Đầu Tư Quỹ sẽ thông qua cho Ban Đại Diện Quỹ thông qua việc lựa chọn công ty kiểm toán. Công ty Quản lý Quỹ sẽ đề xuất với Ban Đại Diện Quỹ ít nhất (02) công ty kiểm toán để kiểm toán cho Quỹ mình.  \n**Chế độ kế toán**', 'Các quy định khác liên quan đến kiểm toán, kế toán và chế độ báo cáo tuân thủ theo quy định tại Điều Lệ Quỹ.  \n**3. Các rủi ro khi đầu tư vào Quỹ**  \nMục tiêu của Công ty Quản lý Quỹ là quản lý các rủi ro đầu tư, và nếu có thể, hạn chế các tác động của các rủi ro này bằng việc áp dụng các phương pháp quản lý đầu tư theo tiêu chuẩn quốc tế tốt nhất. Nhà Đầu tư cần lưu ý về các điểm quan trọng sau đây:  \n*   Quỹ, Công ty Quản lý Quỹ, thành viên Hội đồng quản trị, người điều hành và nhân viên của ngân hàng giám sát sẽ làm nhiệm vụ của quản trị rủi ro và bảo quản tài sản của quỹ đại chúng, công ty đầu tư chứng khoán không được là đối tượng mua, bán trong giao dịch mua, bán tài sản của quỹ đại chúng, công ty đầu tư chứng khoán.', '**Chế độ kế toán**  \nQuỹ sẽ áp dụng chế độ kế toán Việt Nam (VAS) và tuân thủ các quy định khác liên quan tới công tác kế toán cho Quỹ do các cơ quan có thẩm quyền quy định. Đồng Việt Nam sẽ là đồng tiền được sử dụng và thể hiện.  \n**Chế độ báo cáo**  \nCông ty Quản lý Quỹ có trách nhiệm duy trì sổ sách kế toán và chuẩn bị báo cáo tài chính cho Quỹ. Phù hợp với quy định tại Điều 38 của Điều Lệ Quỹ, Công ty Quản lý Quỹ có thể uỷ quyền cho một nhà cung cấp dịch vụ có thực hiện việc này. Một số sách kế toán và báo cáo tài chính mà Công ty Quản lý Quỹ hoặc nhà cung cấp dịch vụ có thể uỷ quyền sẽ được lưu trữ tại văn phòng của Công ty Quản lý Quỹ hoặc nhà cung cấp dịch vụ có liên quan.', '**3.3.Rủi ro tỷ giá**  \nDo tài sản và nợ phải trả của Quỹ đều được trình bày bằng đồng Việt Nam, là đơn vị tiền tệ sử dụng của Quỹ. Mặc dù rủi ro tỷ giá trong tương lai hạn chế ảnh hưởng từ đồng tiền nước ngoài, thì tính chất của từng sản phẩm tài chính được trình bày trên Bảng Cân Đối Kế Toán của Quỹ. Do đó, giá trị thị trường của từng khoản đầu tư có thể bị ảnh hưởng bởi tỷ giá hối đoái.', 'Quỹ đầu tư chứng khoán được mô tả trong Bản cáo bạch này là Quỹ được thành lập theo\nLuật Chứng khoán số 54/2019/QH14 Quốc hội Nước Cộng Hòa Xã hội Chủ nghĩa Việt\nNam thông qua ngày 26 tháng 11 năm 2019 và các văn bản hướng dẫn thi hành. Bản cáo\nbạch này đã được đăng ký với Ủy ban Chứng khoán Nhà nước ngày / /2022.  \nTHÔNG BÁO QUAN TRỌNG  \nCác nhà đầu tư nên nghiên cứu Bản cáo bạch này một cách cẩn trọng và toàn diện và không nên\ncoi nội dung hoặc tóm tắt ở đây là các tư vấn liên quan đến pháp lý, thuế, hoặc tài chính/đầu\ntư và nên tham khảo ý kiến chuyên gia tư vấn của mình về các yêu cầu pháp lý, thuế, năm\ngiữa, hoặc tư vấn về các khía cạnh khác của việc đầu tư, mua, cho tặng, năm giữ,\nnhượng, chuyển nhượng, hoặc bán một phần hoặc toàn bộ các khoản đầu tư vào Quỹ. Nhà đầu tư', 'ngược lại;  \n*   Ngân hàng giám sát, thành viên Hội đồng quản trị, người điều hành và nhân viên của ngân hàng giám sát làm nhiệm vụ giám sát hoạt động và bảo quản tài sản của Quỹ đại chúng, Công ty đầu tư chứng khoán không được là đối tượng mua, bán trong giao dịch mua, bán tài sản của Quỹ đại chúng, công ty đầu tư chứng khoán.\n*   Có đầy đủ năng lực cung cấp dịch vụ giám sát, lưu ký;\n*   Thực hiện các cam kết đối với Quỹ như nêu tại Phụ Lục 2 và Phụ Lục 3 của Điều Lệ Quỹ.  \nCác quy định về quyền và nghĩa vụ, thời hạn công bố thông tin về Công ty Quản lý Quỹ tuân theo quy định tại Chương VII Điều Lệ Quỹ.  \n**2.12. Kiểm toán, kế toán và chế độ báo cáo**', '*   Không có bất kỳ sự bảo đảm nào về số tiền chi trả và giá trị của cổ tức được thanh toán trong tương lai;', '2.2.4 Hạn mức đầu tư\nHạn mức đầu tư của Quỹ được quy định chi tiết tuân theo các quy định tại Thông tư hướng dẫn\nhoạt động và quản lý các quỹ đầu tư chứng khoán. Co cấu danh mục đầu tư của Quỹ phải đảm\nbảo tuân theo các hạn mức đầu tư sau:\na) Tựa trên tổng giá trị tài khoản thanh toán của Quỹ tại ngân hàng giám sát, quỹ mở được\ncâu đề qua 49% tổng giá trị tài sản của quỹ vào các tài sản theo quy định tại điểm a, b mục\nIX.2.2.3\nb) Không được đầu tư vào chứng khoán của một tổ chức phát hành quá 10% tổng giá trị chứng\nkhoán đang lưu hành của tổ chức đó, trừ công cụ nợ của Chính phủ;\nc) Không được đầu tư quá 20% tổng giá trị tài sản của quỹ vào chứng khoán đang lưu hành và\ncác tài sản (nếu có) quy định tại điểm a, b mục IX.2.2.3 của một tổ chức phát hành, trừ công\ncụ nợ của Chính phủ;', 'Việc bảo vệ Nhà Đầu tư nước ngoài không bị rủi ro này nằm ngoài khả năng của Quỹ và vì vậy, các Nhà Đầu tư nước ngoài, nếu cần thiết, cần phải tìm kiếm các công ty tư vấn phù hợp cho các nhà đầu tư của mình.  \n**3.5. Rủi ro thanh khoản**  \nRủi ro thanh khoản là rủi mà nhà đầu tư không bán được chứng chỉ quỹ vào ngày giao dịch chứng chỉ quỹ. Các chứng khoán thuộc danh mục đầu tư của Quỹ không thành khoản, hoặc đầu tư của Quỹ vào các chứng khoán có thanh khoản thấp.\nTrong đó, các chứng khoán trong danh mục đầu tư của Quỹ có thể được giao dịch trên thị trường chứng khoán, được thanh toán theo quy định của Điều Lệ Quỹ.  \n**3.6. Rủi ro biến động giá**', '*   Ngân hàng giám sát, thành viên Hội đồng quản trị, người điều hành và nhân viên của ngân hàng giám sát làm nhiệm vụ giám sát hoạt động và bảo quản tài sản của Quỹ đại chúng, Công ty đầu tư chứng khoán không được là đối tượng mua, bán trong giao dịch mua, bán tài sản của Quỹ đại chúng, công ty đầu tư chứng khoán.\n*   Có đầy đủ năng lực cung cấp dịch vụ giám sát, lưu ký;  \nCác quy định về quyền và nghĩa vụ, thời hạn công bố thông tin về Công ty Quản lý Quỹ tuân theo quy định tại Chương VII Điều Lệ Quỹ.', 'Là rủi ro mà hợp lý của các dòng tiền trong tương lai của chứng khoán có thu nhập cố định bị biến động do những thay đổi của lãi suất thị trường, dẫn tới giá trị thị trường của chứng khoán thay đổi. Thông thường, giá trị thị trường của trái phiếu và các chứng khoán có thu nhập cố định biến động ngược chiều với lãi suất. Quỹ có thể giảm thiểu rủi ro lãi suất bằng cách giữ các trái phiếu phù hợp với thời hạn của lãi suất. Công ty Quản lý Quỹ sẽ cố gắng giảm thiểu rủi ro lãi suất bằng cách lựa chọn các chứng khoán có lãi suất phù hợp với thời hạn của lãi suất.  \n**3.8. Rủi ro khối lượng**', '*   Công ty Quản lý Quỹ sẽ xem xét và lựa chọn các khoản đầu tư có liên quan đến các chi phí.\n**3.1.Rủi ro lãi suất**  \nLà rủi ro mà hợp lý của các dòng tiền trong tương lai của chứng khoán có thu nhập cố định bị biến động do những thay đổi của lãi suất thị trường, dẫn tới giá trị thị trường của chứng khoán thay đổi. Thông thường, giá trị thị trường của trái phiếu và các chứng khoán có thu nhập cố định biến động ngược chiều với lãi suất. Quỹ có thể giảm thiểu rủi ro lãi suất bằng cách giữ các trái phiếu phù hợp với thời hạn của lãi suất. Công ty Quản lý Quỹ sẽ cố gắng giảm thiểu rủi ro lãi suất bằng cách lựa chọn các chứng khoán có lãi suất phù hợp với thời hạn của lãi suất.\n**3.2.Rủi ro lạm phát**', 'quỹ (nếu có) so với mọi chỉ phí phát sinh liên quan đến việc điều chỉnh lại danh mục đầu tư.\nTrong thời hạn 05 ngày làm việc kể từ ngày hoãn khẩn tại thời điểm điều chỉnh lại danh mục đầu tư.\nTrong thời hạn 05 ngày làm việc kể từ ngày hoãn khẩn tại thời điểm điều chỉnh lại danh mục đầu tư.\nTrong thời hạn 05 ngày làm việc kể từ ngày hoãn khẩn tại thời điểm điều chỉnh lại danh mục đầu tư.\nTrong thời hạn 05 ngày làm việc kể từ ngày hoãn khẩn tại thời điểm điều chỉnh lại danh mục đầu tư.\nTrong thời hạn 05 ngày làm việc kể từ ngày hoãn khẩn tại thời điểm điều chỉnh lại danh mục đầu tư.\nTrong thời hạn 05 ngày làm việc kể từ ngày hoãn khẩn tại thời điểm điều chỉnh lại danh mục đầu tư.\nTrong thời hạn 05 ngày làm việc kể từ ngày hoãn khẩn tại thời điểm điều chỉnh lại danh mục đầu tư.', '*   Thảm họa thiên nhiên như động đất, lũ lụt, hỏa hoạn, thảm họa thiên nhiên, thảm họa thiên nhiên, thảm họa thiên nhiên, thảm họa thiên nhiên, thảm họa thiên nhiên, thảm họa thiên nhiên, thảm họa thiên nhiên, thảm họa thiên nhiên, thảm họa thiên nhiên, thảm họa thiên nhiên, thảm họa thiên nhiên, thảm họa thiên nhiên, thảm họa thiên nhiên, thảm họa thiên nhiên, thảm họa thiên nhiên, thảm họa thiên nhiên, thảm họa thiên nhiên, thảm họa thiên nhiên, thảm họa thiên nhiên, thảm họa thiên nhiên, thảm họa thiên nhiên, thảm họa thiên nhiên, thảm họa thiên nhiên, thảm họa thiên nhiên, thảm họa thiên nhiên, thảm họa thiên nhiên, thảm họa thiên nhiên, thảm họa thiên nhiên, thảm họa thiên nhiên, thảm họa thiên nhiên, thảm họa thiên nhiên, thảm họa thiên nhiên, thảm họa thiên nhiên, thảm họa thiên', 'cụ nợ của Chính phủ;\nd) Không được đầu tư quá 30% tổng giá trị tài sản của quỹ vào các tài sản quỹ định tại điểm a,\nb, d, e và f mục IX.2.2.3, phải hành bởi các công ty trong cùng một nhóm công ty cơ quan hệ\nsở hữu với nhau, thuộc sở hữu hợp của sau đây: Công ty con, các công ty sở hữu\nhien 35% cổ phần, phần vốn góp của nhau.nhóm công ty con, công ty mẹ. Tổng\nđộ phân đầu tư vào chứng khoán phái sinh tính bằng giá trị cam kết của hợp đồng xác định\ntheo quy định tại Phụ Lục 4 Điều Lệ Quỹ;\ne) Không được đầu tư quá 10% tổng giá trị tài sản của quỹ vào các tài sản quỹ định tại điểm d\nmục IX.2.2.3;\nf) Tổng giá trị các hạng mục đầu tư lớn trong danh mục đầu tư của quỹ không được vượt quá\n40% tổng giá trị tài sản của quỹ. Trong đó, hạng mục đầu tư lớn của quỹ là hạng mục đầu tư', '**3.6. Rủi ro biến động giá**  \nRủi ro về biến động giá của Quỹ phát sinh khi một hay một số Nhà Đầu tư nắm giữ một số lượng lớn cổ phiếu của Quỹ quyết định thực hiện lệnh bán của các cổ phiếu của Quỹ này. Nắm giữ một số lượng lớn cổ phiếu của Quỹ quyết định bán.  \n**3.7. Rủi ro tái đầu tư**  \nRủi ro tái đầu tư là rủi ro có thể xảy ra khi các khoản đầu tư trái phiếu với dòng tiền lãi trái phiếu nhận được hàng kỳ và gốc trái phiếu nhận được vào thời điểm đáo hạn được đi tìm đầu tư nhận lại. Công ty Quản lý Quỹ quyết định bán các chứng khoán của Quỹ.', '40% tổng giá trị tài sản của quỹ. Trong đó, hạng mục đầu tư lớn của quỹ là hạng mục đầu tư\nvào các loại tài sản quỹ định tại điểm a, d, và g mục IX.2.2.3 (ngoại trừ chứng chỉ tiền gửi)\nphải hành bởi cùng một tổ chức, có tổng giá trị chiếm từ 5% trở lên tổng giá trị tài sản của\nquỹ;\ng) Tại mọi thời điểm, tổng giá trị cam kết trong các giao dịch chứng khoán phái sinh, dự nợ vay\nvà các khoản phải trả của quỹ không được vượt giá trị tài sản ròng của quỹ;\nh) Không được đầu tư vào chứng khoán của Chính phủ Quỹ;\ni) Chỉ được đầu tư vào chứng chỉ quỹ đại chúng khác, công ty đầu tư chứng khoán đại chúng\ndo công ty quản lý quỹ khác quản lý và bảo đảm các hạn chế sau:\n- Không đầu tư vào quá 10% tổng giá trị chứng chỉ quỹ đang lưu hành của một quỹ đại chúng,', '*   Có đầy đủ cơ sở vật chất, nhân sự để Quản lý Quỹ mở;\n*   Đồng ý thực hiện các cam kết đối với Quỹ như nêu tại Phụ Lục 1 và Phụ Lục 3 của Điều Lệ Quỹ.  \nCác quy định về quyền và nghĩa vụ, chấm dứt quyền và nghĩa vụ, hạn chế hoạt động của Công ty Quản lý Quỹ tuân thủ theo quy định tại Chương VI Điều Lệ Quỹ.  \n**2.11. Tiêu chí lựa chọn, quyền hạn và trách nhiệm của Ngân hàng giám sát**\nNgân hàng Giám sát được lựa chọn phải đáp ứng các điều kiện sau:  \n*   Ngân hàng giám sát do Công ty Quản lý Quỹ lựa chọn phải đáp ứng các điều kiện quy định tại Khoản 1 Điều 116 Luật Chứng khoán;\n*   Ngân hàng giám sát phải hoạt động độc lập và tách biệt với Công ty Quản lý Quỹ mà ngân hàng cung cấp dịch vụ giám sát;', 'Số: 9176 /QĐ-UBCK\nGiấy phép hành chứng chỉ quỹ ra công chúng\n----------------  \nCăn cứ khoản 2, Điều 46 Pháp lệnh Chứng khoán và Điều 45, 46 Nghị định số\n56/2007/NĐ-CP ngày 09/04/2007 của Chính phủ quy định chi tiết thi hành một số\nđiều của Pháp lệnh Chứng khoán;\nCăn cứ Quyết định số 30/2008/QĐ-BTC ngày 02/06/2008 của Bộ Tài chính về việc\nban hành Quy chế tổ chức và hoạt động của công ty quản lý quỹ, công ty chứng khoán;\nCăn cứ Giấy chứng nhận đăng ký kinh doanh số 0102013096 do Sở Kế hoạch và\nĐầu tư Thành phố Hà Nội cấp ngày 21/10/2008;\nXét đề nghị của Công ty cổ phần Quản lý Quỹ Ký Thương - TechcomCapital;  \nQUỸ ĐẦU TƯ CỔ PHIẾU DOANH NGHIỆP VỪA VÀ NHỎ TECHCOM\n(TCSME)  \nCHÀO BẢN CHỨNG CHỈ QUỸ ĐẦU TƯ CHỨNG KHOÁN RA CÔNG CHỨNG\n(Quỹ chứng khoán doanh nghiệp vừa và nhỏ Techcom)', 'c) Hoạt động mới, các cập, pháp lập hoặc các tổ chức phát hành;\nd) Quy định mới trong thời gian giải thể;\nTrong thời hạn 03 tháng kể từ ngày có các sai lệch phát sinh do các nguyên nhân quy định tại\nđiểm a, b, d, e điều này, công ty quản lý quỹ có nghĩa vụ thông báo cho Ủy ban Chứng khoán\nNhà nước và điều chỉnh lại cơ cấu danh mục đầu tư cho phù hợp với quy định tại Mục IX.2.2.4.\nTrường hợp sai lệch cơ cấu danh mục đầu tư không tuân thủ hạn chế đầu tư theo quy định\npháp luật hoặc điều lệ Quỹ, công ty quản lý quỹ phải điều chỉnh lại danh mục đầu tư trong\nhạn 15 ngày kể từ ngày phát hiện sai lệch. Công ty quản lý quỹ phải đối chiếu tương hai cho\nquỹ (nếu có) so với mọi chỉ phí phát sinh liên quan đến việc điều chỉnh lại danh mục đầu tư.', '**3.2.Rủi ro lạm phát**  \nGiá trị thị trường tỷ lệ nghịch với lạm phát. Vì dụ trong môi trường lạm phát tăng, sức mua hay giá trị thực của các đồng tiền trong tương lai (menh giá và lãi trái phiếu nhận được hàng kỳ) sẽ giảm. Khi đó lợi suất của Quỹ trái phiếu tăng lên dẫn đến giá trị trái phiếu ròng. Rủi ro lạm phát giới hạn mức tăng trưởng của trái phiếu. Điều này thường biểu hiện cách rủi ro tài sản tài sản, trái phiếu hoặc chứng khoán nhận được hàng kỳ có thể bị ảnh hưởng bởi lạm phát.\n**3.3.Rủi ro tỷ giá**', 'từ trên 12 tháng trở lên 0,00%  \nGiấy dịch vụ Chuyển Đổi Quỹ sẽ được hạch toán cho Công ty Quản lý Quỹ và Đại Lý Phân Phối căn cứ theo hợp đồng ký giữa Công ty Quản lý Quỹ và Đại Lý Phân Phối.  \nd) Giấy dịch vụ Chuyển Nhượng  \nNhà Đầu tư phải trả một mức phí dịch vụ Chuyển Nhượng duy nhất là 300.000 đồng (ba trăm nghìn đồng) cho mỗi giao dịch chuyển nhượng Đơn vị Quỹ. Giá dịch vụ Chuyển Nhượng do người thực hiện chuyển nhượng thanh toán.  \nGiấy dịch vụ Chuyển nhượng sẽ không áp dụng trong trường hợp Nhà Đầu tư thực hiện chuyển nhượng số Chứng Chỉ quỹ từ tài khoản này sang tài khoản khác cùng tên thì Nhà Đầu tư tại Hai Đại Lý Phân Phối khác nhau.', '1. Công ty Quản lý Quỹ\nBà Nguyễn Thị Thu Hiền\nÔng Đặng Lưu Dũng\nBà Phan Thị Thu Hằng\n5\n5\n5\nII. CÁC ĐỊNH NGHĨA\n1. Tổng quan tình hình kinh tế vĩ mô.................................... 8\n2. Thị trường tài chính Việt Nam và cơ hội đầu tư.......................... 8\n3. Lợi tức của nhà đầu tư............................................. 14\n4. THÔNG TIN VỀ CÔNG TY CỔ PHẦN QUẢN LÝ QUỸ KÝ THƯƠNG............ 15\n1. Các thông tin chung............................................... 17\n2. Tình hình hoạt động của Công ty Cổ phần Quản lý Quỹ Ký Thương (TCSME)........ 17\n3. Ngành hàng Giám Sát............................................. 17\nVI. CÔNG TY KIỂM TOÁN............................................ 18\nVII. ĐẠI LÝ PHÂN PHỐI CHỨNG CHỈ QUỸ.................................. 18', '**3.8. Rủi ro khối lượng**  \nRủi ro khối lượng là rủi ro có thể phát sinh khi thực hiện các lệnh mua, bán của Quỹ hoặc các khoản đầu tư của Quỹ mà các lệnh mua bán này bị hạn chế về số lượng, hoặc chỉ có thể thực hiện được một số lượng giới hạn.\nCông ty Quản lý Quỹ có thể có một số lượng lớn cổ phiếu trong danh mục đầu tư của Quỹ có thể bị ảnh hưởng bởi rủi ro khối lượng.  \n**3.9. Rủi ro bất khả kháng**  \nRủi ro này là những sự kiện bất thường có tính chất ảnh hưởng đến khả năng hoạt động của Quỹ.']",Trong thời hạn 5 ngày làm việc sau ngày giao dịch Chứng chỉ quỹ.
Quỹ TCSME không được đầu tư quá bao nhiêu phần trăm tổng giá trị tài sản vào chứng khoán của một tổ chức phát hành?,"Quỹ TCSME không được đầu tư quá 10% tổng giá trị chứng khoán đang lưu hành của một tổ chức phát hành, trừ công cụ nợ của Chính phủ.","['Số: 9176 /QĐ-UBCK\nGiấy phép hành chứng chỉ quỹ ra công chúng\n----------------  \nCăn cứ khoản 2, Điều 46 Pháp lệnh Chứng khoán và Điều 45, 46 Nghị định số\n56/2007/NĐ-CP ngày 09/04/2007 của Chính phủ quy định chi tiết thi hành một số\nđiều của Pháp lệnh Chứng khoán;\nCăn cứ Quyết định số 30/2008/QĐ-BTC ngày 02/06/2008 của Bộ Tài chính về việc\nban hành Quy chế tổ chức và hoạt động của công ty quản lý quỹ, công ty chứng khoán;\nCăn cứ Giấy chứng nhận đăng ký kinh doanh số 0102013096 do Sở Kế hoạch và\nĐầu tư Thành phố Hà Nội cấp ngày 21/10/2008;\nXét đề nghị của Công ty cổ phần Quản lý Quỹ Ký Thương - TechcomCapital;  \nQUỸ ĐẦU TƯ CỔ PHIẾU DOANH NGHIỆP VỪA VÀ NHỎ TECHCOM\n(TCSME)  \nCHÀO BẢN CHỨNG CHỈ QUỸ ĐẦU TƯ CHỨNG KHOÁN RA CÔNG CHỨNG\n(Quỹ chứng khoán doanh nghiệp vừa và nhỏ Techcom)', '1. Công ty Quản lý Quỹ\nBà Nguyễn Thị Thu Hiền\nÔng Đặng Lưu Dũng\nBà Phan Thị Thu Hằng\n5\n5\n5\nII. CÁC ĐỊNH NGHĨA\n1. Tổng quan tình hình kinh tế vĩ mô.................................... 8\n2. Thị trường tài chính Việt Nam và cơ hội đầu tư.......................... 8\n3. Lợi tức của nhà đầu tư............................................. 14\n4. THÔNG TIN VỀ CÔNG TY CỔ PHẦN QUẢN LÝ QUỸ KÝ THƯƠNG............ 15\n1. Các thông tin chung............................................... 17\n2. Tình hình hoạt động của Công ty Cổ phần Quản lý Quỹ Ký Thương (TCSME)........ 17\n3. Ngành hàng Giám Sát............................................. 17\nVI. CÔNG TY KIỂM TOÁN............................................ 18\nVII. ĐẠI LÝ PHÂN PHỐI CHỨNG CHỈ QUỸ.................................. 18', 'VII. ĐẠI LÝ PHÂN PHỐI CHỨNG CHỈ QUỸ.................................. 18\nVIII. TỔ CHỨC CHỨC UP QUYỀN.......................................... 18\nIX. THÔNG TIN VỀ QUỸ ĐẦU TƯ CỔ PHIẾU DOANH NGHIỆP VỪA VÀ NHỎ\nTECHCOM (TCSME).............................................. 18\n1. Thông tin về Quỹ................................................ 18\n1.1. Các điều khoản chung........................................... 19\n2.1. Các điều khoản chung........................................... 19\n2.1. Các điều khoản chung........................................... 19\n2.2. Mục tiêu, chính sách và hạn chế đầu tư.............................. 24\n2.2.1. Cơ cấu danh mục.............................................. 24\n2.2.2. Các quy định về mục tiêu, chính sách và hạn chế đầu tư.............. 26', 'nhượng, chuyển nhượng, hoặc bán một phần hoặc toàn bộ các khoản đầu tư vào Quỹ. Nhà đầu tư\ncó trách nhiệm tự mình thực hiện việc thẩm định và đánh giá mọi rủi ro liên quan đến đầu tư.  \nBản cáo bạch này bao gồm các thông tin về Quỹ, dự kiến các khoản đầu tư của Quỹ, các điều kiện\nvà quy định của Quỹ, hoặc các thông tin khác mà nhà đầu tư cần biết. Nhà đầu tư nên đọc kỹ Bản\ncáo bạch này và các tài liệu đính kèm trước khi ra quyết định đầu tư.\nTCC sẽ cập nhật Bản cáo bạch này nếu có bất kỳ thay đổi nào về thông tin.\nBản cáo bạch được cung cấp miễn phí tại văn phòng của TCC, các Đại lý phân phối và trên trang\nweb của TCC.  \nBản cáo bạch này được phát hành bởi:\nCông ty Cổ phần Quản lý Quỹ Ký Thương - TechcomCapital (“TCC”)', '(Quỹ chứng khoán doanh nghiệp vừa và nhỏ Techcom)\nBản cáo bạch này được phát hành bởi:\nCông ty Cổ phần Quản lý Quỹ Ký Thương - TechcomCapital (“TCC”)\nĐịa chỉ : Tầng 28, Tòa C5, số 119 Trần Duy Hưng, phường Trung Hòa, Quận Cầu\nGiấy, Hà Nội\nĐiện thoại : (84-24) 39446368 Fax: (84-24) 39446583\nWebsite : www.techcomcapital.com.vn  \nNơi cung cấp Bản cáo bạch:\nBản cáo bạch cập nhật những các tài liệu của Quỹ (báo cáo hoạt động, báo cáo tài chính,\nĐiểu Lệ Quỹ và các tài liệu cần thiết khác) được cung cấp trên trang điện tử của TCC,\nwww.techcomcapital.com.vn, tại văn phòng của TCC và các Đại lý phân phối như danh sách\ntrong phụ lục 1 của Bản cáo Bạch.  \nPhụ trách công bố thông tin:\nÔng Đặng Lưu Dũng – Tổng Giám đốc\nĐịa chỉ : Công ty Cổ phần Quản lý Quỹ Ký Thương', 'Bản cáo bạch này được phát hành bởi:\nCông ty Cổ phần Quản lý Quỹ Ký Thương - TechcomCapital (“TCC”)\nĐịa chỉ: Tầng 28, Tòa C5, số 119 Trần Duy Hưng, phường Trung Hòa, Quận Cầu Giấy, Hà Nội.\nĐiện thoại: (84-24) 39446368. Fax: (84-24) 39446583. Website: www.techcomcapital.com.vn.  \nBản cáo bạch này được phát hành bởi:\nCông ty Cổ phần Quản lý Quỹ Ký Thương - TechcomCapital (“TCC”)\nĐịa chỉ: Tầng 28, Tòa C5, số 119 Trần Duy Hưng, phường Trung Hòa, Quận Cầu Giấy, Hà Nội\nĐiện thoại: (84-24) 39446368 Fax: (84-24) 39446583\nWebsite: www.techcomcapital.com.vn  \nNơi cung cấp Bản cáo bạch:\nBản cáo bạch cập nhật những các tài liệu của Quỹ (báo cáo hoạt động, báo cáo tài chính,\nĐiểu Lệ Quỹ và các tài liệu cần thiết khác) được cung cấp trên trang điện tử của TCC,', 'Điểu Lệ Quỹ và các tài liệu cần thiết khác) được cung cấp trên trang điện tử của TCC,\nwww.techcomcapital.com.vn, tại văn phòng của TCC và các Đại lý phân phối như danh sách\ntrong phụ lục 1 của Bản cáo Bạch.  \nPhụ trách công bố thông tin:\nÔng Đặng Lưu Dũng – Tổng Giám đốc\nĐịa chỉ: Công ty Cổ phần Quản lý Quỹ Ký Thương\nTầng 28, Tòa C5, số 119 Trần Duy Hưng, phường Trung Hòa, Quận Cầu Giấy, Hà Nội\nĐiện thoại: (84-24) 39446368 Fax: (84-24) 39446583  \nBản cáo bạch này được phát hành bởi:\nCông ty Cổ phần Quản lý Quỹ Ký Thương - TechcomCapital (“TCC”)\nĐịa chỉ : Tầng 28, Tòa C5, số 119 Trần Duy Hưng, phường Trung Hòa, Quận Cầu Giấy, Hà Nội\nĐiện thoại : (84-24) 39446368 Fax: (84-24) 39446583\nWebsite : www.techcomcapital.com.vn  \nNơi cung cấp Bản cáo bạch:', '2.2.4 Hạn mức đầu tư\nHạn mức đầu tư của Quỹ được quy định chi tiết tuân theo các quy định tại Thông tư hướng dẫn\nhoạt động và quản lý các quỹ đầu tư chứng khoán. Co cấu danh mục đầu tư của Quỹ phải đảm\nbảo tuân theo các hạn mức đầu tư sau:\na) Tựa trên tổng giá trị tài khoản thanh toán của Quỹ tại ngân hàng giám sát, quỹ mở được\ncâu đề qua 49% tổng giá trị tài sản của quỹ vào các tài sản theo quy định tại điểm a, b mục\nIX.2.2.3\nb) Không được đầu tư vào chứng khoán của một tổ chức phát hành quá 10% tổng giá trị chứng\nkhoán đang lưu hành của tổ chức đó, trừ công cụ nợ của Chính phủ;\nc) Không được đầu tư quá 20% tổng giá trị tài sản của quỹ vào chứng khoán đang lưu hành và\ncác tài sản (nếu có) quy định tại điểm a, b mục IX.2.2.3 của một tổ chức phát hành, trừ công\ncụ nợ của Chính phủ;', 'Quỹ thực hiện hoặc gián tiếp hoặc tổng hợp các khoản phí và các chi phí/phí/giá dịch vụ liên quan đến các hoạt động của Quỹ mà Quỹ thực hiện hoặc gián tiếp hoặc tổng hợp các khoản phí và các chi phí/phí/giá dịch vụ liên quan đến các hoạt động của Quỹ mà Quỹ thực hiện hoặc gián tiếp hoặc tổng hợp các khoản phí và các chi phí/phí/giá dịch vụ liên quan đến các hoạt động của Quỹ mà Quỹ thực hiện hoặc gián tiếp hoặc tổng hợp các khoản phí và các chi phí/phí/giá dịch vụ liên quan đến các hoạt động của Quỹ mà Quỹ thực hiện hoặc gián tiếp hoặc tổng hợp các khoản phí và các chi phí/phí/giá dịch vụ liên quan đến các hoạt động của Quỹ mà Quỹ thực hiện hoặc gián tiếp hoặc tổng hợp các khoản phí và các chi phí/phí/giá dịch vụ liên quan đến các hoạt động của Quỹ mà Quỹ thực hiện hoặc gián tiếp hoặc', 'Quỹ đầu tư chứng khoán được mô tả trong Bản cáo bạch này là Quỹ được thành lập theo\nLuật Chứng khoán số 54/2019/QH14 Quốc hội Nước Cộng Hòa Xã hội Chủ nghĩa Việt\nNam thông qua ngày 26 tháng 11 năm 2019 và các văn bản hướng dẫn thi hành. Bản cáo\nbạch này đã được đăng ký với Ủy ban Chứng khoán Nhà nước ngày / /2022.  \nTHÔNG BÁO QUAN TRỌNG  \nCác nhà đầu tư nên nghiên cứu Bản cáo bạch này một cách cẩn trọng và toàn diện và không nên\ncoi nội dung hoặc tóm tắt ở đây là các tư vấn liên quan đến pháp lý, thuế, hoặc tài chính/đầu\ntư và nên tham khảo ý kiến chuyên gia tư vấn của mình về các yêu cầu pháp lý, thuế, năm\ngiữa, hoặc tư vấn về các khía cạnh khác của việc đầu tư, mua, cho tặng, năm giữ,\nnhượng, chuyển nhượng, hoặc bán một phần hoặc toàn bộ các khoản đầu tư vào Quỹ. Nhà đầu tư', 'gián tiếp hoặc tổng hợp các khoản phí và các chi phí/phí/giá dịch vụ liên quan đến các hoạt động của Quỹ mà Quỹ thực hiện hoặc gián tiếp hoặc tổng hợp các khoản phí và các chi phí/phí/giá dịch vụ liên quan đến các hoạt động của Quỹ mà Quỹ thực hiện hoặc gián tiếp hoặc tổng hợp các khoản phí và các chi phí/phí/giá dịch vụ liên quan đến các hoạt động của Quỹ mà Quỹ thực hiện hoặc gián tiếp hoặc tổng hợp các khoản phí và các chi phí/phí/giá dịch vụ liên quan đến các hoạt động của Quỹ mà Quỹ thực hiện hoặc gián tiếp hoặc tổng hợp các khoản phí và các chi phí/phí/giá dịch vụ liên quan đến các hoạt động của Quỹ mà Quỹ thực hiện hoặc gián tiếp hoặc tổng hợp các khoản phí và các chi phí/phí/giá dịch vụ liên quan đến các hoạt động của Quỹ mà Quỹ thực hiện hoặc gián tiếp hoặc tổng hợp các khoản phí', 'Website : www.techcomcapital.com.vn  \nNơi cung cấp Bản cáo bạch:\nBản cáo bạch cập nhật những các tài liệu của Quỹ (báo cáo hoạt động, báo cáo tài chính,\nĐiểu Lệ Quỹ và các tài liệu cần thiết khác) được cung cấp trên trang điện tử của TCC,\nwww.techcomcapital.com.vn, tại văn phòng của TCC và các Đại lý phân phối như danh sách\ntrong phụ lục 1 của Bản cáo Bạch.  \nPhụ trách công bố thông tin:\nÔng Đặng Lưu Dũng – Tổng Giám đốc\nĐịa chỉ: Công ty Cổ phần Quản lý Quỹ Ký Thương\nTầng 28, Tòa C5, số 119 Trần Duy Hưng, phường Trung Hòa, Quận Cầu Giấy, Hà Nội\nĐiện thoại: (84-24) 39446368 Fax: (84-24) 39446583', 'chi phí/phí/giá dịch vụ liên quan đến các hoạt động của Quỹ mà Quỹ thực hiện hoặc gián tiếp hoặc tổng hợp các khoản phí và các chi phí/phí/giá dịch vụ liên quan đến các hoạt động của Quỹ mà Quỹ thực hiện hoặc gián tiếp hoặc tổng hợp các khoản phí và các chi phí/phí/giá dịch vụ liên quan đến các hoạt động của Quỹ mà Quỹ thực hiện hoặc gián tiếp hoặc tổng hợp các khoản phí và các chi phí/phí/giá dịch vụ liên quan đến các hoạt động của Quỹ mà Quỹ thực hiện hoặc gián tiếp hoặc tổng hợp các khoản phí và các chi phí/phí/giá dịch vụ liên quan đến các hoạt động của Quỹ mà Quỹ thực hiện hoặc gián tiếp hoặc tổng hợp các khoản phí và các chi phí/phí/giá dịch vụ liên quan đến các hoạt động của Quỹ mà Quỹ thực hiện hoặc gián tiếp hoặc tổng hợp các khoản phí và các chi phí/phí/giá dịch vụ liên quan đến', 'Chỉ có các loại phí/dịch vụ và các chi phí/phí/giá dịch vụ liên quan trực tiếp hoặc gián tiếp hoặc tổng hợp các khoản phí và các chi phí/phí/giá dịch vụ liên quan đến các hoạt động của Quỹ mà Quỹ thực hiện hoặc gián tiếp hoặc tổng hợp các khoản phí và các chi phí/phí/giá dịch vụ liên quan đến các hoạt động của Quỹ mà Quỹ thực hiện hoặc gián tiếp hoặc tổng hợp các khoản phí và các chi phí/phí/giá dịch vụ liên quan đến các hoạt động của Quỹ mà Quỹ thực hiện hoặc gián tiếp hoặc tổng hợp các khoản phí và các chi phí/phí/giá dịch vụ liên quan đến các hoạt động của Quỹ mà Quỹ thực hiện hoặc gián tiếp hoặc tổng hợp các khoản phí và các chi phí/phí/giá dịch vụ liên quan đến các hoạt động của Quỹ mà Quỹ thực hiện hoặc gián tiếp hoặc tổng hợp các khoản phí và các chi phí/phí/giá dịch vụ liên quan', 'thực hiện hoặc gián tiếp hoặc tổng hợp các khoản phí và các chi phí/phí/giá dịch vụ liên quan đến các hoạt động của Quỹ mà Quỹ thực hiện hoặc gián tiếp hoặc tổng hợp các khoản phí và các chi phí/phí/giá dịch vụ liên quan đến các hoạt động của Quỹ mà Quỹ thực hiện hoặc gián tiếp hoặc tổng hợp các khoản phí và các chi phí/phí/giá dịch vụ liên quan đến các hoạt động của Quỹ mà Quỹ thực hiện hoặc gián tiếp hoặc tổng hợp các khoản phí và các chi phí/phí/giá dịch vụ liên quan đến các hoạt động của Quỹ mà Quỹ thực hiện hoặc gián tiếp hoặc tổng hợp các khoản phí và các chi phí/phí/giá dịch vụ liên quan đến các hoạt động của Quỹ mà Quỹ thực hiện hoặc gián tiếp hoặc tổng hợp các khoản phí và các chi phí/phí/giá dịch vụ liên quan đến các hoạt động của Quỹ mà Quỹ thực hiện hoặc gián tiếp hoặc tổng', 'tiếp hoặc tổng hợp các khoản phí và các chi phí/phí/giá dịch vụ liên quan đến các hoạt động của Quỹ mà Quỹ thực hiện hoặc gián tiếp hoặc tổng hợp các khoản phí và các chi phí/phí/giá dịch vụ liên quan đến các hoạt động của Quỹ mà Quỹ thực hiện hoặc gián tiếp hoặc tổng hợp các khoản phí và các chi phí/phí/giá dịch vụ liên quan đến các hoạt động của Quỹ mà Quỹ thực hiện hoặc gián tiếp hoặc tổng hợp các khoản phí và các chi phí/phí/giá dịch vụ liên quan đến các hoạt động của Quỹ mà Quỹ thực hiện hoặc gián tiếp hoặc tổng hợp các khoản phí và các chi phí/phí/giá dịch vụ liên quan đến các hoạt động của Quỹ mà Quỹ thực hiện hoặc gián tiếp hoặc tổng hợp các khoản phí và các chi phí/phí/giá dịch vụ liên quan đến các hoạt động của Quỹ mà Quỹ thực hiện hoặc gián tiếp hoặc tổng hợp các khoản phí và', 'tiếp hoặc tổng hợp các khoản phí và các chi phí/phí/giá dịch vụ liên quan đến các hoạt động của Quỹ mà Quỹ thực hiện hoặc gián tiếp hoặc tổng hợp các khoản phí và các chi phí/phí/giá dịch vụ liên quan đến các hoạt động của Quỹ mà Quỹ thực hiện hoặc gián tiếp hoặc tổng hợp các khoản phí và các chi phí/phí/giá dịch vụ liên quan đến các hoạt động của Quỹ mà Quỹ thực hiện hoặc gián tiếp hoặc tổng hợp các khoản phí và các chi phí/phí/giá dịch vụ liên quan đến các hoạt động của Quỹ mà Quỹ thực hiện hoặc gián tiếp hoặc tổng hợp các khoản phí và các chi phí/phí/giá dịch vụ liên quan đến các hoạt động của Quỹ mà Quỹ thực hiện hoặc gián tiếp hoặc tổng hợp các khoản phí và các chi phí/phí/giá dịch vụ liên quan đến các hoạt động của Quỹ mà Quỹ thực hiện hoặc gián tiếp hoặc tổng hợp các khoản phí và', 'tiếp hoặc tổng hợp các khoản phí và các chi phí/phí/giá dịch vụ liên quan đến các hoạt động của Quỹ mà Quỹ thực hiện hoặc gián tiếp hoặc tổng hợp các khoản phí và các chi phí/phí/giá dịch vụ liên quan đến các hoạt động của Quỹ mà Quỹ thực hiện hoặc gián tiếp hoặc tổng hợp các khoản phí và các chi phí/phí/giá dịch vụ liên quan đến các hoạt động của Quỹ mà Quỹ thực hiện hoặc gián tiếp hoặc tổng hợp các khoản phí và các chi phí/phí/giá dịch vụ liên quan đến các hoạt động của Quỹ mà Quỹ thực hiện hoặc gián tiếp hoặc tổng hợp các khoản phí và các chi phí/phí/giá dịch vụ liên quan đến các hoạt động của Quỹ mà Quỹ thực hiện hoặc gián tiếp hoặc tổng hợp các khoản phí và các chi phí/phí/giá dịch vụ liên quan đến các hoạt động của Quỹ mà Quỹ thực hiện hoặc gián tiếp hoặc tổng hợp các khoản phí và', 'tiếp hoặc tổng hợp các khoản phí và các chi phí/phí/giá dịch vụ liên quan đến các hoạt động của Quỹ mà Quỹ thực hiện hoặc gián tiếp hoặc tổng hợp các khoản phí và các chi phí/phí/giá dịch vụ liên quan đến các hoạt động của Quỹ mà Quỹ thực hiện hoặc gián tiếp hoặc tổng hợp các khoản phí và các chi phí/phí/giá dịch vụ liên quan đến các hoạt động của Quỹ mà Quỹ thực hiện hoặc gián tiếp hoặc tổng hợp các khoản phí và các chi phí/phí/giá dịch vụ liên quan đến các hoạt động của Quỹ mà Quỹ thực hiện hoặc gián tiếp hoặc tổng hợp các khoản phí và các chi phí/phí/giá dịch vụ liên quan đến các hoạt động của Quỹ mà Quỹ thực hiện hoặc gián tiếp hoặc tổng hợp các khoản phí và các chi phí/phí/giá dịch vụ liên quan đến các hoạt động của Quỹ mà Quỹ thực hiện hoặc gián tiếp hoặc tổng hợp các khoản phí và', 'tiếp hoặc tổng hợp các khoản phí và các chi phí/phí/giá dịch vụ liên quan đến các hoạt động của Quỹ mà Quỹ thực hiện hoặc gián tiếp hoặc tổng hợp các khoản phí và các chi phí/phí/giá dịch vụ liên quan đến các hoạt động của Quỹ mà Quỹ thực hiện hoặc gián tiếp hoặc tổng hợp các khoản phí và các chi phí/phí/giá dịch vụ liên quan đến các hoạt động của Quỹ mà Quỹ thực hiện hoặc gián tiếp hoặc tổng hợp các khoản phí và các chi phí/phí/giá dịch vụ liên quan đến các hoạt động của Quỹ mà Quỹ thực hiện hoặc gián tiếp hoặc tổng hợp các khoản phí và các chi phí/phí/giá dịch vụ liên quan đến các hoạt động của Quỹ mà Quỹ thực hiện hoặc gián tiếp hoặc tổng hợp các khoản phí và các chi phí/phí/giá dịch vụ liên quan đến các hoạt động của Quỹ mà Quỹ thực hiện hoặc gián tiếp hoặc tổng hợp các khoản phí và', 'tiếp hoặc tổng hợp các khoản phí và các chi phí/phí/giá dịch vụ liên quan đến các hoạt động của Quỹ mà Quỹ thực hiện hoặc gián tiếp hoặc tổng hợp các khoản phí và các chi phí/phí/giá dịch vụ liên quan đến các hoạt động của Quỹ mà Quỹ thực hiện hoặc gián tiếp hoặc tổng hợp các khoản phí và các chi phí/phí/giá dịch vụ liên quan đến các hoạt động của Quỹ mà Quỹ thực hiện hoặc gián tiếp hoặc tổng hợp các khoản phí và các chi phí/phí/giá dịch vụ liên quan đến các hoạt động của Quỹ mà Quỹ thực hiện hoặc gián tiếp hoặc tổng hợp các khoản phí và các chi phí/phí/giá dịch vụ liên quan đến các hoạt động của Quỹ mà Quỹ thực hiện hoặc gián tiếp hoặc tổng hợp các khoản phí và các chi phí/phí/giá dịch vụ liên quan đến các hoạt động của Quỹ mà Quỹ thực hiện hoặc gián tiếp hoặc tổng hợp các khoản phí và', 'tiếp hoặc tổng hợp các khoản phí và các chi phí/phí/giá dịch vụ liên quan đến các hoạt động của Quỹ mà Quỹ thực hiện hoặc gián tiếp hoặc tổng hợp các khoản phí và các chi phí/phí/giá dịch vụ liên quan đến các hoạt động của Quỹ mà Quỹ thực hiện hoặc gián tiếp hoặc tổng hợp các khoản phí và các chi phí/phí/giá dịch vụ liên quan đến các hoạt động của Quỹ mà Quỹ thực hiện hoặc gián tiếp hoặc tổng hợp các khoản phí và các chi phí/phí/giá dịch vụ liên quan đến các hoạt động của Quỹ mà Quỹ thực hiện hoặc gián tiếp hoặc tổng hợp các khoản phí và các chi phí/phí/giá dịch vụ liên quan đến các hoạt động của Quỹ mà Quỹ thực hiện hoặc gián tiếp hoặc tổng hợp các khoản phí và các chi phí/phí/giá dịch vụ liên quan đến các hoạt động của Quỹ mà Quỹ thực hiện hoặc gián tiếp hoặc tổng hợp các khoản phí và', 'tiếp hoặc tổng hợp các khoản phí và các chi phí/phí/giá dịch vụ liên quan đến các hoạt động của Quỹ mà Quỹ thực hiện hoặc gián tiếp hoặc tổng hợp các khoản phí và các chi phí/phí/giá dịch vụ liên quan đến các hoạt động của Quỹ mà Quỹ thực hiện hoặc gián tiếp hoặc tổng hợp các khoản phí và các chi phí/phí/giá dịch vụ liên quan đến các hoạt động của Quỹ mà Quỹ thực hiện hoặc gián tiếp hoặc tổng hợp các khoản phí và các chi phí/phí/giá dịch vụ liên quan đến các hoạt động của Quỹ mà Quỹ thực hiện hoặc gián tiếp hoặc tổng hợp các khoản phí và các chi phí/phí/giá dịch vụ liên quan đến các hoạt động của Quỹ mà Quỹ thực hiện hoặc gián tiếp hoặc tổng hợp các khoản phí và các chi phí/phí/giá dịch vụ liên quan đến các hoạt động của Quỹ mà Quỹ thực hiện hoặc gián tiếp hoặc tổng hợp các khoản phí và', 'tiếp hoặc tổng hợp các khoản phí và các chi phí/phí/giá dịch vụ liên quan đến các hoạt động của Quỹ mà Quỹ thực hiện hoặc gián tiếp hoặc tổng hợp các khoản phí và các chi phí/phí/giá dịch vụ liên quan đến các hoạt động của Quỹ mà Quỹ thực hiện hoặc gián tiếp hoặc tổng hợp các khoản phí và các chi phí/phí/giá dịch vụ liên quan đến các hoạt động của Quỹ mà Quỹ thực hiện hoặc gián tiếp hoặc tổng hợp các khoản phí và các chi phí/phí/giá dịch vụ liên quan đến các hoạt động của Quỹ mà Quỹ thực hiện hoặc gián tiếp hoặc tổng hợp các khoản phí và các chi phí/phí/giá dịch vụ liên quan đến các hoạt động của Quỹ mà Quỹ thực hiện hoặc gián tiếp hoặc tổng hợp các khoản phí và các chi phí/phí/giá dịch vụ liên quan đến các hoạt động của Quỹ mà Quỹ thực hiện hoặc gián tiếp hoặc tổng hợp các khoản phí và', 'tiếp hoặc tổng hợp các khoản phí và các chi phí/phí/giá dịch vụ liên quan đến các hoạt động của Quỹ mà Quỹ thực hiện hoặc gián tiếp hoặc tổng hợp các khoản phí và các chi phí/phí/giá dịch vụ liên quan đến các hoạt động của Quỹ mà Quỹ thực hiện hoặc gián tiếp hoặc tổng hợp các khoản phí và các chi phí/phí/giá dịch vụ liên quan đến các hoạt động của Quỹ mà Quỹ thực hiện hoặc gián tiếp hoặc tổng hợp các khoản phí và các chi phí/phí/giá dịch vụ liên quan đến các hoạt động của Quỹ mà Quỹ thực hiện hoặc gián tiếp hoặc tổng hợp các khoản phí và các chi phí/phí/giá dịch vụ liên quan đến các hoạt động của Quỹ mà Quỹ thực hiện hoặc gián tiếp hoặc tổng hợp các khoản phí và các chi phí/phí/giá dịch vụ liên quan đến các hoạt động của Quỹ mà Quỹ thực hiện hoặc gián tiếp hoặc tổng hợp các khoản phí và']",Không được đầu tư quá 10% tổng giá trị chứng khoán đang lưu hành của tổ chức đó (trừ công cụ nợ Chính phủ) và không quá 20% tổng tài sản quỹ vào một tổ chức.
Tổng giá trị các hạng mục đầu tư lớn (chiếm từ 5% tài sản quỹ trở lên) không được vượt quá tỷ lệ nào?,Tổng giá trị các hạng mục đầu tư lớn không được vượt quá 40% tổng giá trị tài sản của quỹ.,"['40% tổng giá trị tài sản của quỹ. Trong đó, hạng mục đầu tư lớn của quỹ là hạng mục đầu tư\nvào các loại tài sản quỹ định tại điểm a, d, và g mục IX.2.2.3 (ngoại trừ chứng chỉ tiền gửi)\nphải hành bởi cùng một tổ chức, có tổng giá trị chiếm từ 5% trở lên tổng giá trị tài sản của\nquỹ;\ng) Tại mọi thời điểm, tổng giá trị cam kết trong các giao dịch chứng khoán phái sinh, dự nợ vay\nvà các khoản phải trả của quỹ không được vượt giá trị tài sản ròng của quỹ;\nh) Không được đầu tư vào chứng khoán của Chính phủ Quỹ;\ni) Chỉ được đầu tư vào chứng chỉ quỹ đại chúng khác, công ty đầu tư chứng khoán đại chúng\ndo công ty quản lý quỹ khác quản lý và bảo đảm các hạn chế sau:\n- Không đầu tư vào quá 10% tổng giá trị chứng chỉ quỹ đang lưu hành của một quỹ đại chúng,', 'cụ nợ của Chính phủ;\nd) Không được đầu tư quá 30% tổng giá trị tài sản của quỹ vào các tài sản quỹ định tại điểm a,\nb, d, e và f mục IX.2.2.3, phải hành bởi các công ty trong cùng một nhóm công ty cơ quan hệ\nsở hữu với nhau, thuộc sở hữu hợp của sau đây: Công ty con, các công ty sở hữu\nhien 35% cổ phần, phần vốn góp của nhau.nhóm công ty con, công ty mẹ. Tổng\nđộ phân đầu tư vào chứng khoán phái sinh tính bằng giá trị cam kết của hợp đồng xác định\ntheo quy định tại Phụ Lục 4 Điều Lệ Quỹ;\ne) Không được đầu tư quá 10% tổng giá trị tài sản của quỹ vào các tài sản quỹ định tại điểm d\nmục IX.2.2.3;\nf) Tổng giá trị các hạng mục đầu tư lớn trong danh mục đầu tư của quỹ không được vượt quá\n40% tổng giá trị tài sản của quỹ. Trong đó, hạng mục đầu tư lớn của quỹ là hạng mục đầu tư', 'từ trên 12 tháng trở lên 0,00%  \nGiấy dịch vụ Chuyển Đổi Quỹ sẽ được hạch toán cho Công ty Quản lý Quỹ và Đại Lý Phân Phối căn cứ theo hợp đồng ký giữa Công ty Quản lý Quỹ và Đại Lý Phân Phối.  \nd) Giấy dịch vụ Chuyển Nhượng  \nNhà Đầu tư phải trả một mức phí dịch vụ Chuyển Nhượng duy nhất là 300.000 đồng (ba trăm nghìn đồng) cho mỗi giao dịch chuyển nhượng Đơn vị Quỹ. Giá dịch vụ Chuyển Nhượng do người thực hiện chuyển nhượng thanh toán.  \nGiấy dịch vụ Chuyển nhượng sẽ không áp dụng trong trường hợp Nhà Đầu tư thực hiện chuyển nhượng số Chứng Chỉ quỹ từ tài khoản này sang tài khoản khác cùng tên thì Nhà Đầu tư tại Hai Đại Lý Phân Phối khác nhau.', '- Không đầu tư vào quá 10% tổng giá trị chứng chỉ quỹ đang lưu hành của một quỹ đại chúng,\ncổ phiếu công ty quản lý quỹ khác có chứng khoán đại chúng;\n- Không đầu tư quá 20% tổng giá trị tài sản của quỹ vào chứng chỉ quỹ của một quỹ đại\nchúng, cổ phiếu của một công ty đầu tư chứng khoán đại chúng;\n- Không được đầu tư quá 50% tổng giá trị tài sản của quỹ vào các chứng chỉ quỹ đại chúng, cổ\nphiếu công ty đầu tư chứng khoán đại chúng;\nk) Không được đầu tư trực tiếp bất động sản, đã quỹ, kim loại quý hiếm;\n1) Phải có chứng khoán của ít nhất 06 tổ chức phát hành.\n2.2.5 Điều chỉnh danh mục đầu tư\nCơ cấu đầu tư của Quỹ mới chỉ được vược với các hạn chế đầu tư đã quy định tại điểm a,\nb, c, d, e và mục IX.2.2.4 và chỉ do các nguyên nhân sau:', '2.2.4 Hạn mức đầu tư\nHạn mức đầu tư của Quỹ được quy định chi tiết tuân theo các quy định tại Thông tư hướng dẫn\nhoạt động và quản lý các quỹ đầu tư chứng khoán. Co cấu danh mục đầu tư của Quỹ phải đảm\nbảo tuân theo các hạn mức đầu tư sau:\na) Tựa trên tổng giá trị tài khoản thanh toán của Quỹ tại ngân hàng giám sát, quỹ mở được\ncâu đề qua 49% tổng giá trị tài sản của quỹ vào các tài sản theo quy định tại điểm a, b mục\nIX.2.2.3\nb) Không được đầu tư vào chứng khoán của một tổ chức phát hành quá 10% tổng giá trị chứng\nkhoán đang lưu hành của tổ chức đó, trừ công cụ nợ của Chính phủ;\nc) Không được đầu tư quá 20% tổng giá trị tài sản của quỹ vào chứng khoán đang lưu hành và\ncác tài sản (nếu có) quy định tại điểm a, b mục IX.2.2.3 của một tổ chức phát hành, trừ công\ncụ nợ của Chính phủ;', 'quỹ (nếu có) so với mọi chỉ phí phát sinh liên quan đến việc điều chỉnh lại danh mục đầu tư.\nTrong thời hạn 05 ngày làm việc kể từ ngày hoãn khẩn tại thời điểm điều chỉnh lại danh mục đầu tư.\nTrong thời hạn 05 ngày làm việc kể từ ngày hoãn khẩn tại thời điểm điều chỉnh lại danh mục đầu tư.\nTrong thời hạn 05 ngày làm việc kể từ ngày hoãn khẩn tại thời điểm điều chỉnh lại danh mục đầu tư.\nTrong thời hạn 05 ngày làm việc kể từ ngày hoãn khẩn tại thời điểm điều chỉnh lại danh mục đầu tư.\nTrong thời hạn 05 ngày làm việc kể từ ngày hoãn khẩn tại thời điểm điều chỉnh lại danh mục đầu tư.\nTrong thời hạn 05 ngày làm việc kể từ ngày hoãn khẩn tại thời điểm điều chỉnh lại danh mục đầu tư.\nTrong thời hạn 05 ngày làm việc kể từ ngày hoãn khẩn tại thời điểm điều chỉnh lại danh mục đầu tư.', '*   Kết quả hoạt động trong quá khứ của các Quỹ không có nghĩa là kết quả hoạt động trong tương lai.\n*   Tên của Quỹ không hàm ý về chất lượng hoạt động cũng như những lợi và lợi nhuận của Quỹ trong tương lai;\n*   Công ty Quản lý Quỹ không chịu trách nhiệm pháp lý về những rủi ro từ đầu tư của các chủ nợ, thành viên Hội đồng thành viên, Ban điều hành và nhân viên của Công ty Quản lý Quỹ không có trách nhiệm pháp lý về các rủi ro hoạt động của Công ty Quản lý Quỹ.\n*   Giống như các hình thức đầu tư khác, Quỹ, rủi ro thanh khoản sẽ được phân bổ trên cơ sở số ngày gần nhất với giá trị tài sản ròng. Các khoản đầu tư khác có thể có nhiều rủi ro hơn so với thời điểm hiện tại. Nhà Đầu tư cần phải nhận thức được khả năng chấp nhận rủi ro từ vơi rủi ro đầu tư mà Quỹ có thể gặp phải trong tương lai.', 'Trong thời hạn 05 ngày làm việc kể từ ngày hoãn khẩn tại thời điểm điều chỉnh lại danh mục đầu tư.\nTrong thời hạn 05 ngày làm việc kể từ ngày hoãn khẩn tại thời điểm điều chỉnh lại danh mục đầu tư.\nTrong thời hạn 05 ngày làm việc kể từ ngày hoãn khẩn tại thời điểm điều chỉnh lại danh mục đầu tư.\nTrong thời hạn 05 ngày làm việc kể từ ngày hoãn khẩn tại thời điểm điều chỉnh lại danh mục đầu tư.\nTrong thời hạn 05 ngày làm việc kể từ ngày hoãn khẩn tại thời điểm điều chỉnh lại danh mục đầu tư.\nTrong thời hạn 05 ngày làm việc kể từ ngày hoãn khẩn tại thời điểm điều chỉnh lại danh mục đầu tư.\nTrong thời hạn 05 ngày làm việc kể từ ngày hoãn khẩn tại thời điểm điều chỉnh lại danh mục đầu tư.\nTrong thời hạn 05 ngày làm việc kể từ ngày hoãn khẩn tại thời điểm điều chỉnh lại danh mục đầu tư.', 'Trong thời hạn 05 ngày làm việc kể từ ngày hoãn khẩn tại thời điểm điều chỉnh lại danh mục đầu tư.\nTrong thời hạn 05 ngày làm việc kể từ ngày hoãn khẩn tại thời điểm điều chỉnh lại danh mục đầu tư.\nTrong thời hạn 05 ngày làm việc kể từ ngày hoãn khẩn tại thời điểm điều chỉnh lại danh mục đầu tư.\nTrong thời hạn 05 ngày làm việc kể từ ngày hoãn khẩn tại thời điểm điều chỉnh lại danh mục đầu tư.\nTrong thời hạn 05 ngày làm việc kể từ ngày hoãn khẩn tại thời điểm điều chỉnh lại danh mục đầu tư.\nTrong thời hạn 05 ngày làm việc kể từ ngày hoãn khẩn tại thời điểm điều chỉnh lại danh mục đầu tư.\nTrong thời hạn 05 ngày làm việc kể từ ngày hoãn khẩn tại thời điểm điều chỉnh lại danh mục đầu tư.\nTrong thời hạn 05 ngày làm việc kể từ ngày hoãn khẩn tại thời điểm điều chỉnh lại danh mục đầu tư.', 'Trong thời hạn 05 ngày làm việc kể từ ngày hoãn khẩn tại thời điểm điều chỉnh lại danh mục đầu tư.\nTrong thời hạn 05 ngày làm việc kể từ ngày hoãn khẩn tại thời điểm điều chỉnh lại danh mục đầu tư.\nTrong thời hạn 05 ngày làm việc kể từ ngày hoãn khẩn tại thời điểm điều chỉnh lại danh mục đầu tư.\nTrong thời hạn 05 ngày làm việc kể từ ngày hoãn khẩn tại thời điểm điều chỉnh lại danh mục đầu tư.\nTrong thời hạn 05 ngày làm việc kể từ ngày hoãn khẩn tại thời điểm điều chỉnh lại danh mục đầu tư.\nTrong thời hạn 05 ngày làm việc kể từ ngày hoãn khẩn tại thời điểm điều chỉnh lại danh mục đầu tư.\nTrong thời hạn 05 ngày làm việc kể từ ngày hoãn khẩn tại thời điểm điều chỉnh lại danh mục đầu tư.\nTrong thời hạn 05 ngày làm việc kể từ ngày hoãn khẩn tại thời điểm điều chỉnh lại danh mục đầu tư.', 'Trong thời hạn 05 ngày làm việc kể từ ngày hoãn khẩn tại thời điểm điều chỉnh lại danh mục đầu tư.\nTrong thời hạn 05 ngày làm việc kể từ ngày hoãn khẩn tại thời điểm điều chỉnh lại danh mục đầu tư.\nTrong thời hạn 05 ngày làm việc kể từ ngày hoãn khẩn tại thời điểm điều chỉnh lại danh mục đầu tư.\nTrong thời hạn 05 ngày làm việc kể từ ngày hoãn khẩn tại thời điểm điều chỉnh lại danh mục đầu tư.\nTrong thời hạn 05 ngày làm việc kể từ ngày hoãn khẩn tại thời điểm điều chỉnh lại danh mục đầu tư.\nTrong thời hạn 05 ngày làm việc kể từ ngày hoãn khẩn tại thời điểm điều chỉnh lại danh mục đầu tư.\nTrong thời hạn 05 ngày làm việc kể từ ngày hoãn khẩn tại thời điểm điều chỉnh lại danh mục đầu tư.\nTrong thời hạn 05 ngày làm việc kể từ ngày hoãn khẩn tại thời điểm điều chỉnh lại danh mục đầu tư.', 'Trong thời hạn 05 ngày làm việc kể từ ngày hoãn khẩn tại thời điểm điều chỉnh lại danh mục đầu tư.\nTrong thời hạn 05 ngày làm việc kể từ ngày hoãn khẩn tại thời điểm điều chỉnh lại danh mục đầu tư.\nTrong thời hạn 05 ngày làm việc kể từ ngày hoãn khẩn tại thời điểm điều chỉnh lại danh mục đầu tư.\nTrong thời hạn 05 ngày làm việc kể từ ngày hoãn khẩn tại thời điểm điều chỉnh lại danh mục đầu tư.\nTrong thời hạn 05 ngày làm việc kể từ ngày hoãn khẩn tại thời điểm điều chỉnh lại danh mục đầu tư.\nTrong thời hạn 05 ngày làm việc kể từ ngày hoãn khẩn tại thời điểm điều chỉnh lại danh mục đầu tư.\nTrong thời hạn 05 ngày làm việc kể từ ngày hoãn khẩn tại thời điểm điều chỉnh lại danh mục đầu tư.\nTrong thời hạn 05 ngày làm việc kể từ ngày hoãn khẩn tại thời điểm điều chỉnh lại danh mục đầu tư.', 'Trong thời hạn 05 ngày làm việc kể từ ngày hoãn khẩn tại thời điểm điều chỉnh lại danh mục đầu tư.\nTrong thời hạn 05 ngày làm việc kể từ ngày hoãn khẩn tại thời điểm điều chỉnh lại danh mục đầu tư.\nTrong thời hạn 05 ngày làm việc kể từ ngày hoãn khẩn tại thời điểm điều chỉnh lại danh mục đầu tư.\nTrong thời hạn 05 ngày làm việc kể từ ngày hoãn khẩn tại thời điểm điều chỉnh lại danh mục đầu tư.\nTrong thời hạn 05 ngày làm việc kể từ ngày hoãn khẩn tại thời điểm điều chỉnh lại danh mục đầu tư.\nTrong thời hạn 05 ngày làm việc kể từ ngày hoãn khẩn tại thời điểm điều chỉnh lại danh mục đầu tư.\nTrong thời hạn 05 ngày làm việc kể từ ngày hoãn khẩn tại thời điểm điều chỉnh lại danh mục đầu tư.\nTrong thời hạn 05 ngày làm việc kể từ ngày hoãn khẩn tại thời điểm điều chỉnh lại danh mục đầu tư.', 'Trong thời hạn 05 ngày làm việc kể từ ngày hoãn khẩn tại thời điểm điều chỉnh lại danh mục đầu tư.\nTrong thời hạn 05 ngày làm việc kể từ ngày hoãn khẩn tại thời điểm điều chỉnh lại danh mục đầu tư.\nTrong thời hạn 05 ngày làm việc kể từ ngày hoãn khẩn tại thời điểm điều chỉnh lại danh mục đầu tư.\nTrong thời hạn 05 ngày làm việc kể từ ngày hoãn khẩn tại thời điểm điều chỉnh lại danh mục đầu tư.\nTrong thời hạn 05 ngày làm việc kể từ ngày hoãn khẩn tại thời điểm điều chỉnh lại danh mục đầu tư.\nTrong thời hạn 05 ngày làm việc kể từ ngày hoãn khẩn tại thời điểm điều chỉnh lại danh mục đầu tư.\nTrong thời hạn 05 ngày làm việc kể từ ngày hoãn khẩn tại thời điểm điều chỉnh lại danh mục đầu tư.\nTrong thời hạn 05 ngày làm việc kể từ ngày hoãn khẩn tại thời điểm điều chỉnh lại danh mục đầu tư.', 'Trong thời hạn 05 ngày làm việc kể từ ngày hoãn khẩn tại thời điểm điều chỉnh lại danh mục đầu tư.\nTrong thời hạn 05 ngày làm việc kể từ ngày hoãn khẩn tại thời điểm điều chỉnh lại danh mục đầu tư.\nTrong thời hạn 05 ngày làm việc kể từ ngày hoãn khẩn tại thời điểm điều chỉnh lại danh mục đầu tư.\nTrong thời hạn 05 ngày làm việc kể từ ngày hoãn khẩn tại thời điểm điều chỉnh lại danh mục đầu tư.\nTrong thời hạn 05 ngày làm việc kể từ ngày hoãn khẩn tại thời điểm điều chỉnh lại danh mục đầu tư.\nTrong thời hạn 05 ngày làm việc kể từ ngày hoãn khẩn tại thời điểm điều chỉnh lại danh mục đầu tư.\nTrong thời hạn 05 ngày làm việc kể từ ngày hoãn khẩn tại thời điểm điều chỉnh lại danh mục đầu tư.\nTrong thời hạn 05 ngày làm việc kể từ ngày hoãn khẩn tại thời điểm điều chỉnh lại danh mục đầu tư.', 'Trong thời hạn 05 ngày làm việc kể từ ngày hoãn khẩn tại thời điểm điều chỉnh lại danh mục đầu tư.\nTrong thời hạn 05 ngày làm việc kể từ ngày hoãn khẩn tại thời điểm điều chỉnh lại danh mục đầu tư.\nTrong thời hạn 05 ngày làm việc kể từ ngày hoãn khẩn tại thời điểm điều chỉnh lại danh mục đầu tư.\nTrong thời hạn 05 ngày làm việc kể từ ngày hoãn khẩn tại thời điểm điều chỉnh lại danh mục đầu tư.\nTrong thời hạn 05 ngày làm việc kể từ ngày hoãn khẩn tại thời điểm điều chỉnh lại danh mục đầu tư.\nTrong thời hạn 05 ngày làm việc kể từ ngày hoãn khẩn tại thời điểm điều chỉnh lại danh mục đầu tư.\nTrong thời hạn 05 ngày làm việc kể từ ngày hoãn khẩn tại thời điểm điều chỉnh lại danh mục đầu tư.\nTrong thời hạn 05 ngày làm việc kể từ ngày hoãn khẩn tại thời điểm điều chỉnh lại danh mục đầu tư.', 'Trong thời hạn 05 ngày làm việc kể từ ngày hoãn khẩn tại thời điểm điều chỉnh lại danh mục đầu tư.\nTrong thời hạn 05 ngày làm việc kể từ ngày hoãn khẩn tại thời điểm điều chỉnh lại danh mục đầu tư.\nTrong thời hạn 05 ngày làm việc kể từ ngày hoãn khẩn tại thời điểm điều chỉnh lại danh mục đầu tư.\nTrong thời hạn 05 ngày làm việc kể từ ngày hoãn khẩn tại thời điểm điều chỉnh lại danh mục đầu tư.\nTrong thời hạn 05 ngày làm việc kể từ ngày hoãn khẩn tại thời điểm điều chỉnh lại danh mục đầu tư.\nTrong thời hạn 05 ngày làm việc kể từ ngày hoãn khẩn tại thời điểm điều chỉnh lại danh mục đầu tư.\nTrong thời hạn 05 ngày làm việc kể từ ngày hoãn khẩn tại thời điểm điều chỉnh lại danh mục đầu tư.\nTrong thời hạn 05 ngày làm việc kể từ ngày hoãn khẩn tại thời điểm điều chỉnh lại danh mục đầu tư.', 'Trong thời hạn 05 ngày làm việc kể từ ngày hoãn khẩn tại thời điểm điều chỉnh lại danh mục đầu tư.\nTrong thời hạn 05 ngày làm việc kể từ ngày hoãn khẩn tại thời điểm điều chỉnh lại danh mục đầu tư.\nTrong thời hạn 05 ngày làm việc kể từ ngày hoãn khẩn tại thời điểm điều chỉnh lại danh mục đầu tư.\nTrong thời hạn 05 ngày làm việc kể từ ngày hoãn khẩn tại thời điểm điều chỉnh lại danh mục đầu tư.\nTrong thời hạn 05 ngày làm việc kể từ ngày hoãn khẩn tại thời điểm điều chỉnh lại danh mục đầu tư.\nTrong thời hạn 05 ngày làm việc kể từ ngày hoãn khẩn tại thời điểm điều chỉnh lại danh mục đầu tư.\nTrong thời hạn 05 ngày làm việc kể từ ngày hoãn khẩn tại thời điểm điều chỉnh lại danh mục đầu tư.\nTrong thời hạn 05 ngày làm việc kể từ ngày hoãn khẩn tại thời điểm điều chỉnh lại danh mục đầu tư.', 'Trong thời hạn 05 ngày làm việc kể từ ngày hoãn khẩn tại thời điểm điều chỉnh lại danh mục đầu tư.\nTrong thời hạn 05 ngày làm việc kể từ ngày hoãn khẩn tại thời điểm điều chỉnh lại danh mục đầu tư.\nTrong thời hạn 05 ngày làm việc kể từ ngày hoãn khẩn tại thời điểm điều chỉnh lại danh mục đầu tư.\nTrong thời hạn 05 ngày làm việc kể từ ngày hoãn khẩn tại thời điểm điều chỉnh lại danh mục đầu tư.\nTrong thời hạn 05 ngày làm việc kể từ ngày hoãn khẩn tại thời điểm điều chỉnh lại danh mục đầu tư.\nTrong thời hạn 05 ngày làm việc kể từ ngày hoãn khẩn tại thời điểm điều chỉnh lại danh mục đầu tư.\nTrong thời hạn 05 ngày làm việc kể từ ngày hoãn khẩn tại thời điểm điều chỉnh lại danh mục đầu tư.\nTrong thời hạn 05 ngày làm việc kể từ ngày hoãn khẩn tại thời điểm điều chỉnh lại danh mục đầu tư.', 'Trong thời hạn 05 ngày làm việc kể từ ngày hoãn khẩn tại thời điểm điều chỉnh lại danh mục đầu tư.\nTrong thời hạn 05 ngày làm việc kể từ ngày hoãn khẩn tại thời điểm điều chỉnh lại danh mục đầu tư.\nTrong thời hạn 05 ngày làm việc kể từ ngày hoãn khẩn tại thời điểm điều chỉnh lại danh mục đầu tư.\nTrong thời hạn 05 ngày làm việc kể từ ngày hoãn khẩn tại thời điểm điều chỉnh lại danh mục đầu tư.\nTrong thời hạn 05 ngày làm việc kể từ ngày hoãn khẩn tại thời điểm điều chỉnh lại danh mục đầu tư.\nTrong thời hạn 05 ngày làm việc kể từ ngày hoãn khẩn tại thời điểm điều chỉnh lại danh mục đầu tư.\nTrong thời hạn 05 ngày làm việc kể từ ngày hoãn khẩn tại thời điểm điều chỉnh lại danh mục đầu tư.\nTrong thời hạn 05 ngày làm việc kể từ ngày hoãn khẩn tại thời điểm điều chỉnh lại danh mục đầu tư.', 'Trong thời hạn 05 ngày làm việc kể từ ngày hoãn khẩn tại thời điểm điều chỉnh lại danh mục đầu tư.\nTrong thời hạn 05 ngày làm việc kể từ ngày hoãn khẩn tại thời điểm điều chỉnh lại danh mục đầu tư.\nTrong thời hạn 05 ngày làm việc kể từ ngày hoãn khẩn tại thời điểm điều chỉnh lại danh mục đầu tư.\nTrong thời hạn 05 ngày làm việc kể từ ngày hoãn khẩn tại thời điểm điều chỉnh lại danh mục đầu tư.\nTrong thời hạn 05 ngày làm việc kể từ ngày hoãn khẩn tại thời điểm điều chỉnh lại danh mục đầu tư.\nTrong thời hạn 05 ngày làm việc kể từ ngày hoãn khẩn tại thời điểm điều chỉnh lại danh mục đầu tư.\nTrong thời hạn 05 ngày làm việc kể từ ngày hoãn khẩn tại thời điểm điều chỉnh lại danh mục đầu tư.\nTrong thời hạn 05 ngày làm việc kể từ ngày hoãn khẩn tại thời điểm điều chỉnh lại danh mục đầu tư.', 'Trong thời hạn 05 ngày làm việc kể từ ngày hoãn khẩn tại thời điểm điều chỉnh lại danh mục đầu tư.\nTrong thời hạn 05 ngày làm việc kể từ ngày hoãn khẩn tại thời điểm điều chỉnh lại danh mục đầu tư.\nTrong thời hạn 05 ngày làm việc kể từ ngày hoãn khẩn tại thời điểm điều chỉnh lại danh mục đầu tư.\nTrong thời hạn 05 ngày làm việc kể từ ngày hoãn khẩn tại thời điểm điều chỉnh lại danh mục đầu tư.\nTrong thời hạn 05 ngày làm việc kể từ ngày hoãn khẩn tại thời điểm điều chỉnh lại danh mục đầu tư.\nTrong thời hạn 05 ngày làm việc kể từ ngày hoãn khẩn tại thời điểm điều chỉnh lại danh mục đầu tư.\nTrong thời hạn 05 ngày làm việc kể từ ngày hoãn khẩn tại thời điểm điều chỉnh lại danh mục đầu tư.\nTrong thời hạn 05 ngày làm việc kể từ ngày hoãn khẩn tại thời điểm điều chỉnh lại danh mục đầu tư.', 'Trong thời hạn 05 ngày làm việc kể từ ngày hoãn khẩn tại thời điểm điều chỉnh lại danh mục đầu tư.\nTrong thời hạn 05 ngày làm việc kể từ ngày hoãn khẩn tại thời điểm điều chỉnh lại danh mục đầu tư.\nTrong thời hạn 05 ngày làm việc kể từ ngày hoãn khẩn tại thời điểm điều chỉnh lại danh mục đầu tư.\nTrong thời hạn 05 ngày làm việc kể từ ngày hoãn khẩn tại thời điểm điều chỉnh lại danh mục đầu tư.\nTrong thời hạn 05 ngày làm việc kể từ ngày hoãn khẩn tại thời điểm điều chỉnh lại danh mục đầu tư.\nTrong thời hạn 05 ngày làm việc kể từ ngày hoãn khẩn tại thời điểm điều chỉnh lại danh mục đầu tư.\nTrong thời hạn 05 ngày làm việc kể từ ngày hoãn khẩn tại thời điểm điều chỉnh lại danh mục đầu tư.\nTrong thời hạn 05 ngày làm việc kể từ ngày hoãn khẩn tại thời điểm điều chỉnh lại danh mục đầu tư.', 'Trong thời hạn 05 ngày làm việc kể từ ngày hoãn khẩn tại thời điểm điều chỉnh lại danh mục đầu tư.\nTrong thời hạn 05 ngày làm việc kể từ ngày hoãn khẩn tại thời điểm điều chỉnh lại danh mục đầu tư.\nTrong thời hạn 05 ngày làm việc kể từ ngày hoãn khẩn tại thời điểm điều chỉnh lại danh mục đầu tư.\nTrong thời hạn 05 ngày làm việc kể từ ngày hoãn khẩn tại thời điểm điều chỉnh lại danh mục đầu tư.\nTrong thời hạn 05 ngày làm việc kể từ ngày hoãn khẩn tại thời điểm điều chỉnh lại danh mục đầu tư.\nTrong thời hạn 05 ngày làm việc kể từ ngày hoãn khẩn tại thời điểm điều chỉnh lại danh mục đầu tư.\nTrong thời hạn 05 ngày làm việc kể từ ngày hoãn khẩn tại thời điểm điều chỉnh lại danh mục đầu tư.\nTrong thời hạn 05 ngày làm việc kể từ ngày hoãn khẩn tại thời điểm điều chỉnh lại danh mục đầu tư.', 'Trong thời hạn 05 ngày làm việc kể từ ngày hoãn khẩn tại thời điểm điều chỉnh lại danh mục đầu tư.\nTrong thời hạn 05 ngày làm việc kể từ ngày hoãn khẩn tại thời điểm điều chỉnh lại danh mục đầu tư.\nTrong thời hạn 05 ngày làm việc kể từ ngày hoãn khẩn tại thời điểm điều chỉnh lại danh mục đầu tư.\nTrong thời hạn 05 ngày làm việc kể từ ngày hoãn khẩn tại thời điểm điều chỉnh lại danh mục đầu tư.\nTrong thời hạn 05 ngày làm việc kể từ ngày hoãn khẩn tại thời điểm điều chỉnh lại danh mục đầu tư.\nTrong thời hạn 05 ngày làm việc kể từ ngày hoãn khẩn tại thời điểm điều chỉnh lại danh mục đầu tư.\nTrong thời hạn 05 ngày làm việc kể từ ngày hoãn khẩn tại thời điểm điều chỉnh lại danh mục đầu tư.\nTrong thời hạn 05 ngày làm việc kể từ ngày hoãn khẩn tại thời điểm điều chỉnh lại danh mục đầu tư.']",Không được vượt quá 40% tổng giá trị tài sản của quỹ.
Quỹ có được phép đầu tư vào chứng chỉ quỹ của chính mình hoặc đầu tư trực tiếp vào bất động sản không?,Tôi không tìm thấy thông tin đó trong tài liệu.,"['Quỹ đầu tư chứng khoán được mô tả trong Bản cáo bạch này là Quỹ được thành lập theo\nLuật Chứng khoán số 54/2019/QH14 Quốc hội Nước Cộng Hòa Xã hội Chủ nghĩa Việt\nNam thông qua ngày 26 tháng 11 năm 2019 và các văn bản hướng dẫn thi hành. Bản cáo\nbạch này đã được đăng ký với Ủy ban Chứng khoán Nhà nước ngày / /2022.  \nTHÔNG BÁO QUAN TRỌNG  \nCác nhà đầu tư nên nghiên cứu Bản cáo bạch này một cách cẩn trọng và toàn diện và không nên\ncoi nội dung hoặc tóm tắt ở đây là các tư vấn liên quan đến pháp lý, thuế, hoặc tài chính/đầu\ntư và nên tham khảo ý kiến chuyên gia tư vấn của mình về các yêu cầu pháp lý, thuế, năm\ngiữa, hoặc tư vấn về các khía cạnh khác của việc đầu tư, mua, cho tặng, năm giữ,\nnhượng, chuyển nhượng, hoặc bán một phần hoặc toàn bộ các khoản đầu tư vào Quỹ. Nhà đầu tư', '*   Kết quả hoạt động trong quá khứ của các Quỹ không có nghĩa là kết quả hoạt động trong tương lai.\n*   Tên của Quỹ không hàm ý về chất lượng hoạt động cũng như những lợi và lợi nhuận của Quỹ trong tương lai;\n*   Công ty Quản lý Quỹ không chịu trách nhiệm pháp lý về những rủi ro từ đầu tư của các chủ nợ, thành viên Hội đồng thành viên, Ban điều hành và nhân viên của Công ty Quản lý Quỹ không có trách nhiệm pháp lý về các rủi ro hoạt động của Công ty Quản lý Quỹ.\n*   Giống như các hình thức đầu tư khác, Quỹ, rủi ro thanh khoản sẽ được phân bổ trên cơ sở số ngày gần nhất với giá trị tài sản ròng. Các khoản đầu tư khác có thể có nhiều rủi ro hơn so với thời điểm hiện tại. Nhà Đầu tư cần phải nhận thức được khả năng chấp nhận rủi ro từ vơi rủi ro đầu tư mà Quỹ có thể gặp phải trong tương lai.', '*   Công ty Quản lý Quỹ sẽ xem xét và lựa chọn các khoản đầu tư có liên quan đến các chi phí.\n**3.1.Rủi ro lãi suất**  \nLà rủi ro mà hợp lý của các dòng tiền trong tương lai của chứng khoán có thu nhập cố định bị biến động do những thay đổi của lãi suất thị trường, dẫn tới giá trị thị trường của chứng khoán thay đổi. Thông thường, giá trị thị trường của trái phiếu và các chứng khoán có thu nhập cố định biến động ngược chiều với lãi suất. Quỹ có thể giảm thiểu rủi ro lãi suất bằng cách giữ các trái phiếu phù hợp với thời hạn của lãi suất. Công ty Quản lý Quỹ sẽ cố gắng giảm thiểu rủi ro lãi suất bằng cách lựa chọn các chứng khoán có lãi suất phù hợp với thời hạn của lãi suất.\n**3.2.Rủi ro lạm phát**', 'tiếp hoặc tổng hợp các khoản phí và các chi phí/phí/giá dịch vụ liên quan đến các hoạt động của Quỹ mà Quỹ thực hiện hoặc gián tiếp hoặc tổng hợp các khoản phí và các chi phí/phí/giá dịch vụ liên quan đến các hoạt động của Quỹ mà Quỹ thực hiện hoặc gián tiếp hoặc tổng hợp các khoản phí và các chi phí/phí/giá dịch vụ liên quan đến các hoạt động của Quỹ mà Quỹ thực hiện hoặc gián tiếp hoặc tổng hợp các khoản phí và các chi phí/phí/giá dịch vụ liên quan đến các hoạt động của Quỹ mà Quỹ thực hiện hoặc gián tiếp hoặc tổng hợp các khoản phí và các chi phí/phí/giá dịch vụ liên quan đến các hoạt động của Quỹ mà Quỹ thực hiện hoặc gián tiếp hoặc tổng hợp các khoản phí và các chi phí/phí/giá dịch vụ liên quan đến các hoạt động của Quỹ mà Quỹ thực hiện hoặc gián tiếp hoặc tổng hợp các khoản phí và', 'tiếp hoặc tổng hợp các khoản phí và các chi phí/phí/giá dịch vụ liên quan đến các hoạt động của Quỹ mà Quỹ thực hiện hoặc gián tiếp hoặc tổng hợp các khoản phí và các chi phí/phí/giá dịch vụ liên quan đến các hoạt động của Quỹ mà Quỹ thực hiện hoặc gián tiếp hoặc tổng hợp các khoản phí và các chi phí/phí/giá dịch vụ liên quan đến các hoạt động của Quỹ mà Quỹ thực hiện hoặc gián tiếp hoặc tổng hợp các khoản phí và các chi phí/phí/giá dịch vụ liên quan đến các hoạt động của Quỹ mà Quỹ thực hiện hoặc gián tiếp hoặc tổng hợp các khoản phí và các chi phí/phí/giá dịch vụ liên quan đến các hoạt động của Quỹ mà Quỹ thực hiện hoặc gián tiếp hoặc tổng hợp các khoản phí và các chi phí/phí/giá dịch vụ liên quan đến các hoạt động của Quỹ mà Quỹ thực hiện hoặc gián tiếp hoặc tổng hợp các khoản phí và', 'tiếp hoặc tổng hợp các khoản phí và các chi phí/phí/giá dịch vụ liên quan đến các hoạt động của Quỹ mà Quỹ thực hiện hoặc gián tiếp hoặc tổng hợp các khoản phí và các chi phí/phí/giá dịch vụ liên quan đến các hoạt động của Quỹ mà Quỹ thực hiện hoặc gián tiếp hoặc tổng hợp các khoản phí và các chi phí/phí/giá dịch vụ liên quan đến các hoạt động của Quỹ mà Quỹ thực hiện hoặc gián tiếp hoặc tổng hợp các khoản phí và các chi phí/phí/giá dịch vụ liên quan đến các hoạt động của Quỹ mà Quỹ thực hiện hoặc gián tiếp hoặc tổng hợp các khoản phí và các chi phí/phí/giá dịch vụ liên quan đến các hoạt động của Quỹ mà Quỹ thực hiện hoặc gián tiếp hoặc tổng hợp các khoản phí và các chi phí/phí/giá dịch vụ liên quan đến các hoạt động của Quỹ mà Quỹ thực hiện hoặc gián tiếp hoặc tổng hợp các khoản phí và', 'tiếp hoặc tổng hợp các khoản phí và các chi phí/phí/giá dịch vụ liên quan đến các hoạt động của Quỹ mà Quỹ thực hiện hoặc gián tiếp hoặc tổng hợp các khoản phí và các chi phí/phí/giá dịch vụ liên quan đến các hoạt động của Quỹ mà Quỹ thực hiện hoặc gián tiếp hoặc tổng hợp các khoản phí và các chi phí/phí/giá dịch vụ liên quan đến các hoạt động của Quỹ mà Quỹ thực hiện hoặc gián tiếp hoặc tổng hợp các khoản phí và các chi phí/phí/giá dịch vụ liên quan đến các hoạt động của Quỹ mà Quỹ thực hiện hoặc gián tiếp hoặc tổng hợp các khoản phí và các chi phí/phí/giá dịch vụ liên quan đến các hoạt động của Quỹ mà Quỹ thực hiện hoặc gián tiếp hoặc tổng hợp các khoản phí và các chi phí/phí/giá dịch vụ liên quan đến các hoạt động của Quỹ mà Quỹ thực hiện hoặc gián tiếp hoặc tổng hợp các khoản phí và', 'tiếp hoặc tổng hợp các khoản phí và các chi phí/phí/giá dịch vụ liên quan đến các hoạt động của Quỹ mà Quỹ thực hiện hoặc gián tiếp hoặc tổng hợp các khoản phí và các chi phí/phí/giá dịch vụ liên quan đến các hoạt động của Quỹ mà Quỹ thực hiện hoặc gián tiếp hoặc tổng hợp các khoản phí và các chi phí/phí/giá dịch vụ liên quan đến các hoạt động của Quỹ mà Quỹ thực hiện hoặc gián tiếp hoặc tổng hợp các khoản phí và các chi phí/phí/giá dịch vụ liên quan đến các hoạt động của Quỹ mà Quỹ thực hiện hoặc gián tiếp hoặc tổng hợp các khoản phí và các chi phí/phí/giá dịch vụ liên quan đến các hoạt động của Quỹ mà Quỹ thực hiện hoặc gián tiếp hoặc tổng hợp các khoản phí và các chi phí/phí/giá dịch vụ liên quan đến các hoạt động của Quỹ mà Quỹ thực hiện hoặc gián tiếp hoặc tổng hợp các khoản phí và', 'tiếp hoặc tổng hợp các khoản phí và các chi phí/phí/giá dịch vụ liên quan đến các hoạt động của Quỹ mà Quỹ thực hiện hoặc gián tiếp hoặc tổng hợp các khoản phí và các chi phí/phí/giá dịch vụ liên quan đến các hoạt động của Quỹ mà Quỹ thực hiện hoặc gián tiếp hoặc tổng hợp các khoản phí và các chi phí/phí/giá dịch vụ liên quan đến các hoạt động của Quỹ mà Quỹ thực hiện hoặc gián tiếp hoặc tổng hợp các khoản phí và các chi phí/phí/giá dịch vụ liên quan đến các hoạt động của Quỹ mà Quỹ thực hiện hoặc gián tiếp hoặc tổng hợp các khoản phí và các chi phí/phí/giá dịch vụ liên quan đến các hoạt động của Quỹ mà Quỹ thực hiện hoặc gián tiếp hoặc tổng hợp các khoản phí và các chi phí/phí/giá dịch vụ liên quan đến các hoạt động của Quỹ mà Quỹ thực hiện hoặc gián tiếp hoặc tổng hợp các khoản phí và', 'tiếp hoặc tổng hợp các khoản phí và các chi phí/phí/giá dịch vụ liên quan đến các hoạt động của Quỹ mà Quỹ thực hiện hoặc gián tiếp hoặc tổng hợp các khoản phí và các chi phí/phí/giá dịch vụ liên quan đến các hoạt động của Quỹ mà Quỹ thực hiện hoặc gián tiếp hoặc tổng hợp các khoản phí và các chi phí/phí/giá dịch vụ liên quan đến các hoạt động của Quỹ mà Quỹ thực hiện hoặc gián tiếp hoặc tổng hợp các khoản phí và các chi phí/phí/giá dịch vụ liên quan đến các hoạt động của Quỹ mà Quỹ thực hiện hoặc gián tiếp hoặc tổng hợp các khoản phí và các chi phí/phí/giá dịch vụ liên quan đến các hoạt động của Quỹ mà Quỹ thực hiện hoặc gián tiếp hoặc tổng hợp các khoản phí và các chi phí/phí/giá dịch vụ liên quan đến các hoạt động của Quỹ mà Quỹ thực hiện hoặc gián tiếp hoặc tổng hợp các khoản phí và', 'tiếp hoặc tổng hợp các khoản phí và các chi phí/phí/giá dịch vụ liên quan đến các hoạt động của Quỹ mà Quỹ thực hiện hoặc gián tiếp hoặc tổng hợp các khoản phí và các chi phí/phí/giá dịch vụ liên quan đến các hoạt động của Quỹ mà Quỹ thực hiện hoặc gián tiếp hoặc tổng hợp các khoản phí và các chi phí/phí/giá dịch vụ liên quan đến các hoạt động của Quỹ mà Quỹ thực hiện hoặc gián tiếp hoặc tổng hợp các khoản phí và các chi phí/phí/giá dịch vụ liên quan đến các hoạt động của Quỹ mà Quỹ thực hiện hoặc gián tiếp hoặc tổng hợp các khoản phí và các chi phí/phí/giá dịch vụ liên quan đến các hoạt động của Quỹ mà Quỹ thực hiện hoặc gián tiếp hoặc tổng hợp các khoản phí và các chi phí/phí/giá dịch vụ liên quan đến các hoạt động của Quỹ mà Quỹ thực hiện hoặc gián tiếp hoặc tổng hợp các khoản phí và', 'tiếp hoặc tổng hợp các khoản phí và các chi phí/phí/giá dịch vụ liên quan đến các hoạt động của Quỹ mà Quỹ thực hiện hoặc gián tiếp hoặc tổng hợp các khoản phí và các chi phí/phí/giá dịch vụ liên quan đến các hoạt động của Quỹ mà Quỹ thực hiện hoặc gián tiếp hoặc tổng hợp các khoản phí và các chi phí/phí/giá dịch vụ liên quan đến các hoạt động của Quỹ mà Quỹ thực hiện hoặc gián tiếp hoặc tổng hợp các khoản phí và các chi phí/phí/giá dịch vụ liên quan đến các hoạt động của Quỹ mà Quỹ thực hiện hoặc gián tiếp hoặc tổng hợp các khoản phí và các chi phí/phí/giá dịch vụ liên quan đến các hoạt động của Quỹ mà Quỹ thực hiện hoặc gián tiếp hoặc tổng hợp các khoản phí và các chi phí/phí/giá dịch vụ liên quan đến các hoạt động của Quỹ mà Quỹ thực hiện hoặc gián tiếp hoặc tổng hợp các khoản phí và', 'tiếp hoặc tổng hợp các khoản phí và các chi phí/phí/giá dịch vụ liên quan đến các hoạt động của Quỹ mà Quỹ thực hiện hoặc gián tiếp hoặc tổng hợp các khoản phí và các chi phí/phí/giá dịch vụ liên quan đến các hoạt động của Quỹ mà Quỹ thực hiện hoặc gián tiếp hoặc tổng hợp các khoản phí và các chi phí/phí/giá dịch vụ liên quan đến các hoạt động của Quỹ mà Quỹ thực hiện hoặc gián tiếp hoặc tổng hợp các khoản phí và các chi phí/phí/giá dịch vụ liên quan đến các hoạt động của Quỹ mà Quỹ thực hiện hoặc gián tiếp hoặc tổng hợp các khoản phí và các chi phí/phí/giá dịch vụ liên quan đến các hoạt động của Quỹ mà Quỹ thực hiện hoặc gián tiếp hoặc tổng hợp các khoản phí và các chi phí/phí/giá dịch vụ liên quan đến các hoạt động của Quỹ mà Quỹ thực hiện hoặc gián tiếp hoặc tổng hợp các khoản phí và', 'tiếp hoặc tổng hợp các khoản phí và các chi phí/phí/giá dịch vụ liên quan đến các hoạt động của Quỹ mà Quỹ thực hiện hoặc gián tiếp hoặc tổng hợp các khoản phí và các chi phí/phí/giá dịch vụ liên quan đến các hoạt động của Quỹ mà Quỹ thực hiện hoặc gián tiếp hoặc tổng hợp các khoản phí và các chi phí/phí/giá dịch vụ liên quan đến các hoạt động của Quỹ mà Quỹ thực hiện hoặc gián tiếp hoặc tổng hợp các khoản phí và các chi phí/phí/giá dịch vụ liên quan đến các hoạt động của Quỹ mà Quỹ thực hiện hoặc gián tiếp hoặc tổng hợp các khoản phí và các chi phí/phí/giá dịch vụ liên quan đến các hoạt động của Quỹ mà Quỹ thực hiện hoặc gián tiếp hoặc tổng hợp các khoản phí và các chi phí/phí/giá dịch vụ liên quan đến các hoạt động của Quỹ mà Quỹ thực hiện hoặc gián tiếp hoặc tổng hợp các khoản phí và', 'tiếp hoặc tổng hợp các khoản phí và các chi phí/phí/giá dịch vụ liên quan đến các hoạt động của Quỹ mà Quỹ thực hiện hoặc gián tiếp hoặc tổng hợp các khoản phí và các chi phí/phí/giá dịch vụ liên quan đến các hoạt động của Quỹ mà Quỹ thực hiện hoặc gián tiếp hoặc tổng hợp các khoản phí và các chi phí/phí/giá dịch vụ liên quan đến các hoạt động của Quỹ mà Quỹ thực hiện hoặc gián tiếp hoặc tổng hợp các khoản phí và các chi phí/phí/giá dịch vụ liên quan đến các hoạt động của Quỹ mà Quỹ thực hiện hoặc gián tiếp hoặc tổng hợp các khoản phí và các chi phí/phí/giá dịch vụ liên quan đến các hoạt động của Quỹ mà Quỹ thực hiện hoặc gián tiếp hoặc tổng hợp các khoản phí và các chi phí/phí/giá dịch vụ liên quan đến các hoạt động của Quỹ mà Quỹ thực hiện hoặc gián tiếp hoặc tổng hợp các khoản phí và', 'tiếp hoặc tổng hợp các khoản phí và các chi phí/phí/giá dịch vụ liên quan đến các hoạt động của Quỹ mà Quỹ thực hiện hoặc gián tiếp hoặc tổng hợp các khoản phí và các chi phí/phí/giá dịch vụ liên quan đến các hoạt động của Quỹ mà Quỹ thực hiện hoặc gián tiếp hoặc tổng hợp các khoản phí và các chi phí/phí/giá dịch vụ liên quan đến các hoạt động của Quỹ mà Quỹ thực hiện hoặc gián tiếp hoặc tổng hợp các khoản phí và các chi phí/phí/giá dịch vụ liên quan đến các hoạt động của Quỹ mà Quỹ thực hiện hoặc gián tiếp hoặc tổng hợp các khoản phí và các chi phí/phí/giá dịch vụ liên quan đến các hoạt động của Quỹ mà Quỹ thực hiện hoặc gián tiếp hoặc tổng hợp các khoản phí và các chi phí/phí/giá dịch vụ liên quan đến các hoạt động của Quỹ mà Quỹ thực hiện hoặc gián tiếp hoặc tổng hợp các khoản phí và', 'tiếp hoặc tổng hợp các khoản phí và các chi phí/phí/giá dịch vụ liên quan đến các hoạt động của Quỹ mà Quỹ thực hiện hoặc gián tiếp hoặc tổng hợp các khoản phí và các chi phí/phí/giá dịch vụ liên quan đến các hoạt động của Quỹ mà Quỹ thực hiện hoặc gián tiếp hoặc tổng hợp các khoản phí và các chi phí/phí/giá dịch vụ liên quan đến các hoạt động của Quỹ mà Quỹ thực hiện hoặc gián tiếp hoặc tổng hợp các khoản phí và các chi phí/phí/giá dịch vụ liên quan đến các hoạt động của Quỹ mà Quỹ thực hiện hoặc gián tiếp hoặc tổng hợp các khoản phí và các chi phí/phí/giá dịch vụ liên quan đến các hoạt động của Quỹ mà Quỹ thực hiện hoặc gián tiếp hoặc tổng hợp các khoản phí và các chi phí/phí/giá dịch vụ liên quan đến các hoạt động của Quỹ mà Quỹ thực hiện hoặc gián tiếp hoặc tổng hợp các khoản phí và', 'tiếp hoặc tổng hợp các khoản phí và các chi phí/phí/giá dịch vụ liên quan đến các hoạt động của Quỹ mà Quỹ thực hiện hoặc gián tiếp hoặc tổng hợp các khoản phí và các chi phí/phí/giá dịch vụ liên quan đến các hoạt động của Quỹ mà Quỹ thực hiện hoặc gián tiếp hoặc tổng hợp các khoản phí và các chi phí/phí/giá dịch vụ liên quan đến các hoạt động của Quỹ mà Quỹ thực hiện hoặc gián tiếp hoặc tổng hợp các khoản phí và các chi phí/phí/giá dịch vụ liên quan đến các hoạt động của Quỹ mà Quỹ thực hiện hoặc gián tiếp hoặc tổng hợp các khoản phí và các chi phí/phí/giá dịch vụ liên quan đến các hoạt động của Quỹ mà Quỹ thực hiện hoặc gián tiếp hoặc tổng hợp các khoản phí và các chi phí/phí/giá dịch vụ liên quan đến các hoạt động của Quỹ mà Quỹ thực hiện hoặc gián tiếp hoặc tổng hợp các khoản phí và', 'tiếp hoặc tổng hợp các khoản phí và các chi phí/phí/giá dịch vụ liên quan đến các hoạt động của Quỹ mà Quỹ thực hiện hoặc gián tiếp hoặc tổng hợp các khoản phí và các chi phí/phí/giá dịch vụ liên quan đến các hoạt động của Quỹ mà Quỹ thực hiện hoặc gián tiếp hoặc tổng hợp các khoản phí và các chi phí/phí/giá dịch vụ liên quan đến các hoạt động của Quỹ mà Quỹ thực hiện hoặc gián tiếp hoặc tổng hợp các khoản phí và các chi phí/phí/giá dịch vụ liên quan đến các hoạt động của Quỹ mà Quỹ thực hiện hoặc gián tiếp hoặc tổng hợp các khoản phí và các chi phí/phí/giá dịch vụ liên quan đến các hoạt động của Quỹ mà Quỹ thực hiện hoặc gián tiếp hoặc tổng hợp các khoản phí và các chi phí/phí/giá dịch vụ liên quan đến các hoạt động của Quỹ mà Quỹ thực hiện hoặc gián tiếp hoặc tổng hợp các khoản phí và', 'tiếp hoặc tổng hợp các khoản phí và các chi phí/phí/giá dịch vụ liên quan đến các hoạt động của Quỹ mà Quỹ thực hiện hoặc gián tiếp hoặc tổng hợp các khoản phí và các chi phí/phí/giá dịch vụ liên quan đến các hoạt động của Quỹ mà Quỹ thực hiện hoặc gián tiếp hoặc tổng hợp các khoản phí và các chi phí/phí/giá dịch vụ liên quan đến các hoạt động của Quỹ mà Quỹ thực hiện hoặc gián tiếp hoặc tổng hợp các khoản phí và các chi phí/phí/giá dịch vụ liên quan đến các hoạt động của Quỹ mà Quỹ thực hiện hoặc gián tiếp hoặc tổng hợp các khoản phí và các chi phí/phí/giá dịch vụ liên quan đến các hoạt động của Quỹ mà Quỹ thực hiện hoặc gián tiếp hoặc tổng hợp các khoản phí và các chi phí/phí/giá dịch vụ liên quan đến các hoạt động của Quỹ mà Quỹ thực hiện hoặc gián tiếp hoặc tổng hợp các khoản phí và', 'tiếp hoặc tổng hợp các khoản phí và các chi phí/phí/giá dịch vụ liên quan đến các hoạt động của Quỹ mà Quỹ thực hiện hoặc gián tiếp hoặc tổng hợp các khoản phí và các chi phí/phí/giá dịch vụ liên quan đến các hoạt động của Quỹ mà Quỹ thực hiện hoặc gián tiếp hoặc tổng hợp các khoản phí và các chi phí/phí/giá dịch vụ liên quan đến các hoạt động của Quỹ mà Quỹ thực hiện hoặc gián tiếp hoặc tổng hợp các khoản phí và các chi phí/phí/giá dịch vụ liên quan đến các hoạt động của Quỹ mà Quỹ thực hiện hoặc gián tiếp hoặc tổng hợp các khoản phí và các chi phí/phí/giá dịch vụ liên quan đến các hoạt động của Quỹ mà Quỹ thực hiện hoặc gián tiếp hoặc tổng hợp các khoản phí và các chi phí/phí/giá dịch vụ liên quan đến các hoạt động của Quỹ mà Quỹ thực hiện hoặc gián tiếp hoặc tổng hợp các khoản phí và', 'tiếp hoặc tổng hợp các khoản phí và các chi phí/phí/giá dịch vụ liên quan đến các hoạt động của Quỹ mà Quỹ thực hiện hoặc gián tiếp hoặc tổng hợp các khoản phí và các chi phí/phí/giá dịch vụ liên quan đến các hoạt động của Quỹ mà Quỹ thực hiện hoặc gián tiếp hoặc tổng hợp các khoản phí và các chi phí/phí/giá dịch vụ liên quan đến các hoạt động của Quỹ mà Quỹ thực hiện hoặc gián tiếp hoặc tổng hợp các khoản phí và các chi phí/phí/giá dịch vụ liên quan đến các hoạt động của Quỹ mà Quỹ thực hiện hoặc gián tiếp hoặc tổng hợp các khoản phí và các chi phí/phí/giá dịch vụ liên quan đến các hoạt động của Quỹ mà Quỹ thực hiện hoặc gián tiếp hoặc tổng hợp các khoản phí và các chi phí/phí/giá dịch vụ liên quan đến các hoạt động của Quỹ mà Quỹ thực hiện hoặc gián tiếp hoặc tổng hợp các khoản phí và', 'tiếp hoặc tổng hợp các khoản phí và các chi phí/phí/giá dịch vụ liên quan đến các hoạt động của Quỹ mà Quỹ thực hiện hoặc gián tiếp hoặc tổng hợp các khoản phí và các chi phí/phí/giá dịch vụ liên quan đến các hoạt động của Quỹ mà Quỹ thực hiện hoặc gián tiếp hoặc tổng hợp các khoản phí và các chi phí/phí/giá dịch vụ liên quan đến các hoạt động của Quỹ mà Quỹ thực hiện hoặc gián tiếp hoặc tổng hợp các khoản phí và các chi phí/phí/giá dịch vụ liên quan đến các hoạt động của Quỹ mà Quỹ thực hiện hoặc gián tiếp hoặc tổng hợp các khoản phí và các chi phí/phí/giá dịch vụ liên quan đến các hoạt động của Quỹ mà Quỹ thực hiện hoặc gián tiếp hoặc tổng hợp các khoản phí và các chi phí/phí/giá dịch vụ liên quan đến các hoạt động của Quỹ mà Quỹ thực hiện hoặc gián tiếp hoặc tổng hợp các khoản phí và', 'tiếp hoặc tổng hợp các khoản phí và các chi phí/phí/giá dịch vụ liên quan đến các hoạt động của Quỹ mà Quỹ thực hiện hoặc gián tiếp hoặc tổng hợp các khoản phí và các chi phí/phí/giá dịch vụ liên quan đến các hoạt động của Quỹ mà Quỹ thực hiện hoặc gián tiếp hoặc tổng hợp các khoản phí và các chi phí/phí/giá dịch vụ liên quan đến các hoạt động của Quỹ mà Quỹ thực hiện hoặc gián tiếp hoặc tổng hợp các khoản phí và các chi phí/phí/giá dịch vụ liên quan đến các hoạt động của Quỹ mà Quỹ thực hiện hoặc gián tiếp hoặc tổng hợp các khoản phí và các chi phí/phí/giá dịch vụ liên quan đến các hoạt động của Quỹ mà Quỹ thực hiện hoặc gián tiếp hoặc tổng hợp các khoản phí và các chi phí/phí/giá dịch vụ liên quan đến các hoạt động của Quỹ mà Quỹ thực hiện hoặc gián tiếp hoặc tổng hợp các khoản phí và', 'tiếp hoặc tổng hợp các khoản phí và các chi phí/phí/giá dịch vụ liên quan đến các hoạt động của Quỹ mà Quỹ thực hiện hoặc gián tiếp hoặc tổng hợp các khoản phí và các chi phí/phí/giá dịch vụ liên quan đến các hoạt động của Quỹ mà Quỹ thực hiện hoặc gián tiếp hoặc tổng hợp các khoản phí và các chi phí/phí/giá dịch vụ liên quan đến các hoạt động của Quỹ mà Quỹ thực hiện hoặc gián tiếp hoặc tổng hợp các khoản phí và các chi phí/phí/giá dịch vụ liên quan đến các hoạt động của Quỹ mà Quỹ thực hiện hoặc gián tiếp hoặc tổng hợp các khoản phí và các chi phí/phí/giá dịch vụ liên quan đến các hoạt động của Quỹ mà Quỹ thực hiện hoặc gián tiếp hoặc tổng hợp các khoản phí và các chi phí/phí/giá dịch vụ liên quan đến các hoạt động của Quỹ mà Quỹ thực hiện hoặc gián tiếp hoặc tổng hợp các khoản phí và']","Không được đầu tư vào chứng chỉ quỹ của chính quỹ đó. Không được đầu tư trực tiếp vào bất động sản, đá quý, kim loại quý hiếm."
"Giới hạn đầu tư vào nhóm công ty có quan hệ sở hữu (công ty mẹ, công ty con) là bao nhiêu phần trăm tổng giá trị tài sản quỹ?",Giới hạn đầu tư vào các tài sản phát hành bởi các công ty trong cùng một nhóm công ty có quan hệ sở hữu là 30% tổng giá trị tài sản của quỹ.,"['cụ nợ của Chính phủ;\nd) Không được đầu tư quá 30% tổng giá trị tài sản của quỹ vào các tài sản quỹ định tại điểm a,\nb, d, e và f mục IX.2.2.3, phải hành bởi các công ty trong cùng một nhóm công ty cơ quan hệ\nsở hữu với nhau, thuộc sở hữu hợp của sau đây: Công ty con, các công ty sở hữu\nhien 35% cổ phần, phần vốn góp của nhau.nhóm công ty con, công ty mẹ. Tổng\nđộ phân đầu tư vào chứng khoán phái sinh tính bằng giá trị cam kết của hợp đồng xác định\ntheo quy định tại Phụ Lục 4 Điều Lệ Quỹ;\ne) Không được đầu tư quá 10% tổng giá trị tài sản của quỹ vào các tài sản quỹ định tại điểm d\nmục IX.2.2.3;\nf) Tổng giá trị các hạng mục đầu tư lớn trong danh mục đầu tư của quỹ không được vượt quá\n40% tổng giá trị tài sản của quỹ. Trong đó, hạng mục đầu tư lớn của quỹ là hạng mục đầu tư', '*   Kết quả hoạt động trong quá khứ của các Quỹ không có nghĩa là kết quả hoạt động trong tương lai.\n*   Tên của Quỹ không hàm ý về chất lượng hoạt động cũng như những lợi và lợi nhuận của Quỹ trong tương lai;\n*   Công ty Quản lý Quỹ không chịu trách nhiệm pháp lý về những rủi ro từ đầu tư của các chủ nợ, thành viên Hội đồng thành viên, Ban điều hành và nhân viên của Công ty Quản lý Quỹ không có trách nhiệm pháp lý về các rủi ro hoạt động của Công ty Quản lý Quỹ.\n*   Giống như các hình thức đầu tư khác, Quỹ, rủi ro thanh khoản sẽ được phân bổ trên cơ sở số ngày gần nhất với giá trị tài sản ròng. Các khoản đầu tư khác có thể có nhiều rủi ro hơn so với thời điểm hiện tại. Nhà Đầu tư cần phải nhận thức được khả năng chấp nhận rủi ro từ vơi rủi ro đầu tư mà Quỹ có thể gặp phải trong tương lai.', 'Các quy định khác liên quan đến kiểm toán, kế toán và chế độ báo cáo tuân thủ theo quy định tại Điều Lệ Quỹ.  \n**3. Các rủi ro khi đầu tư vào Quỹ**  \nMục tiêu của Công ty Quản lý Quỹ là quản lý các rủi ro đầu tư, và nếu có thể, hạn chế các tác động của các rủi ro này bằng việc áp dụng các phương pháp quản lý đầu tư theo tiêu chuẩn quốc tế tốt nhất. Nhà Đầu tư cần lưu ý về các điểm quan trọng sau đây:  \n*   Quỹ, Công ty Quản lý Quỹ, thành viên Hội đồng quản trị, người điều hành và nhân viên của ngân hàng giám sát sẽ làm nhiệm vụ của quản trị rủi ro và bảo quản tài sản của quỹ đại chúng, công ty đầu tư chứng khoán không được là đối tượng mua, bán trong giao dịch mua, bán tài sản của quỹ đại chúng, công ty đầu tư chứng khoán.', '*   Công ty Quản lý Quỹ sẽ xem xét và lựa chọn các khoản đầu tư có liên quan đến các chi phí.\n**3.1.Rủi ro lãi suất**  \nLà rủi ro mà hợp lý của các dòng tiền trong tương lai của chứng khoán có thu nhập cố định bị biến động do những thay đổi của lãi suất thị trường, dẫn tới giá trị thị trường của chứng khoán thay đổi. Thông thường, giá trị thị trường của trái phiếu và các chứng khoán có thu nhập cố định biến động ngược chiều với lãi suất. Quỹ có thể giảm thiểu rủi ro lãi suất bằng cách giữ các trái phiếu phù hợp với thời hạn của lãi suất. Công ty Quản lý Quỹ sẽ cố gắng giảm thiểu rủi ro lãi suất bằng cách lựa chọn các chứng khoán có lãi suất phù hợp với thời hạn của lãi suất.\n**3.2.Rủi ro lạm phát**', '**Chế độ kế toán**  \nQuỹ sẽ áp dụng chế độ kế toán Việt Nam (VAS) và tuân thủ các quy định khác liên quan tới công tác kế toán cho Quỹ do các cơ quan có thẩm quyền quy định. Đồng Việt Nam sẽ là đồng tiền được sử dụng và thể hiện.  \n**Chế độ báo cáo**  \nCông ty Quản lý Quỹ có trách nhiệm duy trì sổ sách kế toán và chuẩn bị báo cáo tài chính cho Quỹ. Phù hợp với quy định tại Điều 38 của Điều Lệ Quỹ, Công ty Quản lý Quỹ có thể uỷ quyền cho một nhà cung cấp dịch vụ có thực hiện việc này. Một số sách kế toán và báo cáo tài chính mà Công ty Quản lý Quỹ hoặc nhà cung cấp dịch vụ có thể uỷ quyền sẽ được lưu trữ tại văn phòng của Công ty Quản lý Quỹ hoặc nhà cung cấp dịch vụ có liên quan.', '*   Ngân hàng giám sát, thành viên Hội đồng quản trị, người điều hành và nhân viên của ngân hàng giám sát làm nhiệm vụ giám sát hoạt động và bảo quản tài sản của Quỹ đại chúng, Công ty đầu tư chứng khoán không được là đối tượng mua, bán trong giao dịch mua, bán tài sản của Quỹ đại chúng, công ty đầu tư chứng khoán.\n*   Có đầy đủ năng lực cung cấp dịch vụ giám sát, lưu ký;  \nCác quy định về quyền và nghĩa vụ, thời hạn công bố thông tin về Công ty Quản lý Quỹ tuân theo quy định tại Chương VII Điều Lệ Quỹ.', 'Là rủi ro mà hợp lý của các dòng tiền trong tương lai của chứng khoán có thu nhập cố định bị biến động do những thay đổi của lãi suất thị trường, dẫn tới giá trị thị trường của chứng khoán thay đổi. Thông thường, giá trị thị trường của trái phiếu và các chứng khoán có thu nhập cố định biến động ngược chiều với lãi suất. Quỹ có thể giảm thiểu rủi ro lãi suất bằng cách giữ các trái phiếu phù hợp với thời hạn của lãi suất. Công ty Quản lý Quỹ sẽ cố gắng giảm thiểu rủi ro lãi suất bằng cách lựa chọn các chứng khoán có lãi suất phù hợp với thời hạn của lãi suất.  \n**3.8. Rủi ro khối lượng**', 'ngược lại;  \n*   Ngân hàng giám sát, thành viên Hội đồng quản trị, người điều hành và nhân viên của ngân hàng giám sát làm nhiệm vụ giám sát hoạt động và bảo quản tài sản của Quỹ đại chúng, Công ty đầu tư chứng khoán không được là đối tượng mua, bán trong giao dịch mua, bán tài sản của Quỹ đại chúng, công ty đầu tư chứng khoán.\n*   Có đầy đủ năng lực cung cấp dịch vụ giám sát, lưu ký;\n*   Thực hiện các cam kết đối với Quỹ như nêu tại Phụ Lục 2 và Phụ Lục 3 của Điều Lệ Quỹ.  \nCác quy định về quyền và nghĩa vụ, thời hạn công bố thông tin về Công ty Quản lý Quỹ tuân theo quy định tại Chương VII Điều Lệ Quỹ.  \n**2.12. Kiểm toán, kế toán và chế độ báo cáo**', '**2.12. Kiểm toán, kế toán và chế độ báo cáo**  \nCông ty kiểm toán được lựa chọn phải được thành lập và hoạt động phù hợp với quy định của Pháp luật, nằm trong danh sách các công ty kiểm toán được UBCKNN chấp thuận kiểm toán cho tổ chức tài chính, tổ chức niêm yết và cho tổ chức kinh doanh chứng khoán và không được là người liên quan của Công ty Quản lý Quỹ, Ngân hàng Giám sát. Năm kiểm toán: Tổng công ty kiểm toán Quỹ sẽ được Công ty Quản lý Quỹ đề cử để Đại Hội Đồng Quỹ thông qua. Các năm sau đó, Đại Hội Đầu Tư Quỹ sẽ thông qua cho Ban Đại Diện Quỹ thông qua việc lựa chọn công ty kiểm toán. Công ty Quản lý Quỹ sẽ đề xuất với Ban Đại Diện Quỹ ít nhất (02) công ty kiểm toán để kiểm toán cho Quỹ mình.  \n**Chế độ kế toán**', '**3.6. Rủi ro biến động giá**  \nRủi ro về biến động giá của Quỹ phát sinh khi một hay một số Nhà Đầu tư nắm giữ một số lượng lớn cổ phiếu của Quỹ quyết định thực hiện lệnh bán của các cổ phiếu của Quỹ này. Nắm giữ một số lượng lớn cổ phiếu của Quỹ quyết định bán.  \n**3.7. Rủi ro tái đầu tư**  \nRủi ro tái đầu tư là rủi ro có thể xảy ra khi các khoản đầu tư trái phiếu với dòng tiền lãi trái phiếu nhận được hàng kỳ và gốc trái phiếu nhận được vào thời điểm đáo hạn được đi tìm đầu tư nhận lại. Công ty Quản lý Quỹ quyết định bán các chứng khoán của Quỹ.', '**3.3.Rủi ro tỷ giá**  \nDo tài sản và nợ phải trả của Quỹ đều được trình bày bằng đồng Việt Nam, là đơn vị tiền tệ sử dụng của Quỹ. Mặc dù rủi ro tỷ giá trong tương lai hạn chế ảnh hưởng từ đồng tiền nước ngoài, thì tính chất của từng sản phẩm tài chính được trình bày trên Bảng Cân Đối Kế Toán của Quỹ. Do đó, giá trị thị trường của từng khoản đầu tư có thể bị ảnh hưởng bởi tỷ giá hối đoái.', 'Quỹ thực hiện hoặc gián tiếp hoặc tổng hợp các khoản phí và các chi phí/phí/giá dịch vụ liên quan đến các hoạt động của Quỹ mà Quỹ thực hiện hoặc gián tiếp hoặc tổng hợp các khoản phí và các chi phí/phí/giá dịch vụ liên quan đến các hoạt động của Quỹ mà Quỹ thực hiện hoặc gián tiếp hoặc tổng hợp các khoản phí và các chi phí/phí/giá dịch vụ liên quan đến các hoạt động của Quỹ mà Quỹ thực hiện hoặc gián tiếp hoặc tổng hợp các khoản phí và các chi phí/phí/giá dịch vụ liên quan đến các hoạt động của Quỹ mà Quỹ thực hiện hoặc gián tiếp hoặc tổng hợp các khoản phí và các chi phí/phí/giá dịch vụ liên quan đến các hoạt động của Quỹ mà Quỹ thực hiện hoặc gián tiếp hoặc tổng hợp các khoản phí và các chi phí/phí/giá dịch vụ liên quan đến các hoạt động của Quỹ mà Quỹ thực hiện hoặc gián tiếp hoặc', 'Số: 9176 /QĐ-UBCK\nGiấy phép hành chứng chỉ quỹ ra công chúng\n----------------  \nCăn cứ khoản 2, Điều 46 Pháp lệnh Chứng khoán và Điều 45, 46 Nghị định số\n56/2007/NĐ-CP ngày 09/04/2007 của Chính phủ quy định chi tiết thi hành một số\nđiều của Pháp lệnh Chứng khoán;\nCăn cứ Quyết định số 30/2008/QĐ-BTC ngày 02/06/2008 của Bộ Tài chính về việc\nban hành Quy chế tổ chức và hoạt động của công ty quản lý quỹ, công ty chứng khoán;\nCăn cứ Giấy chứng nhận đăng ký kinh doanh số 0102013096 do Sở Kế hoạch và\nĐầu tư Thành phố Hà Nội cấp ngày 21/10/2008;\nXét đề nghị của Công ty cổ phần Quản lý Quỹ Ký Thương - TechcomCapital;  \nQUỸ ĐẦU TƯ CỔ PHIẾU DOANH NGHIỆP VỪA VÀ NHỎ TECHCOM\n(TCSME)  \nCHÀO BẢN CHỨNG CHỈ QUỸ ĐẦU TƯ CHỨNG KHOÁN RA CÔNG CHỨNG\n(Quỹ chứng khoán doanh nghiệp vừa và nhỏ Techcom)', '2.2.4 Hạn mức đầu tư\nHạn mức đầu tư của Quỹ được quy định chi tiết tuân theo các quy định tại Thông tư hướng dẫn\nhoạt động và quản lý các quỹ đầu tư chứng khoán. Co cấu danh mục đầu tư của Quỹ phải đảm\nbảo tuân theo các hạn mức đầu tư sau:\na) Tựa trên tổng giá trị tài khoản thanh toán của Quỹ tại ngân hàng giám sát, quỹ mở được\ncâu đề qua 49% tổng giá trị tài sản của quỹ vào các tài sản theo quy định tại điểm a, b mục\nIX.2.2.3\nb) Không được đầu tư vào chứng khoán của một tổ chức phát hành quá 10% tổng giá trị chứng\nkhoán đang lưu hành của tổ chức đó, trừ công cụ nợ của Chính phủ;\nc) Không được đầu tư quá 20% tổng giá trị tài sản của quỹ vào chứng khoán đang lưu hành và\ncác tài sản (nếu có) quy định tại điểm a, b mục IX.2.2.3 của một tổ chức phát hành, trừ công\ncụ nợ của Chính phủ;', 'thực hiện hoặc gián tiếp hoặc tổng hợp các khoản phí và các chi phí/phí/giá dịch vụ liên quan đến các hoạt động của Quỹ mà Quỹ thực hiện hoặc gián tiếp hoặc tổng hợp các khoản phí và các chi phí/phí/giá dịch vụ liên quan đến các hoạt động của Quỹ mà Quỹ thực hiện hoặc gián tiếp hoặc tổng hợp các khoản phí và các chi phí/phí/giá dịch vụ liên quan đến các hoạt động của Quỹ mà Quỹ thực hiện hoặc gián tiếp hoặc tổng hợp các khoản phí và các chi phí/phí/giá dịch vụ liên quan đến các hoạt động của Quỹ mà Quỹ thực hiện hoặc gián tiếp hoặc tổng hợp các khoản phí và các chi phí/phí/giá dịch vụ liên quan đến các hoạt động của Quỹ mà Quỹ thực hiện hoặc gián tiếp hoặc tổng hợp các khoản phí và các chi phí/phí/giá dịch vụ liên quan đến các hoạt động của Quỹ mà Quỹ thực hiện hoặc gián tiếp hoặc tổng', 'hiện hoặc gián tiếp hoặc tổng hợp các khoản phí và các chi phí/phí/giá dịch vụ liên quan đến các hoạt động của Quỹ mà Quỹ thực hiện hoặc gián tiếp hoặc tổng hợp các khoản phí và các chi phí/phí/giá dịch vụ liên quan đến các hoạt động của Quỹ mà Quỹ thực hiện hoặc gián tiếp hoặc tổng hợp các khoản phí và các chi phí/phí/giá dịch vụ liên quan đến các hoạt động của Quỹ mà Quỹ thực hiện hoặc gián tiếp hoặc tổng hợp các khoản phí và các chi phí/phí/giá dịch vụ liên quan đến các hoạt động của Quỹ mà Quỹ thực hiện hoặc gián tiếp hoặc tổng hợp các khoản phí và các chi phí/phí/giá dịch vụ liên quan đến các hoạt động của Quỹ mà Quỹ thực hiện hoặc gián tiếp hoặc tổng hợp các khoản phí và các chi phí/phí/giá dịch vụ liên quan đến các hoạt động của Quỹ mà Quỹ thực hiện hoặc gián tiếp hoặc tổng hợp các', '*   Có đầy đủ cơ sở vật chất, nhân sự để Quản lý Quỹ mở;\n*   Đồng ý thực hiện các cam kết đối với Quỹ như nêu tại Phụ Lục 1 và Phụ Lục 3 của Điều Lệ Quỹ.  \nCác quy định về quyền và nghĩa vụ, chấm dứt quyền và nghĩa vụ, hạn chế hoạt động của Công ty Quản lý Quỹ tuân thủ theo quy định tại Chương VI Điều Lệ Quỹ.  \n**2.11. Tiêu chí lựa chọn, quyền hạn và trách nhiệm của Ngân hàng giám sát**\nNgân hàng Giám sát được lựa chọn phải đáp ứng các điều kiện sau:  \n*   Ngân hàng giám sát do Công ty Quản lý Quỹ lựa chọn phải đáp ứng các điều kiện quy định tại Khoản 1 Điều 116 Luật Chứng khoán;\n*   Ngân hàng giám sát phải hoạt động độc lập và tách biệt với Công ty Quản lý Quỹ mà ngân hàng cung cấp dịch vụ giám sát;', 'dịch vụ liên quan đến các hoạt động của Quỹ mà Quỹ thực hiện hoặc gián tiếp hoặc tổng hợp các khoản phí và các chi phí/phí/giá dịch vụ liên quan đến các hoạt động của Quỹ mà Quỹ thực hiện hoặc gián tiếp hoặc tổng hợp các khoản phí và các chi phí/phí/giá dịch vụ liên quan đến các hoạt động của Quỹ mà Quỹ thực hiện hoặc gián tiếp hoặc tổng hợp các khoản phí và các chi phí/phí/giá dịch vụ liên quan đến các hoạt động của Quỹ mà Quỹ thực hiện hoặc gián tiếp hoặc tổng hợp các khoản phí và các chi phí/phí/giá dịch vụ liên quan đến các hoạt động của Quỹ mà Quỹ thực hiện hoặc gián tiếp hoặc tổng hợp các khoản phí và các chi phí/phí/giá dịch vụ liên quan đến các hoạt động của Quỹ mà Quỹ thực hiện hoặc gián tiếp hoặc tổng hợp các khoản phí và các chi phí/phí/giá dịch vụ liên quan đến các hoạt động', 'liên quan đến các hoạt động của Quỹ mà Quỹ thực hiện hoặc gián tiếp hoặc tổng hợp các khoản phí và các chi phí/phí/giá dịch vụ liên quan đến các hoạt động của Quỹ mà Quỹ thực hiện hoặc gián tiếp hoặc tổng hợp các khoản phí và các chi phí/phí/giá dịch vụ liên quan đến các hoạt động của Quỹ mà Quỹ thực hiện hoặc gián tiếp hoặc tổng hợp các khoản phí và các chi phí/phí/giá dịch vụ liên quan đến các hoạt động của Quỹ mà Quỹ thực hiện hoặc gián tiếp hoặc tổng hợp các khoản phí và các chi phí/phí/giá dịch vụ liên quan đến các hoạt động của Quỹ mà Quỹ thực hiện hoặc gián tiếp hoặc tổng hợp các khoản phí và các chi phí/phí/giá dịch vụ liên quan đến', 'gián tiếp hoặc tổng hợp các khoản phí và các chi phí/phí/giá dịch vụ liên quan đến các hoạt động của Quỹ mà Quỹ thực hiện hoặc gián tiếp hoặc tổng hợp các khoản phí và các chi phí/phí/giá dịch vụ liên quan đến các hoạt động của Quỹ mà Quỹ thực hiện hoặc gián tiếp hoặc tổng hợp các khoản phí và các chi phí/phí/giá dịch vụ liên quan đến các hoạt động của Quỹ mà Quỹ thực hiện hoặc gián tiếp hoặc tổng hợp các khoản phí và các chi phí/phí/giá dịch vụ liên quan đến các hoạt động của Quỹ mà Quỹ thực hiện hoặc gián tiếp hoặc tổng hợp các khoản phí và các chi phí/phí/giá dịch vụ liên quan đến các hoạt động của Quỹ mà Quỹ thực hiện hoặc gián tiếp hoặc tổng hợp các khoản phí và các chi phí/phí/giá dịch vụ liên quan đến các hoạt động của Quỹ mà Quỹ thực hiện hoặc gián tiếp hoặc tổng hợp các khoản phí', 'vụ liên quan đến các hoạt động của Quỹ mà Quỹ thực hiện hoặc gián tiếp hoặc tổng hợp các khoản phí và các chi phí/phí/giá dịch vụ liên quan đến các hoạt động của Quỹ mà Quỹ thực hiện hoặc gián tiếp hoặc tổng hợp các khoản phí và các chi phí/phí/giá dịch vụ liên quan đến các hoạt động của Quỹ mà Quỹ thực hiện hoặc gián tiếp hoặc tổng hợp các khoản phí và các chi phí/phí/giá dịch vụ liên quan đến các hoạt động của Quỹ mà Quỹ thực hiện hoặc gián tiếp hoặc tổng hợp các khoản phí và các chi phí/phí/giá dịch vụ liên quan đến các hoạt động của Quỹ mà Quỹ thực hiện hoặc gián tiếp hoặc tổng hợp các khoản phí và các chi phí/phí/giá dịch vụ liên quan đến các hoạt động của Quỹ mà Quỹ thực hiện hoặc gián tiếp hoặc tổng hợp các khoản phí và các chi phí/phí/giá dịch vụ liên quan đến các hoạt động của', '**3.2.Rủi ro lạm phát**  \nGiá trị thị trường tỷ lệ nghịch với lạm phát. Vì dụ trong môi trường lạm phát tăng, sức mua hay giá trị thực của các đồng tiền trong tương lai (menh giá và lãi trái phiếu nhận được hàng kỳ) sẽ giảm. Khi đó lợi suất của Quỹ trái phiếu tăng lên dẫn đến giá trị trái phiếu ròng. Rủi ro lạm phát giới hạn mức tăng trưởng của trái phiếu. Điều này thường biểu hiện cách rủi ro tài sản tài sản, trái phiếu hoặc chứng khoán nhận được hàng kỳ có thể bị ảnh hưởng bởi lạm phát.\n**3.3.Rủi ro tỷ giá**', 'chi phí/phí/giá dịch vụ liên quan đến các hoạt động của Quỹ mà Quỹ thực hiện hoặc gián tiếp hoặc tổng hợp các khoản phí và các chi phí/phí/giá dịch vụ liên quan đến các hoạt động của Quỹ mà Quỹ thực hiện hoặc gián tiếp hoặc tổng hợp các khoản phí và các chi phí/phí/giá dịch vụ liên quan đến các hoạt động của Quỹ mà Quỹ thực hiện hoặc gián tiếp hoặc tổng hợp các khoản phí và các chi phí/phí/giá dịch vụ liên quan đến các hoạt động của Quỹ mà Quỹ thực hiện hoặc gián tiếp hoặc tổng hợp các khoản phí và các chi phí/phí/giá dịch vụ liên quan đến các hoạt động của Quỹ mà Quỹ thực hiện hoặc gián tiếp hoặc tổng hợp các khoản phí và các chi phí/phí/giá dịch vụ liên quan đến các hoạt động của Quỹ mà Quỹ thực hiện hoặc gián tiếp hoặc tổng hợp các khoản phí và các chi phí/phí/giá dịch vụ liên quan đến', 'tiếp hoặc tổng hợp các khoản phí và các chi phí/phí/giá dịch vụ liên quan đến các hoạt động của Quỹ mà Quỹ thực hiện hoặc gián tiếp hoặc tổng hợp các khoản phí và các chi phí/phí/giá dịch vụ liên quan đến các hoạt động của Quỹ mà Quỹ thực hiện hoặc gián tiếp hoặc tổng hợp các khoản phí và các chi phí/phí/giá dịch vụ liên quan đến các hoạt động của Quỹ mà Quỹ thực hiện hoặc gián tiếp hoặc tổng hợp các khoản phí và các chi phí/phí/giá dịch vụ liên quan đến các hoạt động của Quỹ mà Quỹ thực hiện hoặc gián tiếp hoặc tổng hợp các khoản phí và các chi phí/phí/giá dịch vụ liên quan đến các hoạt động của Quỹ mà Quỹ thực hiện hoặc gián tiếp hoặc tổng hợp các khoản phí và các chi phí/phí/giá dịch vụ liên quan đến các hoạt động của Quỹ mà Quỹ thực hiện hoặc gián tiếp hoặc tổng hợp các khoản phí và', 'tiếp hoặc tổng hợp các khoản phí và các chi phí/phí/giá dịch vụ liên quan đến các hoạt động của Quỹ mà Quỹ thực hiện hoặc gián tiếp hoặc tổng hợp các khoản phí và các chi phí/phí/giá dịch vụ liên quan đến các hoạt động của Quỹ mà Quỹ thực hiện hoặc gián tiếp hoặc tổng hợp các khoản phí và các chi phí/phí/giá dịch vụ liên quan đến các hoạt động của Quỹ mà Quỹ thực hiện hoặc gián tiếp hoặc tổng hợp các khoản phí và các chi phí/phí/giá dịch vụ liên quan đến các hoạt động của Quỹ mà Quỹ thực hiện hoặc gián tiếp hoặc tổng hợp các khoản phí và các chi phí/phí/giá dịch vụ liên quan đến các hoạt động của Quỹ mà Quỹ thực hiện hoặc gián tiếp hoặc tổng hợp các khoản phí và các chi phí/phí/giá dịch vụ liên quan đến các hoạt động của Quỹ mà Quỹ thực hiện hoặc gián tiếp hoặc tổng hợp các khoản phí và']",Không được đầu tư quá 30% tổng giá trị tài sản của quỹ vào các công ty trong cùng một nhóm công ty có quan hệ sở hữu.
Ngân hàng giám sát của Quỹ TCSME là ngân hàng nào và chi nhánh nào?,Ngân hàng giám sát của Quỹ TCSME là Ngân hàng TMCP Đầu tư và Phát triển Việt Nam – Chi nhánh Hà Thành.,"['1. Công ty Quản lý Quỹ\nBà Nguyễn Thị Thu Hiền\nÔng Đặng Lưu Dũng\nBà Phan Thị Thu Hằng\n5\n5\n5\nII. CÁC ĐỊNH NGHĨA\n1. Tổng quan tình hình kinh tế vĩ mô.................................... 8\n2. Thị trường tài chính Việt Nam và cơ hội đầu tư.......................... 8\n3. Lợi tức của nhà đầu tư............................................. 14\n4. THÔNG TIN VỀ CÔNG TY CỔ PHẦN QUẢN LÝ QUỸ KÝ THƯƠNG............ 15\n1. Các thông tin chung............................................... 17\n2. Tình hình hoạt động của Công ty Cổ phần Quản lý Quỹ Ký Thương (TCSME)........ 17\n3. Ngành hàng Giám Sát............................................. 17\nVI. CÔNG TY KIỂM TOÁN............................................ 18\nVII. ĐẠI LÝ PHÂN PHỐI CHỨNG CHỈ QUỸ.................................. 18', 'VII. ĐẠI LÝ PHÂN PHỐI CHỨNG CHỈ QUỸ.................................. 18\nVIII. TỔ CHỨC CHỨC UP QUYỀN.......................................... 18\nIX. THÔNG TIN VỀ QUỸ ĐẦU TƯ CỔ PHIẾU DOANH NGHIỆP VỪA VÀ NHỎ\nTECHCOM (TCSME).............................................. 18\n1. Thông tin về Quỹ................................................ 18\n1.1. Các điều khoản chung........................................... 19\n2.1. Các điều khoản chung........................................... 19\n2.1. Các điều khoản chung........................................... 19\n2.2. Mục tiêu, chính sách và hạn chế đầu tư.............................. 24\n2.2.1. Cơ cấu danh mục.............................................. 24\n2.2.2. Các quy định về mục tiêu, chính sách và hạn chế đầu tư.............. 26', 'Số: 9176 /QĐ-UBCK\nGiấy phép hành chứng chỉ quỹ ra công chúng\n----------------  \nCăn cứ khoản 2, Điều 46 Pháp lệnh Chứng khoán và Điều 45, 46 Nghị định số\n56/2007/NĐ-CP ngày 09/04/2007 của Chính phủ quy định chi tiết thi hành một số\nđiều của Pháp lệnh Chứng khoán;\nCăn cứ Quyết định số 30/2008/QĐ-BTC ngày 02/06/2008 của Bộ Tài chính về việc\nban hành Quy chế tổ chức và hoạt động của công ty quản lý quỹ, công ty chứng khoán;\nCăn cứ Giấy chứng nhận đăng ký kinh doanh số 0102013096 do Sở Kế hoạch và\nĐầu tư Thành phố Hà Nội cấp ngày 21/10/2008;\nXét đề nghị của Công ty cổ phần Quản lý Quỹ Ký Thương - TechcomCapital;  \nQUỸ ĐẦU TƯ CỔ PHIẾU DOANH NGHIỆP VỪA VÀ NHỎ TECHCOM\n(TCSME)  \nCHÀO BẢN CHỨNG CHỈ QUỸ ĐẦU TƯ CHỨNG KHOÁN RA CÔNG CHỨNG\n(Quỹ chứng khoán doanh nghiệp vừa và nhỏ Techcom)', 'nhượng, chuyển nhượng, hoặc bán một phần hoặc toàn bộ các khoản đầu tư vào Quỹ. Nhà đầu tư\ncó trách nhiệm tự mình thực hiện việc thẩm định và đánh giá mọi rủi ro liên quan đến đầu tư.  \nBản cáo bạch này bao gồm các thông tin về Quỹ, dự kiến các khoản đầu tư của Quỹ, các điều kiện\nvà quy định của Quỹ, hoặc các thông tin khác mà nhà đầu tư cần biết. Nhà đầu tư nên đọc kỹ Bản\ncáo bạch này và các tài liệu đính kèm trước khi ra quyết định đầu tư.\nTCC sẽ cập nhật Bản cáo bạch này nếu có bất kỳ thay đổi nào về thông tin.\nBản cáo bạch được cung cấp miễn phí tại văn phòng của TCC, các Đại lý phân phối và trên trang\nweb của TCC.  \nBản cáo bạch này được phát hành bởi:\nCông ty Cổ phần Quản lý Quỹ Ký Thương - TechcomCapital (“TCC”)', 'Bản cáo bạch này được phát hành bởi:\nCông ty Cổ phần Quản lý Quỹ Ký Thương - TechcomCapital (“TCC”)\nĐịa chỉ: Tầng 28, Tòa C5, số 119 Trần Duy Hưng, phường Trung Hòa, Quận Cầu Giấy, Hà Nội.\nĐiện thoại: (84-24) 39446368. Fax: (84-24) 39446583. Website: www.techcomcapital.com.vn.  \nBản cáo bạch này được phát hành bởi:\nCông ty Cổ phần Quản lý Quỹ Ký Thương - TechcomCapital (“TCC”)\nĐịa chỉ: Tầng 28, Tòa C5, số 119 Trần Duy Hưng, phường Trung Hòa, Quận Cầu Giấy, Hà Nội\nĐiện thoại: (84-24) 39446368 Fax: (84-24) 39446583\nWebsite: www.techcomcapital.com.vn  \nNơi cung cấp Bản cáo bạch:\nBản cáo bạch cập nhật những các tài liệu của Quỹ (báo cáo hoạt động, báo cáo tài chính,\nĐiểu Lệ Quỹ và các tài liệu cần thiết khác) được cung cấp trên trang điện tử của TCC,', '(Quỹ chứng khoán doanh nghiệp vừa và nhỏ Techcom)\nBản cáo bạch này được phát hành bởi:\nCông ty Cổ phần Quản lý Quỹ Ký Thương - TechcomCapital (“TCC”)\nĐịa chỉ : Tầng 28, Tòa C5, số 119 Trần Duy Hưng, phường Trung Hòa, Quận Cầu\nGiấy, Hà Nội\nĐiện thoại : (84-24) 39446368 Fax: (84-24) 39446583\nWebsite : www.techcomcapital.com.vn  \nNơi cung cấp Bản cáo bạch:\nBản cáo bạch cập nhật những các tài liệu của Quỹ (báo cáo hoạt động, báo cáo tài chính,\nĐiểu Lệ Quỹ và các tài liệu cần thiết khác) được cung cấp trên trang điện tử của TCC,\nwww.techcomcapital.com.vn, tại văn phòng của TCC và các Đại lý phân phối như danh sách\ntrong phụ lục 1 của Bản cáo Bạch.  \nPhụ trách công bố thông tin:\nÔng Đặng Lưu Dũng – Tổng Giám đốc\nĐịa chỉ : Công ty Cổ phần Quản lý Quỹ Ký Thương', 'Website : www.techcomcapital.com.vn  \nNơi cung cấp Bản cáo bạch:\nBản cáo bạch cập nhật những các tài liệu của Quỹ (báo cáo hoạt động, báo cáo tài chính,\nĐiểu Lệ Quỹ và các tài liệu cần thiết khác) được cung cấp trên trang điện tử của TCC,\nwww.techcomcapital.com.vn, tại văn phòng của TCC và các Đại lý phân phối như danh sách\ntrong phụ lục 1 của Bản cáo Bạch.  \nPhụ trách công bố thông tin:\nÔng Đặng Lưu Dũng – Tổng Giám đốc\nĐịa chỉ: Công ty Cổ phần Quản lý Quỹ Ký Thương\nTầng 28, Tòa C5, số 119 Trần Duy Hưng, phường Trung Hòa, Quận Cầu Giấy, Hà Nội\nĐiện thoại: (84-24) 39446368 Fax: (84-24) 39446583', 'Điểu Lệ Quỹ và các tài liệu cần thiết khác) được cung cấp trên trang điện tử của TCC,\nwww.techcomcapital.com.vn, tại văn phòng của TCC và các Đại lý phân phối như danh sách\ntrong phụ lục 1 của Bản cáo Bạch.  \nPhụ trách công bố thông tin:\nÔng Đặng Lưu Dũng – Tổng Giám đốc\nĐịa chỉ: Công ty Cổ phần Quản lý Quỹ Ký Thương\nTầng 28, Tòa C5, số 119 Trần Duy Hưng, phường Trung Hòa, Quận Cầu Giấy, Hà Nội\nĐiện thoại: (84-24) 39446368 Fax: (84-24) 39446583  \nBản cáo bạch này được phát hành bởi:\nCông ty Cổ phần Quản lý Quỹ Ký Thương - TechcomCapital (“TCC”)\nĐịa chỉ : Tầng 28, Tòa C5, số 119 Trần Duy Hưng, phường Trung Hòa, Quận Cầu Giấy, Hà Nội\nĐiện thoại : (84-24) 39446368 Fax: (84-24) 39446583\nWebsite : www.techcomcapital.com.vn  \nNơi cung cấp Bản cáo bạch:', 'thực hiện hoặc gián tiếp hoặc tổng hợp các khoản phí và các chi phí/phí/giá dịch vụ liên quan đến các hoạt động của Quỹ mà Quỹ thực hiện hoặc gián tiếp hoặc tổng hợp các khoản phí và các chi phí/phí/giá dịch vụ liên quan đến các hoạt động của Quỹ mà Quỹ thực hiện hoặc gián tiếp hoặc tổng hợp các khoản phí và các chi phí/phí/giá dịch vụ liên quan đến các hoạt động của Quỹ mà Quỹ thực hiện hoặc gián tiếp hoặc tổng hợp các khoản phí và các chi phí/phí/giá dịch vụ liên quan đến các hoạt động của Quỹ mà Quỹ thực hiện hoặc gián tiếp hoặc tổng hợp các khoản phí và các chi phí/phí/giá dịch vụ liên quan đến các hoạt động của Quỹ mà Quỹ thực hiện hoặc gián tiếp hoặc tổng hợp các khoản phí và các chi phí/phí/giá dịch vụ liên quan đến các hoạt động của Quỹ mà Quỹ thực hiện hoặc gián tiếp hoặc tổng', 'chi phí/phí/giá dịch vụ liên quan đến các hoạt động của Quỹ mà Quỹ thực hiện hoặc gián tiếp hoặc tổng hợp các khoản phí và các chi phí/phí/giá dịch vụ liên quan đến các hoạt động của Quỹ mà Quỹ thực hiện hoặc gián tiếp hoặc tổng hợp các khoản phí và các chi phí/phí/giá dịch vụ liên quan đến các hoạt động của Quỹ mà Quỹ thực hiện hoặc gián tiếp hoặc tổng hợp các khoản phí và các chi phí/phí/giá dịch vụ liên quan đến các hoạt động của Quỹ mà Quỹ thực hiện hoặc gián tiếp hoặc tổng hợp các khoản phí và các chi phí/phí/giá dịch vụ liên quan đến các hoạt động của Quỹ mà Quỹ thực hiện hoặc gián tiếp hoặc tổng hợp các khoản phí và các chi phí/phí/giá dịch vụ liên quan đến các hoạt động của Quỹ mà Quỹ thực hiện hoặc gián tiếp hoặc tổng hợp các khoản phí và các chi phí/phí/giá dịch vụ liên quan đến', 'dịch vụ liên quan đến các hoạt động của Quỹ mà Quỹ thực hiện hoặc gián tiếp hoặc tổng hợp các khoản phí và các chi phí/phí/giá dịch vụ liên quan đến các hoạt động của Quỹ mà Quỹ thực hiện hoặc gián tiếp hoặc tổng hợp các khoản phí và các chi phí/phí/giá dịch vụ liên quan đến các hoạt động của Quỹ mà Quỹ thực hiện hoặc gián tiếp hoặc tổng hợp các khoản phí và các chi phí/phí/giá dịch vụ liên quan đến các hoạt động của Quỹ mà Quỹ thực hiện hoặc gián tiếp hoặc tổng hợp các khoản phí và các chi phí/phí/giá dịch vụ liên quan đến các hoạt động của Quỹ mà Quỹ thực hiện hoặc gián tiếp hoặc tổng hợp các khoản phí và các chi phí/phí/giá dịch vụ liên quan đến các hoạt động của Quỹ mà Quỹ thực hiện hoặc gián tiếp hoặc tổng hợp các khoản phí và các chi phí/phí/giá dịch vụ liên quan đến các hoạt động', 'hiện hoặc gián tiếp hoặc tổng hợp các khoản phí và các chi phí/phí/giá dịch vụ liên quan đến các hoạt động của Quỹ mà Quỹ thực hiện hoặc gián tiếp hoặc tổng hợp các khoản phí và các chi phí/phí/giá dịch vụ liên quan đến các hoạt động của Quỹ mà Quỹ thực hiện hoặc gián tiếp hoặc tổng hợp các khoản phí và các chi phí/phí/giá dịch vụ liên quan đến các hoạt động của Quỹ mà Quỹ thực hiện hoặc gián tiếp hoặc tổng hợp các khoản phí và các chi phí/phí/giá dịch vụ liên quan đến các hoạt động của Quỹ mà Quỹ thực hiện hoặc gián tiếp hoặc tổng hợp các khoản phí và các chi phí/phí/giá dịch vụ liên quan đến các hoạt động của Quỹ mà Quỹ thực hiện hoặc gián tiếp hoặc tổng hợp các khoản phí và các chi phí/phí/giá dịch vụ liên quan đến các hoạt động của Quỹ mà Quỹ thực hiện hoặc gián tiếp hoặc tổng hợp các', 'Quỹ thực hiện hoặc gián tiếp hoặc tổng hợp các khoản phí và các chi phí/phí/giá dịch vụ liên quan đến các hoạt động của Quỹ mà Quỹ thực hiện hoặc gián tiếp hoặc tổng hợp các khoản phí và các chi phí/phí/giá dịch vụ liên quan đến các hoạt động của Quỹ mà Quỹ thực hiện hoặc gián tiếp hoặc tổng hợp các khoản phí và các chi phí/phí/giá dịch vụ liên quan đến các hoạt động của Quỹ mà Quỹ thực hiện hoặc gián tiếp hoặc tổng hợp các khoản phí và các chi phí/phí/giá dịch vụ liên quan đến các hoạt động của Quỹ mà Quỹ thực hiện hoặc gián tiếp hoặc tổng hợp các khoản phí và các chi phí/phí/giá dịch vụ liên quan đến các hoạt động của Quỹ mà Quỹ thực hiện hoặc gián tiếp hoặc tổng hợp các khoản phí và các chi phí/phí/giá dịch vụ liên quan đến các hoạt động của Quỹ mà Quỹ thực hiện hoặc gián tiếp hoặc', 'liên quan đến các hoạt động của Quỹ mà Quỹ thực hiện hoặc gián tiếp hoặc tổng hợp các khoản phí và các chi phí/phí/giá dịch vụ liên quan đến các hoạt động của Quỹ mà Quỹ thực hiện hoặc gián tiếp hoặc tổng hợp các khoản phí và các chi phí/phí/giá dịch vụ liên quan đến các hoạt động của Quỹ mà Quỹ thực hiện hoặc gián tiếp hoặc tổng hợp các khoản phí và các chi phí/phí/giá dịch vụ liên quan đến các hoạt động của Quỹ mà Quỹ thực hiện hoặc gián tiếp hoặc tổng hợp các khoản phí và các chi phí/phí/giá dịch vụ liên quan đến các hoạt động của Quỹ mà Quỹ thực hiện hoặc gián tiếp hoặc tổng hợp các khoản phí và các chi phí/phí/giá dịch vụ liên quan đến các hoạt động của Quỹ mà Quỹ thực hiện hoặc gián tiếp hoặc tổng hợp các khoản phí và các chi phí/phí/giá dịch vụ liên quan đến các hoạt động của Quỹ', 'liên quan đến các hoạt động của Quỹ mà Quỹ thực hiện hoặc gián tiếp hoặc tổng hợp các khoản phí và các chi phí/phí/giá dịch vụ liên quan đến các hoạt động của Quỹ mà Quỹ thực hiện hoặc gián tiếp hoặc tổng hợp các khoản phí và các chi phí/phí/giá dịch vụ liên quan đến các hoạt động của Quỹ mà Quỹ thực hiện hoặc gián tiếp hoặc tổng hợp các khoản phí và các chi phí/phí/giá dịch vụ liên quan đến các hoạt động của Quỹ mà Quỹ thực hiện hoặc gián tiếp hoặc tổng hợp các khoản phí và các chi phí/phí/giá dịch vụ liên quan đến các hoạt động của Quỹ mà Quỹ thực hiện hoặc gián tiếp hoặc tổng hợp các khoản phí và các chi phí/phí/giá dịch vụ liên quan đến các hoạt động của Quỹ mà Quỹ thực hiện hoặc gián tiếp hoặc tổng hợp các khoản phí và các chi phí/phí/giá dịch vụ liên quan đến các hoạt động của Quỹ', 'liên quan đến các hoạt động của Quỹ mà Quỹ thực hiện hoặc gián tiếp hoặc tổng hợp các khoản phí và các chi phí/phí/giá dịch vụ liên quan đến các hoạt động của Quỹ mà Quỹ thực hiện hoặc gián tiếp hoặc tổng hợp các khoản phí và các chi phí/phí/giá dịch vụ liên quan đến các hoạt động của Quỹ mà Quỹ thực hiện hoặc gián tiếp hoặc tổng hợp các khoản phí và các chi phí/phí/giá dịch vụ liên quan đến các hoạt động của Quỹ mà Quỹ thực hiện hoặc gián tiếp hoặc tổng hợp các khoản phí và các chi phí/phí/giá dịch vụ liên quan đến các hoạt động của Quỹ mà Quỹ thực hiện hoặc gián tiếp hoặc tổng hợp các khoản phí và các chi phí/phí/giá dịch vụ liên quan đến các hoạt động của Quỹ mà Quỹ thực hiện hoặc gián tiếp hoặc tổng hợp các khoản phí và các chi phí/phí/giá dịch vụ liên quan đến các hoạt động của Quỹ', 'liên quan đến các hoạt động của Quỹ mà Quỹ thực hiện hoặc gián tiếp hoặc tổng hợp các khoản phí và các chi phí/phí/giá dịch vụ liên quan đến các hoạt động của Quỹ mà Quỹ thực hiện hoặc gián tiếp hoặc tổng hợp các khoản phí và các chi phí/phí/giá dịch vụ liên quan đến các hoạt động của Quỹ mà Quỹ thực hiện hoặc gián tiếp hoặc tổng hợp các khoản phí và các chi phí/phí/giá dịch vụ liên quan đến các hoạt động của Quỹ mà Quỹ thực hiện hoặc gián tiếp hoặc tổng hợp các khoản phí và các chi phí/phí/giá dịch vụ liên quan đến các hoạt động của Quỹ mà Quỹ thực hiện hoặc gián tiếp hoặc tổng hợp các khoản phí và các chi phí/phí/giá dịch vụ liên quan đến các hoạt động của Quỹ mà Quỹ thực hiện hoặc gián tiếp hoặc tổng hợp các khoản phí và các chi phí/phí/giá dịch vụ liên quan đến các hoạt động của Quỹ', 'liên quan đến các hoạt động của Quỹ mà Quỹ thực hiện hoặc gián tiếp hoặc tổng hợp các khoản phí và các chi phí/phí/giá dịch vụ liên quan đến các hoạt động của Quỹ mà Quỹ thực hiện hoặc gián tiếp hoặc tổng hợp các khoản phí và các chi phí/phí/giá dịch vụ liên quan đến các hoạt động của Quỹ mà Quỹ thực hiện hoặc gián tiếp hoặc tổng hợp các khoản phí và các chi phí/phí/giá dịch vụ liên quan đến các hoạt động của Quỹ mà Quỹ thực hiện hoặc gián tiếp hoặc tổng hợp các khoản phí và các chi phí/phí/giá dịch vụ liên quan đến các hoạt động của Quỹ mà Quỹ thực hiện hoặc gián tiếp hoặc tổng hợp các khoản phí và các chi phí/phí/giá dịch vụ liên quan đến các hoạt động của Quỹ mà Quỹ thực hiện hoặc gián tiếp hoặc tổng hợp các khoản phí và các chi phí/phí/giá dịch vụ liên quan đến các hoạt động của Quỹ', 'liên quan đến các hoạt động của Quỹ mà Quỹ thực hiện hoặc gián tiếp hoặc tổng hợp các khoản phí và các chi phí/phí/giá dịch vụ liên quan đến các hoạt động của Quỹ mà Quỹ thực hiện hoặc gián tiếp hoặc tổng hợp các khoản phí và các chi phí/phí/giá dịch vụ liên quan đến các hoạt động của Quỹ mà Quỹ thực hiện hoặc gián tiếp hoặc tổng hợp các khoản phí và các chi phí/phí/giá dịch vụ liên quan đến các hoạt động của Quỹ mà Quỹ thực hiện hoặc gián tiếp hoặc tổng hợp các khoản phí và các chi phí/phí/giá dịch vụ liên quan đến các hoạt động của Quỹ mà Quỹ thực hiện hoặc gián tiếp hoặc tổng hợp các khoản phí và các chi phí/phí/giá dịch vụ liên quan đến các hoạt động của Quỹ mà Quỹ thực hiện hoặc gián tiếp hoặc tổng hợp các khoản phí và các chi phí/phí/giá dịch vụ liên quan đến các hoạt động của Quỹ', 'liên quan đến các hoạt động của Quỹ mà Quỹ thực hiện hoặc gián tiếp hoặc tổng hợp các khoản phí và các chi phí/phí/giá dịch vụ liên quan đến các hoạt động của Quỹ mà Quỹ thực hiện hoặc gián tiếp hoặc tổng hợp các khoản phí và các chi phí/phí/giá dịch vụ liên quan đến các hoạt động của Quỹ mà Quỹ thực hiện hoặc gián tiếp hoặc tổng hợp các khoản phí và các chi phí/phí/giá dịch vụ liên quan đến các hoạt động của Quỹ mà Quỹ thực hiện hoặc gián tiếp hoặc tổng hợp các khoản phí và các chi phí/phí/giá dịch vụ liên quan đến các hoạt động của Quỹ mà Quỹ thực hiện hoặc gián tiếp hoặc tổng hợp các khoản phí và các chi phí/phí/giá dịch vụ liên quan đến các hoạt động của Quỹ mà Quỹ thực hiện hoặc gián tiếp hoặc tổng hợp các khoản phí và các chi phí/phí/giá dịch vụ liên quan đến các hoạt động của Quỹ', 'liên quan đến các hoạt động của Quỹ mà Quỹ thực hiện hoặc gián tiếp hoặc tổng hợp các khoản phí và các chi phí/phí/giá dịch vụ liên quan đến các hoạt động của Quỹ mà Quỹ thực hiện hoặc gián tiếp hoặc tổng hợp các khoản phí và các chi phí/phí/giá dịch vụ liên quan đến các hoạt động của Quỹ mà Quỹ thực hiện hoặc gián tiếp hoặc tổng hợp các khoản phí và các chi phí/phí/giá dịch vụ liên quan đến các hoạt động của Quỹ mà Quỹ thực hiện hoặc gián tiếp hoặc tổng hợp các khoản phí và các chi phí/phí/giá dịch vụ liên quan đến các hoạt động của Quỹ mà Quỹ thực hiện hoặc gián tiếp hoặc tổng hợp các khoản phí và các chi phí/phí/giá dịch vụ liên quan đến các hoạt động của Quỹ mà Quỹ thực hiện hoặc gián tiếp hoặc tổng hợp các khoản phí và các chi phí/phí/giá dịch vụ liên quan đến các hoạt động của Quỹ', 'liên quan đến các hoạt động của Quỹ mà Quỹ thực hiện hoặc gián tiếp hoặc tổng hợp các khoản phí và các chi phí/phí/giá dịch vụ liên quan đến các hoạt động của Quỹ mà Quỹ thực hiện hoặc gián tiếp hoặc tổng hợp các khoản phí và các chi phí/phí/giá dịch vụ liên quan đến các hoạt động của Quỹ mà Quỹ thực hiện hoặc gián tiếp hoặc tổng hợp các khoản phí và các chi phí/phí/giá dịch vụ liên quan đến các hoạt động của Quỹ mà Quỹ thực hiện hoặc gián tiếp hoặc tổng hợp các khoản phí và các chi phí/phí/giá dịch vụ liên quan đến các hoạt động của Quỹ mà Quỹ thực hiện hoặc gián tiếp hoặc tổng hợp các khoản phí và các chi phí/phí/giá dịch vụ liên quan đến các hoạt động của Quỹ mà Quỹ thực hiện hoặc gián tiếp hoặc tổng hợp các khoản phí và các chi phí/phí/giá dịch vụ liên quan đến các hoạt động của Quỹ', 'liên quan đến các hoạt động của Quỹ mà Quỹ thực hiện hoặc gián tiếp hoặc tổng hợp các khoản phí và các chi phí/phí/giá dịch vụ liên quan đến các hoạt động của Quỹ mà Quỹ thực hiện hoặc gián tiếp hoặc tổng hợp các khoản phí và các chi phí/phí/giá dịch vụ liên quan đến các hoạt động của Quỹ mà Quỹ thực hiện hoặc gián tiếp hoặc tổng hợp các khoản phí và các chi phí/phí/giá dịch vụ liên quan đến các hoạt động của Quỹ mà Quỹ thực hiện hoặc gián tiếp hoặc tổng hợp các khoản phí và các chi phí/phí/giá dịch vụ liên quan đến các hoạt động của Quỹ mà Quỹ thực hiện hoặc gián tiếp hoặc tổng hợp các khoản phí và các chi phí/phí/giá dịch vụ liên quan đến các hoạt động của Quỹ mà Quỹ thực hiện hoặc gián tiếp hoặc tổng hợp các khoản phí và các chi phí/phí/giá dịch vụ liên quan đến các hoạt động của Quỹ', 'liên quan đến các hoạt động của Quỹ mà Quỹ thực hiện hoặc gián tiếp hoặc tổng hợp các khoản phí và các chi phí/phí/giá dịch vụ liên quan đến các hoạt động của Quỹ mà Quỹ thực hiện hoặc gián tiếp hoặc tổng hợp các khoản phí và các chi phí/phí/giá dịch vụ liên quan đến các hoạt động của Quỹ mà Quỹ thực hiện hoặc gián tiếp hoặc tổng hợp các khoản phí và các chi phí/phí/giá dịch vụ liên quan đến các hoạt động của Quỹ mà Quỹ thực hiện hoặc gián tiếp hoặc tổng hợp các khoản phí và các chi phí/phí/giá dịch vụ liên quan đến các hoạt động của Quỹ mà Quỹ thực hiện hoặc gián tiếp hoặc tổng hợp các khoản phí và các chi phí/phí/giá dịch vụ liên quan đến các hoạt động của Quỹ mà Quỹ thực hiện hoặc gián tiếp hoặc tổng hợp các khoản phí và các chi phí/phí/giá dịch vụ liên quan đến các hoạt động của Quỹ', 'liên quan đến các hoạt động của Quỹ mà Quỹ thực hiện hoặc gián tiếp hoặc tổng hợp các khoản phí và các chi phí/phí/giá dịch vụ liên quan đến các hoạt động của Quỹ mà Quỹ thực hiện hoặc gián tiếp hoặc tổng hợp các khoản phí và các chi phí/phí/giá dịch vụ liên quan đến các hoạt động của Quỹ mà Quỹ thực hiện hoặc gián tiếp hoặc tổng hợp các khoản phí và các chi phí/phí/giá dịch vụ liên quan đến các hoạt động của Quỹ mà Quỹ thực hiện hoặc gián tiếp hoặc tổng hợp các khoản phí và các chi phí/phí/giá dịch vụ liên quan đến các hoạt động của Quỹ mà Quỹ thực hiện hoặc gián tiếp hoặc tổng hợp các khoản phí và các chi phí/phí/giá dịch vụ liên quan đến các hoạt động của Quỹ mà Quỹ thực hiện hoặc gián tiếp hoặc tổng hợp các khoản phí và các chi phí/phí/giá dịch vụ liên quan đến các hoạt động của Quỹ']",Ngân hàng TMCP Đầu tư và Phát triển Việt Nam (BIDV) - Chi nhánh Hà Thành.
Đại lý phân phối chứng chỉ quỹ (Distributor) và Đại lý chuyển nhượng (Transfer Agent) là những tổ chức nào?,"Đại lý phân phối chứng chỉ quỹ (Distributor) là Công ty Cổ phần Chứng khoán Kỹ thương (“TCBS”).
Thông tin về Đại lý chuyển nhượng (Transfer Agent) không có trong tài liệu.","['Điểu Lệ Quỹ và các tài liệu cần thiết khác) được cung cấp trên trang điện tử của TCC,\nwww.techcomcapital.com.vn, tại văn phòng của TCC và các Đại lý phân phối như danh sách\ntrong phụ lục 1 của Bản cáo Bạch.  \nPhụ trách công bố thông tin:\nÔng Đặng Lưu Dũng – Tổng Giám đốc\nĐịa chỉ: Công ty Cổ phần Quản lý Quỹ Ký Thương\nTầng 28, Tòa C5, số 119 Trần Duy Hưng, phường Trung Hòa, Quận Cầu Giấy, Hà Nội\nĐiện thoại: (84-24) 39446368 Fax: (84-24) 39446583  \nBản cáo bạch này được phát hành bởi:\nCông ty Cổ phần Quản lý Quỹ Ký Thương - TechcomCapital (“TCC”)\nĐịa chỉ : Tầng 28, Tòa C5, số 119 Trần Duy Hưng, phường Trung Hòa, Quận Cầu Giấy, Hà Nội\nĐiện thoại : (84-24) 39446368 Fax: (84-24) 39446583\nWebsite : www.techcomcapital.com.vn  \nNơi cung cấp Bản cáo bạch:', 'Website : www.techcomcapital.com.vn  \nNơi cung cấp Bản cáo bạch:\nBản cáo bạch cập nhật những các tài liệu của Quỹ (báo cáo hoạt động, báo cáo tài chính,\nĐiểu Lệ Quỹ và các tài liệu cần thiết khác) được cung cấp trên trang điện tử của TCC,\nwww.techcomcapital.com.vn, tại văn phòng của TCC và các Đại lý phân phối như danh sách\ntrong phụ lục 1 của Bản cáo Bạch.  \nPhụ trách công bố thông tin:\nÔng Đặng Lưu Dũng – Tổng Giám đốc\nĐịa chỉ: Công ty Cổ phần Quản lý Quỹ Ký Thương\nTầng 28, Tòa C5, số 119 Trần Duy Hưng, phường Trung Hòa, Quận Cầu Giấy, Hà Nội\nĐiện thoại: (84-24) 39446368 Fax: (84-24) 39446583', '(Quỹ chứng khoán doanh nghiệp vừa và nhỏ Techcom)\nBản cáo bạch này được phát hành bởi:\nCông ty Cổ phần Quản lý Quỹ Ký Thương - TechcomCapital (“TCC”)\nĐịa chỉ : Tầng 28, Tòa C5, số 119 Trần Duy Hưng, phường Trung Hòa, Quận Cầu\nGiấy, Hà Nội\nĐiện thoại : (84-24) 39446368 Fax: (84-24) 39446583\nWebsite : www.techcomcapital.com.vn  \nNơi cung cấp Bản cáo bạch:\nBản cáo bạch cập nhật những các tài liệu của Quỹ (báo cáo hoạt động, báo cáo tài chính,\nĐiểu Lệ Quỹ và các tài liệu cần thiết khác) được cung cấp trên trang điện tử của TCC,\nwww.techcomcapital.com.vn, tại văn phòng của TCC và các Đại lý phân phối như danh sách\ntrong phụ lục 1 của Bản cáo Bạch.  \nPhụ trách công bố thông tin:\nÔng Đặng Lưu Dũng – Tổng Giám đốc\nĐịa chỉ : Công ty Cổ phần Quản lý Quỹ Ký Thương', 'Bản cáo bạch này được phát hành bởi:\nCông ty Cổ phần Quản lý Quỹ Ký Thương - TechcomCapital (“TCC”)\nĐịa chỉ: Tầng 28, Tòa C5, số 119 Trần Duy Hưng, phường Trung Hòa, Quận Cầu Giấy, Hà Nội.\nĐiện thoại: (84-24) 39446368. Fax: (84-24) 39446583. Website: www.techcomcapital.com.vn.  \nBản cáo bạch này được phát hành bởi:\nCông ty Cổ phần Quản lý Quỹ Ký Thương - TechcomCapital (“TCC”)\nĐịa chỉ: Tầng 28, Tòa C5, số 119 Trần Duy Hưng, phường Trung Hòa, Quận Cầu Giấy, Hà Nội\nĐiện thoại: (84-24) 39446368 Fax: (84-24) 39446583\nWebsite: www.techcomcapital.com.vn  \nNơi cung cấp Bản cáo bạch:\nBản cáo bạch cập nhật những các tài liệu của Quỹ (báo cáo hoạt động, báo cáo tài chính,\nĐiểu Lệ Quỹ và các tài liệu cần thiết khác) được cung cấp trên trang điện tử của TCC,', 'nhượng, chuyển nhượng, hoặc bán một phần hoặc toàn bộ các khoản đầu tư vào Quỹ. Nhà đầu tư\ncó trách nhiệm tự mình thực hiện việc thẩm định và đánh giá mọi rủi ro liên quan đến đầu tư.  \nBản cáo bạch này bao gồm các thông tin về Quỹ, dự kiến các khoản đầu tư của Quỹ, các điều kiện\nvà quy định của Quỹ, hoặc các thông tin khác mà nhà đầu tư cần biết. Nhà đầu tư nên đọc kỹ Bản\ncáo bạch này và các tài liệu đính kèm trước khi ra quyết định đầu tư.\nTCC sẽ cập nhật Bản cáo bạch này nếu có bất kỳ thay đổi nào về thông tin.\nBản cáo bạch được cung cấp miễn phí tại văn phòng của TCC, các Đại lý phân phối và trên trang\nweb của TCC.  \nBản cáo bạch này được phát hành bởi:\nCông ty Cổ phần Quản lý Quỹ Ký Thương - TechcomCapital (“TCC”)', 'Số: 9176 /QĐ-UBCK\nGiấy phép hành chứng chỉ quỹ ra công chúng\n----------------  \nCăn cứ khoản 2, Điều 46 Pháp lệnh Chứng khoán và Điều 45, 46 Nghị định số\n56/2007/NĐ-CP ngày 09/04/2007 của Chính phủ quy định chi tiết thi hành một số\nđiều của Pháp lệnh Chứng khoán;\nCăn cứ Quyết định số 30/2008/QĐ-BTC ngày 02/06/2008 của Bộ Tài chính về việc\nban hành Quy chế tổ chức và hoạt động của công ty quản lý quỹ, công ty chứng khoán;\nCăn cứ Giấy chứng nhận đăng ký kinh doanh số 0102013096 do Sở Kế hoạch và\nĐầu tư Thành phố Hà Nội cấp ngày 21/10/2008;\nXét đề nghị của Công ty cổ phần Quản lý Quỹ Ký Thương - TechcomCapital;  \nQUỸ ĐẦU TƯ CỔ PHIẾU DOANH NGHIỆP VỪA VÀ NHỎ TECHCOM\n(TCSME)  \nCHÀO BẢN CHỨNG CHỈ QUỸ ĐẦU TƯ CHỨNG KHOÁN RA CÔNG CHỨNG\n(Quỹ chứng khoán doanh nghiệp vừa và nhỏ Techcom)', 'Quỹ thực hiện hoặc gián tiếp hoặc tổng hợp các khoản phí và các chi phí/phí/giá dịch vụ liên quan đến các hoạt động của Quỹ mà Quỹ thực hiện hoặc gián tiếp hoặc tổng hợp các khoản phí và các chi phí/phí/giá dịch vụ liên quan đến các hoạt động của Quỹ mà Quỹ thực hiện hoặc gián tiếp hoặc tổng hợp các khoản phí và các chi phí/phí/giá dịch vụ liên quan đến các hoạt động của Quỹ mà Quỹ thực hiện hoặc gián tiếp hoặc tổng hợp các khoản phí và các chi phí/phí/giá dịch vụ liên quan đến các hoạt động của Quỹ mà Quỹ thực hiện hoặc gián tiếp hoặc tổng hợp các khoản phí và các chi phí/phí/giá dịch vụ liên quan đến các hoạt động của Quỹ mà Quỹ thực hiện hoặc gián tiếp hoặc tổng hợp các khoản phí và các chi phí/phí/giá dịch vụ liên quan đến các hoạt động của Quỹ mà Quỹ thực hiện hoặc gián tiếp hoặc', 'chi phí/phí/giá dịch vụ liên quan đến các hoạt động của Quỹ mà Quỹ thực hiện hoặc gián tiếp hoặc tổng hợp các khoản phí và các chi phí/phí/giá dịch vụ liên quan đến các hoạt động của Quỹ mà Quỹ thực hiện hoặc gián tiếp hoặc tổng hợp các khoản phí và các chi phí/phí/giá dịch vụ liên quan đến các hoạt động của Quỹ mà Quỹ thực hiện hoặc gián tiếp hoặc tổng hợp các khoản phí và các chi phí/phí/giá dịch vụ liên quan đến các hoạt động của Quỹ mà Quỹ thực hiện hoặc gián tiếp hoặc tổng hợp các khoản phí và các chi phí/phí/giá dịch vụ liên quan đến các hoạt động của Quỹ mà Quỹ thực hiện hoặc gián tiếp hoặc tổng hợp các khoản phí và các chi phí/phí/giá dịch vụ liên quan đến các hoạt động của Quỹ mà Quỹ thực hiện hoặc gián tiếp hoặc tổng hợp các khoản phí và các chi phí/phí/giá dịch vụ liên quan đến', 'Chỉ có các loại phí/dịch vụ và các chi phí/phí/giá dịch vụ liên quan trực tiếp hoặc gián tiếp hoặc tổng hợp các khoản phí và các chi phí/phí/giá dịch vụ liên quan đến các hoạt động của Quỹ mà Quỹ thực hiện hoặc gián tiếp hoặc tổng hợp các khoản phí và các chi phí/phí/giá dịch vụ liên quan đến các hoạt động của Quỹ mà Quỹ thực hiện hoặc gián tiếp hoặc tổng hợp các khoản phí và các chi phí/phí/giá dịch vụ liên quan đến các hoạt động của Quỹ mà Quỹ thực hiện hoặc gián tiếp hoặc tổng hợp các khoản phí và các chi phí/phí/giá dịch vụ liên quan đến các hoạt động của Quỹ mà Quỹ thực hiện hoặc gián tiếp hoặc tổng hợp các khoản phí và các chi phí/phí/giá dịch vụ liên quan đến các hoạt động của Quỹ mà Quỹ thực hiện hoặc gián tiếp hoặc tổng hợp các khoản phí và các chi phí/phí/giá dịch vụ liên quan', 'liên quan đến các hoạt động của Quỹ mà Quỹ thực hiện hoặc gián tiếp hoặc tổng hợp các khoản phí và các chi phí/phí/giá dịch vụ liên quan đến các hoạt động của Quỹ mà Quỹ thực hiện hoặc gián tiếp hoặc tổng hợp các khoản phí và các chi phí/phí/giá dịch vụ liên quan đến các hoạt động của Quỹ mà Quỹ thực hiện hoặc gián tiếp hoặc tổng hợp các khoản phí và các chi phí/phí/giá dịch vụ liên quan đến các hoạt động của Quỹ mà Quỹ thực hiện hoặc gián tiếp hoặc tổng hợp các khoản phí và các chi phí/phí/giá dịch vụ liên quan đến các hoạt động của Quỹ mà Quỹ thực hiện hoặc gián tiếp hoặc tổng hợp các khoản phí và các chi phí/phí/giá dịch vụ liên quan đến', 'phí/phí/giá dịch vụ liên quan đến các hoạt động của Quỹ mà Quỹ thực hiện hoặc gián tiếp hoặc tổng hợp các khoản phí và các chi phí/phí/giá dịch vụ liên quan đến các hoạt động của Quỹ mà Quỹ thực hiện hoặc gián tiếp hoặc tổng hợp các khoản phí và các chi phí/phí/giá dịch vụ liên quan đến các hoạt động của Quỹ mà Quỹ thực hiện hoặc gián tiếp hoặc tổng hợp các khoản phí và các chi phí/phí/giá dịch vụ liên quan đến các hoạt động của Quỹ mà Quỹ thực hiện hoặc gián tiếp hoặc tổng hợp các khoản phí và các chi phí/phí/giá dịch vụ liên quan đến các hoạt động của Quỹ mà Quỹ thực hiện hoặc gián tiếp hoặc tổng hợp các khoản phí và các chi phí/phí/giá dịch vụ liên quan đến các hoạt động của Quỹ mà Quỹ thực hiện hoặc gián tiếp hoặc tổng hợp các khoản phí và các chi phí/phí/giá dịch vụ liên quan đến các', '*   9 năm kinh nghiệm với vai trò giám đốc kiểm toán tại Công ty TNHH KPMG Việt Nam.\n*   Hiện là Giám đốc tài chính (CFO) tại Công ty CP Đầu Tư Thương Mại Quốc Tế Matrrot Dd.  \nCác quy định về tiêu chuẩn lựa chọn thành viên Ban đại diện Quỹ, quyền hạn và nhiệm vụ của Ban đại diện Quỹ, chủ tịch Ban đại diện Quỹ, đinh chỉ hoạc bãi miễn thành viên Ban đại diện Quỹ, cuộc họp của Ban đại diện Quỹ tuân theo quy định tại chương V Điều Lệ Quỹ.  \n**2.10. Quyền hạn và trách nhiệm của Công ty Quản lý Quỹ**\nCông ty Quản lý Quỹ được lựa chọn phải thỏa mãn các điều kiện sau:  \n*   Được thực hiện nghiệp vụ quản lý Quỹ;\n*   Hoàn toàn độc lập với Ngân hàng Giám sát;\n*   Có đầy đủ cơ sở vật chất, nhân sự để Quản lý Quỹ mở;', 'vụ liên quan đến các hoạt động của Quỹ mà Quỹ thực hiện hoặc gián tiếp hoặc tổng hợp các khoản phí và các chi phí/phí/giá dịch vụ liên quan đến các hoạt động của Quỹ mà Quỹ thực hiện hoặc gián tiếp hoặc tổng hợp các khoản phí và các chi phí/phí/giá dịch vụ liên quan đến các hoạt động của Quỹ mà Quỹ thực hiện hoặc gián tiếp hoặc tổng hợp các khoản phí và các chi phí/phí/giá dịch vụ liên quan đến các hoạt động của Quỹ mà Quỹ thực hiện hoặc gián tiếp hoặc tổng hợp các khoản phí và các chi phí/phí/giá dịch vụ liên quan đến các hoạt động của Quỹ mà Quỹ thực hiện hoặc gián tiếp hoặc tổng hợp các khoản phí và các chi phí/phí/giá dịch vụ liên quan đến các hoạt động của Quỹ mà Quỹ thực hiện hoặc gián tiếp hoặc tổng hợp các khoản phí và các chi phí/phí/giá dịch vụ liên quan đến các hoạt động của', 'dịch vụ liên quan đến các hoạt động của Quỹ mà Quỹ thực hiện hoặc gián tiếp hoặc tổng hợp các khoản phí và các chi phí/phí/giá dịch vụ liên quan đến các hoạt động của Quỹ mà Quỹ thực hiện hoặc gián tiếp hoặc tổng hợp các khoản phí và các chi phí/phí/giá dịch vụ liên quan đến các hoạt động của Quỹ mà Quỹ thực hiện hoặc gián tiếp hoặc tổng hợp các khoản phí và các chi phí/phí/giá dịch vụ liên quan đến các hoạt động của Quỹ mà Quỹ thực hiện hoặc gián tiếp hoặc tổng hợp các khoản phí và các chi phí/phí/giá dịch vụ liên quan đến các hoạt động của Quỹ mà Quỹ thực hiện hoặc gián tiếp hoặc tổng hợp các khoản phí và các chi phí/phí/giá dịch vụ liên quan đến các hoạt động của Quỹ mà Quỹ thực hiện hoặc gián tiếp hoặc tổng hợp các khoản phí và các chi phí/phí/giá dịch vụ liên quan đến các hoạt động', '**Chế độ kế toán**  \nQuỹ sẽ áp dụng chế độ kế toán Việt Nam (VAS) và tuân thủ các quy định khác liên quan tới công tác kế toán cho Quỹ do các cơ quan có thẩm quyền quy định. Đồng Việt Nam sẽ là đồng tiền được sử dụng và thể hiện.  \n**Chế độ báo cáo**  \nCông ty Quản lý Quỹ có trách nhiệm duy trì sổ sách kế toán và chuẩn bị báo cáo tài chính cho Quỹ. Phù hợp với quy định tại Điều 38 của Điều Lệ Quỹ, Công ty Quản lý Quỹ có thể uỷ quyền cho một nhà cung cấp dịch vụ có thực hiện việc này. Một số sách kế toán và báo cáo tài chính mà Công ty Quản lý Quỹ hoặc nhà cung cấp dịch vụ có thể uỷ quyền sẽ được lưu trữ tại văn phòng của Công ty Quản lý Quỹ hoặc nhà cung cấp dịch vụ có liên quan.', '**3.6. Rủi ro biến động giá**  \nRủi ro về biến động giá của Quỹ phát sinh khi một hay một số Nhà Đầu tư nắm giữ một số lượng lớn cổ phiếu của Quỹ quyết định thực hiện lệnh bán của các cổ phiếu của Quỹ này. Nắm giữ một số lượng lớn cổ phiếu của Quỹ quyết định bán.  \n**3.7. Rủi ro tái đầu tư**  \nRủi ro tái đầu tư là rủi ro có thể xảy ra khi các khoản đầu tư trái phiếu với dòng tiền lãi trái phiếu nhận được hàng kỳ và gốc trái phiếu nhận được vào thời điểm đáo hạn được đi tìm đầu tư nhận lại. Công ty Quản lý Quỹ quyết định bán các chứng khoán của Quỹ.', 'liên quan đến các hoạt động của Quỹ mà Quỹ thực hiện hoặc gián tiếp hoặc tổng hợp các khoản phí và các chi phí/phí/giá dịch vụ liên quan đến các hoạt động của Quỹ mà Quỹ thực hiện hoặc gián tiếp hoặc tổng hợp các khoản phí và các chi phí/phí/giá dịch vụ liên quan đến các hoạt động của Quỹ mà Quỹ thực hiện hoặc gián tiếp hoặc tổng hợp các khoản phí và các chi phí/phí/giá dịch vụ liên quan đến các hoạt động của Quỹ mà Quỹ thực hiện hoặc gián tiếp hoặc tổng hợp các khoản phí và các chi phí/phí/giá dịch vụ liên quan đến các hoạt động của Quỹ mà Quỹ thực hiện hoặc gián tiếp hoặc tổng hợp các khoản phí và các chi phí/phí/giá dịch vụ liên quan đến các hoạt động của Quỹ mà Quỹ thực hiện hoặc gián tiếp hoặc tổng hợp các khoản phí và các chi phí/phí/giá dịch vụ liên quan đến các hoạt động của Quỹ', 'liên quan đến các hoạt động của Quỹ mà Quỹ thực hiện hoặc gián tiếp hoặc tổng hợp các khoản phí và các chi phí/phí/giá dịch vụ liên quan đến các hoạt động của Quỹ mà Quỹ thực hiện hoặc gián tiếp hoặc tổng hợp các khoản phí và các chi phí/phí/giá dịch vụ liên quan đến các hoạt động của Quỹ mà Quỹ thực hiện hoặc gián tiếp hoặc tổng hợp các khoản phí và các chi phí/phí/giá dịch vụ liên quan đến các hoạt động của Quỹ mà Quỹ thực hiện hoặc gián tiếp hoặc tổng hợp các khoản phí và các chi phí/phí/giá dịch vụ liên quan đến các hoạt động của Quỹ mà Quỹ thực hiện hoặc gián tiếp hoặc tổng hợp các khoản phí và các chi phí/phí/giá dịch vụ liên quan đến các hoạt động của Quỹ mà Quỹ thực hiện hoặc gián tiếp hoặc tổng hợp các khoản phí và các chi phí/phí/giá dịch vụ liên quan đến các hoạt động của Quỹ', 'liên quan đến các hoạt động của Quỹ mà Quỹ thực hiện hoặc gián tiếp hoặc tổng hợp các khoản phí và các chi phí/phí/giá dịch vụ liên quan đến các hoạt động của Quỹ mà Quỹ thực hiện hoặc gián tiếp hoặc tổng hợp các khoản phí và các chi phí/phí/giá dịch vụ liên quan đến các hoạt động của Quỹ mà Quỹ thực hiện hoặc gián tiếp hoặc tổng hợp các khoản phí và các chi phí/phí/giá dịch vụ liên quan đến các hoạt động của Quỹ mà Quỹ thực hiện hoặc gián tiếp hoặc tổng hợp các khoản phí và các chi phí/phí/giá dịch vụ liên quan đến các hoạt động của Quỹ mà Quỹ thực hiện hoặc gián tiếp hoặc tổng hợp các khoản phí và các chi phí/phí/giá dịch vụ liên quan đến các hoạt động của Quỹ mà Quỹ thực hiện hoặc gián tiếp hoặc tổng hợp các khoản phí và các chi phí/phí/giá dịch vụ liên quan đến các hoạt động của Quỹ', 'liên quan đến các hoạt động của Quỹ mà Quỹ thực hiện hoặc gián tiếp hoặc tổng hợp các khoản phí và các chi phí/phí/giá dịch vụ liên quan đến các hoạt động của Quỹ mà Quỹ thực hiện hoặc gián tiếp hoặc tổng hợp các khoản phí và các chi phí/phí/giá dịch vụ liên quan đến các hoạt động của Quỹ mà Quỹ thực hiện hoặc gián tiếp hoặc tổng hợp các khoản phí và các chi phí/phí/giá dịch vụ liên quan đến các hoạt động của Quỹ mà Quỹ thực hiện hoặc gián tiếp hoặc tổng hợp các khoản phí và các chi phí/phí/giá dịch vụ liên quan đến các hoạt động của Quỹ mà Quỹ thực hiện hoặc gián tiếp hoặc tổng hợp các khoản phí và các chi phí/phí/giá dịch vụ liên quan đến các hoạt động của Quỹ mà Quỹ thực hiện hoặc gián tiếp hoặc tổng hợp các khoản phí và các chi phí/phí/giá dịch vụ liên quan đến các hoạt động của Quỹ', 'liên quan đến các hoạt động của Quỹ mà Quỹ thực hiện hoặc gián tiếp hoặc tổng hợp các khoản phí và các chi phí/phí/giá dịch vụ liên quan đến các hoạt động của Quỹ mà Quỹ thực hiện hoặc gián tiếp hoặc tổng hợp các khoản phí và các chi phí/phí/giá dịch vụ liên quan đến các hoạt động của Quỹ mà Quỹ thực hiện hoặc gián tiếp hoặc tổng hợp các khoản phí và các chi phí/phí/giá dịch vụ liên quan đến các hoạt động của Quỹ mà Quỹ thực hiện hoặc gián tiếp hoặc tổng hợp các khoản phí và các chi phí/phí/giá dịch vụ liên quan đến các hoạt động của Quỹ mà Quỹ thực hiện hoặc gián tiếp hoặc tổng hợp các khoản phí và các chi phí/phí/giá dịch vụ liên quan đến các hoạt động của Quỹ mà Quỹ thực hiện hoặc gián tiếp hoặc tổng hợp các khoản phí và các chi phí/phí/giá dịch vụ liên quan đến các hoạt động của Quỹ', 'liên quan đến các hoạt động của Quỹ mà Quỹ thực hiện hoặc gián tiếp hoặc tổng hợp các khoản phí và các chi phí/phí/giá dịch vụ liên quan đến các hoạt động của Quỹ mà Quỹ thực hiện hoặc gián tiếp hoặc tổng hợp các khoản phí và các chi phí/phí/giá dịch vụ liên quan đến các hoạt động của Quỹ mà Quỹ thực hiện hoặc gián tiếp hoặc tổng hợp các khoản phí và các chi phí/phí/giá dịch vụ liên quan đến các hoạt động của Quỹ mà Quỹ thực hiện hoặc gián tiếp hoặc tổng hợp các khoản phí và các chi phí/phí/giá dịch vụ liên quan đến các hoạt động của Quỹ mà Quỹ thực hiện hoặc gián tiếp hoặc tổng hợp các khoản phí và các chi phí/phí/giá dịch vụ liên quan đến các hoạt động của Quỹ mà Quỹ thực hiện hoặc gián tiếp hoặc tổng hợp các khoản phí và các chi phí/phí/giá dịch vụ liên quan đến các hoạt động của Quỹ', 'liên quan đến các hoạt động của Quỹ mà Quỹ thực hiện hoặc gián tiếp hoặc tổng hợp các khoản phí và các chi phí/phí/giá dịch vụ liên quan đến các hoạt động của Quỹ mà Quỹ thực hiện hoặc gián tiếp hoặc tổng hợp các khoản phí và các chi phí/phí/giá dịch vụ liên quan đến các hoạt động của Quỹ mà Quỹ thực hiện hoặc gián tiếp hoặc tổng hợp các khoản phí và các chi phí/phí/giá dịch vụ liên quan đến các hoạt động của Quỹ mà Quỹ thực hiện hoặc gián tiếp hoặc tổng hợp các khoản phí và các chi phí/phí/giá dịch vụ liên quan đến các hoạt động của Quỹ mà Quỹ thực hiện hoặc gián tiếp hoặc tổng hợp các khoản phí và các chi phí/phí/giá dịch vụ liên quan đến các hoạt động của Quỹ mà Quỹ thực hiện hoặc gián tiếp hoặc tổng hợp các khoản phí và các chi phí/phí/giá dịch vụ liên quan đến các hoạt động của Quỹ', 'liên quan đến các hoạt động của Quỹ mà Quỹ thực hiện hoặc gián tiếp hoặc tổng hợp các khoản phí và các chi phí/phí/giá dịch vụ liên quan đến các hoạt động của Quỹ mà Quỹ thực hiện hoặc gián tiếp hoặc tổng hợp các khoản phí và các chi phí/phí/giá dịch vụ liên quan đến các hoạt động của Quỹ mà Quỹ thực hiện hoặc gián tiếp hoặc tổng hợp các khoản phí và các chi phí/phí/giá dịch vụ liên quan đến các hoạt động của Quỹ mà Quỹ thực hiện hoặc gián tiếp hoặc tổng hợp các khoản phí và các chi phí/phí/giá dịch vụ liên quan đến các hoạt động của Quỹ mà Quỹ thực hiện hoặc gián tiếp hoặc tổng hợp các khoản phí và các chi phí/phí/giá dịch vụ liên quan đến các hoạt động của Quỹ mà Quỹ thực hiện hoặc gián tiếp hoặc tổng hợp các khoản phí và các chi phí/phí/giá dịch vụ liên quan đến các hoạt động của Quỹ', 'liên quan đến các hoạt động của Quỹ mà Quỹ thực hiện hoặc gián tiếp hoặc tổng hợp các khoản phí và các chi phí/phí/giá dịch vụ liên quan đến các hoạt động của Quỹ mà Quỹ thực hiện hoặc gián tiếp hoặc tổng hợp các khoản phí và các chi phí/phí/giá dịch vụ liên quan đến các hoạt động của Quỹ mà Quỹ thực hiện hoặc gián tiếp hoặc tổng hợp các khoản phí và các chi phí/phí/giá dịch vụ liên quan đến các hoạt động của Quỹ mà Quỹ thực hiện hoặc gián tiếp hoặc tổng hợp các khoản phí và các chi phí/phí/giá dịch vụ liên quan đến các hoạt động của Quỹ mà Quỹ thực hiện hoặc gián tiếp hoặc tổng hợp các khoản phí và các chi phí/phí/giá dịch vụ liên quan đến các hoạt động của Quỹ mà Quỹ thực hiện hoặc gián tiếp hoặc tổng hợp các khoản phí và các chi phí/phí/giá dịch vụ liên quan đến các hoạt động của Quỹ']",Đại lý phân phối: Công ty CP Chứng khoán Kỹ thương (TCBS). Đại lý chuyển nhượng: Trung tâm Lưu ký Chứng khoán Việt Nam (VSD).
Trong trường hợp nào việc thực hiện lệnh bán của nhà đầu tư có thể bị thực hiện một phần (prorated)?,"Việc thực hiện lệnh bán của nhà đầu tư có thể bị thực hiện một phần (prorated) trong các trường hợp sau:

*   Khi nhà đầu tư bán chứng chỉ quỹ thuộc các trường hợp thực hiện một phần lệnh bán hoặc tạm dừng lệnh bán theo quy định của Điều Lệ Quỹ.
*   Khi chứng khoán trong danh mục của quỹ không thanh khoản được.","['từ trên 12 tháng trở lên 0,00%  \nGiấy dịch vụ Chuyển Đổi Quỹ sẽ được hạch toán cho Công ty Quản lý Quỹ và Đại Lý Phân Phối căn cứ theo hợp đồng ký giữa Công ty Quản lý Quỹ và Đại Lý Phân Phối.  \nd) Giấy dịch vụ Chuyển Nhượng  \nNhà Đầu tư phải trả một mức phí dịch vụ Chuyển Nhượng duy nhất là 300.000 đồng (ba trăm nghìn đồng) cho mỗi giao dịch chuyển nhượng Đơn vị Quỹ. Giá dịch vụ Chuyển Nhượng do người thực hiện chuyển nhượng thanh toán.  \nGiấy dịch vụ Chuyển nhượng sẽ không áp dụng trong trường hợp Nhà Đầu tư thực hiện chuyển nhượng số Chứng Chỉ quỹ từ tài khoản này sang tài khoản khác cùng tên thì Nhà Đầu tư tại Hai Đại Lý Phân Phối khác nhau.', '**3.6. Rủi ro biến động giá**  \nRủi ro về biến động giá của Quỹ phát sinh khi một hay một số Nhà Đầu tư nắm giữ một số lượng lớn cổ phiếu của Quỹ quyết định thực hiện lệnh bán của các cổ phiếu của Quỹ này. Nắm giữ một số lượng lớn cổ phiếu của Quỹ quyết định bán.  \n**3.7. Rủi ro tái đầu tư**  \nRủi ro tái đầu tư là rủi ro có thể xảy ra khi các khoản đầu tư trái phiếu với dòng tiền lãi trái phiếu nhận được hàng kỳ và gốc trái phiếu nhận được vào thời điểm đáo hạn được đi tìm đầu tư nhận lại. Công ty Quản lý Quỹ quyết định bán các chứng khoán của Quỹ.', 'Quỹ đầu tư chứng khoán được mô tả trong Bản cáo bạch này là Quỹ được thành lập theo\nLuật Chứng khoán số 54/2019/QH14 Quốc hội Nước Cộng Hòa Xã hội Chủ nghĩa Việt\nNam thông qua ngày 26 tháng 11 năm 2019 và các văn bản hướng dẫn thi hành. Bản cáo\nbạch này đã được đăng ký với Ủy ban Chứng khoán Nhà nước ngày / /2022.  \nTHÔNG BÁO QUAN TRỌNG  \nCác nhà đầu tư nên nghiên cứu Bản cáo bạch này một cách cẩn trọng và toàn diện và không nên\ncoi nội dung hoặc tóm tắt ở đây là các tư vấn liên quan đến pháp lý, thuế, hoặc tài chính/đầu\ntư và nên tham khảo ý kiến chuyên gia tư vấn của mình về các yêu cầu pháp lý, thuế, năm\ngiữa, hoặc tư vấn về các khía cạnh khác của việc đầu tư, mua, cho tặng, năm giữ,\nnhượng, chuyển nhượng, hoặc bán một phần hoặc toàn bộ các khoản đầu tư vào Quỹ. Nhà đầu tư', '- Không đầu tư vào quá 10% tổng giá trị chứng chỉ quỹ đang lưu hành của một quỹ đại chúng,\ncổ phiếu công ty quản lý quỹ khác có chứng khoán đại chúng;\n- Không đầu tư quá 20% tổng giá trị tài sản của quỹ vào chứng chỉ quỹ của một quỹ đại\nchúng, cổ phiếu của một công ty đầu tư chứng khoán đại chúng;\n- Không được đầu tư quá 50% tổng giá trị tài sản của quỹ vào các chứng chỉ quỹ đại chúng, cổ\nphiếu công ty đầu tư chứng khoán đại chúng;\nk) Không được đầu tư trực tiếp bất động sản, đã quỹ, kim loại quý hiếm;\n1) Phải có chứng khoán của ít nhất 06 tổ chức phát hành.\n2.2.5 Điều chỉnh danh mục đầu tư\nCơ cấu đầu tư của Quỹ mới chỉ được vược với các hạn chế đầu tư đã quy định tại điểm a,\nb, c, d, e và mục IX.2.2.4 và chỉ do các nguyên nhân sau:', 'cụ nợ của Chính phủ;\nd) Không được đầu tư quá 30% tổng giá trị tài sản của quỹ vào các tài sản quỹ định tại điểm a,\nb, d, e và f mục IX.2.2.3, phải hành bởi các công ty trong cùng một nhóm công ty cơ quan hệ\nsở hữu với nhau, thuộc sở hữu hợp của sau đây: Công ty con, các công ty sở hữu\nhien 35% cổ phần, phần vốn góp của nhau.nhóm công ty con, công ty mẹ. Tổng\nđộ phân đầu tư vào chứng khoán phái sinh tính bằng giá trị cam kết của hợp đồng xác định\ntheo quy định tại Phụ Lục 4 Điều Lệ Quỹ;\ne) Không được đầu tư quá 10% tổng giá trị tài sản của quỹ vào các tài sản quỹ định tại điểm d\nmục IX.2.2.3;\nf) Tổng giá trị các hạng mục đầu tư lớn trong danh mục đầu tư của quỹ không được vượt quá\n40% tổng giá trị tài sản của quỹ. Trong đó, hạng mục đầu tư lớn của quỹ là hạng mục đầu tư', '40% tổng giá trị tài sản của quỹ. Trong đó, hạng mục đầu tư lớn của quỹ là hạng mục đầu tư\nvào các loại tài sản quỹ định tại điểm a, d, và g mục IX.2.2.3 (ngoại trừ chứng chỉ tiền gửi)\nphải hành bởi cùng một tổ chức, có tổng giá trị chiếm từ 5% trở lên tổng giá trị tài sản của\nquỹ;\ng) Tại mọi thời điểm, tổng giá trị cam kết trong các giao dịch chứng khoán phái sinh, dự nợ vay\nvà các khoản phải trả của quỹ không được vượt giá trị tài sản ròng của quỹ;\nh) Không được đầu tư vào chứng khoán của Chính phủ Quỹ;\ni) Chỉ được đầu tư vào chứng chỉ quỹ đại chúng khác, công ty đầu tư chứng khoán đại chúng\ndo công ty quản lý quỹ khác quản lý và bảo đảm các hạn chế sau:\n- Không đầu tư vào quá 10% tổng giá trị chứng chỉ quỹ đang lưu hành của một quỹ đại chúng,', 'phí/phí/giá dịch vụ liên quan đến các hoạt động của Quỹ mà Quỹ thực hiện hoặc gián tiếp hoặc tổng hợp các khoản phí và các chi phí/phí/giá dịch vụ liên quan đến các hoạt động của Quỹ mà Quỹ thực hiện hoặc gián tiếp hoặc tổng hợp các khoản phí và các chi phí/phí/giá dịch vụ liên quan đến các hoạt động của Quỹ mà Quỹ thực hiện hoặc gián tiếp hoặc tổng hợp các khoản phí và các chi phí/phí/giá dịch vụ liên quan đến các hoạt động của Quỹ mà Quỹ thực hiện hoặc gián tiếp hoặc tổng hợp các khoản phí và các chi phí/phí/giá dịch vụ liên quan đến các hoạt động của Quỹ mà Quỹ thực hiện hoặc gián tiếp hoặc tổng hợp các khoản phí và các chi phí/phí/giá dịch vụ liên quan đến các hoạt động của Quỹ mà Quỹ thực hiện hoặc gián tiếp hoặc tổng hợp các khoản phí và các chi phí/phí/giá dịch vụ liên quan đến các', 'Quỹ thực hiện hoặc gián tiếp hoặc tổng hợp các khoản phí và các chi phí/phí/giá dịch vụ liên quan đến các hoạt động của Quỹ mà Quỹ thực hiện hoặc gián tiếp hoặc tổng hợp các khoản phí và các chi phí/phí/giá dịch vụ liên quan đến các hoạt động của Quỹ mà Quỹ thực hiện hoặc gián tiếp hoặc tổng hợp các khoản phí và các chi phí/phí/giá dịch vụ liên quan đến các hoạt động của Quỹ mà Quỹ thực hiện hoặc gián tiếp hoặc tổng hợp các khoản phí và các chi phí/phí/giá dịch vụ liên quan đến các hoạt động của Quỹ mà Quỹ thực hiện hoặc gián tiếp hoặc tổng hợp các khoản phí và các chi phí/phí/giá dịch vụ liên quan đến các hoạt động của Quỹ mà Quỹ thực hiện hoặc gián tiếp hoặc tổng hợp các khoản phí và các chi phí/phí/giá dịch vụ liên quan đến các hoạt động của Quỹ mà Quỹ thực hiện hoặc gián tiếp hoặc', 'chi phí/phí/giá dịch vụ liên quan đến các hoạt động của Quỹ mà Quỹ thực hiện hoặc gián tiếp hoặc tổng hợp các khoản phí và các chi phí/phí/giá dịch vụ liên quan đến các hoạt động của Quỹ mà Quỹ thực hiện hoặc gián tiếp hoặc tổng hợp các khoản phí và các chi phí/phí/giá dịch vụ liên quan đến các hoạt động của Quỹ mà Quỹ thực hiện hoặc gián tiếp hoặc tổng hợp các khoản phí và các chi phí/phí/giá dịch vụ liên quan đến các hoạt động của Quỹ mà Quỹ thực hiện hoặc gián tiếp hoặc tổng hợp các khoản phí và các chi phí/phí/giá dịch vụ liên quan đến các hoạt động của Quỹ mà Quỹ thực hiện hoặc gián tiếp hoặc tổng hợp các khoản phí và các chi phí/phí/giá dịch vụ liên quan đến các hoạt động của Quỹ mà Quỹ thực hiện hoặc gián tiếp hoặc tổng hợp các khoản phí và các chi phí/phí/giá dịch vụ liên quan đến', 'Số: 9176 /QĐ-UBCK\nGiấy phép hành chứng chỉ quỹ ra công chúng\n----------------  \nCăn cứ khoản 2, Điều 46 Pháp lệnh Chứng khoán và Điều 45, 46 Nghị định số\n56/2007/NĐ-CP ngày 09/04/2007 của Chính phủ quy định chi tiết thi hành một số\nđiều của Pháp lệnh Chứng khoán;\nCăn cứ Quyết định số 30/2008/QĐ-BTC ngày 02/06/2008 của Bộ Tài chính về việc\nban hành Quy chế tổ chức và hoạt động của công ty quản lý quỹ, công ty chứng khoán;\nCăn cứ Giấy chứng nhận đăng ký kinh doanh số 0102013096 do Sở Kế hoạch và\nĐầu tư Thành phố Hà Nội cấp ngày 21/10/2008;\nXét đề nghị của Công ty cổ phần Quản lý Quỹ Ký Thương - TechcomCapital;  \nQUỸ ĐẦU TƯ CỔ PHIẾU DOANH NGHIỆP VỪA VÀ NHỎ TECHCOM\n(TCSME)  \nCHÀO BẢN CHỨNG CHỈ QUỸ ĐẦU TƯ CHỨNG KHOÁN RA CÔNG CHỨNG\n(Quỹ chứng khoán doanh nghiệp vừa và nhỏ Techcom)', 'nhượng, chuyển nhượng, hoặc bán một phần hoặc toàn bộ các khoản đầu tư vào Quỹ. Nhà đầu tư\ncó trách nhiệm tự mình thực hiện việc thẩm định và đánh giá mọi rủi ro liên quan đến đầu tư.  \nBản cáo bạch này bao gồm các thông tin về Quỹ, dự kiến các khoản đầu tư của Quỹ, các điều kiện\nvà quy định của Quỹ, hoặc các thông tin khác mà nhà đầu tư cần biết. Nhà đầu tư nên đọc kỹ Bản\ncáo bạch này và các tài liệu đính kèm trước khi ra quyết định đầu tư.\nTCC sẽ cập nhật Bản cáo bạch này nếu có bất kỳ thay đổi nào về thông tin.\nBản cáo bạch được cung cấp miễn phí tại văn phòng của TCC, các Đại lý phân phối và trên trang\nweb của TCC.  \nBản cáo bạch này được phát hành bởi:\nCông ty Cổ phần Quản lý Quỹ Ký Thương - TechcomCapital (“TCC”)', '2.2.4 Hạn mức đầu tư\nHạn mức đầu tư của Quỹ được quy định chi tiết tuân theo các quy định tại Thông tư hướng dẫn\nhoạt động và quản lý các quỹ đầu tư chứng khoán. Co cấu danh mục đầu tư của Quỹ phải đảm\nbảo tuân theo các hạn mức đầu tư sau:\na) Tựa trên tổng giá trị tài khoản thanh toán của Quỹ tại ngân hàng giám sát, quỹ mở được\ncâu đề qua 49% tổng giá trị tài sản của quỹ vào các tài sản theo quy định tại điểm a, b mục\nIX.2.2.3\nb) Không được đầu tư vào chứng khoán của một tổ chức phát hành quá 10% tổng giá trị chứng\nkhoán đang lưu hành của tổ chức đó, trừ công cụ nợ của Chính phủ;\nc) Không được đầu tư quá 20% tổng giá trị tài sản của quỹ vào chứng khoán đang lưu hành và\ncác tài sản (nếu có) quy định tại điểm a, b mục IX.2.2.3 của một tổ chức phát hành, trừ công\ncụ nợ của Chính phủ;', 'gián tiếp hoặc tổng hợp các khoản phí và các chi phí/phí/giá dịch vụ liên quan đến các hoạt động của Quỹ mà Quỹ thực hiện hoặc gián tiếp hoặc tổng hợp các khoản phí và các chi phí/phí/giá dịch vụ liên quan đến các hoạt động của Quỹ mà Quỹ thực hiện hoặc gián tiếp hoặc tổng hợp các khoản phí và các chi phí/phí/giá dịch vụ liên quan đến các hoạt động của Quỹ mà Quỹ thực hiện hoặc gián tiếp hoặc tổng hợp các khoản phí và các chi phí/phí/giá dịch vụ liên quan đến các hoạt động của Quỹ mà Quỹ thực hiện hoặc gián tiếp hoặc tổng hợp các khoản phí và các chi phí/phí/giá dịch vụ liên quan đến các hoạt động của Quỹ mà Quỹ thực hiện hoặc gián tiếp hoặc tổng hợp các khoản phí và các chi phí/phí/giá dịch vụ liên quan đến các hoạt động của Quỹ mà Quỹ thực hiện hoặc gián tiếp hoặc tổng hợp các khoản phí', 'vụ liên quan đến các hoạt động của Quỹ mà Quỹ thực hiện hoặc gián tiếp hoặc tổng hợp các khoản phí và các chi phí/phí/giá dịch vụ liên quan đến các hoạt động của Quỹ mà Quỹ thực hiện hoặc gián tiếp hoặc tổng hợp các khoản phí và các chi phí/phí/giá dịch vụ liên quan đến các hoạt động của Quỹ mà Quỹ thực hiện hoặc gián tiếp hoặc tổng hợp các khoản phí và các chi phí/phí/giá dịch vụ liên quan đến các hoạt động của Quỹ mà Quỹ thực hiện hoặc gián tiếp hoặc tổng hợp các khoản phí và các chi phí/phí/giá dịch vụ liên quan đến các hoạt động của Quỹ mà Quỹ thực hiện hoặc gián tiếp hoặc tổng hợp các khoản phí và các chi phí/phí/giá dịch vụ liên quan đến các hoạt động của Quỹ mà Quỹ thực hiện hoặc gián tiếp hoặc tổng hợp các khoản phí và các chi phí/phí/giá dịch vụ liên quan đến các hoạt động của', 'liên quan đến các hoạt động của Quỹ mà Quỹ thực hiện hoặc gián tiếp hoặc tổng hợp các khoản phí và các chi phí/phí/giá dịch vụ liên quan đến các hoạt động của Quỹ mà Quỹ thực hiện hoặc gián tiếp hoặc tổng hợp các khoản phí và các chi phí/phí/giá dịch vụ liên quan đến các hoạt động của Quỹ mà Quỹ thực hiện hoặc gián tiếp hoặc tổng hợp các khoản phí và các chi phí/phí/giá dịch vụ liên quan đến các hoạt động của Quỹ mà Quỹ thực hiện hoặc gián tiếp hoặc tổng hợp các khoản phí và các chi phí/phí/giá dịch vụ liên quan đến các hoạt động của Quỹ mà Quỹ thực hiện hoặc gián tiếp hoặc tổng hợp các khoản phí và các chi phí/phí/giá dịch vụ liên quan đến', 'hiện hoặc gián tiếp hoặc tổng hợp các khoản phí và các chi phí/phí/giá dịch vụ liên quan đến các hoạt động của Quỹ mà Quỹ thực hiện hoặc gián tiếp hoặc tổng hợp các khoản phí và các chi phí/phí/giá dịch vụ liên quan đến các hoạt động của Quỹ mà Quỹ thực hiện hoặc gián tiếp hoặc tổng hợp các khoản phí và các chi phí/phí/giá dịch vụ liên quan đến các hoạt động của Quỹ mà Quỹ thực hiện hoặc gián tiếp hoặc tổng hợp các khoản phí và các chi phí/phí/giá dịch vụ liên quan đến các hoạt động của Quỹ mà Quỹ thực hiện hoặc gián tiếp hoặc tổng hợp các khoản phí và các chi phí/phí/giá dịch vụ liên quan đến các hoạt động của Quỹ mà Quỹ thực hiện hoặc gián tiếp hoặc tổng hợp các khoản phí và các chi phí/phí/giá dịch vụ liên quan đến các hoạt động của Quỹ mà Quỹ thực hiện hoặc gián tiếp hoặc tổng hợp các', 'tiếp hoặc tổng hợp các khoản phí và các chi phí/phí/giá dịch vụ liên quan đến các hoạt động của Quỹ mà Quỹ thực hiện hoặc gián tiếp hoặc tổng hợp các khoản phí và các chi phí/phí/giá dịch vụ liên quan đến các hoạt động của Quỹ mà Quỹ thực hiện hoặc gián tiếp hoặc tổng hợp các khoản phí và các chi phí/phí/giá dịch vụ liên quan đến các hoạt động của Quỹ mà Quỹ thực hiện hoặc gián tiếp hoặc tổng hợp các khoản phí và các chi phí/phí/giá dịch vụ liên quan đến các hoạt động của Quỹ mà Quỹ thực hiện hoặc gián tiếp hoặc tổng hợp các khoản phí và các chi phí/phí/giá dịch vụ liên quan đến các hoạt động của Quỹ mà Quỹ thực hiện hoặc gián tiếp hoặc tổng hợp các khoản phí và các chi phí/phí/giá dịch vụ liên quan đến các hoạt động của Quỹ mà Quỹ thực hiện hoặc gián tiếp hoặc tổng hợp các khoản phí và', 'tiếp hoặc tổng hợp các khoản phí và các chi phí/phí/giá dịch vụ liên quan đến các hoạt động của Quỹ mà Quỹ thực hiện hoặc gián tiếp hoặc tổng hợp các khoản phí và các chi phí/phí/giá dịch vụ liên quan đến các hoạt động của Quỹ mà Quỹ thực hiện hoặc gián tiếp hoặc tổng hợp các khoản phí và các chi phí/phí/giá dịch vụ liên quan đến các hoạt động của Quỹ mà Quỹ thực hiện hoặc gián tiếp hoặc tổng hợp các khoản phí và các chi phí/phí/giá dịch vụ liên quan đến các hoạt động của Quỹ mà Quỹ thực hiện hoặc gián tiếp hoặc tổng hợp các khoản phí và các chi phí/phí/giá dịch vụ liên quan đến các hoạt động của Quỹ mà Quỹ thực hiện hoặc gián tiếp hoặc tổng hợp các khoản phí và các chi phí/phí/giá dịch vụ liên quan đến các hoạt động của Quỹ mà Quỹ thực hiện hoặc gián tiếp hoặc tổng hợp các khoản phí và', 'tiếp hoặc tổng hợp các khoản phí và các chi phí/phí/giá dịch vụ liên quan đến các hoạt động của Quỹ mà Quỹ thực hiện hoặc gián tiếp hoặc tổng hợp các khoản phí và các chi phí/phí/giá dịch vụ liên quan đến các hoạt động của Quỹ mà Quỹ thực hiện hoặc gián tiếp hoặc tổng hợp các khoản phí và các chi phí/phí/giá dịch vụ liên quan đến các hoạt động của Quỹ mà Quỹ thực hiện hoặc gián tiếp hoặc tổng hợp các khoản phí và các chi phí/phí/giá dịch vụ liên quan đến các hoạt động của Quỹ mà Quỹ thực hiện hoặc gián tiếp hoặc tổng hợp các khoản phí và các chi phí/phí/giá dịch vụ liên quan đến các hoạt động của Quỹ mà Quỹ thực hiện hoặc gián tiếp hoặc tổng hợp các khoản phí và các chi phí/phí/giá dịch vụ liên quan đến các hoạt động của Quỹ mà Quỹ thực hiện hoặc gián tiếp hoặc tổng hợp các khoản phí và', 'tiếp hoặc tổng hợp các khoản phí và các chi phí/phí/giá dịch vụ liên quan đến các hoạt động của Quỹ mà Quỹ thực hiện hoặc gián tiếp hoặc tổng hợp các khoản phí và các chi phí/phí/giá dịch vụ liên quan đến các hoạt động của Quỹ mà Quỹ thực hiện hoặc gián tiếp hoặc tổng hợp các khoản phí và các chi phí/phí/giá dịch vụ liên quan đến các hoạt động của Quỹ mà Quỹ thực hiện hoặc gián tiếp hoặc tổng hợp các khoản phí và các chi phí/phí/giá dịch vụ liên quan đến các hoạt động của Quỹ mà Quỹ thực hiện hoặc gián tiếp hoặc tổng hợp các khoản phí và các chi phí/phí/giá dịch vụ liên quan đến các hoạt động của Quỹ mà Quỹ thực hiện hoặc gián tiếp hoặc tổng hợp các khoản phí và các chi phí/phí/giá dịch vụ liên quan đến các hoạt động của Quỹ mà Quỹ thực hiện hoặc gián tiếp hoặc tổng hợp các khoản phí và', 'tiếp hoặc tổng hợp các khoản phí và các chi phí/phí/giá dịch vụ liên quan đến các hoạt động của Quỹ mà Quỹ thực hiện hoặc gián tiếp hoặc tổng hợp các khoản phí và các chi phí/phí/giá dịch vụ liên quan đến các hoạt động của Quỹ mà Quỹ thực hiện hoặc gián tiếp hoặc tổng hợp các khoản phí và các chi phí/phí/giá dịch vụ liên quan đến các hoạt động của Quỹ mà Quỹ thực hiện hoặc gián tiếp hoặc tổng hợp các khoản phí và các chi phí/phí/giá dịch vụ liên quan đến các hoạt động của Quỹ mà Quỹ thực hiện hoặc gián tiếp hoặc tổng hợp các khoản phí và các chi phí/phí/giá dịch vụ liên quan đến các hoạt động của Quỹ mà Quỹ thực hiện hoặc gián tiếp hoặc tổng hợp các khoản phí và các chi phí/phí/giá dịch vụ liên quan đến các hoạt động của Quỹ mà Quỹ thực hiện hoặc gián tiếp hoặc tổng hợp các khoản phí và', 'tiếp hoặc tổng hợp các khoản phí và các chi phí/phí/giá dịch vụ liên quan đến các hoạt động của Quỹ mà Quỹ thực hiện hoặc gián tiếp hoặc tổng hợp các khoản phí và các chi phí/phí/giá dịch vụ liên quan đến các hoạt động của Quỹ mà Quỹ thực hiện hoặc gián tiếp hoặc tổng hợp các khoản phí và các chi phí/phí/giá dịch vụ liên quan đến các hoạt động của Quỹ mà Quỹ thực hiện hoặc gián tiếp hoặc tổng hợp các khoản phí và các chi phí/phí/giá dịch vụ liên quan đến các hoạt động của Quỹ mà Quỹ thực hiện hoặc gián tiếp hoặc tổng hợp các khoản phí và các chi phí/phí/giá dịch vụ liên quan đến các hoạt động của Quỹ mà Quỹ thực hiện hoặc gián tiếp hoặc tổng hợp các khoản phí và các chi phí/phí/giá dịch vụ liên quan đến các hoạt động của Quỹ mà Quỹ thực hiện hoặc gián tiếp hoặc tổng hợp các khoản phí và', 'tiếp hoặc tổng hợp các khoản phí và các chi phí/phí/giá dịch vụ liên quan đến các hoạt động của Quỹ mà Quỹ thực hiện hoặc gián tiếp hoặc tổng hợp các khoản phí và các chi phí/phí/giá dịch vụ liên quan đến các hoạt động của Quỹ mà Quỹ thực hiện hoặc gián tiếp hoặc tổng hợp các khoản phí và các chi phí/phí/giá dịch vụ liên quan đến các hoạt động của Quỹ mà Quỹ thực hiện hoặc gián tiếp hoặc tổng hợp các khoản phí và các chi phí/phí/giá dịch vụ liên quan đến các hoạt động của Quỹ mà Quỹ thực hiện hoặc gián tiếp hoặc tổng hợp các khoản phí và các chi phí/phí/giá dịch vụ liên quan đến các hoạt động của Quỹ mà Quỹ thực hiện hoặc gián tiếp hoặc tổng hợp các khoản phí và các chi phí/phí/giá dịch vụ liên quan đến các hoạt động của Quỹ mà Quỹ thực hiện hoặc gián tiếp hoặc tổng hợp các khoản phí và', 'tiếp hoặc tổng hợp các khoản phí và các chi phí/phí/giá dịch vụ liên quan đến các hoạt động của Quỹ mà Quỹ thực hiện hoặc gián tiếp hoặc tổng hợp các khoản phí và các chi phí/phí/giá dịch vụ liên quan đến các hoạt động của Quỹ mà Quỹ thực hiện hoặc gián tiếp hoặc tổng hợp các khoản phí và các chi phí/phí/giá dịch vụ liên quan đến các hoạt động của Quỹ mà Quỹ thực hiện hoặc gián tiếp hoặc tổng hợp các khoản phí và các chi phí/phí/giá dịch vụ liên quan đến các hoạt động của Quỹ mà Quỹ thực hiện hoặc gián tiếp hoặc tổng hợp các khoản phí và các chi phí/phí/giá dịch vụ liên quan đến các hoạt động của Quỹ mà Quỹ thực hiện hoặc gián tiếp hoặc tổng hợp các khoản phí và các chi phí/phí/giá dịch vụ liên quan đến các hoạt động của Quỹ mà Quỹ thực hiện hoặc gián tiếp hoặc tổng hợp các khoản phí và', 'tiếp hoặc tổng hợp các khoản phí và các chi phí/phí/giá dịch vụ liên quan đến các hoạt động của Quỹ mà Quỹ thực hiện hoặc gián tiếp hoặc tổng hợp các khoản phí và các chi phí/phí/giá dịch vụ liên quan đến các hoạt động của Quỹ mà Quỹ thực hiện hoặc gián tiếp hoặc tổng hợp các khoản phí và các chi phí/phí/giá dịch vụ liên quan đến các hoạt động của Quỹ mà Quỹ thực hiện hoặc gián tiếp hoặc tổng hợp các khoản phí và các chi phí/phí/giá dịch vụ liên quan đến các hoạt động của Quỹ mà Quỹ thực hiện hoặc gián tiếp hoặc tổng hợp các khoản phí và các chi phí/phí/giá dịch vụ liên quan đến các hoạt động của Quỹ mà Quỹ thực hiện hoặc gián tiếp hoặc tổng hợp các khoản phí và các chi phí/phí/giá dịch vụ liên quan đến các hoạt động của Quỹ mà Quỹ thực hiện hoặc gián tiếp hoặc tổng hợp các khoản phí và']",Khi tổng giá trị lệnh bán ròng > 10% NAV hoặc việc thực hiện lệnh làm NAV Quỹ < 50 tỷ đồng.
Chương trình Đầu tư Định kỳ (SIP) sẽ tự động chấm dứt trong trường hợp nào?,Tôi không tìm thấy thông tin đó trong tài liệu.,"['*   Không có bất kỳ sự bảo đảm nào về số tiền chi trả và giá trị của cổ tức được thanh toán trong tương lai;', 'quỹ (nếu có) so với mọi chỉ phí phát sinh liên quan đến việc điều chỉnh lại danh mục đầu tư.\nTrong thời hạn 05 ngày làm việc kể từ ngày hoãn khẩn tại thời điểm điều chỉnh lại danh mục đầu tư.\nTrong thời hạn 05 ngày làm việc kể từ ngày hoãn khẩn tại thời điểm điều chỉnh lại danh mục đầu tư.\nTrong thời hạn 05 ngày làm việc kể từ ngày hoãn khẩn tại thời điểm điều chỉnh lại danh mục đầu tư.\nTrong thời hạn 05 ngày làm việc kể từ ngày hoãn khẩn tại thời điểm điều chỉnh lại danh mục đầu tư.\nTrong thời hạn 05 ngày làm việc kể từ ngày hoãn khẩn tại thời điểm điều chỉnh lại danh mục đầu tư.\nTrong thời hạn 05 ngày làm việc kể từ ngày hoãn khẩn tại thời điểm điều chỉnh lại danh mục đầu tư.\nTrong thời hạn 05 ngày làm việc kể từ ngày hoãn khẩn tại thời điểm điều chỉnh lại danh mục đầu tư.', 'Số: 9176 /QĐ-UBCK\nGiấy phép hành chứng chỉ quỹ ra công chúng\n----------------  \nCăn cứ khoản 2, Điều 46 Pháp lệnh Chứng khoán và Điều 45, 46 Nghị định số\n56/2007/NĐ-CP ngày 09/04/2007 của Chính phủ quy định chi tiết thi hành một số\nđiều của Pháp lệnh Chứng khoán;\nCăn cứ Quyết định số 30/2008/QĐ-BTC ngày 02/06/2008 của Bộ Tài chính về việc\nban hành Quy chế tổ chức và hoạt động của công ty quản lý quỹ, công ty chứng khoán;\nCăn cứ Giấy chứng nhận đăng ký kinh doanh số 0102013096 do Sở Kế hoạch và\nĐầu tư Thành phố Hà Nội cấp ngày 21/10/2008;\nXét đề nghị của Công ty cổ phần Quản lý Quỹ Ký Thương - TechcomCapital;  \nQUỸ ĐẦU TƯ CỔ PHIẾU DOANH NGHIỆP VỪA VÀ NHỎ TECHCOM\n(TCSME)  \nCHÀO BẢN CHỨNG CHỈ QUỸ ĐẦU TƯ CHỨNG KHOÁN RA CÔNG CHỨNG\n(Quỹ chứng khoán doanh nghiệp vừa và nhỏ Techcom)', 'Trong thời hạn 05 ngày làm việc kể từ ngày hoãn khẩn tại thời điểm điều chỉnh lại danh mục đầu tư.\nTrong thời hạn 05 ngày làm việc kể từ ngày hoãn khẩn tại thời điểm điều chỉnh lại danh mục đầu tư.\nTrong thời hạn 05 ngày làm việc kể từ ngày hoãn khẩn tại thời điểm điều chỉnh lại danh mục đầu tư.\nTrong thời hạn 05 ngày làm', '2.2.4 Hạn mức đầu tư\nHạn mức đầu tư của Quỹ được quy định chi tiết tuân theo các quy định tại Thông tư hướng dẫn\nhoạt động và quản lý các quỹ đầu tư chứng khoán. Co cấu danh mục đầu tư của Quỹ phải đảm\nbảo tuân theo các hạn mức đầu tư sau:\na) Tựa trên tổng giá trị tài khoản thanh toán của Quỹ tại ngân hàng giám sát, quỹ mở được\ncâu đề qua 49% tổng giá trị tài sản của quỹ vào các tài sản theo quy định tại điểm a, b mục\nIX.2.2.3\nb) Không được đầu tư vào chứng khoán của một tổ chức phát hành quá 10% tổng giá trị chứng\nkhoán đang lưu hành của tổ chức đó, trừ công cụ nợ của Chính phủ;\nc) Không được đầu tư quá 20% tổng giá trị tài sản của quỹ vào chứng khoán đang lưu hành và\ncác tài sản (nếu có) quy định tại điểm a, b mục IX.2.2.3 của một tổ chức phát hành, trừ công\ncụ nợ của Chính phủ;', 'Trong thời hạn 05 ngày làm việc kể từ ngày hoãn khẩn tại thời điểm điều chỉnh lại danh mục đầu tư.\nTrong thời hạn 05 ngày làm việc kể từ ngày hoãn khẩn tại thời điểm điều chỉnh lại danh mục đầu tư.\nTrong thời hạn 05 ngày làm việc kể từ ngày hoãn khẩn tại thời điểm điều chỉnh lại danh mục đầu tư.\nTrong thời hạn 05 ngày làm việc kể từ ngày hoãn khẩn tại thời điểm điều chỉnh lại danh mục đầu tư.\nTrong thời hạn 05 ngày làm việc kể từ ngày hoãn khẩn tại thời điểm điều chỉnh lại danh mục đầu tư.\nTrong thời hạn 05 ngày làm việc kể từ ngày hoãn khẩn tại thời điểm điều chỉnh lại danh mục đầu tư.\nTrong thời hạn 05 ngày làm việc kể từ ngày hoãn khẩn tại thời điểm điều chỉnh lại danh mục đầu tư.\nTrong thời hạn 05 ngày làm việc kể từ ngày hoãn khẩn tại thời điểm điều chỉnh lại danh mục đầu tư.', 'Trong thời hạn 05 ngày làm việc kể từ ngày hoãn khẩn tại thời điểm điều chỉnh lại danh mục đầu tư.\nTrong thời hạn 05 ngày làm việc kể từ ngày hoãn khẩn tại thời điểm điều chỉnh lại danh mục đầu tư.\nTrong thời hạn 05 ngày làm việc kể từ ngày hoãn khẩn tại thời điểm điều chỉnh lại danh mục đầu tư.\nTrong thời hạn 05 ngày làm việc kể từ ngày hoãn khẩn tại thời điểm điều chỉnh lại danh mục đầu tư.\nTrong thời hạn 05 ngày làm việc kể từ ngày hoãn khẩn tại thời điểm điều chỉnh lại danh mục đầu tư.\nTrong thời hạn 05 ngày làm việc kể từ ngày hoãn khẩn tại thời điểm điều chỉnh lại danh mục đầu tư.\nTrong thời hạn 05 ngày làm việc kể từ ngày hoãn khẩn tại thời điểm điều chỉnh lại danh mục đầu tư.\nTrong thời hạn 05 ngày làm việc kể từ ngày hoãn khẩn tại thời điểm điều chỉnh lại danh mục đầu tư.', 'Trong thời hạn 05 ngày làm việc kể từ ngày hoãn khẩn tại thời điểm điều chỉnh lại danh mục đầu tư.\nTrong thời hạn 05 ngày làm việc kể từ ngày hoãn khẩn tại thời điểm điều chỉnh lại danh mục đầu tư.\nTrong thời hạn 05 ngày làm việc kể từ ngày hoãn khẩn tại thời điểm điều chỉnh lại danh mục đầu tư.\nTrong thời hạn 05 ngày làm việc kể từ ngày hoãn khẩn tại thời điểm điều chỉnh lại danh mục đầu tư.\nTrong thời hạn 05 ngày làm việc kể từ ngày hoãn khẩn tại thời điểm điều chỉnh lại danh mục đầu tư.\nTrong thời hạn 05 ngày làm việc kể từ ngày hoãn khẩn tại thời điểm điều chỉnh lại danh mục đầu tư.\nTrong thời hạn 05 ngày làm việc kể từ ngày hoãn khẩn tại thời điểm điều chỉnh lại danh mục đầu tư.\nTrong thời hạn 05 ngày làm việc kể từ ngày hoãn khẩn tại thời điểm điều chỉnh lại danh mục đầu tư.', 'Trong thời hạn 05 ngày làm việc kể từ ngày hoãn khẩn tại thời điểm điều chỉnh lại danh mục đầu tư.\nTrong thời hạn 05 ngày làm việc kể từ ngày hoãn khẩn tại thời điểm điều chỉnh lại danh mục đầu tư.\nTrong thời hạn 05 ngày làm việc kể từ ngày hoãn khẩn tại thời điểm điều chỉnh lại danh mục đầu tư.\nTrong thời hạn 05 ngày làm việc kể từ ngày hoãn khẩn tại thời điểm điều chỉnh lại danh mục đầu tư.\nTrong thời hạn 05 ngày làm việc kể từ ngày hoãn khẩn tại thời điểm điều chỉnh lại danh mục đầu tư.\nTrong thời hạn 05 ngày làm việc kể từ ngày hoãn khẩn tại thời điểm điều chỉnh lại danh mục đầu tư.\nTrong thời hạn 05 ngày làm việc kể từ ngày hoãn khẩn tại thời điểm điều chỉnh lại danh mục đầu tư.\nTrong thời hạn 05 ngày làm việc kể từ ngày hoãn khẩn tại thời điểm điều chỉnh lại danh mục đầu tư.', 'Trong thời hạn 05 ngày làm việc kể từ ngày hoãn khẩn tại thời điểm điều chỉnh lại danh mục đầu tư.\nTrong thời hạn 05 ngày làm việc kể từ ngày hoãn khẩn tại thời điểm điều chỉnh lại danh mục đầu tư.\nTrong thời hạn 05 ngày làm việc kể từ ngày hoãn khẩn tại thời điểm điều chỉnh lại danh mục đầu tư.\nTrong thời hạn 05 ngày làm việc kể từ ngày hoãn khẩn tại thời điểm điều chỉnh lại danh mục đầu tư.\nTrong thời hạn 05 ngày làm việc kể từ ngày hoãn khẩn tại thời điểm điều chỉnh lại danh mục đầu tư.\nTrong thời hạn 05 ngày làm việc kể từ ngày hoãn khẩn tại thời điểm điều chỉnh lại danh mục đầu tư.\nTrong thời hạn 05 ngày làm việc kể từ ngày hoãn khẩn tại thời điểm điều chỉnh lại danh mục đầu tư.\nTrong thời hạn 05 ngày làm việc kể từ ngày hoãn khẩn tại thời điểm điều chỉnh lại danh mục đầu tư.', 'Trong thời hạn 05 ngày làm việc kể từ ngày hoãn khẩn tại thời điểm điều chỉnh lại danh mục đầu tư.\nTrong thời hạn 05 ngày làm việc kể từ ngày hoãn khẩn tại thời điểm điều chỉnh lại danh mục đầu tư.\nTrong thời hạn 05 ngày làm việc kể từ ngày hoãn khẩn tại thời điểm điều chỉnh lại danh mục đầu tư.\nTrong thời hạn 05 ngày làm việc kể từ ngày hoãn khẩn tại thời điểm điều chỉnh lại danh mục đầu tư.\nTrong thời hạn 05 ngày làm việc kể từ ngày hoãn khẩn tại thời điểm điều chỉnh lại danh mục đầu tư.\nTrong thời hạn 05 ngày làm việc kể từ ngày hoãn khẩn tại thời điểm điều chỉnh lại danh mục đầu tư.\nTrong thời hạn 05 ngày làm việc kể từ ngày hoãn khẩn tại thời điểm điều chỉnh lại danh mục đầu tư.\nTrong thời hạn 05 ngày làm việc kể từ ngày hoãn khẩn tại thời điểm điều chỉnh lại danh mục đầu tư.', 'Trong thời hạn 05 ngày làm việc kể từ ngày hoãn khẩn tại thời điểm điều chỉnh lại danh mục đầu tư.\nTrong thời hạn 05 ngày làm việc kể từ ngày hoãn khẩn tại thời điểm điều chỉnh lại danh mục đầu tư.\nTrong thời hạn 05 ngày làm việc kể từ ngày hoãn khẩn tại thời điểm điều chỉnh lại danh mục đầu tư.\nTrong thời hạn 05 ngày làm việc kể từ ngày hoãn khẩn tại thời điểm điều chỉnh lại danh mục đầu tư.\nTrong thời hạn 05 ngày làm việc kể từ ngày hoãn khẩn tại thời điểm điều chỉnh lại danh mục đầu tư.\nTrong thời hạn 05 ngày làm việc kể từ ngày hoãn khẩn tại thời điểm điều chỉnh lại danh mục đầu tư.\nTrong thời hạn 05 ngày làm việc kể từ ngày hoãn khẩn tại thời điểm điều chỉnh lại danh mục đầu tư.\nTrong thời hạn 05 ngày làm việc kể từ ngày hoãn khẩn tại thời điểm điều chỉnh lại danh mục đầu tư.', 'Trong thời hạn 05 ngày làm việc kể từ ngày hoãn khẩn tại thời điểm điều chỉnh lại danh mục đầu tư.\nTrong thời hạn 05 ngày làm việc kể từ ngày hoãn khẩn tại thời điểm điều chỉnh lại danh mục đầu tư.\nTrong thời hạn 05 ngày làm việc kể từ ngày hoãn khẩn tại thời điểm điều chỉnh lại danh mục đầu tư.\nTrong thời hạn 05 ngày làm việc kể từ ngày hoãn khẩn tại thời điểm điều chỉnh lại danh mục đầu tư.\nTrong thời hạn 05 ngày làm việc kể từ ngày hoãn khẩn tại thời điểm điều chỉnh lại danh mục đầu tư.\nTrong thời hạn 05 ngày làm việc kể từ ngày hoãn khẩn tại thời điểm điều chỉnh lại danh mục đầu tư.\nTrong thời hạn 05 ngày làm việc kể từ ngày hoãn khẩn tại thời điểm điều chỉnh lại danh mục đầu tư.\nTrong thời hạn 05 ngày làm việc kể từ ngày hoãn khẩn tại thời điểm điều chỉnh lại danh mục đầu tư.', 'Trong thời hạn 05 ngày làm việc kể từ ngày hoãn khẩn tại thời điểm điều chỉnh lại danh mục đầu tư.\nTrong thời hạn 05 ngày làm việc kể từ ngày hoãn khẩn tại thời điểm điều chỉnh lại danh mục đầu tư.\nTrong thời hạn 05 ngày làm việc kể từ ngày hoãn khẩn tại thời điểm điều chỉnh lại danh mục đầu tư.\nTrong thời hạn 05 ngày làm việc kể từ ngày hoãn khẩn tại thời điểm điều chỉnh lại danh mục đầu tư.\nTrong thời hạn 05 ngày làm việc kể từ ngày hoãn khẩn tại thời điểm điều chỉnh lại danh mục đầu tư.\nTrong thời hạn 05 ngày làm việc kể từ ngày hoãn khẩn tại thời điểm điều chỉnh lại danh mục đầu tư.\nTrong thời hạn 05 ngày làm việc kể từ ngày hoãn khẩn tại thời điểm điều chỉnh lại danh mục đầu tư.\nTrong thời hạn 05 ngày làm việc kể từ ngày hoãn khẩn tại thời điểm điều chỉnh lại danh mục đầu tư.', 'Trong thời hạn 05 ngày làm việc kể từ ngày hoãn khẩn tại thời điểm điều chỉnh lại danh mục đầu tư.\nTrong thời hạn 05 ngày làm việc kể từ ngày hoãn khẩn tại thời điểm điều chỉnh lại danh mục đầu tư.\nTrong thời hạn 05 ngày làm việc kể từ ngày hoãn khẩn tại thời điểm điều chỉnh lại danh mục đầu tư.\nTrong thời hạn 05 ngày làm việc kể từ ngày hoãn khẩn tại thời điểm điều chỉnh lại danh mục đầu tư.\nTrong thời hạn 05 ngày làm việc kể từ ngày hoãn khẩn tại thời điểm điều chỉnh lại danh mục đầu tư.\nTrong thời hạn 05 ngày làm việc kể từ ngày hoãn khẩn tại thời điểm điều chỉnh lại danh mục đầu tư.\nTrong thời hạn 05 ngày làm việc kể từ ngày hoãn khẩn tại thời điểm điều chỉnh lại danh mục đầu tư.\nTrong thời hạn 05 ngày làm việc kể từ ngày hoãn khẩn tại thời điểm điều chỉnh lại danh mục đầu tư.', 'Trong thời hạn 05 ngày làm việc kể từ ngày hoãn khẩn tại thời điểm điều chỉnh lại danh mục đầu tư.\nTrong thời hạn 05 ngày làm việc kể từ ngày hoãn khẩn tại thời điểm điều chỉnh lại danh mục đầu tư.\nTrong thời hạn 05 ngày làm việc kể từ ngày hoãn khẩn tại thời điểm điều chỉnh lại danh mục đầu tư.\nTrong thời hạn 05 ngày làm việc kể từ ngày hoãn khẩn tại thời điểm điều chỉnh lại danh mục đầu tư.\nTrong thời hạn 05 ngày làm việc kể từ ngày hoãn khẩn tại thời điểm điều chỉnh lại danh mục đầu tư.\nTrong thời hạn 05 ngày làm việc kể từ ngày hoãn khẩn tại thời điểm điều chỉnh lại danh mục đầu tư.\nTrong thời hạn 05 ngày làm việc kể từ ngày hoãn khẩn tại thời điểm điều chỉnh lại danh mục đầu tư.\nTrong thời hạn 05 ngày làm việc kể từ ngày hoãn khẩn tại thời điểm điều chỉnh lại danh mục đầu tư.', 'Trong thời hạn 05 ngày làm việc kể từ ngày hoãn khẩn tại thời điểm điều chỉnh lại danh mục đầu tư.\nTrong thời hạn 05 ngày làm việc kể từ ngày hoãn khẩn tại thời điểm điều chỉnh lại danh mục đầu tư.\nTrong thời hạn 05 ngày làm việc kể từ ngày hoãn khẩn tại thời điểm điều chỉnh lại danh mục đầu tư.\nTrong thời hạn 05 ngày làm việc kể từ ngày hoãn khẩn tại thời điểm điều chỉnh lại danh mục đầu tư.\nTrong thời hạn 05 ngày làm việc kể từ ngày hoãn khẩn tại thời điểm điều chỉnh lại danh mục đầu tư.\nTrong thời hạn 05 ngày làm việc kể từ ngày hoãn khẩn tại thời điểm điều chỉnh lại danh mục đầu tư.\nTrong thời hạn 05 ngày làm việc kể từ ngày hoãn khẩn tại thời điểm điều chỉnh lại danh mục đầu tư.\nTrong thời hạn 05 ngày làm việc kể từ ngày hoãn khẩn tại thời điểm điều chỉnh lại danh mục đầu tư.', 'Trong thời hạn 05 ngày làm việc kể từ ngày hoãn khẩn tại thời điểm điều chỉnh lại danh mục đầu tư.\nTrong thời hạn 05 ngày làm việc kể từ ngày hoãn khẩn tại thời điểm điều chỉnh lại danh mục đầu tư.\nTrong thời hạn 05 ngày làm việc kể từ ngày hoãn khẩn tại thời điểm điều chỉnh lại danh mục đầu tư.\nTrong thời hạn 05 ngày làm việc kể từ ngày hoãn khẩn tại thời điểm điều chỉnh lại danh mục đầu tư.\nTrong thời hạn 05 ngày làm việc kể từ ngày hoãn khẩn tại thời điểm điều chỉnh lại danh mục đầu tư.\nTrong thời hạn 05 ngày làm việc kể từ ngày hoãn khẩn tại thời điểm điều chỉnh lại danh mục đầu tư.\nTrong thời hạn 05 ngày làm việc kể từ ngày hoãn khẩn tại thời điểm điều chỉnh lại danh mục đầu tư.\nTrong thời hạn 05 ngày làm việc kể từ ngày hoãn khẩn tại thời điểm điều chỉnh lại danh mục đầu tư.', 'Trong thời hạn 05 ngày làm việc kể từ ngày hoãn khẩn tại thời điểm điều chỉnh lại danh mục đầu tư.\nTrong thời hạn 05 ngày làm việc kể từ ngày hoãn khẩn tại thời điểm điều chỉnh lại danh mục đầu tư.\nTrong thời hạn 05 ngày làm việc kể từ ngày hoãn khẩn tại thời điểm điều chỉnh lại danh mục đầu tư.\nTrong thời hạn 05 ngày làm việc kể từ ngày hoãn khẩn tại thời điểm điều chỉnh lại danh mục đầu tư.\nTrong thời hạn 05 ngày làm việc kể từ ngày hoãn khẩn tại thời điểm điều chỉnh lại danh mục đầu tư.\nTrong thời hạn 05 ngày làm việc kể từ ngày hoãn khẩn tại thời điểm điều chỉnh lại danh mục đầu tư.\nTrong thời hạn 05 ngày làm việc kể từ ngày hoãn khẩn tại thời điểm điều chỉnh lại danh mục đầu tư.\nTrong thời hạn 05 ngày làm việc kể từ ngày hoãn khẩn tại thời điểm điều chỉnh lại danh mục đầu tư.', 'Trong thời hạn 05 ngày làm việc kể từ ngày hoãn khẩn tại thời điểm điều chỉnh lại danh mục đầu tư.\nTrong thời hạn 05 ngày làm việc kể từ ngày hoãn khẩn tại thời điểm điều chỉnh lại danh mục đầu tư.\nTrong thời hạn 05 ngày làm việc kể từ ngày hoãn khẩn tại thời điểm điều chỉnh lại danh mục đầu tư.\nTrong thời hạn 05 ngày làm việc kể từ ngày hoãn khẩn tại thời điểm điều chỉnh lại danh mục đầu tư.\nTrong thời hạn 05 ngày làm việc kể từ ngày hoãn khẩn tại thời điểm điều chỉnh lại danh mục đầu tư.\nTrong thời hạn 05 ngày làm việc kể từ ngày hoãn khẩn tại thời điểm điều chỉnh lại danh mục đầu tư.\nTrong thời hạn 05 ngày làm việc kể từ ngày hoãn khẩn tại thời điểm điều chỉnh lại danh mục đầu tư.\nTrong thời hạn 05 ngày làm việc kể từ ngày hoãn khẩn tại thời điểm điều chỉnh lại danh mục đầu tư.', 'Trong thời hạn 05 ngày làm việc kể từ ngày hoãn khẩn tại thời điểm điều chỉnh lại danh mục đầu tư.\nTrong thời hạn 05 ngày làm việc kể từ ngày hoãn khẩn tại thời điểm điều chỉnh lại danh mục đầu tư.\nTrong thời hạn 05 ngày làm việc kể từ ngày hoãn khẩn tại thời điểm điều chỉnh lại danh mục đầu tư.\nTrong thời hạn 05 ngày làm việc kể từ ngày hoãn khẩn tại thời điểm điều chỉnh lại danh mục đầu tư.\nTrong thời hạn 05 ngày làm việc kể từ ngày hoãn khẩn tại thời điểm điều chỉnh lại danh mục đầu tư.\nTrong thời hạn 05 ngày làm việc kể từ ngày hoãn khẩn tại thời điểm điều chỉnh lại danh mục đầu tư.\nTrong thời hạn 05 ngày làm việc kể từ ngày hoãn khẩn tại thời điểm điều chỉnh lại danh mục đầu tư.\nTrong thời hạn 05 ngày làm việc kể từ ngày hoãn khẩn tại thời điểm điều chỉnh lại danh mục đầu tư.', 'Trong thời hạn 05 ngày làm việc kể từ ngày hoãn khẩn tại thời điểm điều chỉnh lại danh mục đầu tư.\nTrong thời hạn 05 ngày làm việc kể từ ngày hoãn khẩn tại thời điểm điều chỉnh lại danh mục đầu tư.\nTrong thời hạn 05 ngày làm việc kể từ ngày hoãn khẩn tại thời điểm điều chỉnh lại danh mục đầu tư.\nTrong thời hạn 05 ngày làm việc kể từ ngày hoãn khẩn tại thời điểm điều chỉnh lại danh mục đầu tư.\nTrong thời hạn 05 ngày làm việc kể từ ngày hoãn khẩn tại thời điểm điều chỉnh lại danh mục đầu tư.\nTrong thời hạn 05 ngày làm việc kể từ ngày hoãn khẩn tại thời điểm điều chỉnh lại danh mục đầu tư.\nTrong thời hạn 05 ngày làm việc kể từ ngày hoãn khẩn tại thời điểm điều chỉnh lại danh mục đầu tư.\nTrong thời hạn 05 ngày làm việc kể từ ngày hoãn khẩn tại thời điểm điều chỉnh lại danh mục đầu tư.', 'Trong thời hạn 05 ngày làm việc kể từ ngày hoãn khẩn tại thời điểm điều chỉnh lại danh mục đầu tư.\nTrong thời hạn 05 ngày làm việc kể từ ngày hoãn khẩn tại thời điểm điều chỉnh lại danh mục đầu tư.\nTrong thời hạn 05 ngày làm việc kể từ ngày hoãn khẩn tại thời điểm điều chỉnh lại danh mục đầu tư.\nTrong thời hạn 05 ngày làm việc kể từ ngày hoãn khẩn tại thời điểm điều chỉnh lại danh mục đầu tư.\nTrong thời hạn 05 ngày làm việc kể từ ngày hoãn khẩn tại thời điểm điều chỉnh lại danh mục đầu tư.\nTrong thời hạn 05 ngày làm việc kể từ ngày hoãn khẩn tại thời điểm điều chỉnh lại danh mục đầu tư.\nTrong thời hạn 05 ngày làm việc kể từ ngày hoãn khẩn tại thời điểm điều chỉnh lại danh mục đầu tư.\nTrong thời hạn 05 ngày làm việc kể từ ngày hoãn khẩn tại thời điểm điều chỉnh lại danh mục đầu tư.', 'Trong thời hạn 05 ngày làm việc kể từ ngày hoãn khẩn tại thời điểm điều chỉnh lại danh mục đầu tư.\nTrong thời hạn 05 ngày làm việc kể từ ngày hoãn khẩn tại thời điểm điều chỉnh lại danh mục đầu tư.\nTrong thời hạn 05 ngày làm việc kể từ ngày hoãn khẩn tại thời điểm điều chỉnh lại danh mục đầu tư.\nTrong thời hạn 05 ngày làm việc kể từ ngày hoãn khẩn tại thời điểm điều chỉnh lại danh mục đầu tư.\nTrong thời hạn 05 ngày làm việc kể từ ngày hoãn khẩn tại thời điểm điều chỉnh lại danh mục đầu tư.\nTrong thời hạn 05 ngày làm việc kể từ ngày hoãn khẩn tại thời điểm điều chỉnh lại danh mục đầu tư.\nTrong thời hạn 05 ngày làm việc kể từ ngày hoãn khẩn tại thời điểm điều chỉnh lại danh mục đầu tư.\nTrong thời hạn 05 ngày làm việc kể từ ngày hoãn khẩn tại thời điểm điều chỉnh lại danh mục đầu tư.', 'Trong thời hạn 05 ngày làm việc kể từ ngày hoãn khẩn tại thời điểm điều chỉnh lại danh mục đầu tư.\nTrong thời hạn 05 ngày làm việc kể từ ngày hoãn khẩn tại thời điểm điều chỉnh lại danh mục đầu tư.\nTrong thời hạn 05 ngày làm việc kể từ ngày hoãn khẩn tại thời điểm điều chỉnh lại danh mục đầu tư.\nTrong thời hạn 05 ngày làm việc kể từ ngày hoãn khẩn tại thời điểm điều chỉnh lại danh mục đầu tư.\nTrong thời hạn 05 ngày làm việc kể từ ngày hoãn khẩn tại thời điểm điều chỉnh lại danh mục đầu tư.\nTrong thời hạn 05 ngày làm việc kể từ ngày hoãn khẩn tại thời điểm điều chỉnh lại danh mục đầu tư.\nTrong thời hạn 05 ngày làm việc kể từ ngày hoãn khẩn tại thời điểm điều chỉnh lại danh mục đầu tư.\nTrong thời hạn 05 ngày làm việc kể từ ngày hoãn khẩn tại thời điểm điều chỉnh lại danh mục đầu tư.']",Khi Nhà Đầu Tư thông báo dừng hoặc không nộp tiền/không nộp đủ tiền mua trong 05 kỳ liên tiếp.
Rủi ro tái đầu tư (Reinvestment risk) được mô tả như thế nào trong Bản cáo bạch?,"Rủi ro tái đầu tư xảy ra khi các khoản đầu tư trái phiếu, với dòng tiền lãi nhận được định kỳ và gốc trái phiếu nhận được khi đáo hạn, được tìm kiếm để tái đầu tư. Công ty Quản lý Quỹ quyết định bán các chứng khoán của Quỹ.","['**3.6. Rủi ro biến động giá**  \nRủi ro về biến động giá của Quỹ phát sinh khi một hay một số Nhà Đầu tư nắm giữ một số lượng lớn cổ phiếu của Quỹ quyết định thực hiện lệnh bán của các cổ phiếu của Quỹ này. Nắm giữ một số lượng lớn cổ phiếu của Quỹ quyết định bán.  \n**3.7. Rủi ro tái đầu tư**  \nRủi ro tái đầu tư là rủi ro có thể xảy ra khi các khoản đầu tư trái phiếu với dòng tiền lãi trái phiếu nhận được hàng kỳ và gốc trái phiếu nhận được vào thời điểm đáo hạn được đi tìm đầu tư nhận lại. Công ty Quản lý Quỹ quyết định bán các chứng khoán của Quỹ.', '2.2.4 Hạn mức đầu tư\nHạn mức đầu tư của Quỹ được quy định chi tiết tuân theo các quy định tại Thông tư hướng dẫn\nhoạt động và quản lý các quỹ đầu tư chứng khoán. Co cấu danh mục đầu tư của Quỹ phải đảm\nbảo tuân theo các hạn mức đầu tư sau:\na) Tựa trên tổng giá trị tài khoản thanh toán của Quỹ tại ngân hàng giám sát, quỹ mở được\ncâu đề qua 49% tổng giá trị tài sản của quỹ vào các tài sản theo quy định tại điểm a, b mục\nIX.2.2.3\nb) Không được đầu tư vào chứng khoán của một tổ chức phát hành quá 10% tổng giá trị chứng\nkhoán đang lưu hành của tổ chức đó, trừ công cụ nợ của Chính phủ;\nc) Không được đầu tư quá 20% tổng giá trị tài sản của quỹ vào chứng khoán đang lưu hành và\ncác tài sản (nếu có) quy định tại điểm a, b mục IX.2.2.3 của một tổ chức phát hành, trừ công\ncụ nợ của Chính phủ;', 'Số: 9176 /QĐ-UBCK\nGiấy phép hành chứng chỉ quỹ ra công chúng\n----------------  \nCăn cứ khoản 2, Điều 46 Pháp lệnh Chứng khoán và Điều 45, 46 Nghị định số\n56/2007/NĐ-CP ngày 09/04/2007 của Chính phủ quy định chi tiết thi hành một số\nđiều của Pháp lệnh Chứng khoán;\nCăn cứ Quyết định số 30/2008/QĐ-BTC ngày 02/06/2008 của Bộ Tài chính về việc\nban hành Quy chế tổ chức và hoạt động của công ty quản lý quỹ, công ty chứng khoán;\nCăn cứ Giấy chứng nhận đăng ký kinh doanh số 0102013096 do Sở Kế hoạch và\nĐầu tư Thành phố Hà Nội cấp ngày 21/10/2008;\nXét đề nghị của Công ty cổ phần Quản lý Quỹ Ký Thương - TechcomCapital;  \nQUỸ ĐẦU TƯ CỔ PHIẾU DOANH NGHIỆP VỪA VÀ NHỎ TECHCOM\n(TCSME)  \nCHÀO BẢN CHỨNG CHỈ QUỸ ĐẦU TƯ CHỨNG KHOÁN RA CÔNG CHỨNG\n(Quỹ chứng khoán doanh nghiệp vừa và nhỏ Techcom)', '**3.2.Rủi ro lạm phát**  \nGiá trị thị trường tỷ lệ nghịch với lạm phát. Vì dụ trong môi trường lạm phát tăng, sức mua hay giá trị thực của các đồng tiền trong tương lai (menh giá và lãi trái phiếu nhận được hàng kỳ) sẽ giảm. Khi đó lợi suất của Quỹ trái phiếu tăng lên dẫn đến giá trị trái phiếu ròng. Rủi ro lạm phát giới hạn mức tăng trưởng của trái phiếu. Điều này thường biểu hiện cách rủi ro tài sản tài sản, trái phiếu hoặc chứng khoán nhận được hàng kỳ có thể bị ảnh hưởng bởi lạm phát.\n**3.3.Rủi ro tỷ giá**', '**3.3.Rủi ro tỷ giá**  \nDo tài sản và nợ phải trả của Quỹ đều được trình bày bằng đồng Việt Nam, là đơn vị tiền tệ sử dụng của Quỹ. Mặc dù rủi ro tỷ giá trong tương lai hạn chế ảnh hưởng từ đồng tiền nước ngoài, thì tính chất của từng sản phẩm tài chính được trình bày trên Bảng Cân Đối Kế Toán của Quỹ. Do đó, giá trị thị trường của từng khoản đầu tư có thể bị ảnh hưởng bởi tỷ giá hối đoái.', '*   9 năm kinh nghiệm với vai trò giám đốc kiểm toán tại Công ty TNHH KPMG Việt Nam.\n*   Hiện là Giám đốc tài chính (CFO) tại Công ty CP Đầu Tư Thương Mại Quốc Tế Matrrot Dd.  \nCác quy định về tiêu chuẩn lựa chọn thành viên Ban đại diện Quỹ, quyền hạn và nhiệm vụ của Ban đại diện Quỹ, chủ tịch Ban đại diện Quỹ, đinh chỉ hoạc bãi miễn thành viên Ban đại diện Quỹ, cuộc họp của Ban đại diện Quỹ tuân theo quy định tại chương V Điều Lệ Quỹ.  \n**2.10. Quyền hạn và trách nhiệm của Công ty Quản lý Quỹ**\nCông ty Quản lý Quỹ được lựa chọn phải thỏa mãn các điều kiện sau:  \n*   Được thực hiện nghiệp vụ quản lý Quỹ;\n*   Hoàn toàn độc lập với Ngân hàng Giám sát;\n*   Có đầy đủ cơ sở vật chất, nhân sự để Quản lý Quỹ mở;', '40% tổng giá trị tài sản của quỹ. Trong đó, hạng mục đầu tư lớn của quỹ là hạng mục đầu tư\nvào các loại tài sản quỹ định tại điểm a, d, và g mục IX.2.2.3 (ngoại trừ chứng chỉ tiền gửi)\nphải hành bởi cùng một tổ chức, có tổng giá trị chiếm từ 5% trở lên tổng giá trị tài sản của\nquỹ;\ng) Tại mọi thời điểm, tổng giá trị cam kết trong các giao dịch chứng khoán phái sinh, dự nợ vay\nvà các khoản phải trả của quỹ không được vượt giá trị tài sản ròng của quỹ;\nh) Không được đầu tư vào chứng khoán của Chính phủ Quỹ;\ni) Chỉ được đầu tư vào chứng chỉ quỹ đại chúng khác, công ty đầu tư chứng khoán đại chúng\ndo công ty quản lý quỹ khác quản lý và bảo đảm các hạn chế sau:\n- Không đầu tư vào quá 10% tổng giá trị chứng chỉ quỹ đang lưu hành của một quỹ đại chúng,', 'cụ nợ của Chính phủ;\nd) Không được đầu tư quá 30% tổng giá trị tài sản của quỹ vào các tài sản quỹ định tại điểm a,\nb, d, e và f mục IX.2.2.3, phải hành bởi các công ty trong cùng một nhóm công ty cơ quan hệ\nsở hữu với nhau, thuộc sở hữu hợp của sau đây: Công ty con, các công ty sở hữu\nhien 35% cổ phần, phần vốn góp của nhau.nhóm công ty con, công ty mẹ. Tổng\nđộ phân đầu tư vào chứng khoán phái sinh tính bằng giá trị cam kết của hợp đồng xác định\ntheo quy định tại Phụ Lục 4 Điều Lệ Quỹ;\ne) Không được đầu tư quá 10% tổng giá trị tài sản của quỹ vào các tài sản quỹ định tại điểm d\nmục IX.2.2.3;\nf) Tổng giá trị các hạng mục đầu tư lớn trong danh mục đầu tư của quỹ không được vượt quá\n40% tổng giá trị tài sản của quỹ. Trong đó, hạng mục đầu tư lớn của quỹ là hạng mục đầu tư', 'từ trên 12 tháng trở lên 0,00%  \nGiấy dịch vụ Chuyển Đổi Quỹ sẽ được hạch toán cho Công ty Quản lý Quỹ và Đại Lý Phân Phối căn cứ theo hợp đồng ký giữa Công ty Quản lý Quỹ và Đại Lý Phân Phối.  \nd) Giấy dịch vụ Chuyển Nhượng  \nNhà Đầu tư phải trả một mức phí dịch vụ Chuyển Nhượng duy nhất là 300.000 đồng (ba trăm nghìn đồng) cho mỗi giao dịch chuyển nhượng Đơn vị Quỹ. Giá dịch vụ Chuyển Nhượng do người thực hiện chuyển nhượng thanh toán.  \nGiấy dịch vụ Chuyển nhượng sẽ không áp dụng trong trường hợp Nhà Đầu tư thực hiện chuyển nhượng số Chứng Chỉ quỹ từ tài khoản này sang tài khoản khác cùng tên thì Nhà Đầu tư tại Hai Đại Lý Phân Phối khác nhau.', '**3.8. Rủi ro khối lượng**  \nRủi ro khối lượng là rủi ro có thể phát sinh khi thực hiện các lệnh mua, bán của Quỹ hoặc các khoản đầu tư của Quỹ mà các lệnh mua bán này bị hạn chế về số lượng, hoặc chỉ có thể thực hiện được một số lượng giới hạn.\nCông ty Quản lý Quỹ có thể có một số lượng lớn cổ phiếu trong danh mục đầu tư của Quỹ có thể bị ảnh hưởng bởi rủi ro khối lượng.  \n**3.9. Rủi ro bất khả kháng**  \nRủi ro này là những sự kiện bất thường có tính chất ảnh hưởng đến khả năng hoạt động của Quỹ.', 'Là rủi ro mà hợp lý của các dòng tiền trong tương lai của chứng khoán có thu nhập cố định bị biến động do những thay đổi của lãi suất thị trường, dẫn tới giá trị thị trường của chứng khoán thay đổi. Thông thường, giá trị thị trường của trái phiếu và các chứng khoán có thu nhập cố định biến động ngược chiều với lãi suất. Quỹ có thể giảm thiểu rủi ro lãi suất bằng cách giữ các trái phiếu phù hợp với thời hạn của lãi suất. Công ty Quản lý Quỹ sẽ cố gắng giảm thiểu rủi ro lãi suất bằng cách lựa chọn các chứng khoán có lãi suất phù hợp với thời hạn của lãi suất.  \n**3.8. Rủi ro khối lượng**', '*   Kết quả hoạt động trong quá khứ của các Quỹ không có nghĩa là kết quả hoạt động trong tương lai.\n*   Tên của Quỹ không hàm ý về chất lượng hoạt động cũng như những lợi và lợi nhuận của Quỹ trong tương lai;\n*   Công ty Quản lý Quỹ không chịu trách nhiệm pháp lý về những rủi ro từ đầu tư của các chủ nợ, thành viên Hội đồng thành viên, Ban điều hành và nhân viên của Công ty Quản lý Quỹ không có trách nhiệm pháp lý về các rủi ro hoạt động của Công ty Quản lý Quỹ.\n*   Giống như các hình thức đầu tư khác, Quỹ, rủi ro thanh khoản sẽ được phân bổ trên cơ sở số ngày gần nhất với giá trị tài sản ròng. Các khoản đầu tư khác có thể có nhiều rủi ro hơn so với thời điểm hiện tại. Nhà Đầu tư cần phải nhận thức được khả năng chấp nhận rủi ro từ vơi rủi ro đầu tư mà Quỹ có thể gặp phải trong tương lai.', '*   Không có bất kỳ sự bảo đảm nào về số tiền chi trả và giá trị của cổ tức được thanh toán trong tương lai;', 'Việc bảo vệ Nhà Đầu tư nước ngoài không bị rủi ro này nằm ngoài khả năng của Quỹ và vì vậy, các Nhà Đầu tư nước ngoài, nếu cần thiết, cần phải tìm kiếm các công ty tư vấn phù hợp cho các nhà đầu tư của mình.  \n**3.5. Rủi ro thanh khoản**  \nRủi ro thanh khoản là rủi mà nhà đầu tư không bán được chứng chỉ quỹ vào ngày giao dịch chứng chỉ quỹ. Các chứng khoán thuộc danh mục đầu tư của Quỹ không thành khoản, hoặc đầu tư của Quỹ vào các chứng khoán có thanh khoản thấp.\nTrong đó, các chứng khoán trong danh mục đầu tư của Quỹ có thể được giao dịch trên thị trường chứng khoán, được thanh toán theo quy định của Điều Lệ Quỹ.  \n**3.6. Rủi ro biến động giá**', 'nhượng, chuyển nhượng, hoặc bán một phần hoặc toàn bộ các khoản đầu tư vào Quỹ. Nhà đầu tư\ncó trách nhiệm tự mình thực hiện việc thẩm định và đánh giá mọi rủi ro liên quan đến đầu tư.  \nBản cáo bạch này bao gồm các thông tin về Quỹ, dự kiến các khoản đầu tư của Quỹ, các điều kiện\nvà quy định của Quỹ, hoặc các thông tin khác mà nhà đầu tư cần biết. Nhà đầu tư nên đọc kỹ Bản\ncáo bạch này và các tài liệu đính kèm trước khi ra quyết định đầu tư.\nTCC sẽ cập nhật Bản cáo bạch này nếu có bất kỳ thay đổi nào về thông tin.\nBản cáo bạch được cung cấp miễn phí tại văn phòng của TCC, các Đại lý phân phối và trên trang\nweb của TCC.  \nBản cáo bạch này được phát hành bởi:\nCông ty Cổ phần Quản lý Quỹ Ký Thương - TechcomCapital (“TCC”)', 'Quỹ đầu tư chứng khoán được mô tả trong Bản cáo bạch này là Quỹ được thành lập theo\nLuật Chứng khoán số 54/2019/QH14 Quốc hội Nước Cộng Hòa Xã hội Chủ nghĩa Việt\nNam thông qua ngày 26 tháng 11 năm 2019 và các văn bản hướng dẫn thi hành. Bản cáo\nbạch này đã được đăng ký với Ủy ban Chứng khoán Nhà nước ngày / /2022.  \nTHÔNG BÁO QUAN TRỌNG  \nCác nhà đầu tư nên nghiên cứu Bản cáo bạch này một cách cẩn trọng và toàn diện và không nên\ncoi nội dung hoặc tóm tắt ở đây là các tư vấn liên quan đến pháp lý, thuế, hoặc tài chính/đầu\ntư và nên tham khảo ý kiến chuyên gia tư vấn của mình về các yêu cầu pháp lý, thuế, năm\ngiữa, hoặc tư vấn về các khía cạnh khác của việc đầu tư, mua, cho tặng, năm giữ,\nnhượng, chuyển nhượng, hoặc bán một phần hoặc toàn bộ các khoản đầu tư vào Quỹ. Nhà đầu tư', '(Quỹ chứng khoán doanh nghiệp vừa và nhỏ Techcom)\nBản cáo bạch này được phát hành bởi:\nCông ty Cổ phần Quản lý Quỹ Ký Thương - TechcomCapital (“TCC”)\nĐịa chỉ : Tầng 28, Tòa C5, số 119 Trần Duy Hưng, phường Trung Hòa, Quận Cầu\nGiấy, Hà Nội\nĐiện thoại : (84-24) 39446368 Fax: (84-24) 39446583\nWebsite : www.techcomcapital.com.vn  \nNơi cung cấp Bản cáo bạch:\nBản cáo bạch cập nhật những các tài liệu của Quỹ (báo cáo hoạt động, báo cáo tài chính,\nĐiểu Lệ Quỹ và các tài liệu cần thiết khác) được cung cấp trên trang điện tử của TCC,\nwww.techcomcapital.com.vn, tại văn phòng của TCC và các Đại lý phân phối như danh sách\ntrong phụ lục 1 của Bản cáo Bạch.  \nPhụ trách công bố thông tin:\nÔng Đặng Lưu Dũng – Tổng Giám đốc\nĐịa chỉ : Công ty Cổ phần Quản lý Quỹ Ký Thương', 'Website : www.techcomcapital.com.vn  \nNơi cung cấp Bản cáo bạch:\nBản cáo bạch cập nhật những các tài liệu của Quỹ (báo cáo hoạt động, báo cáo tài chính,\nĐiểu Lệ Quỹ và các tài liệu cần thiết khác) được cung cấp trên trang điện tử của TCC,\nwww.techcomcapital.com.vn, tại văn phòng của TCC và các Đại lý phân phối như danh sách\ntrong phụ lục 1 của Bản cáo Bạch.  \nPhụ trách công bố thông tin:\nÔng Đặng Lưu Dũng – Tổng Giám đốc\nĐịa chỉ: Công ty Cổ phần Quản lý Quỹ Ký Thương\nTầng 28, Tòa C5, số 119 Trần Duy Hưng, phường Trung Hòa, Quận Cầu Giấy, Hà Nội\nĐiện thoại: (84-24) 39446368 Fax: (84-24) 39446583', '*   Công ty Quản lý Quỹ sẽ xem xét và lựa chọn các khoản đầu tư có liên quan đến các chi phí.\n**3.1.Rủi ro lãi suất**  \nLà rủi ro mà hợp lý của các dòng tiền trong tương lai của chứng khoán có thu nhập cố định bị biến động do những thay đổi của lãi suất thị trường, dẫn tới giá trị thị trường của chứng khoán thay đổi. Thông thường, giá trị thị trường của trái phiếu và các chứng khoán có thu nhập cố định biến động ngược chiều với lãi suất. Quỹ có thể giảm thiểu rủi ro lãi suất bằng cách giữ các trái phiếu phù hợp với thời hạn của lãi suất. Công ty Quản lý Quỹ sẽ cố gắng giảm thiểu rủi ro lãi suất bằng cách lựa chọn các chứng khoán có lãi suất phù hợp với thời hạn của lãi suất.\n**3.2.Rủi ro lạm phát**', 'Bản cáo bạch này được phát hành bởi:\nCông ty Cổ phần Quản lý Quỹ Ký Thương - TechcomCapital (“TCC”)\nĐịa chỉ: Tầng 28, Tòa C5, số 119 Trần Duy Hưng, phường Trung Hòa, Quận Cầu Giấy, Hà Nội.\nĐiện thoại: (84-24) 39446368. Fax: (84-24) 39446583. Website: www.techcomcapital.com.vn.  \nBản cáo bạch này được phát hành bởi:\nCông ty Cổ phần Quản lý Quỹ Ký Thương - TechcomCapital (“TCC”)\nĐịa chỉ: Tầng 28, Tòa C5, số 119 Trần Duy Hưng, phường Trung Hòa, Quận Cầu Giấy, Hà Nội\nĐiện thoại: (84-24) 39446368 Fax: (84-24) 39446583\nWebsite: www.techcomcapital.com.vn  \nNơi cung cấp Bản cáo bạch:\nBản cáo bạch cập nhật những các tài liệu của Quỹ (báo cáo hoạt động, báo cáo tài chính,\nĐiểu Lệ Quỹ và các tài liệu cần thiết khác) được cung cấp trên trang điện tử của TCC,', 'Điểu Lệ Quỹ và các tài liệu cần thiết khác) được cung cấp trên trang điện tử của TCC,\nwww.techcomcapital.com.vn, tại văn phòng của TCC và các Đại lý phân phối như danh sách\ntrong phụ lục 1 của Bản cáo Bạch.  \nPhụ trách công bố thông tin:\nÔng Đặng Lưu Dũng – Tổng Giám đốc\nĐịa chỉ: Công ty Cổ phần Quản lý Quỹ Ký Thương\nTầng 28, Tòa C5, số 119 Trần Duy Hưng, phường Trung Hòa, Quận Cầu Giấy, Hà Nội\nĐiện thoại: (84-24) 39446368 Fax: (84-24) 39446583  \nBản cáo bạch này được phát hành bởi:\nCông ty Cổ phần Quản lý Quỹ Ký Thương - TechcomCapital (“TCC”)\nĐịa chỉ : Tầng 28, Tòa C5, số 119 Trần Duy Hưng, phường Trung Hòa, Quận Cầu Giấy, Hà Nội\nĐiện thoại : (84-24) 39446368 Fax: (84-24) 39446583\nWebsite : www.techcomcapital.com.vn  \nNơi cung cấp Bản cáo bạch:', 'Quỹ thực hiện hoặc gián tiếp hoặc tổng hợp các khoản phí và các chi phí/phí/giá dịch vụ liên quan đến các hoạt động của Quỹ mà Quỹ thực hiện hoặc gián tiếp hoặc tổng hợp các khoản phí và các chi phí/phí/giá dịch vụ liên quan đến các hoạt động của Quỹ mà Quỹ thực hiện hoặc gián tiếp hoặc tổng hợp các khoản phí và các chi phí/phí/giá dịch vụ liên quan đến các hoạt động của Quỹ mà Quỹ thực hiện hoặc gián tiếp hoặc tổng hợp các khoản phí và các chi phí/phí/giá dịch vụ liên quan đến các hoạt động của Quỹ mà Quỹ thực hiện hoặc gián tiếp hoặc tổng hợp các khoản phí và các chi phí/phí/giá dịch vụ liên quan đến các hoạt động của Quỹ mà Quỹ thực hiện hoặc gián tiếp hoặc tổng hợp các khoản phí và các chi phí/phí/giá dịch vụ liên quan đến các hoạt động của Quỹ mà Quỹ thực hiện hoặc gián tiếp hoặc', 'Các quy định khác liên quan đến kiểm toán, kế toán và chế độ báo cáo tuân thủ theo quy định tại Điều Lệ Quỹ.  \n**3. Các rủi ro khi đầu tư vào Quỹ**  \nMục tiêu của Công ty Quản lý Quỹ là quản lý các rủi ro đầu tư, và nếu có thể, hạn chế các tác động của các rủi ro này bằng việc áp dụng các phương pháp quản lý đầu tư theo tiêu chuẩn quốc tế tốt nhất. Nhà Đầu tư cần lưu ý về các điểm quan trọng sau đây:  \n*   Quỹ, Công ty Quản lý Quỹ, thành viên Hội đồng quản trị, người điều hành và nhân viên của ngân hàng giám sát sẽ làm nhiệm vụ của quản trị rủi ro và bảo quản tài sản của quỹ đại chúng, công ty đầu tư chứng khoán không được là đối tượng mua, bán trong giao dịch mua, bán tài sản của quỹ đại chúng, công ty đầu tư chứng khoán.', '- Không đầu tư vào quá 10% tổng giá trị chứng chỉ quỹ đang lưu hành của một quỹ đại chúng,\ncổ phiếu công ty quản lý quỹ khác có chứng khoán đại chúng;\n- Không đầu tư quá 20% tổng giá trị tài sản của quỹ vào chứng chỉ quỹ của một quỹ đại\nchúng, cổ phiếu của một công ty đầu tư chứng khoán đại chúng;\n- Không được đầu tư quá 50% tổng giá trị tài sản của quỹ vào các chứng chỉ quỹ đại chúng, cổ\nphiếu công ty đầu tư chứng khoán đại chúng;\nk) Không được đầu tư trực tiếp bất động sản, đã quỹ, kim loại quý hiếm;\n1) Phải có chứng khoán của ít nhất 06 tổ chức phát hành.\n2.2.5 Điều chỉnh danh mục đầu tư\nCơ cấu đầu tư của Quỹ mới chỉ được vược với các hạn chế đầu tư đã quy định tại điểm a,\nb, c, d, e và mục IX.2.2.4 và chỉ do các nguyên nhân sau:', 'chi phí/phí/giá dịch vụ liên quan đến các hoạt động của Quỹ mà Quỹ thực hiện hoặc gián tiếp hoặc tổng hợp các khoản phí và các chi phí/phí/giá dịch vụ liên quan đến các hoạt động của Quỹ mà Quỹ thực hiện hoặc gián tiếp hoặc tổng hợp các khoản phí và các chi phí/phí/giá dịch vụ liên quan đến các hoạt động của Quỹ mà Quỹ thực hiện hoặc gián tiếp hoặc tổng hợp các khoản phí và các chi phí/phí/giá dịch vụ liên quan đến các hoạt động của Quỹ mà Quỹ thực hiện hoặc gián tiếp hoặc tổng hợp các khoản phí và các chi phí/phí/giá dịch vụ liên quan đến các hoạt động của Quỹ mà Quỹ thực hiện hoặc gián tiếp hoặc tổng hợp các khoản phí và các chi phí/phí/giá dịch vụ liên quan đến các hoạt động của Quỹ mà Quỹ thực hiện hoặc gián tiếp hoặc tổng hợp các khoản phí và các chi phí/phí/giá dịch vụ liên quan đến']","Là rủi ro khi lãi suất thị trường giảm, tiền lãi hoặc gốc nhận được phải tái đầu tư với mức sinh lợi thấp hơn."
